id,institutionCode,collectionCode,ownerInstitutionCode,basisOfRecord,occurrenceID,catalogNumber,otherCatalogNumbers,higherClassification,kingdom,phylum,class,order,family,scientificName,taxonID,scientificNameAuthorship,genus,subgenus,specificEpithet,verbatimTaxonRank,infraspecificEpithet,taxonRank,identifiedBy,dateIdentified,identificationReferences,identificationRemarks,taxonRemarks,identificationQualifier,typeStatus,recordedBy,associatedCollectors,recordNumber,eventDate,eventDate2,year,month,day,startDayOfYear,endDayOfYear,verbatimEventDate,occurrenceRemarks,habitat,substrate,verbatimAttributes,fieldNumber,eventID,informationWithheld,dataGeneralizations,dynamicProperties,associatedOccurrences,associatedSequences,associatedTaxa,reproductiveCondition,establishmentMeans,cultivationStatus,lifeStage,sex,individualCount,preparations,locationID,continent,waterBody,islandGroup,island,country,stateProvince,county,municipality,locality,locationRemarks,localitySecurity,localitySecurityReason,decimalLatitude,decimalLongitude,geodeticDatum,coordinateUncertaintyInMeters,georeferencedBy,georeferenceProtocol,georeferenceSources,georeferenceVerificationStatus,georeferenceRemarks,minimumElevationInMeters,maximumElevationInMeters,minimumDepthInMeters,maximumDepthInMeters,verbatimDepth,verbatimElevation,disposition,language,recordEnteredBy,sourcePrimaryKey-dbpk,collID,recordID,references
4896924,US,,,PreservedSpecimen,http://n2t.net/ark:/65665/368d13b54-2cc5-4015-8815-dd9f3f968cce,US 6501,,Organism|Plantae|Viridiplantae|Streptophyta|Embryophyta|Tracheophyta|Spermatophytina|Magnoliopsida|Rosanae|Brassicales|Brassicaceae|Raphanus,Plantae,Tracheophyta,Magnoliopsida,Brassicales,Brassicaceae,Raphanus sativus,29702,L.,Raphanus,,sativus,,,Species,,,,,,,,L. Xantus de Vesey,,9,1857-00-00,,1857,0,0,,,1857,,,,,,,,,,,,,,,,,,1,,,North America,,,,United States,California,,,"Fort Tejon, and vicinity.",,0,,,,,,,,,,,,,,,,,,,,http://n2t.net/ark:/65665/368d13b54-2cc5-4015-8815-dd9f3f968cce,91,9cb9c734-e3a2-4e0a-b7df-b8daad79bfad,https://www.cch2.org/portal/collections/individual/index.php?occid=4896924
4848896,US,,,PreservedSpecimen,http://n2t.net/ark:/65665/32c05f346-3097-49e7-9040-636e4f8e112e,US 320538,,Organism|Plantae|Viridiplantae|Streptophyta|Embryophyta|Tracheophyta|Spermatophytina|Magnoliopsida|Rosanae|Brassicales|Brassicaceae|Raphanus,Plantae,Tracheophyta,Magnoliopsida,Brassicales,Brassicaceae,Raphanus sativus,29702,L.,Raphanus,,sativus,,,Species,,,,,,,,W. H. Brewer,,1004,1862-04-30,,1862,4,30,120,120,1862-4-30,,,,,,,,,,,,,,,,,,1,,,North America,,,,United States,California,Contra Costa,,"Camp 69, Walnut Creek.",,0,,,,,,,,,,,,,,,,,,,,http://n2t.net/ark:/65665/32c05f346-3097-49e7-9040-636e4f8e112e,91,6ce92645-eff6-4086-be70-034b7a352e96,https://www.cch2.org/portal/collections/individual/index.php?occid=4848896
4929046,US,,,PreservedSpecimen,http://n2t.net/ark:/65665/39188cfbc-5f2b-473f-ba86-f12eca4ab568,US 320539,,Organism|Plantae|Viridiplantae|Streptophyta|Embryophyta|Tracheophyta|Spermatophytina|Magnoliopsida|Rosanae|Brassicales|Brassicaceae|Raphanus,Plantae,Tracheophyta,Magnoliopsida,Brassicales,Brassicaceae,Raphanus sativus,29702,L.,Raphanus,,sativus,,,Species,,,,,,,,W. H. Brewer,,2733,1864-04-00,,1864,4,0,121,121,1864-4,,,,,,,,,,,,,,,,,,1,,,North America,,,,United States,California,,,Oakland.,,0,,,,,,,,,,,,,,,,,,,,http://n2t.net/ark:/65665/39188cfbc-5f2b-473f-ba86-f12eca4ab568,91,fc32f536-c3eb-477a-b1a4-1782fefd719e,https://www.cch2.org/portal/collections/individual/index.php?occid=4929046
468963,SD,,,PreservedSpecimen,6D04235B-A364-47A9-B732-B5F6D78EEB10,SD00062742,SD8276,Organism|Plantae|Viridiplantae|Streptophyta|Embryophyta|Tracheophyta|Spermatophytina|Magnoliopsida|Rosanae|Brassicales|Brassicaceae|Raphanus,Plantae,Tracheophyta,Magnoliopsida,Brassicales,Brassicaceae,Raphanus sativus,29702,L.,Raphanus,,sativus,,,Species,,,,,,,,Daniel Cleveland,,s.n.,1875-05-24,,1875,5,24,144,,05/24/1875,,,,,,,,,,,,,FFL,,,,,,,,,,,,United States,California,San Diego,,Sweetwater,,0,,32.7089,-116.9682,WGS84,5000,fjg,,Google Earth,,point is centered on large general area of Sweetwater Lake,75,,,,,,,,,SD8276,43,eeb62ff2-6914-4222-af5f-8e5850d7bc63,https://www.cch2.org/portal/collections/individual/index.php?occid=468963
304566,UCSB,,,PreservedSpecimen,fc2b9ad6-1a5d-11e3-b49f-525400a0a001,UCSB032030,32021,Organism|Plantae|Viridiplantae|Streptophyta|Embryophyta|Tracheophyta|Spermatophytina|Magnoliopsida|Rosanae|Brassicales|Brassicaceae|Raphanus,Plantae,Tracheophyta,Magnoliopsida,Brassicales,Brassicaceae,Raphanus sativus,29702,L.,Raphanus,,sativus,,,Species,,,,,,,,Mrs. R. F. Bingham,,,1882-07-00,,1882,7,0,,,1882-07,,,,,,,,,,,,,,,,,,,Sheet - 1,,,,,,United States,California,Santa Barbara,,Montecito,,0,,34.4367,-119.6311,NAD83,5700,Santa Barbara Botanic Garden A,,GeoLocate (copied from SBBG63245),,Mon Apr 28 17:51:46 2014,,,,,,,,,preprocessed,,35,898cc859-55f6-4c0b-b723-505f66b13149,https://www.cch2.org/portal/collections/individual/index.php?occid=304566
3258364,UCJEPS,VASC,,PreservedSpecimen,7bcfe3aa-155d-4558-8aa7-7ec6c1340d0f,UC14322,,Organism|Plantae|Viridiplantae|Streptophyta|Embryophyta|Tracheophyta|Spermatophytina|Magnoliopsida|Rosanae|Brassicales|Brassicaceae|Raphanus,Plantae,Tracheophyta,Magnoliopsida,Brassicales,Brassicaceae,Raphanus sativus,29702,L.,Raphanus,,sativus,,,Species,,,,,,,,E. R. Drew,,,1882-04-01,,1882,4,1,91,120,April 1882,"Date as ""April 1882",,,,,,,,,,,,Flowering/Fruiting,,,,,,,,,,,,United States,California,Sacramento,,Elk Grove,,0,,38.4,-121.36,NAD27,1609,,,Terrain Navigator 5.03 USGS 1:24000,,,,,,,,,,,,7bcfe3aa-155d-4558-8aa7-7ec6c1340d0f,46,66be8dfd-8b90-47a9-8741-ce9bccac1555,https://www.cch2.org/portal/collections/individual/index.php?occid=3258364
468961,SD,,,PreservedSpecimen,6715347B-6C68-4322-B5B2-E84C19AA3281,SD00062744,SD8274,Organism|Plantae|Viridiplantae|Streptophyta|Embryophyta|Tracheophyta|Spermatophytina|Magnoliopsida|Rosanae|Brassicales|Brassicaceae|Raphanus,Plantae,Tracheophyta,Magnoliopsida,Brassicales,Brassicaceae,Raphanus sativus,29702,L.,Raphanus,,sativus,,,Species,,,,,,,,unknown,,s.n.,1884-02-26,,1884,2,26,57,,02/26/1884,,,,,,,,,,,,,FFL,,,,,,,,,,,,United States,California,San Diego,,San Diego,,0,,32.731,-117.1371,WGS84,2500,fjg,,Google Earth,,general point for city of San Diego,76,,,,,,,,,SD8274,43,f804791c-2380-48fb-b5a9-8b354a379c03,https://www.cch2.org/portal/collections/individual/index.php?occid=468961
468962,SD,,,PreservedSpecimen,6BE9CF75-0765-4C0D-A038-BCFDABC7E8D9,SD00062741,SD8275,Organism|Plantae|Viridiplantae|Streptophyta|Embryophyta|Tracheophyta|Spermatophytina|Magnoliopsida|Rosanae|Brassicales|Brassicaceae|Raphanus,Plantae,Tracheophyta,Magnoliopsida,Brassicales,Brassicaceae,Raphanus sativus,29702,L.,Raphanus,,sativus,,,Species,Frank F. Gander,,,,,,,unknown,,s.n.,1884-04-25,,1884,4,25,116,,04/25/1884,,,,,,,,,,,,,FFL,,,,,,,,,,,,United States,California,San Diego,,Chollas Valley,,0,,32.72173,-117.10117,WGS84,2414,mak,,TOPO! v3.4.2,,,,,,,,unknownft.,,,,SD8275,43,dffa19ee-a62c-4b34-bf69-e892e01d7e06,https://www.cch2.org/portal/collections/individual/index.php?occid=468962
3351467,UCJEPS,VASC,,PreservedSpecimen,f7a67d87-873c-4f88-9a0a-e19f38e52e4d,JEPS53818,,Organism|Plantae|Viridiplantae|Streptophyta|Embryophyta|Tracheophyta|Spermatophytina|Magnoliopsida|Rosanae|Brassicales|Brassicaceae|Raphanus,Plantae,Tracheophyta,Magnoliopsida,Brassicales,Brassicaceae,Raphanus sativus,29702,L.,Raphanus,,sativus,,,Species,,,,,,,,Willis L. Jepson,,5K,1884-06-10,,1884,6,10,162,,Jun 10 1884,,in cultivated fields,,,,,,,,,,,Flowering/Fruiting,,,,,,,,,,,,United States,California,Solano,,Vacaville,,0,,38.35667,-121.9867,,,,,,,,,,,,,,,,,f7a67d87-873c-4f88-9a0a-e19f38e52e4d,46,c3a608ca-3af7-4c86-b010-2a7a8a042e2d,https://www.cch2.org/portal/collections/individual/index.php?occid=3351467
3268949,UCJEPS,VASC,,PreservedSpecimen,c50271ec-63b6-4743-9fb7-a3a47dcd8ce8,UC10778,,Organism|Plantae|Viridiplantae|Streptophyta|Embryophyta|Tracheophyta|Spermatophytina|Magnoliopsida|Rosanae|Brassicales|Brassicaceae|Raphanus,Plantae,Tracheophyta,Magnoliopsida,Brassicales,Brassicaceae,Raphanus sativus,29702,L.,Raphanus,,sativus,,,Species,,,,,,,,J. A. Sanford,,95,1890-01-01,,1890,1,1,1,365,1890-1891,"Date as ""1890-91",,,,,,,,,,,,Flowering/Fruiting,,,,,,,,,,,,United States,California,San Joaquin,,French Camp,,0,,37.88255,-121.27376,NAD27,819,,,Terrain Navigator 5.03 USGS 1:24000,,,,,,,,,,,,c50271ec-63b6-4743-9fb7-a3a47dcd8ce8,46,69c1e870-4f18-4e6f-91b2-c9ece3e3d5fe,https://www.cch2.org/portal/collections/individual/index.php?occid=3268949
2286213,CAS,BOT-BC,,PreservedSpecimen,urn:catalog:CAS:BOT-BC:74276,74276,urn:catalog:CAS:DS:95623,Organism|Plantae|Viridiplantae|Streptophyta|Embryophyta|Tracheophyta|Spermatophytina|Magnoliopsida|Rosanae|Brassicales|Brassicaceae|Raphanus,Plantae,Tracheophyta,Magnoliopsida,Brassicales,Brassicaceae,Raphanus sativus,29702,L.,Raphanus,,sativus,,,Species,Ihsan A. Al-Shehbaz,2010-01,,,,,,"Parish, W. F.",,s.n.,1891-00-00,,1891,1,1,,,1891,,,,,,,,,,,,,,,,,,,,,North America,,,,United States,California,Los Angeles County,,Wayside - Long Beach.,,0,,33.76694,-118.18833,,,,Biogeomancer,,,(copied from UC2154),,,,,,,,en,,urn:catalog:CAS:BOT-BC:74276,1,795ff28a-bca5-4dec-8588-ec615bb2efae,https://www.cch2.org/portal/collections/individual/index.php?occid=2286213
2376470,CAS,BOT-BC,,PreservedSpecimen,urn:catalog:CAS:BOT-BC:74174,74174,urn:catalog:CAS:BOT:77387,Organism|Plantae|Viridiplantae|Streptophyta|Embryophyta|Tracheophyta|Spermatophytina|Magnoliopsida|Rosanae|Brassicales|Brassicaceae|Raphanus,Plantae,Tracheophyta,Magnoliopsida,Brassicales,Brassicaceae,Raphanus raphanistrum,29701,L.,Raphanus,,raphanistrum,,,Species,Ihsan A. Al-Shehbaz,2010-01,,,,,,"Shepard, Mrs. G. C.",,s.n.,1893-00-00,,1893,1,1,,,Summer 1893,,,,,,,,,,,,,,,,,,,,,North America,,,,United States,California,,,Pine Ridge. Sierra Nevada Mountains.,,0,,,,,,,,,,,,,,,,,,en,,urn:catalog:CAS:BOT-BC:74174,1,6007e7ba-a7f7-4810-9e2e-4bb789e45727,https://www.cch2.org/portal/collections/individual/index.php?occid=2376470
3366602,UCJEPS,VASC,,PreservedSpecimen,3be07165-45aa-404a-b4ba-e04b212c4394,UC10776,,Organism|Plantae|Viridiplantae|Streptophyta|Embryophyta|Tracheophyta|Spermatophytina|Magnoliopsida|Rosanae|Brassicales|Brassicaceae|Raphanus,Plantae,Tracheophyta,Magnoliopsida,Brassicales,Brassicaceae,Raphanus raphanistrum,29701,L.,Raphanus,,raphanistrum,,,Species,,,,,,,,Fr. Denicke,,,1893-04-01,,1893,4,1,91,120,Apr 1893,"Date as ""Arpil 1893",,,,,,,,,,,,Flowering/Fruiting,,,,,,,,,,,,United States,California,San Francisco,,at San Francisco San Francisco,,0,,37.7514,-122.4413,WGS84,8000,San Jose S.U. A,,GoogleMaps via BerkeleyMapper,,georef from 2006-2015 archive backup file; Thu Nov 1 21:45:14 2012; (copied from RSA101836),,,,,,,,,preprocessed,3be07165-45aa-404a-b4ba-e04b212c4394,46,40697225-cc30-4f63-8e1d-8faedc6044b1,https://www.cch2.org/portal/collections/individual/index.php?occid=3366602
468999,SD,,,PreservedSpecimen,5EDCDFD0-6F3C-4F1B-8097-55272A22B94B,SD00062711,SD52157,Organism|Plantae|Viridiplantae|Streptophyta|Embryophyta|Tracheophyta|Spermatophytina|Magnoliopsida|Rosanae|Brassicales|Brassicaceae|Raphanus,Plantae,Tracheophyta,Magnoliopsida,Brassicales,Brassicaceae,Raphanus sativus,29702,L.,Raphanus,,sativus,,,Species,,,,,,,,R. D. Alderson,,633a,1893-04-01,,1893,4,1,91,,04/01/1893,,,,,,,,,,,,,FFL,,,,,,,,,,,,United States,California,San Diego,,Witch Creek,,0,,33.08272,-116.71691,WGS84,3620,mak,,TOPO! v3.4.2,,,,,,,,unknownft.,,,,SD52157,43,1189ab74-4bb1-4b57-8a7f-38d64cadcf9c,https://www.cch2.org/portal/collections/individual/index.php?occid=468999
2448284,CAS,BOT-BC,,PreservedSpecimen,urn:catalog:CAS:BOT-BC:74317,74317,urn:catalog:CAS:DS:95605,Organism|Plantae|Viridiplantae|Streptophyta|Embryophyta|Tracheophyta|Spermatophytina|Magnoliopsida|Rosanae|Brassicales|Brassicaceae|Raphanus,Plantae,Tracheophyta,Magnoliopsida,Brassicales,Brassicaceae,Raphanus sativus,29702,L.,Raphanus,,sativus,,,Species,Ihsan A. Al-Shehbaz,2010-01,,,,,,"Parish, S. B.",,2642,1893-04-05,,1893,4,5,95,,5 Apr 1893.,,Grain fields.,,,,,,,,,,,,,,,,,,,North America,,,,United States,California,San Bernardino County,,Rialto.,,0,,,,,,,,,,,,,,,,,,en,,urn:catalog:CAS:BOT-BC:74317,1,db4a7498-1f7d-4925-8d1d-8f4516180711,https://www.cch2.org/portal/collections/individual/index.php?occid=2448284
3904083,LA,,,PreservedSpecimen,e568d646-4e35-4857-9c0d-1fe646685eb2,LA00606064,,Organism|Plantae|Viridiplantae|Streptophyta|Embryophyta|Tracheophyta|Spermatophytina|Magnoliopsida|Rosanae|Brassicales|Brassicaceae|Raphanus,Plantae,Tracheophyta,Magnoliopsida,Brassicales,Brassicaceae,Raphanus sativus,29702,L.,Raphanus,,sativus,,,Species,,,,,,,,Th. Wolf,,1510,1893-09-23,,1893,9,23,266,,,,,,,,,,,,,,,,,,,,,,,,,,,,,,,,,0,,,,,,,,,,,,,,,,,,,abaniaga,,34,e568d646-4e35-4857-9c0d-1fe646685eb2,https://www.cch2.org/portal/collections/individual/index.php?occid=3904083
5009796,US,,,PreservedSpecimen,http://n2t.net/ark:/65665/3f7bb48a5-0f1b-4886-bac0-a9ac28195ac1,US 238201,,Organism|Plantae|Viridiplantae|Streptophyta|Embryophyta|Tracheophyta|Spermatophytina|Magnoliopsida|Rosanae|Brassicales|Brassicaceae|Raphanus,Plantae,Tracheophyta,Magnoliopsida,Brassicales,Brassicaceae,Raphanus sativus,29702,L.,Raphanus,,sativus,,,Species,,,,,,,,H. Henshaw,,234,1893-04-05,,1893,4,5,95,95,1893-4-5,,,,,,,,,,,,,,,,,,1,,,North America,,,,United States,California,,,San Ysabel.,,0,,,,,,,,,,,,,,,,,,,,http://n2t.net/ark:/65665/3f7bb48a5-0f1b-4886-bac0-a9ac28195ac1,91,01041209-ef04-4bc4-a2dc-36ed2f43fac9,https://www.cch2.org/portal/collections/individual/index.php?occid=5009796
2283873,CAS,BOT-BC,,PreservedSpecimen,urn:catalog:CAS:BOT-BC:74352,74352,urn:catalog:CAS:DS:185825,Organism|Plantae|Viridiplantae|Streptophyta|Embryophyta|Tracheophyta|Spermatophytina|Magnoliopsida|Rosanae|Brassicales|Brassicaceae|Raphanus,Plantae,Tracheophyta,Magnoliopsida,Brassicales,Brassicaceae,Raphanus sativus,29702,L.,Raphanus,,sativus,,,Species,Ihsan A. Al-Shehbaz,2010-01,,,,,,"Applegate, Elmer I.",,38,1895-04-06,,1895,4,6,96,,"April 6, 1895.",,,,,,,,,,,,,,,,,,,,,North America,,,,United States,California,Santa Clara County,,Stanford University. Above Stock Farm.,,0,,,,,,,,,,,,,,,,,,en,,urn:catalog:CAS:BOT-BC:74352,1,e6544f39-7daa-48d3-accf-6e27d8723284,https://www.cch2.org/portal/collections/individual/index.php?occid=2283873
3330781,UCJEPS,VASC,,PreservedSpecimen,9ab2930d-3e88-4ca5-9b56-4636a9f482f6,UC117497,,Organism|Plantae|Viridiplantae|Streptophyta|Embryophyta|Tracheophyta|Spermatophytina|Magnoliopsida|Rosanae|Brassicales|Brassicaceae|Raphanus,Plantae,Tracheophyta,Magnoliopsida,Brassicales,Brassicaceae,Raphanus sativus,29702,L.,Raphanus,,sativus,,,Species,,,,,,,,T. S. Brandegee,,,1895-04-07,,1895,4,7,97,,Apr 7 1895,,,,,,,,,,,,,Flowering/Fruiting,,,,,,,,,,,,United States,California,San Diego,,San Diego,,0,,32.73409,-117.12945,WGS84,9654,San Diego NHM A,,TOPO! and personal research,,georef from 2006-2015 archive backup file; Tue Sep 3 16:06:22 2013; (copied from UC101054),,,,,,,,,preprocessed,9ab2930d-3e88-4ca5-9b56-4636a9f482f6,46,8739095e-470f-4567-be73-0af2e7de5302,https://www.cch2.org/portal/collections/individual/index.php?occid=3330781
3308798,UCJEPS,VASC,,PreservedSpecimen,b3a3ff71-9373-4b0e-9337-af2e17154f83,UC220629,,Organism|Plantae|Viridiplantae|Streptophyta|Embryophyta|Tracheophyta|Spermatophytina|Magnoliopsida|Rosanae|Brassicales|Brassicaceae|Raphanus,Plantae,Tracheophyta,Magnoliopsida,Brassicales,Brassicaceae,Raphanus raphanistrum,29701,L.,Raphanus,,raphanistrum,,,Species,,,,,,,,H. E. Brown,,343,1897-06-01,,1897,6,1,152,161,June 1-10 1897,"Date as ""June 1-10 1897",,,,,,,,,,,,Flowering/Fruiting,,,,,,,,,,,,United States,California,Siskiyou,,near Sisson,,0,,41.3315,-122.3362,WGS84,6000,,,BerkeleyMapper,,,1083,,,,,3555 ft,,,,b3a3ff71-9373-4b0e-9337-af2e17154f83,46,574b6ade-a3c9-417e-b6a8-8662cdf1b62d,https://www.cch2.org/portal/collections/individual/index.php?occid=3308798
929536,RSA,POM,,PreservedSpecimen,6707ea3c-ed1a-4286-a28d-eff42060194c,,POM accession: 94326,Organism|Plantae|Viridiplantae|Streptophyta|Embryophyta|Tracheophyta|Spermatophytina|Magnoliopsida|Rosanae|Brassicales|Brassicaceae|Raphanus,Plantae,Tracheophyta,Magnoliopsida,Brassicales,Brassicaceae,Raphanus sativus,29702,L.,Raphanus,,sativus,,,Species,,,,,,,,C. C. Bruce,,1941,1897-04-00,,1897,4,0,,,1897-04,,Fields.,,,,,,,,,,,flowers & fruits,Introduced,,,,,herbarium sheet,,,,,,United States,California,Butte,,[No locality information provided],,0,,,,,,,,,,,,,,,,,,,Jackie C. McConnaughy; cataloged date: 2012-04-13,6707ea3c-ed1a-4286-a28d-eff42060194c,17,5e2bb05b-5065-44ab-87e8-cf6277775ff8,https://www.cch2.org/portal/collections/individual/index.php?occid=929536
2286564,CAS,BOT-BC,,PreservedSpecimen,urn:catalog:CAS:BOT-BC:74343,74343,urn:catalog:CAS:DS:62625,Organism|Plantae|Viridiplantae|Streptophyta|Embryophyta|Tracheophyta|Spermatophytina|Magnoliopsida|Rosanae|Brassicales|Brassicaceae|Raphanus,Plantae,Tracheophyta,Magnoliopsida,Brassicales,Brassicaceae,Raphanus sativus,29702,L.,Raphanus,,sativus,,,Species,Ihsan A. Al-Shehbaz,2010-01,,,,,,"Dudley, W. R.",,s.n.,1897-05-24,,1897,5,24,144,,"May 24, 1897.",,,,,,,,,,,,,,,,,,,,,North America,,,,United States,California,Santa Clara County,,"Santa Cruz Peninsula. Near Lake Lagunita, Stanford University.",,0,,,,,,,,,,,,,,,,,,en,,urn:catalog:CAS:BOT-BC:74343,1,de56ea59-38aa-44c2-8d18-228a10088121,https://www.cch2.org/portal/collections/individual/index.php?occid=2286564
2358923,CAS,BOT-BC,,PreservedSpecimen,urn:catalog:CAS:BOT-BC:74342,74342,urn:catalog:CAS:DS:100762,Organism|Plantae|Viridiplantae|Streptophyta|Embryophyta|Tracheophyta|Spermatophytina|Magnoliopsida|Rosanae|Brassicales|Brassicaceae|Raphanus,Plantae,Tracheophyta,Magnoliopsida,Brassicales,Brassicaceae,Raphanus sativus,29702,L.,Raphanus,,sativus,,,Species,Ihsan A. Al-Shehbaz,2010-01,,,,,,"Dudley, W. R.",,s.n.,1897-05-24,,1897,5,24,144,,"May 24, 1897.",,,,,,,,,,,,,,,,,,,,,North America,,,,United States,California,Santa Clara County,,"Santa Cruz Peninsula. Near Lake Lagunita, Stanford University.",,0,,,,,,,,,,,,,,,,,,en,,urn:catalog:CAS:BOT-BC:74342,1,bbdda3f0-6b68-4630-a190-eea51485de84,https://www.cch2.org/portal/collections/individual/index.php?occid=2358923
3209072,UCJEPS,VASC,,PreservedSpecimen,b7d92278-ef1b-45d6-85cc-f9139c4d8b33,UC1206452,,Organism|Plantae|Viridiplantae|Streptophyta|Embryophyta|Tracheophyta|Spermatophytina|Magnoliopsida|Rosanae|Brassicales|Brassicaceae|Raphanus,Plantae,Tracheophyta,Magnoliopsida,Brassicales,Brassicaceae,Raphanus sativus,29702,L.,Raphanus,,sativus,,,Species,,,,,,,,W. R. Dudley,,,1897-05-24,,1897,5,24,144,,May 24 1897,,,,,,,,,,,,,Flowering/Fruiting,,,,,,,,,,,,United States,California,Santa Clara,,"near Lake Lagunita (Stanford University); Santa Cruz Peninsula, Stanford University",,0,,37.42722,-122.16917,NAD27,415,,,"Biogeomancer, inferred",,,,,,,,,,,,b7d92278-ef1b-45d6-85cc-f9139c4d8b33,46,63be5e57-5568-4f75-806e-14590fa01f7e,https://www.cch2.org/portal/collections/individual/index.php?occid=3209072
3511149,UCJEPS,VASC,,PreservedSpecimen,6b6f13c4-ea62-4799-9bcc-f1e53118c532,JEPS53812,,Organism|Plantae|Viridiplantae|Streptophyta|Embryophyta|Tracheophyta|Spermatophytina|Magnoliopsida|Rosanae|Brassicales|Brassicaceae|Raphanus,Plantae,Tracheophyta,Magnoliopsida,Brassicales,Brassicaceae,Raphanus sativus,29702,L.,Raphanus,,sativus,,,Species,,,,,,,,Willis L. Jepson,,126e,1897-06-25,,1897,6,25,176,,Jun 25 1897,,,,,,,,,,,,,Flowering/Fruiting,,,,,,,,,,,,United States,California,Alameda,,Berkeley,,0,,37.87167,-122.27167,,,,,,,,,,,,,,,,,6b6f13c4-ea62-4799-9bcc-f1e53118c532,46,26187fc3-aacb-487c-b451-8941f2bca9bc,https://www.cch2.org/portal/collections/individual/index.php?occid=3511149
4981056,US,,,PreservedSpecimen,http://n2t.net/ark:/65665/3d327f980-0e82-4e24-a51c-34d3ef9fe4fc,US 299174,,Organism|Plantae|Viridiplantae|Streptophyta|Embryophyta|Tracheophyta|Spermatophytina|Magnoliopsida|Rosanae|Brassicales|Brassicaceae|Raphanus,Plantae,Tracheophyta,Magnoliopsida,Brassicales,Brassicaceae,Raphanus sativus,29702,L.,Raphanus,,sativus,,,Species,,,,,,,,H. E. Brown,,343,1897-06-01,,1897,6,1,152,161,1897-6-1,,,,,,,,,,,,,,,,,,1,,,North America,,,,United States,California,,,"Collected near Sisson, Siskiyou County.",,0,,,,,,,,,,,1084,,,,,,,,,http://n2t.net/ark:/65665/3d327f980-0e82-4e24-a51c-34d3ef9fe4fc,91,6427b302-0c56-4926-8a0e-c9fc1f8d671d,https://www.cch2.org/portal/collections/individual/index.php?occid=4981056
2342281,CAS,BOT-BC,,PreservedSpecimen,urn:catalog:CAS:BOT-BC:74316,74316,urn:catalog:CAS:DS:95622,Organism|Plantae|Viridiplantae|Streptophyta|Embryophyta|Tracheophyta|Spermatophytina|Magnoliopsida|Rosanae|Brassicales|Brassicaceae|Raphanus,Plantae,Tracheophyta,Magnoliopsida,Brassicales,Brassicaceae,Raphanus sativus,29702,L.,Raphanus,,sativus,,,Species,Ihsan A. Al-Shehbaz,2010-01,,,,,,"Parish, S. B.",,4540,1898-05-25,,1898,5,25,145,,25 May 1898,,,,,,,,,,,,,,,,,,,,,North America,,,,United States,California,San Bernardino County,,West Riverside.,,0,,34.00372,-117.43835,WGS84,4790,,GoogleMaps via BerkeleyMapper,,,,,,,,,,,en,,urn:catalog:CAS:BOT-BC:74316,1,3129ac88-844e-430d-8b22-15b0da1cdba7,https://www.cch2.org/portal/collections/individual/index.php?occid=2342281
3183373,UCJEPS,VASC,,PreservedSpecimen,bc43feff-56b3-47bc-a0a2-4ab559b62883,UC10780,,Organism|Plantae|Viridiplantae|Streptophyta|Embryophyta|Tracheophyta|Spermatophytina|Magnoliopsida|Rosanae|Brassicales|Brassicaceae|Raphanus,Plantae,Tracheophyta,Magnoliopsida,Brassicales,Brassicaceae,Raphanus sativus,29702,L.,Raphanus,,sativus,,,Species,,,,,,,,T. H. Gilbert,,,1898-08-07,,1898,8,7,219,,Aug 7 1898,,,,,,,,,,,,,Flowering/Fruiting,,,,,,,,,,,,United States,California,Alameda,,Berkeley,,0,,37.87167,-122.27167,,,,,,,,,,,,,,,,,bc43feff-56b3-47bc-a0a2-4ab559b62883,46,b7a7134d-b25d-411d-9204-aff0e0419ee8,https://www.cch2.org/portal/collections/individual/index.php?occid=3183373
468960,SD,,,PreservedSpecimen,369A97AC-A881-45B3-84A4-216BCB900FCE,SD00062712,SD1946,Organism|Plantae|Viridiplantae|Streptophyta|Embryophyta|Tracheophyta|Spermatophytina|Magnoliopsida|Rosanae|Brassicales|Brassicaceae|Raphanus,Plantae,Tracheophyta,Magnoliopsida,Brassicales,Brassicaceae,Raphanus sativus,29702,L.,Raphanus,,sativus,,,Species,,,,,,,,Mary S. Snyder,,s.n.,1899-00-00,,1899,0,0,,,,,,,,,,,,,,,,FFL,,,,,,,,,,,,United States,California,San Diego,,Pacific Beach,,0,,32.80427,-117.24817,WGS84,1609,mak,,TOPO! v3.4.2,,,,,,,,unknownft.,,,,SD1946,43,ee873b08-3c7a-4e63-9c31-6b5958149a8d,https://www.cch2.org/portal/collections/individual/index.php?occid=468960
3452051,UCJEPS,VASC,,PreservedSpecimen,72961331-435b-4d10-8e93-5363d69c564b,UC10775,,Organism|Plantae|Viridiplantae|Streptophyta|Embryophyta|Tracheophyta|Spermatophytina|Magnoliopsida|Rosanae|Brassicales|Brassicaceae|Raphanus,Plantae,Tracheophyta,Magnoliopsida,Brassicales,Brassicaceae,Raphanus raphanistrum,29701,L.,Raphanus,,raphanistrum,,,Species,,,,,,,,J. P. Tracy,,,5/18/00,,1900,5,18,138,,May 18 1900,,field,,,,,,,,,,,Flowering/Fruiting,,,,,,,,,,,,United States,California,Alameda,,"Berkeley, Telegraph Avenue, near Dwight Way Berkeley; , Telegraph Avenue",,0,,37.865246,-122.25729,NAD27,818,,,Terrain Navigator 5.03 1:24000,,,,,,,,,,,,72961331-435b-4d10-8e93-5363d69c564b,46,aac37d75-ce52-4d87-8d38-24c15d7d9f8c,https://www.cch2.org/portal/collections/individual/index.php?occid=3452051
2453178,CAS,BOT-BC,,PreservedSpecimen,urn:catalog:CAS:BOT-BC:74219,74219,urn:catalog:CAS:BOT:77371,Organism|Plantae|Viridiplantae|Streptophyta|Embryophyta|Tracheophyta|Spermatophytina|Magnoliopsida|Rosanae|Brassicales|Brassicaceae|Raphanus,Plantae,Tracheophyta,Magnoliopsida,Brassicales,Brassicaceae,Raphanus sativus,29702,L.,Raphanus,,sativus,,,Species,Ihsan A. Al-Shehbaz,2010-01,,,,,,"Carruth, W. W.",,s.n.,1900-06-00,,1900,6,1,,,June 1900.,,,,,,,,,,,,,,,,,,,,,North America,,,,United States,California,,,Bay Region.,,0,,,,,,,,,,,,,,,,,,en,,urn:catalog:CAS:BOT-BC:74219,1,0eeb7c50-ba1e-428a-bc49-ebd0d702a1f5,https://www.cch2.org/portal/collections/individual/index.php?occid=2453178
3464512,UCJEPS,VASC,,PreservedSpecimen,14843920-3d86-44ef-9b8b-69abc13eb8cd,UC10777,,Organism|Plantae|Viridiplantae|Streptophyta|Embryophyta|Tracheophyta|Spermatophytina|Magnoliopsida|Rosanae|Brassicales|Brassicaceae|Raphanus,Plantae,Tracheophyta,Magnoliopsida,Brassicales,Brassicaceae,Raphanus sativus,29702,L.,Raphanus,,sativus,,,Species,,,,,,,,Jos. Burtt Davy,,,12/28/00,,1900,12,28,362,,Dec 28 1900,,,,,,,,,,,,,Flowering/Fruiting,,,,,,,,,,,,United States,California,Alameda,,"Berkeley, College Avenue Berkeley; , College Avenue",,0,,37.852932,-122.2515,NAD27,1857,,,"Terrain Navigator 1:24,000",,,,,,,,,,,,14843920-3d86-44ef-9b8b-69abc13eb8cd,46,82315f33-2299-4d92-9f8e-1cd6505b7749,https://www.cch2.org/portal/collections/individual/index.php?occid=3464512
4901886,US,,,PreservedSpecimen,http://n2t.net/ark:/65665/36f39a9d6-3453-4c4f-ba39-1dd7c3c6e3e7,US 349903,,Organism|Plantae|Viridiplantae|Streptophyta|Embryophyta|Tracheophyta|Spermatophytina|Magnoliopsida|Rosanae|Brassicales|Brassicaceae|Raphanus,Plantae,Tracheophyta,Magnoliopsida,Brassicales,Brassicaceae,Raphanus sativus,29702,L.,Raphanus,,sativus,,,Species,,,,,,,,B. Trask,,s.n.,1900-06-00,,1900,6,0,181,181,1900-6,,,,,,,,,,,,,,,,,,1,,,North America,,,,United States,California,,,"Avalon, Santa Catalina Island.",,0,,,,,,,,,,,,,,,,,,,,http://n2t.net/ark:/65665/36f39a9d6-3453-4c4f-ba39-1dd7c3c6e3e7,91,8232c89c-d160-45ae-9fe1-41d0412c3ac5,https://www.cch2.org/portal/collections/individual/index.php?occid=4901886
3317219,UCJEPS,VASC,,PreservedSpecimen,51349b5a-7dec-4f02-8ba8-6c9d4962273d,JEPS53816,,Organism|Plantae|Viridiplantae|Streptophyta|Embryophyta|Tracheophyta|Spermatophytina|Magnoliopsida|Rosanae|Brassicales|Brassicaceae|Raphanus,Plantae,Tracheophyta,Magnoliopsida,Brassicales,Brassicaceae,Raphanus raphanistrum,29701,L.,Raphanus,,raphanistrum,,,Species,,,,,,,,Willis L. Jepson,,1242,5/17/01,,1901,5,17,137,,May 17 1901,,roadside near farm,,,,,,,,,,,Flowering/Fruiting,,,,,,,,,,,,United States,California,Riverside,,"San Jacinto Valley, near farm, from Riverside to Santa Rosa Peak and Palomar San Jacinto Valley",,0,,33.8,-117,NAD27,10000,,,RSA:2009,,,,,,,,,,,,51349b5a-7dec-4f02-8ba8-6c9d4962273d,46,04253409-d5cf-44fa-a37d-53b7e7b3ba5f,https://www.cch2.org/portal/collections/individual/index.php?occid=3317219
229779,UCSC,,,PreservedSpecimen,366ab9bc-a0dd-42f4-a406-01a3c33c3e90,UCSC100000692,320,Organism|Plantae|Viridiplantae|Streptophyta|Embryophyta|Tracheophyta|Spermatophytina|Magnoliopsida|Rosanae|Brassicales|Brassicaceae|Raphanus,Plantae,Tracheophyta,Magnoliopsida,Brassicales,Brassicaceae,Raphanus sativus,29702,L.,Raphanus,,sativus,,,Species,,,,,,,,Pupils of Los Angeles High School,,s.n.,1901-06-00,,1901,6,,,,,"""Specimen rec'd from Dr. Hall"" Herbarium of the University of California #455236.",,,,,,,,,,,,,,,,,,,,,,,,United States,California,Los Angeles,,Los Angeles. Specimen recd from Dr. Hall Univ. Cal. Herbarium,,0,,34.052234,-118.243685,WGS84,43952,akrohn,,GeoLocate,,Error polygon from GeoLocate,,,,,,,CaliforniaPolytechnic School Her,,,,13,5e7285fa-39ae-451e-9896-016402a9b38c,https://www.cch2.org/portal/collections/individual/index.php?occid=229779
953408,RSA,RSA,,PreservedSpecimen,72670bf7-437b-4f91-9b6f-604cd6fef07b,,RSA accession: 431470,Organism|Plantae|Viridiplantae|Streptophyta|Embryophyta|Tracheophyta|Spermatophytina|Magnoliopsida|Rosanae|Brassicales|Brassicaceae|Raphanus,Plantae,Tracheophyta,Magnoliopsida,Brassicales,Brassicaceae,Raphanus sativus,29702,L.,Raphanus,,sativus,,,Species,,,,,,,,Blanche Trask,,s.n.,1901-03-00,,1901,3,0,,,1901-03,,,,,,,,,,,,,flowers & fruits,Cultivated,,,,,herbarium sheet,,,,,,United States,California,Los Angeles,,"Avalon, Santa Catalina Island.",,0,,,,,,,,,,,,,,,,,,,T. Kim Nguyen; cataloged date: 2007-09-21,72670bf7-437b-4f91-9b6f-604cd6fef07b,17,aa5b90ac-b28d-4a71-8393-c39912f9d62d,https://www.cch2.org/portal/collections/individual/index.php?occid=953408
4910638,US,,,PreservedSpecimen,http://n2t.net/ark:/65665/37a46f872-dc24-494b-8df0-5e824a1a9e77,US 467936,,Organism|Plantae|Viridiplantae|Streptophyta|Embryophyta|Tracheophyta|Spermatophytina|Magnoliopsida|Rosanae|Brassicales|Brassicaceae|Raphanus,Plantae,Tracheophyta,Magnoliopsida,Brassicales,Brassicaceae,Raphanus sativus,29702,L.,Raphanus,,sativus,,,Species,,,,,,,,ex herb. Geo. B. Grant,,1531,1901-02-00,,1901,2,0,59,59,1901-2,,,,,,,,,,,,,,,,,,1,,,North America,,,,United States,California,,,"The Pacific Coast. South, West part of California.",,0,,,,,,,,,,,,,,,,,,,,http://n2t.net/ark:/65665/37a46f872-dc24-494b-8df0-5e824a1a9e77,91,640130c2-053e-49f2-84e9-757c00c55491,https://www.cch2.org/portal/collections/individual/index.php?occid=4910638
1312145,DAV,,,PreservedSpecimen,0a5c7b1f-1a4d-4863-95a9-15ec95afd703,DAV300682,Accession #: DAV163587,Organism|Plantae|Viridiplantae|Streptophyta|Embryophyta|Tracheophyta|Spermatophytina|Magnoliopsida|Rosanae|Brassicales|Brassicaceae|Raphanus,Plantae,Tracheophyta,Magnoliopsida,Brassicales,Brassicaceae,Raphanus raphanistrum,29701,L.,Raphanus,,raphanistrum,,,Species,,,,,,,,Lloyd P. Tevis,,s.n.,7/1/02,,1902,7,1,182,,2-Jul,Access Database Number (Deprecated): UCD42636,,,'Charlock,,,,,,,,,,,,,,,,,,,,,United States,California,El Dorado,,El Dorado County: Tallac. Lake Tahoe. (elevation estimated by label-maker),,0,,38.936111,-120.051944,WGS84,439,,,,,,1890,,,,,6200ft,,,,UCD42636,39,0a5c7b1f-1a4d-4863-95a9-15ec95afd703,https://www.cch2.org/portal/collections/individual/index.php?occid=1312145
4821653,US,,,PreservedSpecimen,http://n2t.net/ark:/65665/30976f552-caa2-4f42-bedd-ece461b85352,US 465345,,Organism|Plantae|Viridiplantae|Streptophyta|Embryophyta|Tracheophyta|Spermatophytina|Magnoliopsida|Rosanae|Brassicales|Brassicaceae|Raphanus,Plantae,Tracheophyta,Magnoliopsida,Brassicales,Brassicaceae,Raphanus raphanistrum,29701,L.,Raphanus,,raphanistrum,,,Species,,,,,,,,E. Braunton,,357,5/10/02,,1902,5,10,130,130,5/10/02,,,,,,,,,,,,,,,,,,1,,,North America,,,,United States,California,,,"Los Angeles County, Rivera.",,0,,,,,,,,,,,,,,,,,,,,http://n2t.net/ark:/65665/30976f552-caa2-4f42-bedd-ece461b85352,91,a1b2b1f7-ede7-48a3-93f8-684716f9ea9f,https://www.cch2.org/portal/collections/individual/index.php?occid=4821653
1312007,DAV,,,PreservedSpecimen,a0f22c8b-15ef-4aa3-83bb-95cc22e8cb31,DAV310391,Accession #: DAV164009,Organism|Plantae|Viridiplantae|Streptophyta|Embryophyta|Tracheophyta|Spermatophytina|Magnoliopsida|Rosanae|Brassicales|Brassicaceae|Raphanus,Plantae,Tracheophyta,Magnoliopsida,Brassicales,Brassicaceae,Raphanus sativus,29702,L.,Raphanus,,sativus,,,Species,,,,,,,,Lloyd P. Tevis,,s.n.,8/1/02,,1902,8,1,213,,2-Aug,Access Database Number (Deprecated): UCD42469,,,,,,,,,,,,,,,,,,,,,,,,United States,California,El Dorado,,El Dorado County: Tallac. Lake Tahoe. (elevation estimated by label-maker),,0,,38.936111,-120.051944,WGS84,439,,,,,,1890,,,,,6200ft,,,,UCD42469,39,a0f22c8b-15ef-4aa3-83bb-95cc22e8cb31,https://www.cch2.org/portal/collections/individual/index.php?occid=1312007
2271679,CAS,BOT-BC,,PreservedSpecimen,urn:catalog:CAS:BOT-BC:74261,74261,urn:catalog:CAS:BOT:77372,Organism|Plantae|Viridiplantae|Streptophyta|Embryophyta|Tracheophyta|Spermatophytina|Magnoliopsida|Rosanae|Brassicales|Brassicaceae|Raphanus,Plantae,Tracheophyta,Magnoliopsida,Brassicales,Brassicaceae,Raphanus sativus,29702,L.,Raphanus,,sativus,,,Species,Ihsan A. Al-Shehbaz,2010-01,,,,,,"Carruth, W. W.",,s.n.,1902-04-00,,1902,4,1,,,Apr. '02,,,,,,,,,,,,,,,,,,,,,North America,,,,United States,California,Alameda County,,East Oakland Hills.,,0,,,,,,,,,,,,,,,,,,en,,urn:catalog:CAS:BOT-BC:74261,1,5fb9df59-fd43-4553-8c52-f7e4a7bed3f7,https://www.cch2.org/portal/collections/individual/index.php?occid=2271679
3212192,UCJEPS,VASC,,PreservedSpecimen,83b58a19-8c30-4fad-8092-998792e117bf,UC56738,,Organism|Plantae|Viridiplantae|Streptophyta|Embryophyta|Tracheophyta|Spermatophytina|Magnoliopsida|Rosanae|Brassicales|Brassicaceae|Raphanus,Plantae,Tracheophyta,Magnoliopsida,Brassicales,Brassicaceae,Raphanus sativus,29702,L.,Raphanus,,sativus,,,Species,,,,,,,,H. M. Hall,,2989,4/1/02,,1902,4,1,91,120,2-Apr,"county supplied by Wetherwax; Date as ""April 1902",in the Upper Sonoran Zone,,,,,,,,,,,Flowering/Fruiting,,,,,,,,,,,,United States,California,Riverside,,vicinity of Riverside; Southern California,,0,,33.75,-117.3,NAD27,10000,,,RSA:2009,,,457,,,,,1500 ft,,,,83b58a19-8c30-4fad-8092-998792e117bf,46,06f68f35-a5a0-4bdb-929e-e44b96915801,https://www.cch2.org/portal/collections/individual/index.php?occid=3212192
3245328,UCJEPS,VASC,,PreservedSpecimen,2af3a8cc-9ed0-4c4f-ba6e-a20cf8a005b1,UC117496,,Organism|Plantae|Viridiplantae|Streptophyta|Embryophyta|Tracheophyta|Spermatophytina|Magnoliopsida|Rosanae|Brassicales|Brassicaceae|Raphanus,Plantae,Tracheophyta,Magnoliopsida,Brassicales,Brassicaceae,Raphanus sativus,29702,L.,Raphanus,,sativus,,,Species,,,,,,,,T. S. Brandegee,,,6/1/02,,1902,6,1,152,181,2-Jun,"Date as ""June 1902",,,,,,,,,,,,Flowering/Fruiting,,,,,,,,,,,,United States,California,San Diego,,Mission Valley,,0,,32.77479,-117.132,WGS84,6437,,,SD:2009,,,,,,,,,,,,2af3a8cc-9ed0-4c4f-ba6e-a20cf8a005b1,46,c19ce7cb-0b34-4b1f-b7b9-f7f56ed56c09,https://www.cch2.org/portal/collections/individual/index.php?occid=3245328
3382838,UCJEPS,VASC,,PreservedSpecimen,d41ae49e-ebb8-478f-ae7a-39d61d762507,UC56903,,Organism|Plantae|Viridiplantae|Streptophyta|Embryophyta|Tracheophyta|Spermatophytina|Magnoliopsida|Rosanae|Brassicales|Brassicaceae|Raphanus,Plantae,Tracheophyta,Magnoliopsida,Brassicales,Brassicaceae,Raphanus sativus,29702,L.,Raphanus,,sativus,,,Species,,,,,,,,Ernest Braunton,,357,5/10/02,,1902,5,10,130,,May 10 1902,,,,,,,,,,,,,Flowering/Fruiting,,,,,,,,,,,,United States,California,Los Angeles,,Rivera,,0,,,,,,,,,,,,,,,,,,,,d41ae49e-ebb8-478f-ae7a-39d61d762507,46,8b211f22-f6f2-43c5-8ad0-bab83eea3009,https://www.cch2.org/portal/collections/individual/index.php?occid=3382838
4312082,OSC,V,,PreservedSpecimen,{58590855-D8E4-4568-871E-3105459EFD17},OSC-V-023832,ORE40998,Organism|Plantae|Viridiplantae|Streptophyta|Embryophyta|Tracheophyta|Spermatophytina|Magnoliopsida|Rosanae|Brassicales|Brassicaceae|Raphanus,Plantae,Tracheophyta,Magnoliopsida,Brassicales,Brassicaceae,Raphanus sativus,29702,L.,Raphanus,,sativus,,,Species,"Al-Shehbaz, I.",2016,,,,,,Edmund P. Sheldon,E.P. Sheldon,S.9709,6/25/02,,1902,6,25,176,,6/25/02,,On ballast.,,,,,,,,,,,,wild collection,,,,,,,,,,,United States,Oregon,Multnomah,,"Lower Albina, Portland.",,0,,45.5407,-122.6674,,1609,,OregonFlora 1994-2020 methodology,"OrlookId: 10275, StateProvince: Oregon, County: Multnomah, LocName: Lower Albina, Portland",,,,,,,,,,,,4436846,81,10fb7bb9-52aa-4d12-8c94-e5750c381515,https://www.cch2.org/portal/collections/individual/index.php?occid=4312082
2302311,CAS,BOT-BC,,PreservedSpecimen,urn:catalog:CAS:BOT-BC:74297,74297,urn:catalog:CAS:DS:593634,Organism|Plantae|Viridiplantae|Streptophyta|Embryophyta|Tracheophyta|Spermatophytina|Magnoliopsida|Rosanae|Brassicales|Brassicaceae|Raphanus,Plantae,Tracheophyta,Magnoliopsida,Brassicales,Brassicaceae,Raphanus sativus,29702,L.,Raphanus,,sativus,,,Species,Ihsan A. Al-Shehbaz,2010-01,,,,,,"McMurphy, James",,69,1903-06-00,,1903,6,1,,,3-Jun,,,,,,,,,,,,,,,,,,,,,North America,,,,United States,California,Mendocino County,,Kaisen District.,,0,,,,,,,,,,,,,,,,,,en,,urn:catalog:CAS:BOT-BC:74297,1,e1eb501b-23c8-4e49-833b-894bd3444a5b,https://www.cch2.org/portal/collections/individual/index.php?occid=2302311
2393985,CAS,BOT-BC,,PreservedSpecimen,urn:catalog:CAS:BOT-BC:74296,74296,urn:catalog:CAS:DS:593631,Organism|Plantae|Viridiplantae|Streptophyta|Embryophyta|Tracheophyta|Spermatophytina|Magnoliopsida|Rosanae|Brassicales|Brassicaceae|Raphanus,Plantae,Tracheophyta,Magnoliopsida,Brassicales,Brassicaceae,Raphanus sativus,29702,L.,Raphanus,,sativus,,,Species,Ihsan A. Al-Shehbaz,2010-01,,,,,,"McMurphy, James",,69,1903-06-00,,1903,6,1,,,3-Jun,,,,,,,,,,,,,,,,,,,,,North America,,,,United States,California,Mendocino County,,Kaisen District.,,0,,,,,,,,,,,,,,,,,,en,,urn:catalog:CAS:BOT-BC:74296,1,e95b4f0d-4ff6-47ce-9056-280d9b3311ce,https://www.cch2.org/portal/collections/individual/index.php?occid=2393985
2446662,CAS,BOT-BC,,PreservedSpecimen,urn:catalog:CAS:BOT-BC:74295,74295,urn:catalog:CAS:DS:42108,Organism|Plantae|Viridiplantae|Streptophyta|Embryophyta|Tracheophyta|Spermatophytina|Magnoliopsida|Rosanae|Brassicales|Brassicaceae|Raphanus,Plantae,Tracheophyta,Magnoliopsida,Brassicales,Brassicaceae,Raphanus sativus,29702,L.,Raphanus,,sativus,,,Species,Ihsan A. Al-Shehbaz,2010-01,,,,,,"McMurphy, James",,69,1903-06-00,,1903,6,1,,,3-Jun,,,,,,,,,,,,,,,,,,,,,North America,,,,United States,California,Mendocino County,,Kaisen District.,,0,,,,,,,,,,,,,,,,,,en,,urn:catalog:CAS:BOT-BC:74295,1,3cc3769c-0305-4196-b640-4f462068c763,https://www.cch2.org/portal/collections/individual/index.php?occid=2446662
4892598,US,,,PreservedSpecimen,http://n2t.net/ark:/65665/36366f47d-0182-4e63-a107-3bd5380812dc,US 610713,,Organism|Plantae|Viridiplantae|Streptophyta|Embryophyta|Tracheophyta|Spermatophytina|Magnoliopsida|Rosanae|Brassicales|Brassicaceae|Raphanus,Plantae,Tracheophyta,Magnoliopsida,Brassicales,Brassicaceae,Raphanus sativus,29702,L.,Raphanus,,sativus,,,Species,,,,,,,,J. McMurphy,,69,1903-06-00,,1903,6,0,181,181,1903-6,,,,,,,,,,,,,,,,,,1,,,North America,,,,United States,California,,,Northern California. Mendocino County. Kaisen District.,,0,,,,,,,,,,,,,,,,,,,,http://n2t.net/ark:/65665/36366f47d-0182-4e63-a107-3bd5380812dc,91,dd475671-a46c-4580-91c1-da7c6bed209d,https://www.cch2.org/portal/collections/individual/index.php?occid=4892598
2296541,CAS,BOT-BC,,PreservedSpecimen,urn:catalog:CAS:BOT-BC:74177,74177,urn:catalog:CAS:DS:95620,Organism|Plantae|Viridiplantae|Streptophyta|Embryophyta|Tracheophyta|Spermatophytina|Magnoliopsida|Rosanae|Brassicales|Brassicaceae|Raphanus,Plantae,Tracheophyta,Magnoliopsida,Brassicales,Brassicaceae,Raphanus raphanistrum,29701,L.,Raphanus,,raphanistrum,,,Species,Ihsan A. Al-Shehbaz,1/10/10,,,,,,"Braunton, Ernest",,1234,1904-09-00,,1904,9,1,,,"September, 1904",,,,,,,,,,,,,,,,,,,,,North America,,,,United States,California,Amador County,,Vicinity of Ione.,,0,,,,,,,,,,,61,152,,,,200.0000000000-500.0000000000 ft,,en,,urn:catalog:CAS:BOT-BC:74177,1,4742ff6d-fedc-4b10-bdbd-b6eea1d51924,https://www.cch2.org/portal/collections/individual/index.php?occid=2296541
3542265,UCJEPS,VASC,,PreservedSpecimen,5707f5a2-fcb3-471a-9059-08fa407f703a,UC66740,,Organism|Plantae|Viridiplantae|Streptophyta|Embryophyta|Tracheophyta|Spermatophytina|Magnoliopsida|Rosanae|Brassicales|Brassicaceae|Raphanus,Plantae,Tracheophyta,Magnoliopsida,Brassicales,Brassicaceae,Raphanus sativus,29702,L.,Raphanus,,sativus,,,Species,,,,,,,,N. K. Berg,,,3/8/04,,1904,3,8,68,,Mar 8 1904,,,,,,,,,,,,,Flowering/Fruiting,,,,,,,,,,,,United States,California,Los Angeles,,Redondo,,0,,33.85355,-118.38231,NAD27,4461,,,Terrain Navigator Pro USGS 1:24000,,,,,,,,,,,,5707f5a2-fcb3-471a-9059-08fa407f703a,46,1e698734-c983-4794-acf2-4e747b75b15b,https://www.cch2.org/portal/collections/individual/index.php?occid=3542265
2699015,CAS,BOT-BC,,PreservedSpecimen,urn:catalog:CAS:BOT-BC:395327,395327,urn:catalog:CAS:BOT:77375,Organism|Plantae|Viridiplantae|Streptophyta|Embryophyta|Tracheophyta|Spermatophytina|Magnoliopsida|Rosanae|Brassicales|Brassicaceae|Raphanus,Plantae,Tracheophyta,Magnoliopsida,Brassicales,Brassicaceae,Raphanus sativus,29702,L.,Raphanus,,sativus,,,Species,,,,,,,,"Stewart, Alban",,1539,7/7/05,,1905,7,7,188,188,"July 7, ...1905-1906",California Academy of Sciences Expedition to the Galapagos Islands 1905-1906.,in cultivated ground,,,,,,,,,,,,,,,,,,,South America,,,,Ecuador,Galápagos,,,"Wreck Bay, Chatham Island",,0,,,,,,,,,,,,,,,,,,en,,urn:catalog:CAS:BOT-BC:395327,1,49d6898f-993b-4d45-b1fa-1881d010563e,https://www.cch2.org/portal/collections/individual/index.php?occid=2699015
3400958,UCJEPS,VASC,,PreservedSpecimen,1e725a56-c28b-43b2-bd8d-39d7d65e39ed,UC69195,,Organism|Plantae|Viridiplantae|Streptophyta|Embryophyta|Tracheophyta|Spermatophytina|Magnoliopsida|Rosanae|Brassicales|Brassicaceae|Raphanus,Plantae,Tracheophyta,Magnoliopsida,Brassicales,Brassicaceae,Raphanus sativus,29702,L.,Raphanus,,sativus,,,Species,,,,,,,,H. M. Hall,,6250,6/1/05,,1905,6,1,152,181,"June, 1905","Date as ""June, 1905""; ""Teratological",,,,,,,,,,,,Flowering/Fruiting,,,,,,,,,,,,United States,California,Los Angeles,,Wiseburn near Los Angeles; Wiseburn,,0,,33.92408,-118.37802,WGS84,2400,Rancho Santa Ana (no. 6),,CalTopo 1895-1915,,georef from old CCH cumulative file; (copied from DS143868),,,,,,,,,preprocessed,1e725a56-c28b-43b2-bd8d-39d7d65e39ed,46,8cb23cf9-8a53-4765-b9e6-d3903f7c5f82,https://www.cch2.org/portal/collections/individual/index.php?occid=3400958
4830361,US,,,PreservedSpecimen,http://n2t.net/ark:/65665/3146e3239-6118-48bc-8d94-ea5f9a686316,US 874348,,Organism|Plantae|Viridiplantae|Streptophyta|Embryophyta|Tracheophyta|Spermatophytina|Magnoliopsida|Rosanae|Brassicales|Brassicaceae|Raphanus,Plantae,Tracheophyta,Magnoliopsida,Brassicales,Brassicaceae,Raphanus raphanistrum,29701,L.,Raphanus,,raphanistrum,,,Species,,,,,,,,Ex herb. R. L. Pendleton,,52,5/23/06,,1906,5,23,143,143,5/23/06,,,,,,,,,,,,,,,,,,1,,,North America,,,,United States,California,,,"West Central California; Western Santa Clara Co., Santa Clara Valley.",,0,,,,,,,,,,,,,,,,,,,,http://n2t.net/ark:/65665/3146e3239-6118-48bc-8d94-ea5f9a686316,91,f31639fa-1bc8-4091-8c5f-71a4853980b1,https://www.cch2.org/portal/collections/individual/index.php?occid=4830361
3257939,UCJEPS,VASC,,PreservedSpecimen,21b870c7-080a-40db-a572-2d0c0a011966,UC127885,,Organism|Plantae|Viridiplantae|Streptophyta|Embryophyta|Tracheophyta|Spermatophytina|Magnoliopsida|Rosanae|Brassicales|Brassicaceae|Raphanus,Plantae,Tracheophyta,Magnoliopsida,Brassicales,Brassicaceae,Raphanus sativus,29702,L.,Raphanus,,sativus,,,Species,,,,,,,,Miss Harriet A. Walker,,497,7/1/06,,1906,7,1,182,273,"July 1906-September, 1906","Date as ""July-September, 1906",,,,,,,,,,,,Flowering/Fruiting,,,,,,,,,,,,United States,California,Alameda,,vicinity of Berkeley Berkeley,,0,,37.8649,-122.26947,NAD27,3457,,,Terrain Navigator 5.03 1:24000,,,,,,,,,,,,21b870c7-080a-40db-a572-2d0c0a011966,46,77f363a4-d7f8-43d7-8449-db72f3cdf8b6,https://www.cch2.org/portal/collections/individual/index.php?occid=3257939
3468200,UCJEPS,VASC,,PreservedSpecimen,878f15b4-f1e9-4c77-a78d-660accf26792,UC455765,,Organism|Plantae|Viridiplantae|Streptophyta|Embryophyta|Tracheophyta|Spermatophytina|Magnoliopsida|Rosanae|Brassicales|Brassicaceae|Raphanus,Plantae,Tracheophyta,Magnoliopsida,Brassicales,Brassicaceae,Raphanus sativus,29702,L.,Raphanus,,sativus,,,Species,,,,,,,,unknown,,,4/16/06,,1906,4,16,106,,Apr 16 1906,county unknown--supplied by user,"Poly fields"" (school)",,,,,,,,,,,Flowering/Fruiting,,,,,,,,,,,,United States,California,San Luis Obispo,,California Polytechnic School,,0,,35.30075,-120.66102,NAD83/WGS84,418,,,RSA:2009,,,,,,,,,,,,878f15b4-f1e9-4c77-a78d-660accf26792,46,3b52902f-8376-48b0-955e-134591fa3a8e,https://www.cch2.org/portal/collections/individual/index.php?occid=3468200
3489775,UCJEPS,VASC,,PreservedSpecimen,39983a30-6f21-4fe0-ae0b-0d8d12ab2b28,UC1199217,,Organism|Plantae|Viridiplantae|Streptophyta|Embryophyta|Tracheophyta|Spermatophytina|Magnoliopsida|Rosanae|Brassicales|Brassicaceae|Raphanus,Plantae,Tracheophyta,Magnoliopsida,Brassicales,Brassicaceae,Raphanus sativus,29702,L.,Raphanus,,sativus,,,Species,,,,,,,,J. P. Tracy,,2427,4/29/06,,1906,4,29,119,,Apr 29 1906,,weed in field,,,,,,,,,,,Flowering/Fruiting,,,,,,,,,,,,United States,California,Humboldt,,immediate vicinity of Eureka,,0,,40.7914,-124.1635,NAD27,3392,,,Terrain Navigator Pro,,,152,,,,,0-500 ft,,,,39983a30-6f21-4fe0-ae0b-0d8d12ab2b28,46,787cc019-6f75-4920-be02-dfe34a596b88,https://www.cch2.org/portal/collections/individual/index.php?occid=3489775
4301862,OSC,V,,PreservedSpecimen,{13410F06-1294-4E40-9DF8-420851EE9F1F},OSC-V-023814,OSC4747,Organism|Plantae|Viridiplantae|Streptophyta|Embryophyta|Tracheophyta|Spermatophytina|Magnoliopsida|Rosanae|Brassicales|Brassicaceae|Raphanus,Plantae,Tracheophyta,Magnoliopsida,Brassicales,Brassicaceae,Raphanus sativus,29702,L.,Raphanus,,sativus,,,Species,"Al-Shehbaz, I.",2016,,,,,,Myrtle Burnap,,s.n.,5/2/06,,1906,5,2,122,,5/2/06,,Rather dry soil in pastures and grain fields.,,,,,,,,,,,,wild collection,,,,,,,,,,,United States,Oregon,Benton,,Corvallis,,0,,44.5647,-123.2608,,4828,,OregonFlora 1994-2020 methodology,"OrlookId: 99869, StateProvince: Oregon, County: Benton, LocName: Corvallis",,,,,,,,,,,,4436272,81,a130f47c-e352-48ab-b9c2-376ac87821bd,https://www.cch2.org/portal/collections/individual/index.php?occid=4301862
2300919,CAS,BOT-BC,,PreservedSpecimen,urn:catalog:CAS:BOT-BC:74309,74309,urn:catalog:CAS:DS:13638,Organism|Plantae|Viridiplantae|Streptophyta|Embryophyta|Tracheophyta|Spermatophytina|Magnoliopsida|Rosanae|Brassicales|Brassicaceae|Raphanus,Plantae,Tracheophyta,Magnoliopsida,Brassicales,Brassicaceae,Raphanus sativus,29702,L.,Raphanus,,sativus,,,Species,Ihsan A. Al-Shehbaz,2010-01,,,,,,"Patterson, Miss.; Wiltz",,s.n.,7/1/07,,1907,7,1,182,,"July 1, 1907.",,,,,,,,,,,,,,,,,,,,,North America,,,,United States,California,Monterey County,,Monterey Peninsula. Chinatown. Pacific Grove.,,0,,,,,,,,,,,,,,,,,,en,,urn:catalog:CAS:BOT-BC:74309,1,69160ce0-1316-4a23-a094-dd0b398d7831,https://www.cch2.org/portal/collections/individual/index.php?occid=2300919
2316473,CAS,BOT-BC,,PreservedSpecimen,urn:catalog:CAS:BOT-BC:74304,74304,urn:catalog:CAS:DS:13654,Organism|Plantae|Viridiplantae|Streptophyta|Embryophyta|Tracheophyta|Spermatophytina|Magnoliopsida|Rosanae|Brassicales|Brassicaceae|Raphanus,Plantae,Tracheophyta,Magnoliopsida,Brassicales,Brassicaceae,Raphanus sativus,29702,L.,Raphanus,,sativus,,,Species,Ihsan A. Al-Shehbaz,2010-01,,,,,,"Patterson, Miss.; Wiltz",,s.n.,7/1/07,,1907,7,1,182,,"July 1, 1907.",,,,,,,,,,,,,,,,,,,,,North America,,,,United States,California,Monterey County,,Monterey Peninsula. Chinatown. Pacific Grove.,,0,,,,,,,,,,,,,,,,,,en,,urn:catalog:CAS:BOT-BC:74304,1,055151b9-07c5-4b11-8c65-d080ba5da209,https://www.cch2.org/portal/collections/individual/index.php?occid=2316473
2336172,CAS,BOT-BC,,PreservedSpecimen,urn:catalog:CAS:BOT-BC:74305,74305,urn:catalog:CAS:DS:13639,Organism|Plantae|Viridiplantae|Streptophyta|Embryophyta|Tracheophyta|Spermatophytina|Magnoliopsida|Rosanae|Brassicales|Brassicaceae|Raphanus,Plantae,Tracheophyta,Magnoliopsida,Brassicales,Brassicaceae,Raphanus sativus,29702,L.,Raphanus,,sativus,,,Species,Ihsan A. Al-Shehbaz,2010-01,,,,,,"Patterson, Miss.; Wiltz",,66,6/6/07,,1907,6,6,157,,"June 6, 1907.",,,,,,,,,,,,,,,,,,,,,North America,,,,United States,California,Monterey County,,Monterey Peninsula. Near bath house. Pacific Grove.,,0,,,,,,,,,,,,,,,,,,en,,urn:catalog:CAS:BOT-BC:74305,1,8193d577-8948-49eb-8f3c-b87b2247d6a6,https://www.cch2.org/portal/collections/individual/index.php?occid=2336172
2340225,CAS,BOT-BC,,PreservedSpecimen,urn:catalog:CAS:BOT-BC:74344,74344,urn:catalog:CAS:DS:62624,Organism|Plantae|Viridiplantae|Streptophyta|Embryophyta|Tracheophyta|Spermatophytina|Magnoliopsida|Rosanae|Brassicales|Brassicaceae|Raphanus,Plantae,Tracheophyta,Magnoliopsida,Brassicales,Brassicaceae,Raphanus sativus,29702,L.,Raphanus,,sativus,,,Species,Ihsan A. Al-Shehbaz,2010-01,,,,,,"Randall, Josephine D.",,121,6/21/07,,1907,6,21,172,,21-Jun-07,,,,,,,,,,,,,,,,,,,,,North America,,,,United States,California,Santa Clara County,,Santa Cruz Peninsula. Stanford University.,,0,,,,,,,,,,,,,,,,,,en,,urn:catalog:CAS:BOT-BC:74344,1,b1fd3cac-a9f9-49be-a03c-e04ba5002fe6,https://www.cch2.org/portal/collections/individual/index.php?occid=2340225
2390205,CAS,BOT-BC,,PreservedSpecimen,urn:catalog:CAS:BOT-BC:74346,74346,urn:catalog:CAS:DS:62622,Organism|Plantae|Viridiplantae|Streptophyta|Embryophyta|Tracheophyta|Spermatophytina|Magnoliopsida|Rosanae|Brassicales|Brassicaceae|Raphanus,Plantae,Tracheophyta,Magnoliopsida,Brassicales,Brassicaceae,Raphanus sativus,29702,L.,Raphanus,,sativus,,,Species,Ihsan A. Al-Shehbaz,2010-01,,,,,,"Randall, Josephine D.",,123,6/21/07,,1907,6,21,172,,21-Jun-07,,,,,,,,,,,,,,,,,,,,,North America,,,,United States,California,Santa Clara County,,"Santa Cruz Peninsula. Near Lake Lagunita, Stanford University.",,0,,,,,,,,,,,,,,,,,,en,,urn:catalog:CAS:BOT-BC:74346,1,8b309ca4-921b-4480-81fe-c4ea5de6a4ac,https://www.cch2.org/portal/collections/individual/index.php?occid=2390205
2437901,CAS,BOT-BC,,PreservedSpecimen,urn:catalog:CAS:BOT-BC:74235,74235,urn:catalog:CAS:DS:670922,Organism|Plantae|Viridiplantae|Streptophyta|Embryophyta|Tracheophyta|Spermatophytina|Magnoliopsida|Rosanae|Brassicales|Brassicaceae|Raphanus,Plantae,Tracheophyta,Magnoliopsida,Brassicales,Brassicaceae,Raphanus sativus,29702,L.,Raphanus,,sativus,,,Species,Ihsan A. Al-Shehbaz,2010-01,,,,,,"Dows, Barbara",,s.n.,7/12/07,,1907,7,12,193,,12-Jul-07,,,,,,,,,,,,,,,,,,,,,North America,,,,United States,California,Sonoma County,,Sebastopol.,,0,,,,,,,,,,,,,,,,,,en,,urn:catalog:CAS:BOT-BC:74235,1,848c5c4f-958e-4c79-af9d-1dbacacb9671,https://www.cch2.org/portal/collections/individual/index.php?occid=2437901
2465901,CAS,BOT-BC,,PreservedSpecimen,urn:catalog:CAS:BOT-BC:74345,74345,urn:catalog:CAS:DS:62623,Organism|Plantae|Viridiplantae|Streptophyta|Embryophyta|Tracheophyta|Spermatophytina|Magnoliopsida|Rosanae|Brassicales|Brassicaceae|Raphanus,Plantae,Tracheophyta,Magnoliopsida,Brassicales,Brassicaceae,Raphanus sativus,29702,L.,Raphanus,,sativus,,,Species,Ihsan A. Al-Shehbaz,2010-01,,,,,,"Randall, Josephine D.",,122,6/5/07,,1907,6,5,156,,June 5th 1907,,,,,,,,,,,,,,,,,,,,,North America,,,,United States,California,Santa Clara County,,Santa Cruz Peninsula. Page Mill Road. Near Stanford University.,,0,,,,,,,,,,,,,,,,,,en,,urn:catalog:CAS:BOT-BC:74345,1,843bc177-f910-4f6e-b484-142f27333ea3,https://www.cch2.org/portal/collections/individual/index.php?occid=2465901
202465,OBI,,,PreservedSpecimen,6bf3855a-48bc-4186-9a9f-6d34f18d79d6,OBI101786,47942,Organism|Plantae|Viridiplantae|Streptophyta|Embryophyta|Tracheophyta|Spermatophytina|Magnoliopsida|Rosanae|Brassicales|Brassicaceae|Raphanus,Plantae,Tracheophyta,Magnoliopsida,Brassicales,Brassicaceae,Raphanus sativus,29702,L.,Raphanus,,sativus,,,Species,,,,,,,,Dora Heath,,s.n.,4/4/08,,1908,4,4,95,,4-Apr-08,,,,,,,,,,,,,,,,,,,,,,,,,United States,California,Santa Barbara,,Highland Hills,,0,,,,,,,,,,,,,,,,,,,,,12,dbce8b96-f818-49e9-af61-9890224e257b,https://www.cch2.org/portal/collections/individual/index.php?occid=202465
3290499,UCJEPS,VASC,,PreservedSpecimen,db717786-8090-4b20-a071-64c7ff6a7c13,JEPS53817,,Organism|Plantae|Viridiplantae|Streptophyta|Embryophyta|Tracheophyta|Spermatophytina|Magnoliopsida|Rosanae|Brassicales|Brassicaceae|Raphanus,Plantae,Tracheophyta,Magnoliopsida,Brassicales,Brassicaceae,Raphanus sativus,29702,L.,Raphanus,,sativus,,,Species,,,,,,,,Alice King,,,3/1/08,,1908,3,1,61,91,"March, 1908","Date as ""March, 1908""",,,,,,,,,,,,Flowering/Fruiting,,,,,,,,,,,,United States,California,Los Angeles,,Santa Ana,,0,,,,,,,,,,,,,,,,,,,,db717786-8090-4b20-a071-64c7ff6a7c13,46,36efc1d6-3eac-45dc-ad95-802eaf7c8da7,https://www.cch2.org/portal/collections/individual/index.php?occid=3290499
4095395,CDA,,,PreservedSpecimen,33b11848-afe9-4868-92a8-a228e28c49d4,CDA-0020839,,Organism|Plantae|Viridiplantae|Streptophyta|Embryophyta|Tracheophyta|Spermatophytina|Magnoliopsida|Rosanae|Brassicales|Brassicaceae|Raphanus,Plantae,Tracheophyta,Magnoliopsida,Brassicales,Brassicaceae,Raphanus sativus,29702,L.,Raphanus,,sativus,,,Species,,,,,,,,unknown,,,3/27/08,,1908,3,27,87,,3/27/08,,,,annual,,,,,,,,,,Wild: native/naturalized,0,,,,Standard sheet,,,,,,United States,California,Santa Barbara,,Vicinity of Santa Maria Union High School. South Central Coast.,,,,34.9425,-120.4358,,,,,,,,,,,,,,,,,,50,33b11848-afe9-4868-92a8-a228e28c49d4,https://www.cch2.org/portal/collections/individual/index.php?occid=4095395
917287,RSA,POM,,PreservedSpecimen,6123cb6c-53c7-49cc-b5fb-9815b9fb6ba0,,POM accession: 396,Organism|Plantae|Viridiplantae|Streptophyta|Embryophyta|Tracheophyta|Spermatophytina|Magnoliopsida|Rosanae|Brassicales|Brassicaceae|Raphanus,Plantae,Tracheophyta,Magnoliopsida,Brassicales,Brassicaceae,Raphanus sativus,29702,L.,Raphanus,,sativus,,,Species,,,,,,,,D. L. Crawford,,s.n.,4/10/09,,1909,4,10,100,,,,,,,,,,,,,,,flowers & fruits,Cultivated,,,,,herbarium sheet,,,,,,United States,California,Los Angeles,,Claremont.,,0,,,,,,,,,,,,,,,,,,,T. Kim Nguyen; cataloged date: 2007-09-21,6123cb6c-53c7-49cc-b5fb-9815b9fb6ba0,17,5cf78434-833c-4b4b-80d6-4f2a2dd6b064,https://www.cch2.org/portal/collections/individual/index.php?occid=917287
1078648,RSA,POM,,PreservedSpecimen,adfb54c6-1542-4fd2-9111-7612ff209148,,POM accession: 397,Organism|Plantae|Viridiplantae|Streptophyta|Embryophyta|Tracheophyta|Spermatophytina|Magnoliopsida|Rosanae|Brassicales|Brassicaceae|Raphanus,Plantae,Tracheophyta,Magnoliopsida,Brassicales,Brassicaceae,Raphanus sativus,29702,L.,Raphanus,,sativus,,,Species,,,,,,,,C. N. Carter,,s.n.,5/11/09,,1909,5,11,131,,,,,,,,,,,,,,,flowers & fruits,Introduced,,,,,herbarium sheet,,,,,,United States,California,Los Angeles,,Claremont.,,0,,,,,,,,,,,,,,,,,,,T. Kim Nguyen; cataloged date: 2008-10-29,adfb54c6-1542-4fd2-9111-7612ff209148,17,a1f9d536-d823-4d7a-90c1-efe4ad824665,https://www.cch2.org/portal/collections/individual/index.php?occid=1078648
904925,RSA,POM,,PreservedSpecimen,5b3f8ec2-12cb-426a-9ce4-ca7ba9a8f6c2,,POM accession: 127263,Organism|Plantae|Viridiplantae|Streptophyta|Embryophyta|Tracheophyta|Spermatophytina|Magnoliopsida|Rosanae|Brassicales|Brassicaceae|Raphanus,Plantae,Tracheophyta,Magnoliopsida,Brassicales,Brassicaceae,Raphanus sativus,29702,L.,Raphanus,,sativus,,,Species,,,,,,,,Alice D. Randall,,141,3/28/10,,1910,3,28,87,,,,,,,,,,,,herbariumSpecimenDuplicate: https://www.cch2.org/portal/collections/individual/index.php?guid=urn:catalog:CAS:BOT-BC:74302 | herbariumSpecimenDuplicate: https://www.cch2.org/portal/collections/individual/index.php?guid=urn:catalog:CAS:BOT-BC:74301,,,flowers & fruits,Introduced,,,,,herbarium sheet,,,,,,United States,California,Monterey,,Carmel by the sea. The Monterey Peninsula.,,0,,,,,,,,,,,,,,,,,,,Jackie C. McConnaughy; cataloged date: 2012-04-13,5b3f8ec2-12cb-426a-9ce4-ca7ba9a8f6c2,17,6c46400c-63d5-449f-b9d9-7a5035bfa315,https://www.cch2.org/portal/collections/individual/index.php?occid=904925
2286003,CAS,BOT-BC,,PreservedSpecimen,urn:catalog:CAS:BOT-BC:74303,74303,urn:catalog:CAS:DS:13786,Organism|Plantae|Viridiplantae|Streptophyta|Embryophyta|Tracheophyta|Spermatophytina|Magnoliopsida|Rosanae|Brassicales|Brassicaceae|Raphanus,Plantae,Tracheophyta,Magnoliopsida,Brassicales,Brassicaceae,Raphanus sativus,29702,L.,Raphanus,,sativus,,,Species,Ihsan A. Al-Shehbaz,2010-01,,,,,,"Randall, Alice D.",,410,4/26/10,,1910,4,26,116,,26-Apr-10,,,,,,,,,,,,,,,,,,,,,North America,,,,United States,California,Monterey County,,Monterey Peninsula. Carmel Valley.,,0,,,,,,,,,,,,,,,,,,en,,urn:catalog:CAS:BOT-BC:74303,1,5944dd93-89fe-4b5d-83aa-646c1eb8a8ea,https://www.cch2.org/portal/collections/individual/index.php?occid=2286003
2294495,CAS,BOT-BC,,PreservedSpecimen,urn:catalog:CAS:BOT-BC:74302,74302,,Organism|Plantae|Viridiplantae|Streptophyta|Embryophyta|Tracheophyta|Spermatophytina|Magnoliopsida|Rosanae|Brassicales|Brassicaceae|Raphanus,Plantae,Tracheophyta,Magnoliopsida,Brassicales,Brassicaceae,Raphanus sativus,29702,L.,Raphanus,,sativus,,,Species,Ihsan A. Al-Shehbaz,2010-01,,,,,,"Randall, Alice D.",,141,3/28/10,,1910,3,28,87,,"Mch. 28, 1910",,,,,,,,,,herbariumSpecimenDuplicate: https://www.cch2.org/portal/collections/individual/index.php?guid=5b3f8ec2-12cb-426a-9ce4-ca7ba9a8f6c2 | herbariumSpecimenDuplicate: https://www.cch2.org/portal/collections/individual/index.php?guid=urn:catalog:CAS:BOT-BC:74301,,,,,,,,,,,North America,,,,United States,California,Monterey County,,Monterey Peninsula. Carmel-By-The-Sea.,,0,,,,,,,,,,,,,,,,,,en,,urn:catalog:CAS:BOT-BC:74302,1,30adc826-0c61-4947-8cab-d627274409c9,https://www.cch2.org/portal/collections/individual/index.php?occid=2294495
2328808,CAS,BOT-BC,,PreservedSpecimen,urn:catalog:CAS:BOT-BC:74301,74301,urn:catalog:CAS:DS:17941,Organism|Plantae|Viridiplantae|Streptophyta|Embryophyta|Tracheophyta|Spermatophytina|Magnoliopsida|Rosanae|Brassicales|Brassicaceae|Raphanus,Plantae,Tracheophyta,Magnoliopsida,Brassicales,Brassicaceae,Raphanus sativus,29702,L.,Raphanus,,sativus,,,Species,Ihsan A. Al-Shehbaz,2010-01,,,,,,"Randall, Alice D.",,141,3/28/10,,1910,3,28,87,,"Mch. 28, 1910",,,,,,,,,,herbariumSpecimenDuplicate: https://www.cch2.org/portal/collections/individual/index.php?guid=5b3f8ec2-12cb-426a-9ce4-ca7ba9a8f6c2 | herbariumSpecimenDuplicate: https://www.cch2.org/portal/collections/individual/index.php?guid=urn:catalog:CAS:BOT-BC:74302,,,,,,,,,,,North America,,,,United States,California,Monterey County,,Monterey Peninsula. Carmel-By-The-Sea.,,0,,,,,,,,,,,,,,,,,,en,,urn:catalog:CAS:BOT-BC:74301,1,e87fe2d7-8d72-41c7-803b-da250dec86b5,https://www.cch2.org/portal/collections/individual/index.php?occid=2328808
4205526,OSC,V,,PreservedSpecimen,{F8D6317A-F37A-4209-B034-2086AB619758},,WILLU1336,Organism|Plantae|Viridiplantae|Streptophyta|Embryophyta|Tracheophyta|Spermatophytina|Magnoliopsida|Rosanae|Brassicales|Brassicaceae|Raphanus,Plantae,Tracheophyta,Magnoliopsida,Brassicales,Brassicaceae,Raphanus sativus,29702,L.,Raphanus,,sativus,,,Species,"Al-Shehbaz, I.",2016,,,,,,Gerald W. Prescott,Gerald Prescott,s.n.,4/13/10,,1910,4,13,103,,4/13/10,,open ground.,,,,,,,,,,,flowering,,,,,,,,,,,,United States,Oregon,Josephine,,Grants Pass.,,0,,42.4392,-123.3272,,4828,[automated process-OregonFlora/OSU Herb],OregonFlora 1994-2020 methodology,"OrlookId: 75468, StateProvince: Oregon, County: Josephine, LocName: Grants Pass",,,,,,,,,,,,668375,81,db9597eb-4d56-4911-b9c1-86e7b33681ce,https://www.cch2.org/portal/collections/individual/index.php?occid=4205526
4188229,OSC,V,,PreservedSpecimen,{E939EC93-F250-4A90-9B92-F389DF31FCCF},,WILLU3206,Organism|Plantae|Viridiplantae|Streptophyta|Embryophyta|Tracheophyta|Spermatophytina|Magnoliopsida|Rosanae|Brassicales|Brassicaceae,Plantae,Tracheophyta,Magnoliopsida,Brassicales,Brassicaceae,Raphanus,6418,,Raphanus,,,,,Genus,"Al-Shehbaz, I.",2016,,,,,,Harry S. Prescott,H.S. Prescott,s.n.,1912-04-00,,1912,4,0,,,1912-4,,,,,,,,,,,,,fruiting,,,,,,,,,,,,United States,Oregon,Josephine,,Grants Pass.,,0,,42.4392,-123.3272,,4828,[automated process-OregonFlora/OSU Herb],OregonFlora 1994-2020 methodology,"OrlookId: 75468, StateProvince: Oregon, County: Josephine, LocName: Grants Pass",,,,,,,,,,,,651467,81,dd8ac683-3e6b-47f3-8df3-ee89b147d456,https://www.cch2.org/portal/collections/individual/index.php?occid=4188229
3904075,LA,,,PreservedSpecimen,92aba5eb-1fde-4625-b184-fdcfb8387a75,LA00606057,,Organism|Plantae|Viridiplantae|Streptophyta|Embryophyta|Tracheophyta|Spermatophytina|Magnoliopsida|Rosanae|Brassicales|Brassicaceae|Raphanus,Plantae,Tracheophyta,Magnoliopsida,Brassicales,Brassicaceae,Raphanus raphanistrum,29701,L.,Raphanus,,raphanistrum,,,Species,,,,,,,,Cora Smith King,,2061,9/21/12,,1912,9,21,265,,,,,,,,,,,,,,,,,,,,,,,,,,,,,,,,,0,,,,,,,,,,,,,,,,,,,abaniaga,,34,92aba5eb-1fde-4625-b184-fdcfb8387a75,https://www.cch2.org/portal/collections/individual/index.php?occid=3904075
2426166,CAS,BOT-BC,,PreservedSpecimen,urn:catalog:CAS:BOT-BC:74363,74363,urn:catalog:CAS:DS:98468,Organism|Plantae|Viridiplantae|Streptophyta|Embryophyta|Tracheophyta|Spermatophytina|Magnoliopsida|Rosanae|Brassicales|Brassicaceae|Raphanus,Plantae,Tracheophyta,Magnoliopsida,Brassicales,Brassicaceae,Raphanus sativus,29702,L.,Raphanus,,sativus,,,Species,Ihsan A. Al-Shehbaz,2010-01,,,,,,"Rich, W. H.",,s.n.,1912-00-00,,1912,1,1,,,Spring 1912,,,,,,,,,,,,,,,,,,,,,North America,,,,United States,California,Santa Cruz County,,Santa Cruz Peninsula. Swanton.,,0,,,,,,,,,,,,,,,,,,en,,urn:catalog:CAS:BOT-BC:74363,1,76b9dc62-7121-4963-9bc4-96017478146a,https://www.cch2.org/portal/collections/individual/index.php?occid=2426166
2334928,CAS,BOT-BC,,PreservedSpecimen,urn:catalog:CAS:BOT-BC:74198,74198,urn:catalog:CAS:BOT:77386,Organism|Plantae|Viridiplantae|Streptophyta|Embryophyta|Tracheophyta|Spermatophytina|Magnoliopsida|Rosanae|Brassicales|Brassicaceae|Raphanus,Plantae,Tracheophyta,Magnoliopsida,Brassicales,Brassicaceae,Raphanus raphanistrum,29701,L.,Raphanus,,raphanistrum,,,Species,Ihsan A. Al-Shehbaz,2010-01,,,,,,"Smith, L. E.",,s.n.,5/19/13,,1913,5,19,139,,19-May-13,,,,,,,,,,,,,,,,,,,,,North America,,,,United States,California,Shasta County,,Anderson.,,0,,,,,,,,,,,,,,,,,,en,,urn:catalog:CAS:BOT-BC:74198,1,ef5cb3f7-888d-4442-8ac4-b1e406f6097e,https://www.cch2.org/portal/collections/individual/index.php?occid=2334928
2298082,CAS,BOT-BC,,PreservedSpecimen,urn:catalog:CAS:BOT-BC:74233,74233,urn:catalog:CAS:BOT:77370,Organism|Plantae|Viridiplantae|Streptophyta|Embryophyta|Tracheophyta|Spermatophytina|Magnoliopsida|Rosanae|Brassicales|Brassicaceae|Raphanus,Plantae,Tracheophyta,Magnoliopsida,Brassicales,Brassicaceae,Raphanus sativus,29702,L.,Raphanus,,sativus,,,Species,Ihsan A. Al-Shehbaz,1/10/10,,,,,,"Newell, Gwendolan",,s.n.,1913-08-00,,1913,8,1,,,13-Aug,,,,,,,,,,,,,,,,,,,,,North America,,,,United States,California,Santa Barbara County,,Mountains adjacent to Santa Barbara. Prado Ranch.,,0,,,,,,,,,,,,,,,,,,en,,urn:catalog:CAS:BOT-BC:74233,1,b78cf1d1-7e88-4045-b309-c5d1c83bb017,https://www.cch2.org/portal/collections/individual/index.php?occid=2298082
4892287,US,,,PreservedSpecimen,http://n2t.net/ark:/65665/362ff11d0-50b3-4482-8cfc-47cba17e7cfb,US 880131,,Organism|Plantae|Viridiplantae|Streptophyta|Embryophyta|Tracheophyta|Spermatophytina|Magnoliopsida|Rosanae|Brassicales|Brassicaceae|Raphanus,Plantae,Tracheophyta,Magnoliopsida,Brassicales,Brassicaceae,Raphanus sativus,29702,L.,Raphanus,,sativus,,,Species,,,,,,,,W. F. Schmitt,,64,7/12/13,,1913,7,12,193,193,7/12/13,,,,,,,,,,,,,,,,,,1,,,North America,,,,United States,California,,,Berkeley.,,0,,,,,,,,,,,,,,,,,,,,http://n2t.net/ark:/65665/362ff11d0-50b3-4482-8cfc-47cba17e7cfb,91,c54aae73-db57-4d6d-8eee-9f792838d167,https://www.cch2.org/portal/collections/individual/index.php?occid=4892287
5001849,US,,,PreservedSpecimen,http://n2t.net/ark:/65665/3ed8164f0-796e-483c-8cc6-8f398da8250a,US 765571,,Organism|Plantae|Viridiplantae|Streptophyta|Embryophyta|Tracheophyta|Spermatophytina|Magnoliopsida|Rosanae|Brassicales|Brassicaceae|Raphanus,Plantae,Tracheophyta,Magnoliopsida,Brassicales,Brassicaceae,Raphanus sativus,29702,L.,Raphanus,,sativus,,,Species,,,,,,,,A. Hitchcock,,185,7/7/13,,1913,7,7,188,188,7/7/13,,,,,,,,,,,,,,,,,,1,,,North America,,,,United States,California,,,Beach near Wrights. Santa Cruz Mountains.,,0,,,,,,,,,,,,,,,,,,,,http://n2t.net/ark:/65665/3ed8164f0-796e-483c-8cc6-8f398da8250a,91,df4c56d6-24f5-4ad6-af43-5a90b1335445,https://www.cch2.org/portal/collections/individual/index.php?occid=5001849
1368006,DAV,,,PreservedSpecimen,8d5dd6a1-f3be-4457-83f7-e118b2f8535b,DAV310423,Accession #: DAV2639,Organism|Plantae|Viridiplantae|Streptophyta|Embryophyta|Tracheophyta|Spermatophytina|Magnoliopsida|Rosanae|Brassicales|Brassicaceae|Raphanus,Plantae,Tracheophyta,Magnoliopsida,Brassicales,Brassicaceae,Raphanus sativus,29702,L.,Raphanus,,sativus,,,Species,,,,,,,,A. A. Heller,,11203,3/16/14,,1914,3,16,75,,16-Mar-14,Access Database Number (Deprecated): UCD115181,Growing in hills.,,,,,,,,herbariumSpecimenDuplicate: https://www.cch2.org/portal/collections/individual/index.php?guid=0d3b37a6-ff52-4f9a-8390-ac9e45104f26,,,,,,,,,,,,,,,United States,California,Butte,,Butte County: 8 miles north of Oroville.,,0,,39.612827,-121.60595,NAD27,6450,,,Terrain Navigator,,copied from duplicate,,,,,,,,,preprocessed,UCD115181,39,8d5dd6a1-f3be-4457-83f7-e118b2f8535b,https://www.cch2.org/portal/collections/individual/index.php?occid=1368006
1368028,DAV,,,PreservedSpecimen,2edcea89-dc2d-4c04-9c9f-59076f02d22b,DAV310408,Accession #: DAV2631,Organism|Plantae|Viridiplantae|Streptophyta|Embryophyta|Tracheophyta|Spermatophytina|Magnoliopsida|Rosanae|Brassicales|Brassicaceae|Raphanus,Plantae,Tracheophyta,Magnoliopsida,Brassicales,Brassicaceae,Raphanus sativus,29702,L.,Raphanus,,sativus,,,Species,,,,,,,,P. B. Kennedy,,4621,3/15/14,,1914,3,15,74,,15-Mar-14,Access Database Number (Deprecated): UCD115207,,,,,,,,,,,,,,,,,,,,,,,,United States,California,Alameda,,Alameda County: west Berkeley.,,0,,,,,,,,,,,,,,,,,,,,UCD115207,39,2edcea89-dc2d-4c04-9c9f-59076f02d22b,https://www.cch2.org/portal/collections/individual/index.php?occid=1368028
1368029,DAV,,,PreservedSpecimen,0e39ff0d-004b-45f9-9f4a-8faf9b345a86,DAV310407,Accession #: DAV2643,Organism|Plantae|Viridiplantae|Streptophyta|Embryophyta|Tracheophyta|Spermatophytina|Magnoliopsida|Rosanae|Brassicales|Brassicaceae|Raphanus,Plantae,Tracheophyta,Magnoliopsida,Brassicales,Brassicaceae,Raphanus sativus,29702,L.,Raphanus,,sativus,,,Species,,,,,,,,P. B. Kennedy,,4713,4/19/14,,1914,4,19,109,,19-Apr-14,Access Database Number (Deprecated): UCD115208,Margin of cultivated ground.,,,,,,,,,,,,,,,,,,,,,,,United States,California,Marin,,Marin County: Mill Valley.,,0,,,,,,,,,,,,,,,,,,,,UCD115208,39,0e39ff0d-004b-45f9-9f4a-8faf9b345a86,https://www.cch2.org/portal/collections/individual/index.php?occid=1368029
2312024,CAS,BOT-BC,,PreservedSpecimen,urn:catalog:CAS:BOT-BC:74263,74263,urn:catalog:CAS:BOT:77369,Organism|Plantae|Viridiplantae|Streptophyta|Embryophyta|Tracheophyta|Spermatophytina|Magnoliopsida|Rosanae|Brassicales|Brassicaceae|Raphanus,Plantae,Tracheophyta,Magnoliopsida,Brassicales,Brassicaceae,Raphanus sativus,29702,L.,Raphanus,,sativus,,,Species,Ihsan A. Al-Shehbaz,2010-01,,,,,,"Heller, A. A.",,11203,3/16/14,,1914,3,16,75,,16-Mar-14,It is rather common.,"Moist cultivated ground, low hills.",,,,,,,,,,,,,,,,,,,North America,,,,United States,California,Butte County,,Low hills 8 miles north of Oroville.,,0,,,,,,,,,,,,,,,,,,en,,urn:catalog:CAS:BOT-BC:74263,1,102ac159-1634-4857-930b-94959e168b85,https://www.cch2.org/portal/collections/individual/index.php?occid=2312024
2457381,CAS,BOT-BC,,PreservedSpecimen,urn:catalog:CAS:BOT-BC:74311,74311,urn:catalog:CAS:BOT:77367,Organism|Plantae|Viridiplantae|Streptophyta|Embryophyta|Tracheophyta|Spermatophytina|Magnoliopsida|Rosanae|Brassicales|Brassicaceae|Raphanus,Plantae,Tracheophyta,Magnoliopsida,Brassicales,Brassicaceae,Raphanus sativus,29702,L.,Raphanus,,sativus,,,Species,Ihsan A. Al-Shehbaz,1/10/10,,,,,,"Newell, Gwendolan",,s.n.,7/8/14,,1914,7,8,189,,"July 8, 1914.",,,,,,,,,,,,,,,,,,,,,North America,,,,United States,California,Monterey County,,Pacific Grove.,,0,,,,,,,,,,,,,,,,,,en,,urn:catalog:CAS:BOT-BC:74311,1,835679c4-3fa3-42eb-ad7b-2e9fcbf4bb0d,https://www.cch2.org/portal/collections/individual/index.php?occid=2457381
2465731,CAS,BOT-BC,,PreservedSpecimen,urn:catalog:CAS:BOT-BC:74262,74262,urn:catalog:CAS:DS:18736,Organism|Plantae|Viridiplantae|Streptophyta|Embryophyta|Tracheophyta|Spermatophytina|Magnoliopsida|Rosanae|Brassicales|Brassicaceae|Raphanus,Plantae,Tracheophyta,Magnoliopsida,Brassicales,Brassicaceae,Raphanus sativus,29702,L.,Raphanus,,sativus,,,Species,Ihsan A. Al-Shehbaz,2010-01,,,,,,"Heller, A. A.",,11203,3/16/14,,1914,3,16,75,,16-Mar-14,It is rather common.,"Moist cultivated ground, low hills.",,,,,,,,,,,,,,,,,,,North America,,,,United States,California,Butte County,,Low hills 8 miles north of Oroville.,,0,,,,,,,,,,,,,,,,,,en,,urn:catalog:CAS:BOT-BC:74262,1,8a068263-ff50-4918-af03-04d180c75c65,https://www.cch2.org/portal/collections/individual/index.php?occid=2465731
3113066,SD,,,PreservedSpecimen,F6EB7613-8BE7-44A5-9143-380899CE0419,SD00062788,SD19601,Organism|Plantae|Viridiplantae|Streptophyta|Embryophyta|Tracheophyta|Spermatophytina|Magnoliopsida|Rosanae|Brassicales|Brassicaceae|Raphanus,Plantae,Tracheophyta,Magnoliopsida,Brassicales,Brassicaceae,Raphanus sativus,29702,L.,Raphanus,,sativus,,,Species,,,,,,,,Fred Baker,Charlotte Baker,260,6/18/14,,1914,6,18,169,,6/18/14,,,,,,,,,,,,,FFL,,,,,,,,,,,,Japan,NULL,Unknown,,Hakone-Miyanshita Road,,0,,,,,,,,,,n/a,,,,,,unknownft.,,,,SD19601,43,d98910df-9397-4b41-8b4c-edee32d805be,https://www.cch2.org/portal/collections/individual/index.php?occid=3113066
3430357,UCJEPS,VASC,,PreservedSpecimen,0d3b37a6-ff52-4f9a-8390-ac9e45104f26,UC203587,,Organism|Plantae|Viridiplantae|Streptophyta|Embryophyta|Tracheophyta|Spermatophytina|Magnoliopsida|Rosanae|Brassicales|Brassicaceae|Raphanus,Plantae,Tracheophyta,Magnoliopsida,Brassicales,Brassicaceae,Raphanus sativus,29702,L.,Raphanus,,sativus,,,Species,,,,,,,,A. A. Heller,,11203,3/16/14,,1914,3,16,75,,Mar 16 1914,,"moist cultivated ground, low hills",,,,,,,,herbariumSpecimenDuplicate: https://www.cch2.org/portal/collections/individual/index.php?guid=8d5dd6a1-f3be-4457-83f7-e118b2f8535b,,,Flowering/Fruiting,,,,,,,,,,,,United States,California,Butte,,8 mi n of Oroville,,0,,39.612827,-121.60595,NAD27,6450,,,Terrain Navigator,,,,,,,,,,,,0d3b37a6-ff52-4f9a-8390-ac9e45104f26,46,deb1daed-d6f6-42a4-af9a-c37115398a3b,https://www.cch2.org/portal/collections/individual/index.php?occid=3430357
5003685,US,,,PreservedSpecimen,http://n2t.net/ark:/65665/3efd7e67b-6d12-42da-8a25-4114aef5ee2d,US 885379,,Organism|Plantae|Viridiplantae|Streptophyta|Embryophyta|Tracheophyta|Spermatophytina|Magnoliopsida|Rosanae|Brassicales|Brassicaceae|Raphanus,Plantae,Tracheophyta,Magnoliopsida,Brassicales,Brassicaceae,Raphanus sativus,29702,L.,Raphanus,,sativus,,,Species,,,,,,,,A. S. Hitchcock,,12366,8/28/14,,1914,8,28,240,240,8/28/14,,,,,,,,,,,,,,,,,,1,,,North America,,,,United States,Oregon,,,Garibaldi.,,0,,,,,,,,,,,,,,,,,,,,http://n2t.net/ark:/65665/3efd7e67b-6d12-42da-8a25-4114aef5ee2d,91,cf897087-336a-4540-89de-7b5b7d7cea53,https://www.cch2.org/portal/collections/individual/index.php?occid=5003685
469011,SD,,,PreservedSpecimen,FEECD082-09D8-4DE2-82DC-76C7A4442875,SD00062802,SD113142,Organism|Plantae|Viridiplantae|Streptophyta|Embryophyta|Tracheophyta|Spermatophytina|Magnoliopsida|Rosanae|Brassicales|Brassicaceae|Raphanus,Plantae,Tracheophyta,Magnoliopsida,Brassicales,Brassicaceae,Raphanus sativus,29702,L.,Raphanus,,sativus,,,Species,,,,,,,,Darley F. Howe,,41,4/1/15,,1915,4,1,91,,4/1/15,,,,,,,,,,,,,FFL,,,,,,,,,,,,United States,California,Los Angeles,,Claremont,,0,,34.11293,-117.71584,WGS84,3500,LAH,,Google Earth,,Larger Claremont area,,,,,,unknownft.,,,,SD113142,43,7dd0ad72-b3a7-4e40-b9d0-cbbb1da20d05,https://www.cch2.org/portal/collections/individual/index.php?occid=469011
2305031,CAS,BOT-BC,,PreservedSpecimen,urn:catalog:CAS:BOT-BC:74281,74281,urn:catalog:CAS:BOT:77366,Organism|Plantae|Viridiplantae|Streptophyta|Embryophyta|Tracheophyta|Spermatophytina|Magnoliopsida|Rosanae|Brassicales|Brassicaceae|Raphanus,Plantae,Tracheophyta,Magnoliopsida,Brassicales,Brassicaceae,Raphanus sativus,29702,L.,Raphanus,,sativus,,,Species,Ihsan A. Al-Shehbaz,2010-01,,,,,,"Carlson, John I.",,s.n.,6/13/15,,1915,6,13,164,,"June 13, 1915.",,,,,,,,,,,,,,,,,,,,,North America,,,,United States,California,Los Angeles County,,"Avalon, Santa Catalina Island.",,0,,33.3425,-118.3283,NAD27,1000,,Maptech (copied from SBBG113998),,,,,,,,,,,en,,urn:catalog:CAS:BOT-BC:74281,1,d873eba4-0212-4d5c-ac6e-a5e68c7068c2,https://www.cch2.org/portal/collections/individual/index.php?occid=2305031
4299065,OSC,V,,PreservedSpecimen,{34214AD4-B5A1-462A-9520-B6C10A927A71},OSC-V-023830,OSC16201,Organism|Plantae|Viridiplantae|Streptophyta|Embryophyta|Tracheophyta|Spermatophytina|Magnoliopsida|Rosanae|Brassicales|Brassicaceae|Raphanus,Plantae,Tracheophyta,Magnoliopsida,Brassicales,Brassicaceae,Raphanus sativus,29702,L.,Raphanus,,sativus,,,Species,"Al-Shehbaz, I.",2016,,,,,,F. K. Greene,F.K. Greene,s.n.,4/19/15,,1915,4,19,109,,4/19/15,,,,,,,,,,,,,,wild collection,,,,,,,,,,,United States,Oregon,Benton,,NE Corvallis,,0,,44.5647,-123.2608,,4828,Bailey C. Edgley,OregonFlora 1994-2020 methodology,"OrlookId: 99869, StateProvince: Oregon, County: Benton, LocName: Corvallis",,Georeferencing could be made more precise.,,,,,,,,,,4436657,81,a1806f56-f7bd-494b-8a41-8496f18e39e9,https://www.cch2.org/portal/collections/individual/index.php?occid=4299065
1049760,RSA,POM,,PreservedSpecimen,a027247b-1587-49c7-9225-540c93bfd0b1,,POM accession: 398,Organism|Plantae|Viridiplantae|Streptophyta|Embryophyta|Tracheophyta|Spermatophytina|Magnoliopsida|Rosanae|Brassicales|Brassicaceae|Raphanus,Plantae,Tracheophyta,Magnoliopsida,Brassicales,Brassicaceae,Raphanus sativus,29702,L.,Raphanus,,sativus,,,Species,,,,,,,,Robinson,Crocker,s.n.,4/3/16,,1916,4,3,94,,,,,,,,,,,,,,,flowers,Introduced,,,,,herbarium sheet,,,,,,United States,California,Riverside,,Elsinore region.,,0,,33.65,-117.367,NAD27,10000,Rancho Santa Ana: 2007-2009 CCH GBIF georeferencing grant,,CCH GBIF georeference,,Mon Dec 26 13:37:13 2011; georef from 2006-2015 archive backup file,,,,,,,,,Scott D. White; cataloged date: 2006-03-10,a027247b-1587-49c7-9225-540c93bfd0b1,17,a5364a8e-1fc4-4b1a-a218-2b331c2c13a2,https://www.cch2.org/portal/collections/individual/index.php?occid=1049760
2336537,CAS,BOT-BC,,PreservedSpecimen,urn:catalog:CAS:BOT-BC:74243,74243,urn:catalog:CAS:BOT:77365,Organism|Plantae|Viridiplantae|Streptophyta|Embryophyta|Tracheophyta|Spermatophytina|Magnoliopsida|Rosanae|Brassicales|Brassicaceae|Raphanus,Plantae,Tracheophyta,Magnoliopsida,Brassicales,Brassicaceae,Raphanus sativus,29702,L.,Raphanus,,sativus,,,Species,Ihsan A. Al-Shehbaz,2010-01,,,,,,"Eastwood, Alice",,5022,4/17/16,,1916,4,17,108,,"Apr. 17, 1916",,,,,,,,,,,,,,,,,,,,,North America,,,,United States,California,Ventura County,,Ventura. Along Beach.,,0,,,,,,,,,,,,,,,,,,en,,urn:catalog:CAS:BOT-BC:74243,1,afb8b5aa-a757-4ad9-89e1-52ec496d56bd,https://www.cch2.org/portal/collections/individual/index.php?occid=2336537
2363992,CAS,BOT-BC,,PreservedSpecimen,urn:catalog:CAS:BOT-BC:74220,74220,urn:catalog:CAS:DS:73784,Organism|Plantae|Viridiplantae|Streptophyta|Embryophyta|Tracheophyta|Spermatophytina|Magnoliopsida|Rosanae|Brassicales|Brassicaceae|Raphanus,Plantae,Tracheophyta,Magnoliopsida,Brassicales,Brassicaceae,Raphanus sativus,29702,L.,Raphanus,,sativus,,,Species,Ihsan A. Al-Shehbaz,2010-01,,,,,,"Stinchfield, Roxana",,438,7/11/16,,1916,7,11,193,,11-Jul-16,,Grainfields.,,,,,,,,,,,,,,,,,,,North America,,,,United States,California,Colusa County,,Stinchfield Ranch near Sycamore.,,0,,,,,,,,,,,,,,,,,,en,,urn:catalog:CAS:BOT-BC:74220,1,494a954b-8353-428c-881a-aee4f5c0e2c2,https://www.cch2.org/portal/collections/individual/index.php?occid=2363992
3904089,LA,,,PreservedSpecimen,2edae969-45b4-4d6b-82ab-d3b24d54360e,LA00606069,,Organism|Plantae|Viridiplantae|Streptophyta|Embryophyta|Tracheophyta|Spermatophytina|Magnoliopsida|Rosanae|Brassicales|Brassicaceae|Raphanus,Plantae,Tracheophyta,Magnoliopsida,Brassicales,Brassicaceae,Raphanus sativus,29702,L.,Raphanus,,sativus,,,Species,,,,,,,,Schuyler S. Clark,,261,7/8/16,,1916,7,8,190,,"July 8, 16.",,Swamp,,,,,,,,,,,,,,,,,,,,,,,United States,Massachusetts,Essex,,Nahant,,0,,,,,,,,,,,,,,,,,,,UCLA,,34,2edae969-45b4-4d6b-82ab-d3b24d54360e,https://www.cch2.org/portal/collections/individual/index.php?occid=3904089
1367990,DAV,,,PreservedSpecimen,d817e117-a8ee-42b6-89ea-37d38dcf1bb4,DAV300673,Accession #: DAV2640,Organism|Plantae|Viridiplantae|Streptophyta|Embryophyta|Tracheophyta|Spermatophytina|Magnoliopsida|Rosanae|Brassicales|Brassicaceae,Plantae,Tracheophyta,Magnoliopsida,Brassicales,Brassicaceae,Raphanus,6418,,Raphanus,,,,,Genus,,,,,,,,P. B. Kennedy,,s.n.,4/29/17,,1917,4,29,119,,29-Apr-17,Access Database Number (Deprecated): UCD115165,Growing in vacant lots.,,,,,,,,,,,,,,,,,,,,,,,United States,California,Alameda,,"Alameda County: Northbrae, Berkeley.",,0,,,,,,,,,,,,,,,,,,,,UCD115165,39,d817e117-a8ee-42b6-89ea-37d38dcf1bb4,https://www.cch2.org/portal/collections/individual/index.php?occid=1367990
3479641,UCJEPS,VASC,,PreservedSpecimen,b9fe2702-c6a7-4dc5-b18b-a4a2f0ab06f1,UC212637,,Organism|Plantae|Viridiplantae|Streptophyta|Embryophyta|Tracheophyta|Spermatophytina|Magnoliopsida|Rosanae|Brassicales|Brassicaceae|Raphanus,Plantae,Tracheophyta,Magnoliopsida,Brassicales,Brassicaceae,Raphanus raphanistrum,29701,L.,Raphanus,,raphanistrum,,,Species,,,,,,,,S. B. Parish,,11571,8/1/17,,1917,8,1,213,243,"August, 1917","date as ""August, 1917",streets and waste places,,,,,,,,,,,Flowering/Fruiting,,,,,,,,,,,,United States,California,Monterey,,"Pacific Grove; Monterey Peninsula, Pacific Grove",,0,,36.61847,-121.92858,NAD27,4841,,,Terrain Navigator Pro,,,,,,,,,,,,b9fe2702-c6a7-4dc5-b18b-a4a2f0ab06f1,46,aee12851-6c5a-4c88-a3d7-f5bedbc5ae4a,https://www.cch2.org/portal/collections/individual/index.php?occid=3479641
1367991,DAV,,,PreservedSpecimen,ef1444cb-e25d-4e2b-af56-6e4e79fd4cf6,DAV310431,Accession #: DAV2628,Organism|Plantae|Viridiplantae|Streptophyta|Embryophyta|Tracheophyta|Spermatophytina|Magnoliopsida|Rosanae|Brassicales|Brassicaceae|Raphanus,Plantae,Tracheophyta,Magnoliopsida,Brassicales,Brassicaceae,Raphanus sativus,29702,L.,Raphanus,,sativus,,,Species,,,,,,,,L. Angst,,14,4/21/17,,1917,4,21,111,,21-Apr-17,Access Database Number (Deprecated): UCD115166,Growing in fields.,,Common name: Wild Radish.,,,,,,herbariumSpecimenDuplicate: https://www.cch2.org/portal/collections/individual/index.php?guid=03275fde-8101-4482-8be7-e34ca37111ae,,,,,,,,,,,,,,,United States,California,San Mateo,,San Mateo County: south of San Francisco.,,0,,,,,,,,,,,,,,,,,,,,UCD115166,39,ef1444cb-e25d-4e2b-af56-6e4e79fd4cf6,https://www.cch2.org/portal/collections/individual/index.php?occid=1367991
1367992,DAV,,,PreservedSpecimen,03275fde-8101-4482-8be7-e34ca37111ae,DAV310430,Accession #: DAV2633,Organism|Plantae|Viridiplantae|Streptophyta|Embryophyta|Tracheophyta|Spermatophytina|Magnoliopsida|Rosanae|Brassicales|Brassicaceae|Raphanus,Plantae,Tracheophyta,Magnoliopsida,Brassicales,Brassicaceae,Raphanus sativus,29702,L.,Raphanus,,sativus,,,Species,,,,,,,,L. Angst,,14,4/21/17,,1917,4,21,111,,21-Apr-17,Access Database Number (Deprecated): UCD115167,Growing in fields.,,Common name: Wild Radish.,,,,,,herbariumSpecimenDuplicate: https://www.cch2.org/portal/collections/individual/index.php?guid=ef1444cb-e25d-4e2b-af56-6e4e79fd4cf6,,,,,,,,,,,,,,,United States,California,San Mateo,,San Mateo County: south of San Francisco.,,0,,,,,,,,,,,,,,,,,,,,UCD115167,39,03275fde-8101-4482-8be7-e34ca37111ae,https://www.cch2.org/portal/collections/individual/index.php?occid=1367992
3479651,UCJEPS,VASC,,PreservedSpecimen,d1f92925-9b91-4db0-988c-8fbc46deb4be,UC212638,,Organism|Plantae|Viridiplantae|Streptophyta|Embryophyta|Tracheophyta|Spermatophytina|Magnoliopsida|Rosanae|Brassicales|Brassicaceae|Raphanus,Plantae,Tracheophyta,Magnoliopsida,Brassicales,Brassicaceae,Raphanus sativus,29702,L.,Raphanus,,sativus,,,Species,,,,,,,,S. B. Parish,,11570,8/1/17,,1917,8,1,213,,Aug 1 1917,,streets and waste places,,,,,,,,,,,Flowering/Fruiting,,,,,,,,,,,,United States,California,Monterey,,"Pacific Grove; Monterey Peninsula, Pacific Grove",,0,,36.61847,-121.92858,NAD27,4841,,,Terrain Navigator Pro,,,,,,,,,,,,d1f92925-9b91-4db0-988c-8fbc46deb4be,46,1af1a83f-2193-48bf-9ceb-238080101f96,https://www.cch2.org/portal/collections/individual/index.php?occid=3479651
4181615,OSC,V,,PreservedSpecimen,{38689F3C-A5F2-4899-BE00-DE716466067D},,WILLU9444,Organism|Plantae|Viridiplantae|Streptophyta|Embryophyta|Tracheophyta|Spermatophytina|Magnoliopsida|Rosanae|Brassicales|Brassicaceae|Raphanus,Plantae,Tracheophyta,Magnoliopsida,Brassicales,Brassicaceae,Raphanus sativus,29702,L.,Raphanus,,sativus,,,Species,"Al-Shehbaz, I.",2016,,,,,,Morton E. Peck,M.E. Peck,8740,7/10/17,,1917,7,10,191,,7/10/17,,beach.,,,,,,,,,,,flowering and fruiting,,,,,,,,,,,,United States,Oregon,Curry,,Harbor.,,0,,42.0533,-124.2664,,402,[automated process-OregonFlora/OSU Herb],OregonFlora 1994-2020 methodology,"OrlookId: 37655, StateProvince: Oregon, County: Curry, LocName: Harbor",,,,,,,,,,,,645013,81,1dbe6ccc-852e-492a-97f2-df91758b8ffc,https://www.cch2.org/portal/collections/individual/index.php?occid=4181615
2367740,CAS,BOT-BC,,PreservedSpecimen,urn:catalog:CAS:BOT-BC:74231,74231,urn:catalog:CAS:BOT:77385,Organism|Plantae|Viridiplantae|Streptophyta|Embryophyta|Tracheophyta|Spermatophytina|Magnoliopsida|Rosanae|Brassicales|Brassicaceae|Raphanus,Plantae,Tracheophyta,Magnoliopsida,Brassicales,Brassicaceae,Raphanus sativus,29702,L.,Raphanus,,sativus,,,Species,Ihsan A. Al-Shehbaz,2010-01,,,,,,"Carlson, John I.",,s.n.,4/10/18,,1918,4,10,100,,10-Apr-18,,,,,,,,,,,,,,,,,,,,,North America,,,,United States,California,San Diego County,,El Granito Springs.,,0,,,,,,,,,,,,,,,,,,en,,urn:catalog:CAS:BOT-BC:74231,1,9d0aca5d-9037-40db-9101-837a0c462e2a,https://www.cch2.org/portal/collections/individual/index.php?occid=2367740
2450948,CAS,BOT-BC,,PreservedSpecimen,urn:catalog:CAS:BOT-BC:74210,74210,urn:catalog:CAS:BOT:77377,Organism|Plantae|Viridiplantae|Streptophyta|Embryophyta|Tracheophyta|Spermatophytina|Magnoliopsida|Rosanae|Brassicales|Brassicaceae|Raphanus,Plantae,Tracheophyta,Magnoliopsida,Brassicales,Brassicaceae,Raphanus raphanistrum,29701,L.,Raphanus,,raphanistrum,,,Species,Ihsan A. Al-Shehbaz,2010-01,,,,,,"Ferris, Roxana S.",,1468,4/11/19,,1919,4,11,101,106,"April 11-16, 1919",Not common.,In this vicinity in grainfield.,,,,,,,,,,,,,,,,,,,North America,,,,United States,California,Tuolumne County,,Near Rawhide.,,0,,,,,,,,,,,396,,,,,1300.0000000000 ft,,en,,urn:catalog:CAS:BOT-BC:74210,1,deadbba1-3ad9-4d0c-aaac-f2c1df52d893,https://www.cch2.org/portal/collections/individual/index.php?occid=2450948
2357521,CAS,BOT-BC,,PreservedSpecimen,urn:catalog:CAS:BOT-BC:74241,74241,urn:catalog:CAS:DS:97497,Organism|Plantae|Viridiplantae|Streptophyta|Embryophyta|Tracheophyta|Spermatophytina|Magnoliopsida|Rosanae|Brassicales|Brassicaceae|Raphanus,Plantae,Tracheophyta,Magnoliopsida,Brassicales,Brassicaceae,Raphanus sativus,29702,L.,Raphanus,,sativus,,,Species,Ihsan A. Al-Shehbaz,2010-01,,,,,,"Ferris, Roxana S.",,1468,4/11/19,,1919,4,11,101,106,"April 11-16, 1919",Not common in this vicinity.,In grain field.,,,,,,,,,,,,,,,,,,,North America,,,,United States,California,Tuolumne County,,Near Rawhide.,,0,,,,,,,,,,,396,,,,,1300.0000000000 ft,,en,,urn:catalog:CAS:BOT-BC:74241,1,bb31febb-a2b6-4ae6-9e0f-ddaba9fb96c7,https://www.cch2.org/portal/collections/individual/index.php?occid=2357521
3904080,LA,,,PreservedSpecimen,8a176e0d-3891-4a14-9436-87d02de1e7ad,LA00606062,,Organism|Plantae|Viridiplantae|Streptophyta|Embryophyta|Tracheophyta|Spermatophytina|Magnoliopsida|Rosanae|Brassicales|Brassicaceae|Raphanus,Plantae,Tracheophyta,Magnoliopsida,Brassicales,Brassicaceae,Raphanus sativus,29702,L.,Raphanus,,sativus,,,Species,,,,,,,,Otto Buchtien,,523,1/3/19,,1919,1,3,3,,,,,,,,,,,,,,,,,,,,,,,,,,,,,,,,,0,,,,,,,,,,,,,,,,,,,abaniaga,,34,8a176e0d-3891-4a14-9436-87d02de1e7ad,https://www.cch2.org/portal/collections/individual/index.php?occid=3904080
4971847,US,,,PreservedSpecimen,http://n2t.net/ark:/65665/3c78e718e-c202-47b8-8e0d-81ee19416058,US 1201152,,Organism|Plantae|Viridiplantae|Streptophyta|Embryophyta|Tracheophyta|Spermatophytina|Magnoliopsida|Rosanae|Brassicales|Brassicaceae|Raphanus,Plantae,Tracheophyta,Magnoliopsida,Brassicales,Brassicaceae,Raphanus sativus,29702,L.,Raphanus,,sativus,,,Species,,,,,,,,R. S. Ferris,,1468,4/11/19,,1919,4,11,101,106,4/11/19,,,,,,,,,,,,,,,,,,1,,,North America,,,,United States,California,,,Tuolumne County. In grainfield near Rawhide.,,0,,,,,,,,,,,396,,,,,,,,,http://n2t.net/ark:/65665/3c78e718e-c202-47b8-8e0d-81ee19416058,91,715ed142-a574-46f2-8fb5-e67c432b607c,https://www.cch2.org/portal/collections/individual/index.php?occid=4971847
2368640,CAS,BOT-BC,,PreservedSpecimen,urn:catalog:CAS:BOT-BC:74209,74209,urn:catalog:CAS:DS:104019,Organism|Plantae|Viridiplantae|Streptophyta|Embryophyta|Tracheophyta|Spermatophytina|Magnoliopsida|Rosanae|Brassicales|Brassicaceae|Raphanus,Plantae,Tracheophyta,Magnoliopsida,Brassicales,Brassicaceae,Raphanus raphanistrum,29701,L.,Raphanus,,raphanistrum,,,Species,Ihsan A. Al-Shehbaz,2010-01,,,,,,"Quayle, E. H.",,s.n.,1920-05-00,,1920,5,1,,,20-May,,,,,,,,,,,,,,,,,,,,,North America,,,,United States,California,Santa Clara County,,Santa Cruz Mountain Peninsula. Arboretum. Stanford University.,,0,,,,,,,,,,,,,,,,,,en,,urn:catalog:CAS:BOT-BC:74209,1,d818d77b-c11d-4cc7-a35d-e82539dc945f,https://www.cch2.org/portal/collections/individual/index.php?occid=2368640
2385124,CAS,BOT-BC,,PreservedSpecimen,urn:catalog:CAS:BOT-BC:74196,74196,urn:catalog:CAS:DS:105713,Organism|Plantae|Viridiplantae|Streptophyta|Embryophyta|Tracheophyta|Spermatophytina|Magnoliopsida|Rosanae|Brassicales|Brassicaceae|Raphanus,Plantae,Tracheophyta,Magnoliopsida,Brassicales,Brassicaceae,Raphanus raphanistrum,29701,L.,Raphanus,,raphanistrum,,,Species,Ihsan A. Al-Shehbaz,2010-01,,,,,,"Quayle, E. H.",,s.n.,1920-05-00,,1920,5,1,,,May 1920.,,,,,,,,,,,,,,,,,,,,,North America,,,,United States,California,San Mateo County,,Lomitas School near Menlo Park.,,0,,,,,,,,,,,,,,,,,,en,,urn:catalog:CAS:BOT-BC:74196,1,9521a9ff-11f8-41b6-8c03-194ac5097b55,https://www.cch2.org/portal/collections/individual/index.php?occid=2385124
2398571,CAS,BOT-BC,,PreservedSpecimen,urn:catalog:CAS:BOT-BC:74207,74207,urn:catalog:CAS:DS:110070,Organism|Plantae|Viridiplantae|Streptophyta|Embryophyta|Tracheophyta|Spermatophytina|Magnoliopsida|Rosanae|Brassicales|Brassicaceae|Raphanus,Plantae,Tracheophyta,Magnoliopsida,Brassicales,Brassicaceae,Raphanus raphanistrum,29701,L.,Raphanus,,raphanistrum,,,Species,Ihsan A. Al-Shehbaz,2010-01,,,,,,"Duncan, C. D.",,s.n.,3/17/20,,1920,3,17,77,,17-Mar-20,,,,,,,,,,,,,,,,,,,,,North America,,,,United States,California,Santa Clara County,,Between Inn and Library Campus.,,0,,,,,,,,,,,,,,,,,,en,,urn:catalog:CAS:BOT-BC:74207,1,aafd7db5-9a01-426b-90f6-2f545b67bf66,https://www.cch2.org/portal/collections/individual/index.php?occid=2398571
698690,RSA,RSA,,PreservedSpecimen,1cf67526-be74-4a67-aac3-00f6f28d266a,,RSA accession: 66077,Organism|Plantae|Viridiplantae|Streptophyta|Embryophyta|Tracheophyta|Spermatophytina|Magnoliopsida|Rosanae|Brassicales|Brassicaceae|Raphanus,Plantae,Tracheophyta,Magnoliopsida,Brassicales,Brassicaceae,Raphanus sativus,29702,L.,Raphanus,,sativus,,,Species,,,,,,,,F. W. Peirson,,2108,4/25/20,,1920,4,25,116,,,,,,,,,,,,,,,flowers & fruits,Cultivated,,,,,herbarium sheet,,,,,,United States,California,Los Angeles,,"New York Ave, Altadena",,0,,,,,,,,,,,,,,,,,,,T. Kim Nguyen; cataloged date: 2007-09-21,1cf67526-be74-4a67-aac3-00f6f28d266a,17,0309ddd5-303f-4c49-aea0-7e0f11a4a50e,https://www.cch2.org/portal/collections/individual/index.php?occid=698690
1119072,RSA,POM,,PreservedSpecimen,c1651303-d837-4e2b-b489-23ad5e9c73c3,,POM accession: 49298,Organism|Plantae|Viridiplantae|Streptophyta|Embryophyta|Tracheophyta|Spermatophytina|Magnoliopsida|Rosanae|Brassicales|Brassicaceae|Raphanus,Plantae,Tracheophyta,Magnoliopsida,Brassicales,Brassicaceae,Raphanus sativus,29702,L.,Raphanus,,sativus,,,Species,,,,,,,,L. W. Nuttall,,s.n.,5/24/20,,1920,5,24,145,,,,,,,,,,,,,,,flowers & fruits,Cultivated,,,,,herbarium sheet,,,,,,United States,California,Los Angeles,,Santa Catalina Island.,,0,,,,,,,,,,,,,,,,,,,T. Kim Nguyen; cataloged date: 2007-09-21,c1651303-d837-4e2b-b489-23ad5e9c73c3,17,4457a2eb-1ae3-4a14-ae6e-3722a913182f,https://www.cch2.org/portal/collections/individual/index.php?occid=1119072
2342396,CAS,BOT-BC,,PreservedSpecimen,urn:catalog:CAS:BOT-BC:74312,74312,urn:catalog:CAS:DS:111145,Organism|Plantae|Viridiplantae|Streptophyta|Embryophyta|Tracheophyta|Spermatophytina|Magnoliopsida|Rosanae|Brassicales|Brassicaceae|Raphanus,Plantae,Tracheophyta,Magnoliopsida,Brassicales,Brassicaceae,Raphanus sativus,29702,L.,Raphanus,,sativus,,,Species,Ihsan A. Al-Shehbaz,2010-01,,,,,,"Mallory, George H.",,s.n.,5/4/20,,1920,5,4,125,,4-May-20,,,,,,,,,,,,,,,,,,,,,North America,,,,United States,California,Monterey County,,10 miles north of Bradley. West bank of Salinas River.,,0,,,,,,,,,,,,,,,,,,en,,urn:catalog:CAS:BOT-BC:74312,1,9623219a-82f8-450d-b8cd-3de1b18a0a38,https://www.cch2.org/portal/collections/individual/index.php?occid=2342396
906238,RSA,POM,,PreservedSpecimen,5be1f81a-ef04-459f-a398-9572bd08e3e8,,POM accession: 12335,Organism|Plantae|Viridiplantae|Streptophyta|Embryophyta|Tracheophyta|Spermatophytina|Magnoliopsida|Rosanae|Brassicales|Brassicaceae|Raphanus,Plantae,Tracheophyta,Magnoliopsida,Brassicales,Brassicaceae,Raphanus sativus,29702,L.,Raphanus,,sativus,,,Species,,,,,,,,F. L. Robinson,,88,6/2/21,,1921,6,2,153,,,,,,Dry sandy soil.,,,,,,,,,flowers,Introduced,,,,,herbarium sheet,,,,,,United States,California,Los Angeles,,Between Claremont and Upland,,0,,,,,,,,,,,,,,,,,,,Scott D. White; cataloged date: 2006-03-10,5be1f81a-ef04-459f-a398-9572bd08e3e8,17,28197f7b-73b5-486e-9559-8fdc7c6abe44,https://www.cch2.org/portal/collections/individual/index.php?occid=906238
1091776,RSA,POM,,PreservedSpecimen,b4442e91-3571-4040-8069-d1800cf8c967,,POM accession: 12237,Organism|Plantae|Viridiplantae|Streptophyta|Embryophyta|Tracheophyta|Spermatophytina|Magnoliopsida|Rosanae|Brassicales|Brassicaceae|Raphanus,Plantae,Tracheophyta,Magnoliopsida,Brassicales,Brassicaceae,Raphanus sativus,29702,L.,Raphanus,,sativus,,,Species,,,,,,,,F. L. Robinson,,23,4/14/21,,1921,4,14,104,,,,Dry ground in grain field,,,,,,,,herbariumSpecimenDuplicate: https://www.cch2.org/portal/collections/individual/index.php?guid=61b3da01-a89d-48c7-9624-5346daa1de36,,,flowers & fruits,Cultivated,,,,,herbarium sheet,,,,,,United States,California,Los Angeles,,South Hills. South of Pomona.,,0,,,,,,,,,,,,,,,,,,,T. Kim Nguyen; cataloged date: 2007-09-21,b4442e91-3571-4040-8069-d1800cf8c967,17,99da78db-f2ef-46d7-aab4-9b21057808cf,https://www.cch2.org/portal/collections/individual/index.php?occid=1091776
2317066,CAS,BOT-BC,,PreservedSpecimen,urn:catalog:CAS:BOT-BC:74244,74244,urn:catalog:CAS:BOT:496488,Organism|Plantae|Viridiplantae|Streptophyta|Embryophyta|Tracheophyta|Spermatophytina|Magnoliopsida|Rosanae|Brassicales|Brassicaceae|Raphanus,Plantae,Tracheophyta,Magnoliopsida,Brassicales,Brassicaceae,Raphanus sativus,29702,L.,Raphanus,,sativus,,,Species,Ihsan A. Al-Shehbaz,1/10/10,,,,,,"Zeile, E. M.",,22,9/15/21,,1921,9,15,258,,9/15-'21,,,,,,,,,,,,,,,,,,,,,North America,,,,United States,California,Alameda County,,"Berkeley, Campus.",,0,,,,,,,,,,,,,,,,,,en,,urn:catalog:CAS:BOT-BC:74244,1,edae5ed6-89b3-450d-a883-9644376c867f,https://www.cch2.org/portal/collections/individual/index.php?occid=2317066
2322547,CAS,BOT-BC,,PreservedSpecimen,urn:catalog:CAS:BOT-BC:74245,74245,urn:catalog:CAS:BOT:496491,Organism|Plantae|Viridiplantae|Streptophyta|Embryophyta|Tracheophyta|Spermatophytina|Magnoliopsida|Rosanae|Brassicales|Brassicaceae|Raphanus,Plantae,Tracheophyta,Magnoliopsida,Brassicales,Brassicaceae,Raphanus sativus,29702,L.,Raphanus,,sativus,,,Species,Ihsan A. Al-Shehbaz,1/10/10,,,,,,"Zeile, E. M.",,24,9/17/21,,1921,9,17,260,,9/17-'21,,,,,,,,,,,,,,,,,,,,,North America,,,,United States,California,Alameda County,,Albany Key R. Station.,,0,,,,,,,,,,,,,,,,,,en,,urn:catalog:CAS:BOT-BC:74245,1,64a4a3ae-c64e-44d4-a729-61e476ee99f6,https://www.cch2.org/portal/collections/individual/index.php?occid=2322547
2331781,CAS,BOT-BC,,PreservedSpecimen,urn:catalog:CAS:BOT-BC:74362,74362,urn:catalog:CAS:BOT:496493,Organism|Plantae|Viridiplantae|Streptophyta|Embryophyta|Tracheophyta|Spermatophytina|Magnoliopsida|Rosanae|Brassicales|Brassicaceae|Raphanus,Plantae,Tracheophyta,Magnoliopsida,Brassicales,Brassicaceae,Raphanus sativus,29702,L.,Raphanus,,sativus,,,Species,Ihsan A. Al-Shehbaz,2010-01,,,,,,"Zeile, E. M.",,21,8/13/21,,1921,8,13,225,,8/13-'21,,Highway.,,,,,,,,,,,,,,,,,,,North America,,,,United States,California,Santa Cruz County,,Brooksdale to Santa Cruz.,,0,,,,,,,,,,,,,,,,,,en,,urn:catalog:CAS:BOT-BC:74362,1,0c92ed61-995c-4c89-9dfe-b558847a37e9,https://www.cch2.org/portal/collections/individual/index.php?occid=2331781
2352540,CAS,BOT-BC,,PreservedSpecimen,urn:catalog:CAS:BOT-BC:74248,74248,urn:catalog:CAS:BOT:496489,Organism|Plantae|Viridiplantae|Streptophyta|Embryophyta|Tracheophyta|Spermatophytina|Magnoliopsida|Rosanae|Brassicales|Brassicaceae|Raphanus,Plantae,Tracheophyta,Magnoliopsida,Brassicales,Brassicaceae,Raphanus sativus,29702,L.,Raphanus,,sativus,,,Species,Ihsan A. Al-Shehbaz,1/10/10,,,,,,"Zeile, E. M.",,36,9/24/21,,1921,9,24,267,,9/24-'21,,Lot.,,,,,,,,,,,,,,,,,,,North America,,,,United States,California,Alameda County,,Berkeley.,,0,,,,,,,,,,,,,,,,,,en,,urn:catalog:CAS:BOT-BC:74248,1,fdecbfad-f4c3-44b5-8f70-9176b14d82f4,https://www.cch2.org/portal/collections/individual/index.php?occid=2352540
2366181,CAS,BOT-BC,,PreservedSpecimen,urn:catalog:CAS:BOT-BC:74247,74247,urn:catalog:CAS:BOT:496485,Organism|Plantae|Viridiplantae|Streptophyta|Embryophyta|Tracheophyta|Spermatophytina|Magnoliopsida|Rosanae|Brassicales|Brassicaceae|Raphanus,Plantae,Tracheophyta,Magnoliopsida,Brassicales,Brassicaceae,Raphanus sativus,29702,L.,Raphanus,,sativus,,,Species,Ihsan A. Al-Shehbaz,1/10/10,,,,,,"Zeile, E. M.",,27,9/17/21,,1921,9,17,260,,9/17-'21,,Sidewalk.,,,,,,,,,,,,,,,,,,,North America,,,,United States,California,Alameda County,,North Berkeley.,,0,,,,,,,,,,,,,,,,,,en,,urn:catalog:CAS:BOT-BC:74247,1,b5fa9fa3-5ead-4a83-a801-75aa8b63d18e,https://www.cch2.org/portal/collections/individual/index.php?occid=2366181
2388593,CAS,BOT-BC,,PreservedSpecimen,urn:catalog:CAS:BOT-BC:74249,74249,urn:catalog:CAS:BOT:496484,Organism|Plantae|Viridiplantae|Streptophyta|Embryophyta|Tracheophyta|Spermatophytina|Magnoliopsida|Rosanae|Brassicales|Brassicaceae|Raphanus,Plantae,Tracheophyta,Magnoliopsida,Brassicales,Brassicaceae,Raphanus sativus,29702,L.,Raphanus,,sativus,,,Species,Ihsan A. Al-Shehbaz,2010-01,,,,,,"Zeile, E. M.",,37,9/24/21,,1921,9,24,267,,9/24-'21,,Lot.,,,,,,,,,,,,,,,,,,,North America,,,,United States,California,Alameda County,,Berkeley.,,0,,,,,,,,,,,,,,,,,,en,,urn:catalog:CAS:BOT-BC:74249,1,bbc5f474-c07e-41b1-80e3-1cfa5da50964,https://www.cch2.org/portal/collections/individual/index.php?occid=2388593
2401356,CAS,BOT-BC,,PreservedSpecimen,urn:catalog:CAS:BOT-BC:74221,74221,urn:catalog:CAS:DS:137415,Organism|Plantae|Viridiplantae|Streptophyta|Embryophyta|Tracheophyta|Spermatophytina|Magnoliopsida|Rosanae|Brassicales|Brassicaceae|Raphanus,Plantae,Tracheophyta,Magnoliopsida,Brassicales,Brassicaceae,Raphanus sativus,29702,L.,Raphanus,,sativus,,,Species,Ihsan A. Al-Shehbaz,2010-01,,,,,,"McGregor, E. A.",,s.n.,8/25/21,,1921,8,25,237,,"Aug. 25, 1921",,Sandbar.,,,,,,,,,,,,,,,,,,,North America,,,,United States,California,Del Norte County,,Extending southwards from mouth of Klamath River.,,0,,,,,,,,,,,,,,,,,,en,,urn:catalog:CAS:BOT-BC:74221,1,e9b731c8-4fb0-48b4-a910-548970a4c462,https://www.cch2.org/portal/collections/individual/index.php?occid=2401356
2422481,CAS,BOT-BC,,PreservedSpecimen,urn:catalog:CAS:BOT-BC:74246,74246,urn:catalog:CAS:BOT:496400,Organism|Plantae|Viridiplantae|Streptophyta|Embryophyta|Tracheophyta|Spermatophytina|Magnoliopsida|Rosanae|Brassicales|Brassicaceae|Raphanus,Plantae,Tracheophyta,Magnoliopsida,Brassicales,Brassicaceae,Raphanus sativus,29702,L.,Raphanus,,sativus,,,Species,Ihsan A. Al-Shehbaz,2010-01,,,,,,"Zeile, E. M.",,26,9/17/21,,1921,9,17,260,,9/17-'21,,,,,,,,,,,,,,,,,,,,,North America,,,,United States,California,Alameda County,,North Berkeley.,,0,,,,,,,,,,,,,,,,,,en,,urn:catalog:CAS:BOT-BC:74246,1,903558ec-6e2d-460e-87d6-9e9c893b2220,https://www.cch2.org/portal/collections/individual/index.php?occid=2422481
2446817,CAS,BOT-BC,,PreservedSpecimen,urn:catalog:CAS:BOT-BC:74250,74250,urn:catalog:CAS:BOT:496492,Organism|Plantae|Viridiplantae|Streptophyta|Embryophyta|Tracheophyta|Spermatophytina|Magnoliopsida|Rosanae|Brassicales|Brassicaceae|Raphanus,Plantae,Tracheophyta,Magnoliopsida,Brassicales,Brassicaceae,Raphanus sativus,29702,L.,Raphanus,,sativus,,,Species,Ihsan A. Al-Shehbaz,1/10/10,,,,,,"Zeile, E. M.",,45,9/30/21,,1921,9,30,273,,9/30-'21,,Lot.,,,,,,,,,,,,,,,,,,,North America,,,,United States,California,Alameda County,,Berkeley.,,0,,,,,,,,,,,,,,,,,,en,,urn:catalog:CAS:BOT-BC:74250,1,92bdef41-39f7-4bfd-939d-06ef5f81a90d,https://www.cch2.org/portal/collections/individual/index.php?occid=2446817
3904090,LA,,,PreservedSpecimen,e02b40e5-1526-4850-ae0e-f6dd0985f7eb,LA00606071,,Organism|Plantae|Viridiplantae|Streptophyta|Embryophyta|Tracheophyta|Spermatophytina|Magnoliopsida|Rosanae|Brassicales|Brassicaceae|Raphanus,Plantae,Tracheophyta,Magnoliopsida,Brassicales,Brassicaceae,Raphanus sativus,29702,L.,Raphanus,,sativus,,,Species,,,,,,,,Carl Epling,,5105,3/26/21,,1921,3,26,85,,,,,,,,,,,,,,,,,,,,,,,,,,,,,,,,,0,,,,,,,,,,,,,,,,,,,abaniaga,,34,e02b40e5-1526-4850-ae0e-f6dd0985f7eb,https://www.cch2.org/portal/collections/individual/index.php?occid=3904090
712565,RSA,RSA,,PreservedSpecimen,2386689f-e0d9-4039-a45d-e4bae3253647,,RSA accession: 431471,Organism|Plantae|Viridiplantae|Streptophyta|Embryophyta|Tracheophyta|Spermatophytina|Magnoliopsida|Rosanae|Brassicales|Brassicaceae|Raphanus,Plantae,Tracheophyta,Magnoliopsida,Brassicales,Brassicaceae,Raphanus sativus,29702,L.,Raphanus,,sativus,,,Species,E. S. Spalding,,,,,,,Ella M. Kennedy,,s.n.,2/27/23,,1923,2,27,58,,,,,,,,,,,,,,,flowers,Introduced,,,,,herbarium sheet,,,,,,United States,California,Los Angeles,,"Fields, Pasadena",,0,,34.152867,-118.121454,WGS84,6700,Rancho Santa Ana (no. 7),,Geolocate (copied from A343463),,Wed Mar 5 09:10:22 2014; georef from 2006-2015 archive backup file,,,,,,,,,cataloged date: 2000-05-05,2386689f-e0d9-4039-a45d-e4bae3253647,17,299b852d-c182-4ed3-8cdd-c1ca968e0756,https://www.cch2.org/portal/collections/individual/index.php?occid=712565
2413972,CAS,BOT-BC,,PreservedSpecimen,urn:catalog:CAS:BOT-BC:74264,74264,urn:catalog:CAS:DS:151048,Organism|Plantae|Viridiplantae|Streptophyta|Embryophyta|Tracheophyta|Spermatophytina|Magnoliopsida|Rosanae|Brassicales|Brassicaceae|Raphanus,Plantae,Tracheophyta,Magnoliopsida,Brassicales,Brassicaceae,Raphanus sativus,29702,L.,Raphanus,,sativus,,,Species,Ihsan A. Al-Shehbaz,2010-01,,,,,,"Heller, A. A.",,13828a,10/13/23,,1923,10,13,286,,13-Oct-23,Seedlings.,In damp soil in the Valley oak belt.,,,,,,,,,,,,,,,,,,,North America,,,,United States,California,Butte County,,Along the highway near Richvale.,,0,,,,,,,,,,,,,,,,,,en,,urn:catalog:CAS:BOT-BC:74264,1,5d7be789-7141-451f-afaa-c06b9a8cea29,https://www.cch2.org/portal/collections/individual/index.php?occid=2413972
4198238,OSC,V,,PreservedSpecimen,{724CDF7D-14B4-4D6E-873D-78FA061A3786},,WILLU13706,Organism|Plantae|Viridiplantae|Streptophyta|Embryophyta|Tracheophyta|Spermatophytina|Magnoliopsida|Rosanae|Brassicales|Brassicaceae|Raphanus,Plantae,Tracheophyta,Magnoliopsida,Brassicales,Brassicaceae,Raphanus raphanistrum,29701,L.,Raphanus,,raphanistrum,,,Species,"Al-Shehbaz, I.",2016,,,,,,Morton E. Peck,M.E. Peck,13378,7/8/24,,1924,7,8,190,,7/8/24,,along railroad.,,,,,,,,,,,flowering and fruiting,,,,,,,,,,,,United States,Oregon,Tillamook,,Garibaldi.,,0,,45.56,-123.9097,,402,[automated process-OregonFlora/OSU Herb],OregonFlora 1994-2020 methodology,"OrlookId: 82791, StateProvince: Oregon, County: Tillamook, LocName: Garibaldi",,,,,,,,,,,,661247,81,ee843dad-da07-4086-bfa2-52c770a26135,https://www.cch2.org/portal/collections/individual/index.php?occid=4198238
2395018,CAS,BOT-BC,,PreservedSpecimen,urn:catalog:CAS:BOT-BC:74260,74260,urn:catalog:CAS:BOT:176599,Organism|Plantae|Viridiplantae|Streptophyta|Embryophyta|Tracheophyta|Spermatophytina|Magnoliopsida|Rosanae|Brassicales|Brassicaceae|Raphanus,Plantae,Tracheophyta,Magnoliopsida,Brassicales,Brassicaceae,Raphanus sativus,29702,L.,Raphanus,,sativus,,,Species,Ihsan A. Al-Shehbaz,2010-01,,,,,,"Howell, John Thomas",,679,10/11/24,,1924,10,11,285,,"Oct. 11, 1924",,,,,,,,,,,,,,,,,,,,,North America,,,,United States,California,Alameda County,,"Euclid Avenue, Berkeley.",,0,,,,,,,,,,,,,,,,,,en,,urn:catalog:CAS:BOT-BC:74260,1,b90202db-6688-41bf-bd84-15ca4373e2e8,https://www.cch2.org/portal/collections/individual/index.php?occid=2395018
682744,RSA,RSA,,PreservedSpecimen,1569e77b-cf23-4a41-b539-81f9e30199bc,,RSA accession: 2250,Organism|Plantae|Viridiplantae|Streptophyta|Embryophyta|Tracheophyta|Spermatophytina|Magnoliopsida|Rosanae|Brassicales|Brassicaceae|Raphanus,Plantae,Tracheophyta,Magnoliopsida,Brassicales,Brassicaceae,Raphanus sativus,29702,L.,Raphanus,,sativus,,,Species,,,,,,,,J. W. Blankinship,,s.n.,5/20/25,,1925,5,20,140,,,,,,A frequent weed in fields.,,,,,,,,,flowers & fruits,Introduced,,,,,herbarium sheet,,,,,,United States,California,Lake,,Kelseyville.,,0,,,,,,,,,,,,,,,,,,,Jackie C. McConnaughy; cataloged date: 2012-04-13,1569e77b-cf23-4a41-b539-81f9e30199bc,17,6dc3c6ad-df67-4ec3-94eb-82f2f4f1781e,https://www.cch2.org/portal/collections/individual/index.php?occid=682744
2311023,CAS,BOT-BC,,PreservedSpecimen,urn:catalog:CAS:BOT-BC:74259,74259,urn:catalog:CAS:DS:280511,Organism|Plantae|Viridiplantae|Streptophyta|Embryophyta|Tracheophyta|Spermatophytina|Magnoliopsida|Rosanae|Brassicales|Brassicaceae|Raphanus,Plantae,Tracheophyta,Magnoliopsida,Brassicales,Brassicaceae,Raphanus sativus,29702,L.,Raphanus,,sativus,,,Species,Ihsan A. Al-Shehbaz,2010-01,,,,,,"Kennedy, P. B.",,s.n.,5/7/25,,1925,5,7,127,,7-May-25,,,,,,,,,,,,,,,,,,,,,North America,,,,United States,California,Alameda County,,"Schmidt Tract, Berkeley.",,0,,,,,,,,,,,,,,,,,,en,,urn:catalog:CAS:BOT-BC:74259,1,fb3195aa-de12-48e7-a9e5-31ee1b60e8eb,https://www.cch2.org/portal/collections/individual/index.php?occid=2311023
2288164,CAS,BOT-BC,,PreservedSpecimen,urn:catalog:CAS:BOT-BC:74192,74192,urn:catalog:CAS:BOT:705583,Organism|Plantae|Viridiplantae|Streptophyta|Embryophyta|Tracheophyta|Spermatophytina|Magnoliopsida|Rosanae|Brassicales|Brassicaceae|Raphanus,Plantae,Tracheophyta,Magnoliopsida,Brassicales,Brassicaceae,Raphanus raphanistrum,29701,L.,Raphanus,,raphanistrum,,,Species,Ihsan A. Al-Shehbaz,2010-01,,,,,,"Smith, L. S.",,1750,3/31/26,,1926,3,31,90,,31-Mar-26,Scattered.,"Burn. Dry, loose, ashes and gravel. In timber.",,,,,,,,,,,,,,,,,,,North America,,,,United States,California,Nevada County,,"Tahoe Forest. Near Central House, top of ridge.",,0,,,,,,,,,,,1158,,,,,3800.0000000000 ft,,en,,urn:catalog:CAS:BOT-BC:74192,1,f64d8cfa-9d56-43bd-8dca-eebb7ab22f57,https://www.cch2.org/portal/collections/individual/index.php?occid=2288164
715148,RSA,RSA,,PreservedSpecimen,24bffd3b-7cdd-4a29-98ad-d200aa675db5,,RSA accession: 34319,Organism|Plantae|Viridiplantae|Streptophyta|Embryophyta|Tracheophyta|Spermatophytina|Magnoliopsida|Rosanae|Brassicales|Brassicaceae|Raphanus,Plantae,Tracheophyta,Magnoliopsida,Brassicales,Brassicaceae,Raphanus sativus,29702,L.,Raphanus,,sativus,,,Species,,,,,,,,Doris K. Kildale,,1506,5/7/26,,1926,5,7,127,,,,,,,,,,,,,,,flowers,Introduced,,,,,herbarium sheet,,,,,,United States,California,Humboldt,,Bucksport. Eureka.,,0,,,,,,,,,,,,,,,,,,,Jackie C. McConnaughy; cataloged date: 2012-04-13,24bffd3b-7cdd-4a29-98ad-d200aa675db5,17,c8dc387b-e63d-415a-9827-e690eb8a20d6,https://www.cch2.org/portal/collections/individual/index.php?occid=715148
1011868,RSA,RSA,,PreservedSpecimen,8e0e74bc-6388-4cb8-95f4-061a93afe1b6,,RSA accession: 431480,Organism|Plantae|Viridiplantae|Streptophyta|Embryophyta|Tracheophyta|Spermatophytina|Magnoliopsida|Rosanae|Brassicales|Brassicaceae|Raphanus,Plantae,Tracheophyta,Magnoliopsida,Brassicales,Brassicaceae,Raphanus sativus,29702,L.,Raphanus,,sativus,,,Species,Orlando Misretta,2004-06,,,,,,L. E. Hoffman,,s.n.,3/18/26,,1926,3,18,77,,,,,,,,,,,,,,,flowers,Introduced,,,,,herbarium sheet,,,,,,United States,California,Los Angeles,,Arroyo Seco Canyon,,0,,,,,,,,,,,,,,,,,,,Lisa M. Rojas; cataloged date: 2004-09-03,8e0e74bc-6388-4cb8-95f4-061a93afe1b6,17,c1c84088-6c82-437f-930e-9b09499b79b0,https://www.cch2.org/portal/collections/individual/index.php?occid=1011868
1135498,RSA,POM,,PreservedSpecimen,c9394375-08f0-41c9-b7ad-ba72b27c0d75,,POM accession: 96159,Organism|Plantae|Viridiplantae|Streptophyta|Embryophyta|Tracheophyta|Spermatophytina|Magnoliopsida|Rosanae|Brassicales|Brassicaceae|Raphanus,Plantae,Tracheophyta,Magnoliopsida,Brassicales,Brassicaceae,Raphanus sativus,29702,L.,Raphanus,,sativus,,,Species,,,,,,,,Marcus E. Jones,,s.n.,4/28/26,,1926,4,28,118,,,,,,,,,,,,,,,flowers & fruits,Cultivated,,,,,herbarium sheet,,,,,,United States,California,Santa Barbara,,Orcutt.,,0,,,,,,,,,,,,,,,,,,,T. Kim Nguyen; cataloged date: 2007-09-21,c9394375-08f0-41c9-b7ad-ba72b27c0d75,17,858ba816-71d2-422f-8fa4-2f9501820bac,https://www.cch2.org/portal/collections/individual/index.php?occid=1135498
4253748,OSC,V,,PreservedSpecimen,{7CAD5EF9-7CEB-4D14-A148-FF65173482BC},OSC-V-023816,OSC29427,Organism|Plantae|Viridiplantae|Streptophyta|Embryophyta|Tracheophyta|Spermatophytina|Magnoliopsida|Rosanae|Brassicales|Brassicaceae|Raphanus,Plantae,Tracheophyta,Magnoliopsida,Brassicales,Brassicaceae,Raphanus sativus,29702,L.,Raphanus,,sativus,,,Species,"Al-Shehbaz, I.",2016,,,,,,H. A. Scullen,H.A. Scullen,s.n.,7/12/26,,1926,7,12,193,,7/12/26,,,,,,,,,,,,,,wild collection,,,,,,,,,,,United States,Oregon,Coos,,Charleston; Lighthouse grounds.,,0,,43.3403,-124.3289,,402,Stephen C. Meyers,OregonFlora 1994-2020 methodology,"OrlookId: 19040, StateProvince: Oregon, County: Coos, LocName: Charleston",,Georeferencing could be made more precise.,,,,,,,,,,4436433,81,52818b24-6588-4aea-b547-cf3638188ee5,https://www.cch2.org/portal/collections/individual/index.php?occid=4253748
4359405,OSC,V,,PreservedSpecimen,{A5EAC182-326C-47BB-88D1-3CA1223660FD},OSC-V-023834,ORE40995,Organism|Plantae|Viridiplantae|Streptophyta|Embryophyta|Tracheophyta|Spermatophytina|Magnoliopsida|Rosanae|Brassicales|Brassicaceae|Raphanus,Plantae,Tracheophyta,Magnoliopsida,Brassicales,Brassicaceae,Raphanus sativus,29702,L.,Raphanus,,sativus,,,Species,"Al-Shehbaz, I.",2016,,,,,,H. A. Scullen,H.A. Scullen,s.n.,7/12/26,,1926,7,12,193,,7/12/26,,,,,,,,,,,,,,wild collection,,,,,,,,,,,United States,Oregon,Coos,,Arago Lighthouse grounds.,,0,,43.3394,-124.3731,,4828,Stephen C. Meyers,OregonFlora 1994-2020 methodology,"OrlookId: 90965, StateProvince: Oregon, County: Coos, LocName: Cape Arago Lighthouse, Charleston, S of",,,,,,,,,,,,4437284,81,432a1e43-15d6-4900-8bdc-989a7fe5b400,https://www.cch2.org/portal/collections/individual/index.php?occid=4359405
965151,RSA,POM,,PreservedSpecimen,77e5ea74-6a04-4b41-a69d-ea19020009f8,RSA0024109,POM accession: 154398,Organism|Plantae|Viridiplantae|Streptophyta|Embryophyta|Tracheophyta|Spermatophytina|Magnoliopsida|Rosanae|Brassicales|Brassicaceae|Raphanus,Plantae,Tracheophyta,Magnoliopsida,Brassicales,Brassicaceae,Raphanus raphanistrum,29701,L.,Raphanus,,raphanistrum,,,Species,,,,,,,,Marcus E. Jones,,s.n.,2/14/27,,1927,2,14,45,,"Feb. 14, 1927",Specimen label includes a possible catalog number (not M. E. Jones collection number); 22839. Imaged for the Marcus E. Jones Project.,,,,,,,,,,,,flowers & fruits,,,,,,herbarium sheet,,,,,,Mexico,Nayarit,,,Tepic.,,0,,,,,,,,,,,,,,,,,,,Forrest Freund; cataloged date: 2015-01-14,77e5ea74-6a04-4b41-a69d-ea19020009f8,17,cb63a24b-86c3-4d96-82ee-cbb058197e18,https://www.cch2.org/portal/collections/individual/index.php?occid=965151
141265,SBBG,,,PreservedSpecimen,daffe337-e615-4fea-80f2-0ffee42fd5fb,SBBG213823,SBBG_old: 72199,Organism|Plantae|Viridiplantae|Streptophyta|Embryophyta|Tracheophyta|Spermatophytina|Magnoliopsida|Rosanae|Brassicales|Brassicaceae|Raphanus,Plantae,Tracheophyta,Magnoliopsida,Brassicales,Brassicaceae,Raphanus sativus,29702,L.,Raphanus,,sativus,,,Species,,,,,,,,Ralph Hoffmann,,,5/7/27,,1927,5,7,127,,5/7/27,,waste land,,,,,,,,,,,Flowers Present; Fruit Present,,,,,,,,,,,,United States,California,Santa Barbara,,Lompoc,,0,,34.6392,-120.4569,WGS84,3000,,,GeoLocate,,,,,,,,,,,,,16,91e5f1e0-98be-401e-939d-282eb4a3706a,https://www.cch2.org/portal/collections/individual/index.php?occid=141265
375698,SDSU,,,PreservedSpecimen,a7ed7764-9640-41b3-be61-b32f2b7e4464,SDSU01221,1221,Organism|Plantae|Viridiplantae|Streptophyta|Embryophyta|Tracheophyta|Spermatophytina|Magnoliopsida|Rosanae|Brassicales|Brassicaceae|Raphanus,Plantae,Tracheophyta,Magnoliopsida,Brassicales,Brassicaceae,Raphanus sativus,29702,L.,Raphanus,,sativus,,,Species,,,,,,,,"Bastlin, Julia R.",,868,4/20/27,,1927,4,20,110,,4/20/27,,Waste places. San Diego vacant lot.,,Wild Radish.?,,,,,,,,,,,0,,,,,,,,,,United States,California,San Diego,,,No Locality No Locality information,0,,,,,,,,,,,,,,,,,,,preprocessed,,6,a7ed7764-9640-41b3-be61-b32f2b7e4464,https://www.cch2.org/portal/collections/individual/index.php?occid=375698
468984,SD,,,PreservedSpecimen,65E3799B-9336-4471-B12A-5948ED4A5396,SD00062713,SD21952,Organism|Plantae|Viridiplantae|Streptophyta|Embryophyta|Tracheophyta|Spermatophytina|Magnoliopsida|Rosanae|Brassicales|Brassicaceae|Raphanus,Plantae,Tracheophyta,Magnoliopsida,Brassicales,Brassicaceae,Raphanus sativus,29702,L.,Raphanus,,sativus,,,Species,,,,,,,,Catharine M. Wood,,s.n.,3/19/27,,1927,3,19,78,,3/19/27,,,,,,,,,,,,,FFL,,,,,,,,,,,,United States,California,San Diego,,El Cajon,,0,,32.79489,-116.96238,WGS84,,n/a,,Coordinates from label,,Too Vague,,,,,,unknownft.,,,,SD21952,43,463fafb6-2973-4cc3-a0e7-233a3cf4abcd,https://www.cch2.org/portal/collections/individual/index.php?occid=468984
648549,RSA,RSA,,PreservedSpecimen,0527c5b3-8652-4dc1-b692-ede90552daec,,RSA accession: 331,Organism|Plantae|Viridiplantae|Streptophyta|Embryophyta|Tracheophyta|Spermatophytina|Magnoliopsida|Rosanae|Brassicales|Brassicaceae|Raphanus,Plantae,Tracheophyta,Magnoliopsida,Brassicales,Brassicaceae,Raphanus sativus,29702,L.,Raphanus,,sativus,,,Species,,,,,,,,J. T. Howell,,397,7/14/27,,1927,7,14,195,,,,,,,,,,,,,,,flowers & fruits,Cultivated,,,,,herbarium sheet,,,,,,United States,California,Orange,,"Santa Ana River bottom, Rancho Santa Ana.",,0,,,,,,,,,,,152,,,,,500ft.,,,T. Kim Nguyen; cataloged date: 2007-09-21,0527c5b3-8652-4dc1-b692-ede90552daec,17,998a1664-9b4e-4ee1-a622-83d6e092d8c7,https://www.cch2.org/portal/collections/individual/index.php?occid=648549
947300,RSA,RSA,,PreservedSpecimen,6f84c5ae-f9b9-48e5-98b3-f80ae83fa7a2,,RSA accession: 18431,Organism|Plantae|Viridiplantae|Streptophyta|Embryophyta|Tracheophyta|Spermatophytina|Magnoliopsida|Rosanae|Brassicales|Brassicaceae|Raphanus,Plantae,Tracheophyta,Magnoliopsida,Brassicales,Brassicaceae,Raphanus sativus,29702,L.,Raphanus,,sativus,,,Species,,,,,,,,C. B. Wolf,,577,7/12/27,,1927,7,12,193,,,,Sand dunes back of the beach.,,Fls yellow with purple [lines?].,,,,,,herbariumSpecimenDuplicate: https://www.cch2.org/portal/collections/individual/index.php?guid=urn:catalog:CAS:BOT-BC:74329,,,flowers & fruits,Introduced,,,,,herbarium sheet,,,,,,United States,California,San Francisco,,[No location data on label.],,0,,37.7645,-122.5082,WGS84,6000,San Jose S.U. A,,GoogleMaps via BerkeleyMapper (copied from POM203720),,Fri Nov 2 14:29:20 2012; georef from 2006-2015 archive backup file,,,,,,,,,Jackie C. McConnaughy; cataloged date: 2012-04-17,6f84c5ae-f9b9-48e5-98b3-f80ae83fa7a2,17,06230dbc-df6b-4676-bd93-b3dc318c7b6f,https://www.cch2.org/portal/collections/individual/index.php?occid=947300
1113607,RSA,RSA,,PreservedSpecimen,beb2f67a-109a-404f-a9d2-26fdd2280feb,,RSA accession: 11898,Organism|Plantae|Viridiplantae|Streptophyta|Embryophyta|Tracheophyta|Spermatophytina|Magnoliopsida|Rosanae|Brassicales|Brassicaceae|Raphanus,Plantae,Tracheophyta,Magnoliopsida,Brassicales,Brassicaceae,Raphanus sativus,29702,L.,Raphanus,,sativus,,,Species,,,,,,,,Elmer I. Applegate,,5218,8/15/27,,1927,8,15,227,,,,Along seashore,,,,,,,,herbariumSpecimenDuplicate: https://www.cch2.org/portal/collections/individual/index.php?guid=urn:catalog:CAS:BOT-BC:74222,,,flowers & fruits,Introduced,,,,,herbarium sheet,,,,,,United States,California,Del Norte,,Crescent City,,0,,,,,,,,,,,,,,,,,,,Jackie C. McConnaughy; cataloged date: 2012-04-13,beb2f67a-109a-404f-a9d2-26fdd2280feb,17,51969831-e50f-488c-bd91-df68ccdca6a8,https://www.cch2.org/portal/collections/individual/index.php?occid=1113607
1368053,DAV,,,PreservedSpecimen,ebb3d00d-2adb-47fd-ba9c-396b1a4605ae,DAV310402,Accession #: DAV2644,Organism|Plantae|Viridiplantae|Streptophyta|Embryophyta|Tracheophyta|Spermatophytina|Magnoliopsida|Rosanae|Brassicales|Brassicaceae|Raphanus,Plantae,Tracheophyta,Magnoliopsida,Brassicales,Brassicaceae,Raphanus sativus,29702,L.,Raphanus,,sativus,,,Species,,,,,,,,M. Wiesendanger,,716,5/5/27,,1927,5,5,125,,5-May-27,Not enough data to georeference. | Access Database Number (Deprecated): UCD115233,,,Wild radish.,,,,,,,,,,,,,,,,,,,,,United States,California,Sonoma,,Sonoma County.,,0,,,,,,C. Walden,,,,Unable to Georeference,,,,,,,,,,UCD115233,39,ebb3d00d-2adb-47fd-ba9c-396b1a4605ae,https://www.cch2.org/portal/collections/individual/index.php?occid=1368053
2366615,CAS,BOT-BC,,PreservedSpecimen,urn:catalog:CAS:BOT-BC:74232,74232,urn:catalog:CAS:DS:568828,Organism|Plantae|Viridiplantae|Streptophyta|Embryophyta|Tracheophyta|Spermatophytina|Magnoliopsida|Rosanae|Brassicales|Brassicaceae|Raphanus,Plantae,Tracheophyta,Magnoliopsida,Brassicales,Brassicaceae,Raphanus sativus,29702,L.,Raphanus,,sativus,,,Species,Ihsan A. Al-Shehbaz,3/26/04,,,,,,"Wiggins, Ira L.",,2419,4/16/27,,1927,4,16,106,,16-Apr-27,,,,,,,,,,,,,,,,,,,,,North America,,,,United States,California,San Diego County,,Grade 5 miles below Descanso.,,0,,,,,,,,,,,,,,,,,,en,,urn:catalog:CAS:BOT-BC:74232,1,26b1ddf0-0ec3-4381-8c76-6a55079c1e17,https://www.cch2.org/portal/collections/individual/index.php?occid=2366615
2386302,CAS,BOT-BC,,PreservedSpecimen,urn:catalog:CAS:BOT-BC:74329,74329,urn:catalog:CAS:DS:290352,Organism|Plantae|Viridiplantae|Streptophyta|Embryophyta|Tracheophyta|Spermatophytina|Magnoliopsida|Rosanae|Brassicales|Brassicaceae|Raphanus,Plantae,Tracheophyta,Magnoliopsida,Brassicales,Brassicaceae,Raphanus sativus,29702,L.,Raphanus,,sativus,,,Species,Ihsan A. Al-Shehbaz,2010-01,,,,,,"Wolf, Carl B.",,577,7/12/27,,1927,7,12,193,,12-Jul-27,,Sand dunes.,,,,,,,,herbariumSpecimenDuplicate: https://www.cch2.org/portal/collections/individual/index.php?guid=6f84c5ae-f9b9-48e5-98b3-f80ae83fa7a2,,,,,,,,,,,North America,,,,United States,California,San Francisco County,,"San Francisco. Back of ""The Beach"".",,0,,,,,,,,,,,,,,,,,,en,,urn:catalog:CAS:BOT-BC:74329,1,cb2dda02-055d-4488-97ab-ecf14f4ed0d4,https://www.cch2.org/portal/collections/individual/index.php?occid=2386302
2431017,CAS,BOT-BC,,PreservedSpecimen,urn:catalog:CAS:BOT-BC:74222,74222,urn:catalog:CAS:DS:185724,Organism|Plantae|Viridiplantae|Streptophyta|Embryophyta|Tracheophyta|Spermatophytina|Magnoliopsida|Rosanae|Brassicales|Brassicaceae|Raphanus,Plantae,Tracheophyta,Magnoliopsida,Brassicales,Brassicaceae,Raphanus sativus,29702,L.,Raphanus,,sativus,,,Species,Ihsan A. Al-Shehbaz,2010-01,,,,,,"Applegate, Elmer I.",,5218,8/15/27,,1927,8,15,227,,"August 15, 1927.",,Along ocean shore.,,,,,,,,herbariumSpecimenDuplicate: https://www.cch2.org/portal/collections/individual/index.php?guid=beb2f67a-109a-404f-a9d2-26fdd2280feb,,,,,,,,,,,North America,,,,United States,California,Del Norte County,,Crescent City.,,0,,,,,,,,,,,,,,,,,,en,,urn:catalog:CAS:BOT-BC:74222,1,a11d95bb-1a4f-44a4-8440-b7152a351e9f,https://www.cch2.org/portal/collections/individual/index.php?occid=2431017
2970754,YM,,,PreservedSpecimen,,YOSE65260,"SHEET NO. 1898, HERB. ACCESS. NO. 2618",Organism|Plantae|Viridiplantae|Streptophyta|Embryophyta|Tracheophyta|Spermatophytina|Magnoliopsida|Rosanae|Brassicales|Brassicaceae|Raphanus,Plantae,Tracheophyta,Magnoliopsida,Brassicales,Brassicaceae,Raphanus sativus,29702,L.,Raphanus,,sativus,,,Species,,,,,,,,"MICHAEL, ENID",,496,6/9/27,,1927,6,9,160,,6/9/27,,,,,,,,,,,,,,,,,,,,,,,,,United States,California,MARIPOSA,,YOSEMITE VALLEY,,0,,37.726438,-119.611642,WGS84,6000,San Jose S.U. A,,Geolocate (copied from YM-YOSE63489),,Sun Jun 30 17:59:58 2013; georef from 2006-2015 archive backup file,,,,,,,,,preprocessed,,60,ba13b160-e271-48c9-b235-9faed153a511,https://www.cch2.org/portal/collections/individual/index.php?occid=2970754
3499442,UCJEPS,VASC,,PreservedSpecimen,1db83aaf-fdc3-459b-9fbe-715013386653,JEPS53815,,Organism|Plantae|Viridiplantae|Streptophyta|Embryophyta|Tracheophyta|Spermatophytina|Magnoliopsida|Rosanae|Brassicales|Brassicaceae|Raphanus,Plantae,Tracheophyta,Magnoliopsida,Brassicales,Brassicaceae,Raphanus sativus,29702,L.,Raphanus,,sativus,,,Species,,,,,,,,Carl V. Meyer,,122,5/1/27,,1927,5,1,121,151,27-May,"Date given: ""May 1927""",cultivated fields,,,,,,,,,,,Flowering/Fruiting,,,,,,,,,,,,United States,California,San Diego,,Escondido,,0,,33.12177,-117.06739,WGS84,4827,San Diego NHM A,,SD_georef (mak) (copied from UC1199823),,2006-2015 archive backup file; Wed Feb 27 11:23:34 2013,,,,,,,,,preprocessed,1db83aaf-fdc3-459b-9fbe-715013386653,46,ddbeaf25-4272-4a4d-976e-f1ab9f39408b,https://www.cch2.org/portal/collections/individual/index.php?occid=3499442
747857,RSA,POM,,PreservedSpecimen,343ff263-b193-4e3b-9b48-3034fc566bbc,,POM accession: 273395,Organism|Plantae|Viridiplantae|Streptophyta|Embryophyta|Tracheophyta|Spermatophytina|Magnoliopsida|Rosanae|Brassicales|Brassicaceae|Raphanus,Plantae,Tracheophyta,Magnoliopsida,Brassicales,Brassicaceae,Raphanus raphanistrum,29701,L.,Raphanus,,raphanistrum,,,Species,,,,,,,,Lyman Benson,,751,5/12/28,,1928,5,12,133,,,,Upper Sonoran.,,Fields.,,,,,,,,,flowers & fruits,Introduced,,,,,herbarium sheet,,,,,,United States,California,Lake,,"Kelseyville. Middle N Coast range, Kelsey Creek.",,0,,,,,,,,,,,488,,,,,1600ft.,,,Jackie C. McConnaughy; cataloged date: 2012-04-13,343ff263-b193-4e3b-9b48-3034fc566bbc,17,a311c13a-4402-488d-8892-f9f08c95e06c,https://www.cch2.org/portal/collections/individual/index.php?occid=747857
4184975,OSC,V,,PreservedSpecimen,{A90B80B6-0B1E-4492-8E25-21060EF604E1},,WILLU16766,Organism|Plantae|Viridiplantae|Streptophyta|Embryophyta|Tracheophyta|Spermatophytina|Magnoliopsida|Rosanae|Brassicales|Brassicaceae|Raphanus,Plantae,Tracheophyta,Magnoliopsida,Brassicales,Brassicaceae,Raphanus raphanistrum,29701,L.,Raphanus,,raphanistrum,,,Species,"Al-Shehbaz, I.",2016,,,,,,Morton E. Peck,M.E. Peck,16328,8/10/28,,1928,8,10,223,,8/10/28,,beach.,,,,,,,,,,,fruiting,,,,,,,,,,,,United States,Oregon,Tillamook,,mouth of Salmon R.,,0,,45.04721,-124.00428,NAD83,402,,OregonFlora 1994-2020 methodology,"OrlookId: 18358, StateProvince: Oregon, County: Tillamook, LocName: Salmon River, Tillamook Co., mouth of",,,,,,,,,,,,648282,81,eceb73f1-245b-4294-a819-e773c63c224f,https://www.cch2.org/portal/collections/individual/index.php?occid=4184975
83203,SBBG,,,PreservedSpecimen,656a4b77-8cf7-43ee-8529-51add58ed2cb,SBBG213838,SBBG_old: 72198,Organism|Plantae|Viridiplantae|Streptophyta|Embryophyta|Tracheophyta|Spermatophytina|Magnoliopsida|Rosanae|Brassicales|Brassicaceae|Raphanus,Plantae,Tracheophyta,Magnoliopsida,Brassicales,Brassicaceae,Raphanus sativus,29702,L.,Raphanus,,sativus,,,Species,,,,,,,,M. N. Ackley,,132,1928-04-00,,1928,4,0,,,1928-4,,waste ground,,fls purple,,,,,,,,,Flowers Present; Fruit Present,,,,,,,,,,,,United States,California,Los Angeles,,Eagle Rock,,0,,34.146,-118.211,NAD83,1500,,,MyTopo,,,,,,,,,,,,,16,e414c571-5348-42da-a531-07c0019aaa66,https://www.cch2.org/portal/collections/individual/index.php?occid=83203
935273,RSA,POM,,PreservedSpecimen,69c29dd0-1d2f-42ec-947e-8a0c8f2503cb,,POM accession: 273397,Organism|Plantae|Viridiplantae|Streptophyta|Embryophyta|Tracheophyta|Spermatophytina|Magnoliopsida|Rosanae|Brassicales|Brassicaceae|Raphanus,Plantae,Tracheophyta,Magnoliopsida,Brassicales,Brassicaceae,Raphanus sativus,29702,L.,Raphanus,,sativus,,,Species,,,,,,,,Lyman Benson,,359,6/28/28,,1928,6,28,180,,,,Upper Sonoran.,,,,,,,,,,,flowers & fruits,Introduced,,,,,herbarium sheet,,,,,,United States,California,Lake,,"McGaw Slough. Kelseyville. Middle N Coast Mtn range, Cold Creek River.",,0,,,,,,,,,,,457,,,,,1500ft.,,,Jackie C. McConnaughy; cataloged date: 2012-04-13,69c29dd0-1d2f-42ec-947e-8a0c8f2503cb,17,8e5c4149-2f42-40b2-9f55-59cd89e158d5,https://www.cch2.org/portal/collections/individual/index.php?occid=935273
968734,RSA,RSA,,PreservedSpecimen,799bbace-8f11-4fcd-8161-2c5a160329af,,RSA accession: 431475,Organism|Plantae|Viridiplantae|Streptophyta|Embryophyta|Tracheophyta|Spermatophytina|Magnoliopsida|Rosanae|Brassicales|Brassicaceae|Raphanus,Plantae,Tracheophyta,Magnoliopsida,Brassicales,Brassicaceae,Raphanus sativus,29702,L.,Raphanus,,sativus,,,Species,,,,,,,,Elizabeth A. White,,s.n.,1928-05-00,,1928,5,0,,,1928-05,,Sand dunes,,,,,,,,,,,flowers & fruits,Introduced,,,,,herbarium sheet,,,,,,United States,California,Los Angeles,,El Segundo.,,0,,,,,,,,,,,,,,,,,,,Marisa Sripracha; cataloged date: 2001-03-12,799bbace-8f11-4fcd-8161-2c5a160329af,17,ab20eba4-8bfa-4d2a-b740-b372c3d1d3ba,https://www.cch2.org/portal/collections/individual/index.php?occid=968734
1202206,RSA,RSA,,PreservedSpecimen,e91f1b9b-fc82-4446-80b9-d7a0e3a77466,,RSA accession: 431491,Organism|Plantae|Viridiplantae|Streptophyta|Embryophyta|Tracheophyta|Spermatophytina|Magnoliopsida|Rosanae|Brassicales|Brassicaceae|Raphanus,Plantae,Tracheophyta,Magnoliopsida,Brassicales,Brassicaceae,Raphanus sativus,29702,L.,Raphanus,,sativus,,,Species,,,,,,,,F. A. Thackery,,307,5/6/28,,1928,5,6,127,,,,,,,,,,,,,,,flowers & fruits,Cultivated,,,,,herbarium sheet,,,,,,United States,California,San Diego,,"Franklin Canyon, San Diego County.",,0,,,,,,,,,,,,,,,,,,,T. Kim Nguyen; cataloged date: 2007-09-21,e91f1b9b-fc82-4446-80b9-d7a0e3a77466,17,e2e7846f-9504-4f7f-829a-47455ade0bdb,https://www.cch2.org/portal/collections/individual/index.php?occid=1202206
3904082,LA,,,PreservedSpecimen,32795288-70f5-4a9f-9f89-ca04807092d4,LA00606063,,Organism|Plantae|Viridiplantae|Streptophyta|Embryophyta|Tracheophyta|Spermatophytina|Magnoliopsida|Rosanae|Brassicales|Brassicaceae|Raphanus,Plantae,Tracheophyta,Magnoliopsida,Brassicales,Brassicaceae,Raphanus sativus,29702,L.,Raphanus,,sativus,,,Species,,,,,,,,K. Ichikawa,,115,5/10/28,,1928,5,10,131,,,,,,,,,,,,,,,,,,,,,,,,,,,,,,,,,0,,,,,,,,,,,,,,,,,,,abaniaga,,34,32795288-70f5-4a9f-9f89-ca04807092d4,https://www.cch2.org/portal/collections/individual/index.php?occid=3904082
3792158,FSC,,,PreservedSpecimen,f913141e-31a9-4400-a818-21c3ba755df7,FSC0010443,,Organism|Plantae|Viridiplantae|Streptophyta|Embryophyta|Tracheophyta|Spermatophytina|Magnoliopsida|Rosanae|Brassicales|Brassicaceae|Raphanus,Plantae,Tracheophyta,Magnoliopsida,Brassicales,Brassicaceae,Raphanus raphanistrum,29701,L.,Raphanus,,raphanistrum,,,Species,,,,,,,,C. H. Quibell,,546,8/13/29,,1929,8,13,225,,13-Aug-29,,Plowed ground near high school,,,,,,,,,,,,,,,,,,,,,,,United States,California,Monterey,,"Monterey, on Monterey Bay. Near high school.",,0,,,,,,,,,,,,,,,,,,en,pawanpreetgill5,,38,f913141e-31a9-4400-a818-21c3ba755df7,https://www.cch2.org/portal/collections/individual/index.php?occid=3792158
667072,RSA,RSA,,PreservedSpecimen,0df66e11-095c-49ef-92e7-a8aa3a0a9143,,RSA accession: 431503,Organism|Plantae|Viridiplantae|Streptophyta|Embryophyta|Tracheophyta|Spermatophytina|Magnoliopsida|Rosanae|Brassicales|Brassicaceae|Raphanus,Plantae,Tracheophyta,Magnoliopsida,Brassicales,Brassicaceae,Raphanus sativus,29702,L.,Raphanus,,sativus,,,Species,,,,,,,,Ora M. Clark,,1618,3/2/29,,1929,3,2,61,,,,Open field.,,,,,,,,,,,flowers & fruits,Cultivated,,,,,herbarium sheet,,,,,,United States,California,San Diego,,Vista.,,0,,,,,,,,,,,,,,,,,,,T. Kim Nguyen; cataloged date: 2007-09-21,0df66e11-095c-49ef-92e7-a8aa3a0a9143,17,a60c7963-0051-41f9-a995-4716457e5f09,https://www.cch2.org/portal/collections/individual/index.php?occid=667072
684007,RSA,RSA,,PreservedSpecimen,1601abeb-6196-4450-93a3-b39f1e382b05,,RSA accession: 431508,Organism|Plantae|Viridiplantae|Streptophyta|Embryophyta|Tracheophyta|Spermatophytina|Magnoliopsida|Rosanae|Brassicales|Brassicaceae|Raphanus,Plantae,Tracheophyta,Magnoliopsida,Brassicales,Brassicaceae,Raphanus sativus,29702,L.,Raphanus,,sativus,,,Species,,,,,,,,Dr H. de Forest,,s.n.,3/30/29,,1929,3,30,89,,,,,,,,,,,,,,,flowers & fruits,Cultivated,,,,,herbarium sheet,,,,,,United States,California,Santa Barbara,,Cuyama R. Valley,,0,,,,,,,,,,,,,,,,,,,T. Kim Nguyen; cataloged date: 2007-09-21,1601abeb-6196-4450-93a3-b39f1e382b05,17,6167989e-46a4-41b3-8a27-fbad256261d8,https://www.cch2.org/portal/collections/individual/index.php?occid=684007
732955,RSA,RSA,,PreservedSpecimen,2d3a09f0-a0fc-48c4-804a-c64febd0ebb2,,RSA accession: 431477,Organism|Plantae|Viridiplantae|Streptophyta|Embryophyta|Tracheophyta|Spermatophytina|Magnoliopsida|Rosanae|Brassicales|Brassicaceae|Raphanus,Plantae,Tracheophyta,Magnoliopsida,Brassicales,Brassicaceae,Raphanus sativus,29702,L.,Raphanus,,sativus,,,Species,,,,,,,,Ora M. Clark,,1500,2/3/29,,1929,2,3,34,,,,,,,,,,,,,,,flowers & fruits,Cultivated,,,,,herbarium sheet,,,,,,United States,California,Los Angeles,,Palos Verdes,,0,,,,,,,,,,,,,,,,,,,T. Kim Nguyen; cataloged date: 2007-09-21,2d3a09f0-a0fc-48c4-804a-c64febd0ebb2,17,e0f758c2-e993-4822-8dec-45ba3a8661ad,https://www.cch2.org/portal/collections/individual/index.php?occid=732955
806147,RSA,RSA,,PreservedSpecimen,4ffbae4c-8008-4514-be98-886b434cec46,,RSA accession: 431473,Organism|Plantae|Viridiplantae|Streptophyta|Embryophyta|Tracheophyta|Spermatophytina|Magnoliopsida|Rosanae|Brassicales|Brassicaceae|Raphanus,Plantae,Tracheophyta,Magnoliopsida,Brassicales,Brassicaceae,Raphanus sativus,29702,L.,Raphanus,,sativus,,,Species,,,,,,,,H. L. Bauer,,s.n,3/20/29,,1929,3,20,79,,,,Vacant lot,,,,,,,,,,,flowers & fruits,Cultivated,,,,,herbarium sheet,,,,,,United States,California,Los Angeles,,Long Beach.,,0,,,,,,,,,,,,,,,,,,,T. Kim Nguyen; cataloged date: 2007-09-21,4ffbae4c-8008-4514-be98-886b434cec46,17,552faf56-d0a6-4c16-a686-6a4e3c17c6e8,https://www.cch2.org/portal/collections/individual/index.php?occid=806147
963366,RSA,RSA,,PreservedSpecimen,770a4a8a-a608-4574-a42b-6922692cee78,,RSA accession: 431474,Organism|Plantae|Viridiplantae|Streptophyta|Embryophyta|Tracheophyta|Spermatophytina|Magnoliopsida|Rosanae|Brassicales|Brassicaceae|Raphanus,Plantae,Tracheophyta,Magnoliopsida,Brassicales,Brassicaceae,Raphanus sativus,29702,L.,Raphanus,,sativus,,,Species,,,,,,,,T. S. Clare,,s.n.,1929-03-00,,1929,3,0,,,1929-03,,Near stream.,,,,,,,,,,,flowers & fruits,Cultivated,,,,,herbarium sheet,,,,,,United States,California,Los Angeles,,Topanga Canyon.,,0,,,,,,,,,,,,,,,,,,,T. Kim Nguyen; cataloged date: 2007-09-21,770a4a8a-a608-4574-a42b-6922692cee78,17,a85bc968-a112-47ad-a15f-817149479df2,https://www.cch2.org/portal/collections/individual/index.php?occid=963366
1062094,RSA,RSA,,PreservedSpecimen,a6142b02-bfa1-4e1b-b2f7-3a79771f3e69,,RSA accession: 722375,Organism|Plantae|Viridiplantae|Streptophyta|Embryophyta|Tracheophyta|Spermatophytina|Magnoliopsida|Rosanae|Brassicales|Brassicaceae|Raphanus,Plantae,Tracheophyta,Magnoliopsida,Brassicales,Brassicaceae,Raphanus sativus,29702,L.,Raphanus,,sativus,,,Species,,,,,,,,Norland,,42,1929-04-00,,1929,4,0,,,1929-04,,Barley field.,,1-2 in fleshy roots. Fls purplish - dark veined. Biennial.,,,,,,,,,flowers,Introduced,,,,,herbarium sheet,,,,,,United States,California,Trinity,,[no locality information provided],,0,,,,,,,,,,,,,,,,,,,Jackie C. McConnaughy; cataloged date: 2012-04-17,a6142b02-bfa1-4e1b-b2f7-3a79771f3e69,17,437274dc-45c9-4840-9526-ba0afa787197,https://www.cch2.org/portal/collections/individual/index.php?occid=1062094
1080763,RSA,RSA,,PreservedSpecimen,aeff0710-56dd-49eb-9396-3a9d85660d29,,RSA accession: 431479,Organism|Plantae|Viridiplantae|Streptophyta|Embryophyta|Tracheophyta|Spermatophytina|Magnoliopsida|Rosanae|Brassicales|Brassicaceae|Raphanus,Plantae,Tracheophyta,Magnoliopsida,Brassicales,Brassicaceae,Raphanus sativus,29702,L.,Raphanus,,sativus,,,Species,,,,,,,,L. E. Hoffman,,s.n,5/5/29,,1929,5,5,125,,,,,,,,,,,,,,,flowers & fruits,Cultivated,,,,,herbarium sheet,,,,,,United States,California,Los Angeles,,"Hermon Hills, Ave-57. Pasadena.",,0,,,,,,,,,,,,,,,,,,,T. Kim Nguyen; cataloged date: 2007-09-19,aeff0710-56dd-49eb-9396-3a9d85660d29,17,fcc326ce-e5dc-48a0-b39f-3b5b79d388c9,https://www.cch2.org/portal/collections/individual/index.php?occid=1080763
1123870,RSA,POM,,PreservedSpecimen,c3b510cb-ba16-46c2-934c-b316765b0aaf,,POM accession: 273398,Organism|Plantae|Viridiplantae|Streptophyta|Embryophyta|Tracheophyta|Spermatophytina|Magnoliopsida|Rosanae|Brassicales|Brassicaceae|Raphanus,Plantae,Tracheophyta,Magnoliopsida,Brassicales,Brassicaceae,Raphanus sativus,29702,L.,Raphanus,,sativus,,,Species,,,,,,,,Cora W. Benson,,s.n.,1/26/29,,1929,1,26,26,,,,Upper Sonoran.,,,,,,,,,,,flowers & fruits,Introduced,,,,,herbarium sheet,,,,,,United States,California,San Luis Obispo,,Pismo Beach.,,0,,,,,,,,,,,30,,,,,100ft.,,,Jackie C. McConnaughy; cataloged date: 2012-04-17,c3b510cb-ba16-46c2-934c-b316765b0aaf,17,a1ae9acd-5001-46bf-9441-0699882fdd62,https://www.cch2.org/portal/collections/individual/index.php?occid=1123870
1368002,DAV,,,PreservedSpecimen,47bbf3e6-08ee-4e83-bdbd-cc0358149f62,DAV310416,Accession #: DAV2634,Organism|Plantae|Viridiplantae|Streptophyta|Embryophyta|Tracheophyta|Spermatophytina|Magnoliopsida|Rosanae|Brassicales|Brassicaceae|Raphanus,Plantae,Tracheophyta,Magnoliopsida,Brassicales,Brassicaceae,Raphanus sativus,29702,L.,Raphanus,,sativus,,,Species,,,,,,,,Morris Halperin,,s.n.,3/23/29,,1929,3,23,82,,23-Mar-29,Access Database Number (Deprecated): UCD115177,,,,,,,,,,,,,,,,,,,,,,,,United States,California,Alameda,,"Alameda County: Craigmont Hills, Berkeley.",,0,,,,,,,,,,,,,,,,,,,,UCD115177,39,47bbf3e6-08ee-4e83-bdbd-cc0358149f62,https://www.cch2.org/portal/collections/individual/index.php?occid=1368002
2866836,MACF,,,PreservedSpecimen,ff6012c5-f400-48a3-85ad-7bb5bbfbca3b,MACF030464,MACF005309,Organism|Plantae|Viridiplantae|Streptophyta|Embryophyta|Tracheophyta|Spermatophytina|Magnoliopsida|Rosanae|Brassicales|Brassicaceae|Raphanus,Plantae,Tracheophyta,Magnoliopsida,Brassicales,Brassicaceae,Raphanus sativus,29702,L.,Raphanus,,sativus,,,Species,,,,,,,,Fay A. McFadden,,1064,3/8/29,,1929,3,8,67,,Mar.8.29,,,,,,,,,,,,,,,,,,,,,,,,,United States,California,,Brea,,,0,,,,,,,,,,,,,,,,,,,TuesDani,,36,ff6012c5-f400-48a3-85ad-7bb5bbfbca3b,https://www.cch2.org/portal/collections/individual/index.php?occid=2866836
3792196,FSC,,,PreservedSpecimen,c0f14f2c-7c10-497a-9710-3302ba9dce1f,FSC0010481,,Organism|Plantae|Viridiplantae|Streptophyta|Embryophyta|Tracheophyta|Spermatophytina|Magnoliopsida|Rosanae|Brassicales|Brassicaceae|Raphanus,Plantae,Tracheophyta,Magnoliopsida,Brassicales,Brassicaceae,Raphanus sativus,29702,L.,Raphanus,,sativus,,,Species,,,,,,,,Chas. H. Quibell,,86,8/13/29,,1929,8,13,225,,13-Aug-29,,found on plowed ground at the High School athletic field.,,,,,,,,,,,,,,,,,,,,,,,United States,California,Monterey,,Pacific Grove. This was found on plowed ground at the High School athletic field.,,0,,,,,,,,,,,,,,,,,,en,pawanpreetgill5,,38,c0f14f2c-7c10-497a-9710-3302ba9dce1f,https://www.cch2.org/portal/collections/individual/index.php?occid=3792196
73443,SBBG,,,PreservedSpecimen,5213e121-ff97-49f4-bbee-ea5f92b0e4c0,SBBG213811,SBBG_old: 72197,Organism|Plantae|Viridiplantae|Streptophyta|Embryophyta|Tracheophyta|Spermatophytina|Magnoliopsida|Rosanae|Brassicales|Brassicaceae|Raphanus,Plantae,Tracheophyta,Magnoliopsida,Brassicales,Brassicaceae,Raphanus raphanistrum,29701,L.,Raphanus,,raphanistrum,,,Species,,,,,,,,Ralph Hoffmann,,,4/3/30,,1930,4,3,93,,4/3/30,,field,,,,,,,,,,,Flowers Present,,,,,,,,,,,,United States,California,Santa Barbara,,"Veronica Springs Rd, Santa Barbara",,0,,34.413,-119.742,NAD83,500,dwilken,,MyTopo,,,,,,,,,,,,,16,d6543ba6-4793-450b-a73e-7d9d5a53c50c,https://www.cch2.org/portal/collections/individual/index.php?occid=73443
2463835,CAS,BOT-BC,,PreservedSpecimen,urn:catalog:CAS:BOT-BC:74205,74205,urn:catalog:CAS:BOT:178454,Organism|Plantae|Viridiplantae|Streptophyta|Embryophyta|Tracheophyta|Spermatophytina|Magnoliopsida|Rosanae|Brassicales|Brassicaceae|Raphanus,Plantae,Tracheophyta,Magnoliopsida,Brassicales,Brassicaceae,Raphanus raphanistrum,29701,L.,Raphanus,,raphanistrum,,,Species,Ihsan A. Al-Shehbaz,2010-01,,,,,,"Hoffmann, Ralph",,s.n.,6/15/30,,1930,6,15,166,,"June 15, 1930.",,,,,,,,,,,,,,,,,,,,,North America,,,,United States,California,Santa Barbara County,,Santa Cruz Island. Smuggler's Cove.,,0,,,,,,,,,,,,,,,,,,en,,urn:catalog:CAS:BOT-BC:74205,1,9acc2eb8-4cea-4315-b243-82e3f28c9b6d,https://www.cch2.org/portal/collections/individual/index.php?occid=2463835
49448,SBBG,,,PreservedSpecimen,21ca90c3-e374-486f-8d16-2c566a68a16f,SBBG155536,SBBG_old: 77984,Organism|Plantae|Viridiplantae|Streptophyta|Embryophyta|Tracheophyta|Spermatophytina|Magnoliopsida|Rosanae|Brassicales|Brassicaceae|Raphanus,Plantae,Tracheophyta,Magnoliopsida,Brassicales,Brassicaceae,Raphanus sativus,29702,L.,Raphanus,,sativus,,,Species,,,,,,,,Ralph Hoffmann,,,6/15/30,,1930,6,15,166,,6/15/30,,,,,,,,,,,,,Flowers Present; Fruit Present,,,,,,,,,,,,United States,California,Santa Barbara,,Santa Cruz Island: Smugglers Cove,,0,,34.022,-119.5444,NAD83,1300,dwilken,,MyTopo,,,,,,,,,,,,,16,ae7207c3-30b3-4a49-8937-0aa6ea404ba3,https://www.cch2.org/portal/collections/individual/index.php?occid=49448
90647,SBBG,,,PreservedSpecimen,7457b0f0-3c93-4f47-a78d-d7b3c76915b9,SBBG155533,SBBG_old: 77983,Organism|Plantae|Viridiplantae|Streptophyta|Embryophyta|Tracheophyta|Spermatophytina|Magnoliopsida|Rosanae|Brassicales|Brassicaceae|Raphanus,Plantae,Tracheophyta,Magnoliopsida,Brassicales,Brassicaceae,Raphanus sativus,29702,L.,Raphanus,,sativus,,,Species,,,,,,,,H. and M. Dearing,,,7/11/30,,1930,7,11,192,,7/11/30,,,,,,,,,,,,,Flowers Present; Fruit Present,,,,,,,,,,,,United States,California,Santa Barbara,,Santa Cruz Island: Scorpion Harbor,,0,,34.0484,-119.557,NAD83,750,dwilken,,MyTopo,,,,,,,,,,,,,16,d3333140-2c70-4e8e-9b6f-6694624725b6,https://www.cch2.org/portal/collections/individual/index.php?occid=90647
144474,SBBG,,,PreservedSpecimen,e1b90342-55c2-4f1e-88ee-a661a581bff8,SBBG155531,SBBG_old: 77982,Organism|Plantae|Viridiplantae|Streptophyta|Embryophyta|Tracheophyta|Spermatophytina|Magnoliopsida|Rosanae|Brassicales|Brassicaceae|Raphanus,Plantae,Tracheophyta,Magnoliopsida,Brassicales,Brassicaceae,Raphanus sativus,29702,L.,Raphanus,,sativus,,,Species,,,,,,,,Ralph Hoffmann,,,6/15/30,,1930,6,15,166,,6/15/30,,,,,,,,,,,,,Flowers Present; Fruit Present,,,,,,,,,,,,United States,California,Santa Barbara,,Santa Cruz Island: Smugglers Cove,,0,,34.022,-119.5444,NAD83,1300,dwilken,,MyTopo,,,,,,,,,,,,,16,8a20136a-8dd8-48a2-afa2-26c884db7da9,https://www.cch2.org/portal/collections/individual/index.php?occid=144474
469005,SD,,,PreservedSpecimen,91F19B9F-21E7-4CAC-BF45-32E55EBCED98,SD00062739,SD72214,Organism|Plantae|Viridiplantae|Streptophyta|Embryophyta|Tracheophyta|Spermatophytina|Magnoliopsida|Rosanae|Brassicales|Brassicaceae|Raphanus,Plantae,Tracheophyta,Magnoliopsida,Brassicales,Brassicaceae,Raphanus sativus,29702,L.,Raphanus,,sativus,,,Species,,,,,,,,R. S. Woglum,,s.n.,5/3/30,,1930,5,3,123,,5/3/30,,,,,,,,,,,,,FFL,,,,,,,,,,,,United States,California,San Diego,,Rancho Santa Fe,,0,,33.02028,-117.20278,WGS84,3218,mak,,TOPO! v3.4.2,,,,,,,,unknownft.,,,,SD72214,43,f3d2dc74-a5bd-4c24-b9f1-7a53055874bf,https://www.cch2.org/portal/collections/individual/index.php?occid=469005
956927,RSA,RSA,,PreservedSpecimen,7404f794-773a-4a47-ab96-5e834881c577,,RSA accession: 431505,Organism|Plantae|Viridiplantae|Streptophyta|Embryophyta|Tracheophyta|Spermatophytina|Magnoliopsida|Rosanae|Brassicales|Brassicaceae|Raphanus,Plantae,Tracheophyta,Magnoliopsida,Brassicales,Brassicaceae,Raphanus sativus,29702,L.,Raphanus,,sativus,,,Species,,,,,,,,E. E. Stanford,,s.n.,4/18/30,,1930,4,18,108,,,,,,,,,,,,,,,flowers & fruits,Introduced,,,,,herbarium sheet,,,,,,United States,California,San Joaquin,,Northeastern portion of the county.,,0,,,,,,,,,,,,,,,,,,,Jackie C. McConnaughy; cataloged date: 2012-04-17,7404f794-773a-4a47-ab96-5e834881c577,17,f45283ec-d8c4-4d17-9616-4d13679f82a1,https://www.cch2.org/portal/collections/individual/index.php?occid=956927
981549,RSA,RSA,,PreservedSpecimen,7fbdc05c-74e2-47fd-a517-31d765d941b9,,RSA accession: 431482,Organism|Plantae|Viridiplantae|Streptophyta|Embryophyta|Tracheophyta|Spermatophytina|Magnoliopsida|Rosanae|Brassicales|Brassicaceae|Raphanus,Plantae,Tracheophyta,Magnoliopsida,Brassicales,Brassicaceae,Raphanus sativus,29702,L.,Raphanus,,sativus,,,Species,,,,,,,,James Clizbe,,s.n.,5/6/30,,1930,5,6,126,,,,waste ground,,,,,,,,,,,flowers & fruits,Cultivated,,,,,herbarium sheet,,,,,,United States,California,Los Angeles,,Laurel Canyon.,,0,,34.1112,-118.3733,WGS84,1500,Mare Nazaire; georef date: 2018-07-17,,GEOLocate,,,,,,,,,,,T. Kim Nguyen; cataloged date: 2007-09-19,7fbdc05c-74e2-47fd-a517-31d765d941b9,17,1d4120c4-d53b-4179-b9ef-e6f86d8200e6,https://www.cch2.org/portal/collections/individual/index.php?occid=981549
1110471,RSA,POM,,PreservedSpecimen,bd30836b-eb7a-4798-8c2e-ef22affd0410,,POM accession: 181430,Organism|Plantae|Viridiplantae|Streptophyta|Embryophyta|Tracheophyta|Spermatophytina|Magnoliopsida|Rosanae|Brassicales|Brassicaceae|Raphanus,Plantae,Tracheophyta,Magnoliopsida,Brassicales,Brassicaceae,Raphanus sativus,29702,L.,Raphanus,,sativus,,,Species,,,,,,,,I. L. Wiggins,,4610,4/18/30,,1930,4,18,108,,,,,,Fallow fields.,,,,,,herbariumSpecimenDuplicate: https://www.cch2.org/portal/collections/individual/index.php?guid=urn:catalog:CAS:BOT-BC:74267 | herbariumSpecimenDuplicate: https://www.cch2.org/portal/collections/individual/index.php?guid=b4e705fc-fb1a-40c9-9d34-dafb7763a4f4 | herbariumSpecimenDuplicate: https://www.cch2.org/portal/collections/individual/index.php?guid=abe4d268-9eed-4902-ae52-ecfc8ef7e7ad,,,flowers & fruits,Introduced,,,,,herbarium sheet,,,,,,United States,California,Contra Costa,,Jersey Island.,,0,,38.032608,-121.682014,NAD27,4033,San Jose S.U. A,,"Terrain Navigator Pro 1:24,000 (copied from UC406991)",,Wed May 15 20:32:05 2013; georef from 2006-2015 archive backup file,,,,,,,,,Jackie C. McConnaughy; cataloged date: 2012-04-13,bd30836b-eb7a-4798-8c2e-ef22affd0410,17,9e2984d1-a434-486c-8b5d-66b282e3d571,https://www.cch2.org/portal/collections/individual/index.php?occid=1110471
1119747,RSA,RSA,,PreservedSpecimen,c1bec370-520b-48b1-bba7-13372945b535,,RSA accession: 431478,Organism|Plantae|Viridiplantae|Streptophyta|Embryophyta|Tracheophyta|Spermatophytina|Magnoliopsida|Rosanae|Brassicales|Brassicaceae|Raphanus,Plantae,Tracheophyta,Magnoliopsida,Brassicales,Brassicaceae,Raphanus sativus,29702,L.,Raphanus,,sativus,,,Species,,,,,,,,F. R. Fosberg,,2985,6/23/30,,1930,6,23,174,,,,San Dunes; Supra littoral zone,,,,,,,,,,,flowers & fruits,Cultivated,,,,,herbarium sheet,,,,,,United States,California,Los Angeles,,Del Rey.,,0,,,,,,,,,,,1,,,,,3ft.,,,T. Kim Nguyen; cataloged date: 2007-09-21,c1bec370-520b-48b1-bba7-13372945b535,17,1bc15117-5f67-4e6d-914b-68a67c11ba29,https://www.cch2.org/portal/collections/individual/index.php?occid=1119747
1146837,RSA,RSA,,PreservedSpecimen,ce94f09e-129c-46dc-9b44-6f806093e3fc,RSA0125360,RSA accession: 482907,Organism|Plantae|Viridiplantae|Streptophyta|Embryophyta|Tracheophyta|Spermatophytina|Magnoliopsida|Rosanae|Brassicales|Brassicaceae|Raphanus,Plantae,Tracheophyta,Magnoliopsida,Brassicales,Brassicaceae,Raphanus sativus,29702,L.,Raphanus,,sativus,,,Species,LeRoy Gross,2018-06,,,,,,E. E. Stanford,,s.n.,4/18/30,,1930,4,18,108,,,,,,,,,,,,,,,flowers & fruits,Introduced,,,,,herbarium sheet,,,,,,United States,California,San Joaquin,,Northeastern portion of the county.,,0,,,,,,,,,,,,,,,,,,,K. J. Blassey; cataloged date: 2012-05-08,ce94f09e-129c-46dc-9b44-6f806093e3fc,17,7da7d5c5-69d1-40ad-bba1-468e0ab54420,https://www.cch2.org/portal/collections/individual/index.php?occid=1146837
1368057,DAV,,,PreservedSpecimen,UCD115237,DAV310399,Accession #: DAV98672,Organism|Plantae|Viridiplantae|Streptophyta|Embryophyta|Tracheophyta|Spermatophytina|Magnoliopsida|Rosanae|Brassicales|Brassicaceae|Raphanus,Plantae,Tracheophyta,Magnoliopsida,Brassicales,Brassicaceae,Raphanus sativus,29702,L.,Raphanus,,sativus,,,Species,,,,,,,,R. S. Woglum,,s.n.,5/3/30,,1930,5,3,123,,3-May-30,Los Angeles State and County Herbarium #3258. | Access Database Number (Deprecated): UCD115237,,,'Wild Radish.',,,,,,,,,,,,,,,,,,,,,United States,California,San Diego,,"San Diego County: Rancho Santa Fe, in west-central park of county.",,0,,33.02028,-117.20278,WGS84,3218,San Diego NHM E,,SD: 2007-2009 CCH GBIF georeferencing grant (copied from SD72214),,Date Georeferenced: Mon May 15 08:34:28 2017,,,,,,,,,tcbarry,UCD115237,39,661090f7-69fc-40a9-9a9e-8f2e91a1b0ce,https://www.cch2.org/portal/collections/individual/index.php?occid=1368057
2408641,CAS,BOT-BC,,PreservedSpecimen,urn:catalog:CAS:BOT-BC:74267,74267,urn:catalog:CAS:DS:201088,Organism|Plantae|Viridiplantae|Streptophyta|Embryophyta|Tracheophyta|Spermatophytina|Magnoliopsida|Rosanae|Brassicales|Brassicaceae|Raphanus,Plantae,Tracheophyta,Magnoliopsida,Brassicales,Brassicaceae,Raphanus sativus,29702,L.,Raphanus,,sativus,,,Species,Ihsan A. Al-Shehbaz,2010-01,,,,,,"Wiggins, Ira L.",,4610,4/18/30,,1930,4,18,108,,"April 18, 1930.",,Fallow fields.,,,,,,,,herbariumSpecimenDuplicate: https://www.cch2.org/portal/collections/individual/index.php?guid=bd30836b-eb7a-4798-8c2e-ef22affd0410 | herbariumSpecimenDuplicate: https://www.cch2.org/portal/collections/individual/index.php?guid=b4e705fc-fb1a-40c9-9d34-dafb7763a4f4 | herbariumSpecimenDuplicate: https://www.cch2.org/portal/collections/individual/index.php?guid=abe4d268-9eed-4902-ae52-ecfc8ef7e7ad,,,,,,,,,,,North America,,,,United States,California,Contra Costa County,,Jersey Island.,,0,,,,,,,,,,,,,,,,,,en,,urn:catalog:CAS:BOT-BC:74267,1,fadfc0d5-8785-4428-bfb5-6fb71205827e,https://www.cch2.org/portal/collections/individual/index.php?occid=2408641
3260290,UCJEPS,VASC,,PreservedSpecimen,b4e705fc-fb1a-40c9-9d34-dafb7763a4f4,UC407038,,Organism|Plantae|Viridiplantae|Streptophyta|Embryophyta|Tracheophyta|Spermatophytina|Magnoliopsida|Rosanae|Brassicales|Brassicaceae|Raphanus,Plantae,Tracheophyta,Magnoliopsida,Brassicales,Brassicaceae,Raphanus sativus,29702,L.,Raphanus,,sativus,,,Species,,,,,,,,Ira L. Wiggins,,4610,4/18/30,,1930,4,18,108,,Apr 18 1930,,[fallow] fields,,,,,,,,herbariumSpecimenDuplicate: https://www.cch2.org/portal/collections/individual/index.php?guid=bd30836b-eb7a-4798-8c2e-ef22affd0410 | herbariumSpecimenDuplicate: https://www.cch2.org/portal/collections/individual/index.php?guid=urn:catalog:CAS:BOT-BC:74267 | herbariumSpecimenDuplicate: https://www.cch2.org/portal/collections/individual/index.php?guid=abe4d268-9eed-4902-ae52-ecfc8ef7e7ad,,,Flowering/Fruiting,,,,,,,,,,,,United States,California,Contra Costa,,Jersey Island,,0,,38.03639,-121.68472,,,,,,,,,,,,,,,,,b4e705fc-fb1a-40c9-9d34-dafb7763a4f4,46,c2397a1c-03f8-4ad4-bf91-7996c4637df1,https://www.cch2.org/portal/collections/individual/index.php?occid=3260290
3334730,UCJEPS,VASC,,PreservedSpecimen,abe4d268-9eed-4902-ae52-ecfc8ef7e7ad,UC650429,,Organism|Plantae|Viridiplantae|Streptophyta|Embryophyta|Tracheophyta|Spermatophytina|Magnoliopsida|Rosanae|Brassicales|Brassicaceae|Raphanus,Plantae,Tracheophyta,Magnoliopsida,Brassicales,Brassicaceae,Raphanus sativus,29702,L.,Raphanus,,sativus,,,Species,,,,,,,,Ira L. Wiggins,,4610,4/18/30,,1930,4,18,108,,Apr 18 1930,,[fallow] fields,,,,,,,,herbariumSpecimenDuplicate: https://www.cch2.org/portal/collections/individual/index.php?guid=bd30836b-eb7a-4798-8c2e-ef22affd0410 | herbariumSpecimenDuplicate: https://www.cch2.org/portal/collections/individual/index.php?guid=urn:catalog:CAS:BOT-BC:74267 | herbariumSpecimenDuplicate: https://www.cch2.org/portal/collections/individual/index.php?guid=b4e705fc-fb1a-40c9-9d34-dafb7763a4f4,,,Flowering/Fruiting,,,,,,,,,,,,United States,California,Contra Costa,,Jersey Island,,0,,38.03639,-121.68472,,,,,,,,,,,,,,,,,abe4d268-9eed-4902-ae52-ecfc8ef7e7ad,46,8789530d-6664-4a06-b957-4a1207431a34,https://www.cch2.org/portal/collections/individual/index.php?occid=3334730
2866791,MACF,,,PreservedSpecimen,be0c672e-ace1-4015-af8d-e86d8caba1b0,MACF030473,MACF005312,Organism|Plantae|Viridiplantae|Streptophyta|Embryophyta|Tracheophyta|Spermatophytina|Magnoliopsida|Rosanae|Brassicales|Brassicaceae|Raphanus,Plantae,Tracheophyta,Magnoliopsida,Brassicales,Brassicaceae,Raphanus raphanistrum,29701,L.,Raphanus,,raphanistrum,,,Species,,,,,,,,V. I. Goddard,,51,4/3/31,,1931,4,3,93,,"April 3rd, 1931",,,,A common field weed,,,,,,,,,,,,,,,,,,,,,Canada,British Columbia,,Sidney,,,0,,,,,,,,,,,,,,,,,,,TuesDani,,36,be0c672e-ace1-4015-af8d-e86d8caba1b0,https://www.cch2.org/portal/collections/individual/index.php?occid=2866791
468988,SD,,,PreservedSpecimen,2423BB59-AE98-4BBF-B049-ECCB6EB813B5,SD00062800,SD31165,Organism|Plantae|Viridiplantae|Streptophyta|Embryophyta|Tracheophyta|Spermatophytina|Magnoliopsida|Rosanae|Brassicales|Brassicaceae|Raphanus,Plantae,Tracheophyta,Magnoliopsida,Brassicales,Brassicaceae,Raphanus sativus,29702,L.,Raphanus,,sativus,,,Species,,,,,,,,Edith A. Purer,,156,2/21/31,,1931,2,21,52,,2/21/31,,Fields,,,,,,,,,,,FFL,,,,,,,,,,,,United States,California,Los Angeles,,Palos Verdes,,0,,33.75995,-118.36373,WGS84,6500,LAH,,Google Earth,,Palos Verdes Peninsula,,,,,,unknownft.,,,,SD31165,43,0e26c506-3560-4fb8-a824-2d04f276d147,https://www.cch2.org/portal/collections/individual/index.php?occid=468988
468996,SD,,,PreservedSpecimen,7AE5E2EA-3C50-4220-8F47-699CCA658488,SD00062799,SD39747,Organism|Plantae|Viridiplantae|Streptophyta|Embryophyta|Tracheophyta|Spermatophytina|Magnoliopsida|Rosanae|Brassicales|Brassicaceae|Raphanus,Plantae,Tracheophyta,Magnoliopsida,Brassicales,Brassicaceae,Raphanus sativus,29702,L.,Raphanus,,sativus,,,Species,,,,,,,,Edith A. Purer,,2007,4/8/31,,1931,4,8,98,,4/8/31,,Established dunes.,,,,,,,,,,,FFL,,,,,,,,,,,,United States,California,Los Angeles,,El Segundo,,0,,33.92241,-118.42313,WGS84,3000,LAH,,Google Earth,,Larger El Segundo area. Original info very vague.,,,,,,unknownft.,,,,SD39747,43,73134ffd-9022-4a7a-af4e-bab98c62010d,https://www.cch2.org/portal/collections/individual/index.php?occid=468996
657525,RSA,RSA,,PreservedSpecimen,096ffc2f-06e0-4270-bd9b-d81261057481,,RSA accession: 431493,Organism|Plantae|Viridiplantae|Streptophyta|Embryophyta|Tracheophyta|Spermatophytina|Magnoliopsida|Rosanae|Brassicales|Brassicaceae|Raphanus,Plantae,Tracheophyta,Magnoliopsida,Brassicales,Brassicaceae,Raphanus sativus,29702,L.,Raphanus,,sativus,,,Species,,,,,,,,Howard Mullins,,s.n.,3/13/31,,1931,3,13,72,,,,,,,,,,,,,,,flowers & fruits,Cultivated,,,,,herbarium sheet,,,,,,United States,California,Los Angeles,,"Los Angeles. Vacant lots and waste places in the city, roadsides.",,0,,,,,,,,,,,,,,,,,,,T. Kim Nguyen; cataloged date: 2007-09-21,096ffc2f-06e0-4270-bd9b-d81261057481,17,a34d5d4c-1120-4784-9f2c-f6db8ad9e58d,https://www.cch2.org/portal/collections/individual/index.php?occid=657525
942849,RSA,RSA,,PreservedSpecimen,6d621969-f2e3-4ebb-b5d3-efb52d8e6416,,RSA accession: 431469,Organism|Plantae|Viridiplantae|Streptophyta|Embryophyta|Tracheophyta|Spermatophytina|Magnoliopsida|Rosanae|Brassicales|Brassicaceae|Raphanus,Plantae,Tracheophyta,Magnoliopsida,Brassicales,Brassicaceae,Raphanus sativus,29702,L.,Raphanus,,sativus,,,Species,Gary D. Wallace,1981-11,,,,,,F. R. Fosberg,,S4663,4/16/31,,1931,4,16,106,,,,Upper Sonoran zone.,,Canyon floor.,,,,,,,,,flowers & fruits,Introduced,,,,,herbarium sheet,,,,,,United States,California,Los Angeles,,"Eagles Nest, Middle Ranch Canyon, Santa Catalina Island.",,0,,,,,,,,,,,180,,,,,590ft.,,,Jackie C. McConnaughy; cataloged date: 2012-04-13,6d621969-f2e3-4ebb-b5d3-efb52d8e6416,17,ccac5721-6cc7-4150-8a24-61a3f7e3a8fe,https://www.cch2.org/portal/collections/individual/index.php?occid=942849
971402,RSA,RSA,,PreservedSpecimen,7ae25f02-4d99-42c7-926a-e4f593419fe5,,RSA accession: 431484,Organism|Plantae|Viridiplantae|Streptophyta|Embryophyta|Tracheophyta|Spermatophytina|Magnoliopsida|Rosanae|Brassicales|Brassicaceae|Raphanus,Plantae,Tracheophyta,Magnoliopsida,Brassicales,Brassicaceae,Raphanus sativus,29702,L.,Raphanus,,sativus,,,Species,,,,,,,,Adele G. Axtman,,s.n.,7/5/31,,1931,7,5,186,,,,,,,,,,,,,,,flowers & fruits,Cultivated,,,,,herbarium sheet,,,,,,United States,California,Los Angeles,,Alhambra,,0,,,,,,,,,,,,,,,,,,,T. Kim Nguyen; cataloged date: 2007-09-19,7ae25f02-4d99-42c7-926a-e4f593419fe5,17,aeffd786-f37e-4e2f-8888-008672113fd0,https://www.cch2.org/portal/collections/individual/index.php?occid=971402
1006340,RSA,RSA,,PreservedSpecimen,8b6b3ffb-2c09-4bb2-b441-82ea9351a291,,RSA accession: 431507,Organism|Plantae|Viridiplantae|Streptophyta|Embryophyta|Tracheophyta|Spermatophytina|Magnoliopsida|Rosanae|Brassicales|Brassicaceae|Raphanus,Plantae,Tracheophyta,Magnoliopsida,Brassicales,Brassicaceae,Raphanus sativus,29702,L.,Raphanus,,sativus,,,Species,,,,,,,,Ralph Hoffmann,,s.n.,4/10/31,,1931,4,10,100,,,,,,,,,,,,,,,flowers & fruits,Cultivated,,,,,herbarium sheet,,,,,,United States,California,Santa Barbara,,Santa Cruz Island. Main Ranch.,,0,,,,,,,,,,,,,,,,,,,T. Kim Nguyen; cataloged date: 2007-09-21,8b6b3ffb-2c09-4bb2-b441-82ea9351a291,17,18b8eced-7b3d-4451-80f9-42617b100d35,https://www.cch2.org/portal/collections/individual/index.php?occid=1006340
1050131,RSA,RSA,,PreservedSpecimen,a0521cfe-b137-4d43-8f1d-8e36968b5d82,,RSA accession: 431483,Organism|Plantae|Viridiplantae|Streptophyta|Embryophyta|Tracheophyta|Spermatophytina|Magnoliopsida|Rosanae|Brassicales|Brassicaceae|Raphanus,Plantae,Tracheophyta,Magnoliopsida,Brassicales,Brassicaceae,Raphanus sativus,29702,L.,Raphanus,,sativus,,,Species,,,,,,,,Alva Watry,,s.n.,8/6/31,,1931,8,6,218,,,,,,,,,,,,,,,flowers & fruits,Cultivated,,,,,herbarium sheet,,,,,,United States,California,Los Angeles,,Santa Monica.,,0,,,,,,,,,,,,,,,,,,,T. Kim Nguyen; cataloged date: 2007-09-19,a0521cfe-b137-4d43-8f1d-8e36968b5d82,17,d02a2c95-462d-4096-8472-3489541b63c8,https://www.cch2.org/portal/collections/individual/index.php?occid=1050131
1143640,RSA,RSA,,PreservedSpecimen,cd13550b-4174-41e6-945e-9c213eecd567,,RSA accession: 608062,Organism|Plantae|Viridiplantae|Streptophyta|Embryophyta|Tracheophyta|Spermatophytina|Magnoliopsida|Rosanae|Brassicales|Brassicaceae|Raphanus,Plantae,Tracheophyta,Magnoliopsida,Brassicales,Brassicaceae,Raphanus sativus,29702,L.,Raphanus,,sativus,,,Species,,,,,,,,L. C. Wheeler,,s.n.,2/15/31,,1931,2,15,46,,,,,,Wild Radish.,,,,,,,,,,Introduced,,,,,herbarium sheet,,,,,,United States,California,Los Angeles,,Pomona.,,0,,,,,,,,,,,,,,,,,,,cataloged date: 1998-01-27,cd13550b-4174-41e6-945e-9c213eecd567,17,4466fbc5-5055-4090-a799-38b6d75cc173,https://www.cch2.org/portal/collections/individual/index.php?occid=1143640
2197161,DAV,,,PreservedSpecimen,65ed111c-8b1f-4dac-880f-e1f66b838941,DAV310433,Accession #: DAV212246,Organism|Plantae|Viridiplantae|Streptophyta|Embryophyta|Tracheophyta|Spermatophytina|Magnoliopsida|Rosanae|Brassicales|Brassicaceae|Raphanus,Plantae,Tracheophyta,Magnoliopsida,Brassicales,Brassicaceae,Raphanus sativus,29702,L.,Raphanus,,sativus,,,Species,,,,,,,,Nellie Coffey,,s.n.,4/3/31,,1931,4,3,93,,3-Apr-31,,,,,,,,,,,,,,,,,,,,,,,,,United States,California,Solano,,Vallejo.,,0,,38.098333,-122.253889,,,,,,,,,,,,,,,,tcbarry,,39,65ed111c-8b1f-4dac-880f-e1f66b838941,https://www.cch2.org/portal/collections/individual/index.php?occid=2197161
3272683,UCJEPS,VASC,,PreservedSpecimen,e606d525-a82a-4b38-998d-36e5cb4b1444,UC520022,,Organism|Plantae|Viridiplantae|Streptophyta|Embryophyta|Tracheophyta|Spermatophytina|Magnoliopsida|Rosanae|Brassicales|Brassicaceae|Raphanus,Plantae,Tracheophyta,Magnoliopsida,Brassicales,Brassicaceae,Raphanus raphanistrum,29701,L.,Raphanus,,raphanistrum,,,Species,,,,,,,,Joseph A. Ewan,,7428,4/30/32,,1932,4,30,121,,Apr 30 1932,,on grassy hillside above creek; Upper Sonoran Zone,,,,,,,,herbariumSpecimenDuplicate: https://www.cch2.org/portal/collections/individual/index.php?guid=fa0f8c7f-7101-49d2-b735-22c2b71071a1,,,Flowering/Fruiting,,,,,,,,,,,,United States,California,Los Angeles,,above Balllona Creek (Baldwin Hills); Baldwin Hills,,0,,,,,,,,,,,,,,,,,,,,e606d525-a82a-4b38-998d-36e5cb4b1444,46,6fa3137f-8e62-4595-b0c8-d8250ec38682,https://www.cch2.org/portal/collections/individual/index.php?occid=3272683
3904069,LA,,,PreservedSpecimen,fa0f8c7f-7101-49d2-b735-22c2b71071a1,LA00606050,LA214076,Organism|Plantae|Viridiplantae|Streptophyta|Embryophyta|Tracheophyta|Spermatophytina|Magnoliopsida|Rosanae|Brassicales|Brassicaceae|Raphanus,Plantae,Tracheophyta,Magnoliopsida,Brassicales,Brassicaceae,Raphanus raphanistrum,29701,L.,Raphanus,,raphanistrum,,,Species,,,,,,,,Joseph Andorfer Ewan,,7428,4/30/32,,1932,4,30,121,,30-Apr-32,,,,,,,,,,herbariumSpecimenDuplicate: https://www.cch2.org/portal/collections/individual/index.php?guid=e606d525-a82a-4b38-998d-36e5cb4b1444,,,,,,,,,,,,,,,United States,California,Los Angeles,,"Above Ballona Creek, Baldwin Hills",,0,,,,,,,,,,,,,,,,,,,abaniaga,,34,fa0f8c7f-7101-49d2-b735-22c2b71071a1,https://www.cch2.org/portal/collections/individual/index.php?occid=3904069
65108,SBBG,,,PreservedSpecimen,413d9102-9034-4987-a427-d5c39cd7aa10,SBBG155527,SBBG_old: 77985,Organism|Plantae|Viridiplantae|Streptophyta|Embryophyta|Tracheophyta|Spermatophytina|Magnoliopsida|Rosanae|Brassicales|Brassicaceae|Raphanus,Plantae,Tracheophyta,Magnoliopsida,Brassicales,Brassicaceae,Raphanus sativus,29702,L.,Raphanus,,sativus,,,Species,,,,,,,,Ralph Hoffmann,,,5/10/32,,1932,5,10,131,,5/10/32,few plants,,,,,,,,,,,,Flowers Present; Fruit Present,,,,,,,,,,,,United States,California,Santa Barbara,,Santa Rosa Island: Mesa W of ranch,,0,,34.0059,-120.0582,NAD83,1000,Rancho Santa Ana (no. 8),,MyTopo,,georef from 2006-2015 archive backup file; Date Georeferenced: Mon Dec 26 13:37:13 2011,,,,,,,,,LucieG,,16,fd57e532-bdc6-4557-9114-81792e0bd6dc,https://www.cch2.org/portal/collections/individual/index.php?occid=65108
468994,SD,,,PreservedSpecimen,05934E36-8381-498B-B34C-E754E43B0DE5,SD00062794,SD39744,Organism|Plantae|Viridiplantae|Streptophyta|Embryophyta|Tracheophyta|Spermatophytina|Magnoliopsida|Rosanae|Brassicales|Brassicaceae|Raphanus,Plantae,Tracheophyta,Magnoliopsida,Brassicales,Brassicaceae,Raphanus sativus,29702,L.,Raphanus,,sativus,,,Species,,,,,,,,Edith A. Purer,,4742,8/25/32,,1932,8,25,238,,8/25/32,,Sand dunes.,,,,,,,,,,,FFL,,,,,,,,,,,,United States,California,Santa Barbara,,Northwest Guadalupe.,,0,,34.96896,-120.58147,WGS84,,n/a,,Coordinates from label,,n/a,,,,,,unknownft.,,,,SD39744,43,5955d834-8703-46dc-bde5-5000cbf8deb0,https://www.cch2.org/portal/collections/individual/index.php?occid=468994
468995,SD,,,PreservedSpecimen,5A4C85CC-0598-47F3-B440-445FAA33ADEF,SD00062714,SD39746,Organism|Plantae|Viridiplantae|Streptophyta|Embryophyta|Tracheophyta|Spermatophytina|Magnoliopsida|Rosanae|Brassicales|Brassicaceae|Raphanus,Plantae,Tracheophyta,Magnoliopsida,Brassicales,Brassicaceae,Raphanus sativus,29702,L.,Raphanus,,sativus,,,Species,,,,,,,,Edith A. Purer,,s.n.,3/15/32,,1932,3,15,75,,3/15/32,,,,,,,,,,,,,FFL,,,,,,,,,,,,United States,California,San Diego,,"Silver Strand,along roadside.",,0,,32.64633,-117.15096,WGS84,4023,mak,,"TOPO! v3.4.2, San Diego County Place Names A to Z by Fetzer",,,,,,,,unknownft.,,,,SD39746,43,00d0ea3d-b5c1-4fec-9396-a56ce895478c,https://www.cch2.org/portal/collections/individual/index.php?occid=468995
468997,SD,,,PreservedSpecimen,53850F9D-0918-4238-8D98-AE913D97DE8B,SD00062792,SD39748,Organism|Plantae|Viridiplantae|Streptophyta|Embryophyta|Tracheophyta|Spermatophytina|Magnoliopsida|Rosanae|Brassicales|Brassicaceae|Raphanus,Plantae,Tracheophyta,Magnoliopsida,Brassicales,Brassicaceae,Raphanus sativus,29702,L.,Raphanus,,sativus,,,Species,,,,,,,,Edith A. Purer,,3810,7/15/32,,1932,7,15,197,,7/15/32,,"Sand dunes, stabilized.",,,,,,,,,,,FFL,,,,,,,,,,,,United States,California,Monterey,,Del Monte,,0,,36.60643,-121.86748,WGS84,,n/a,,Coordinates from label,,n/a,,,,,,unknownft.,,,,SD39748,43,9fcf02df-3576-42c3-af11-441a26a85828,https://www.cch2.org/portal/collections/individual/index.php?occid=468997
468998,SD,,,PreservedSpecimen,FA3A913F-296C-462A-B433-1ECB93EBE2DA,SD00062791,SD39749,Organism|Plantae|Viridiplantae|Streptophyta|Embryophyta|Tracheophyta|Spermatophytina|Magnoliopsida|Rosanae|Brassicales|Brassicaceae|Raphanus,Plantae,Tracheophyta,Magnoliopsida,Brassicales,Brassicaceae,Raphanus sativus,29702,L.,Raphanus,,sativus,,,Species,,,,,,,,Edith A. Purer,,4103,7/25/32,,1932,7,25,207,,7/25/32,,Sand dunes.,,,,,,,,,,,FFL,,,,,,,,,,,,United States,California,Mendocino,,"Near mouth of Big River, south of Mendocino.",,0,,39.3021,-123.7927,WGS84,,n/a,,Coordinates from label,,n/a,,,,,,unknownft.,,,,SD39749,43,96b647a2-bb88-4024-bd72-55a6ba5ae120,https://www.cch2.org/portal/collections/individual/index.php?occid=468998
884140,RSA,POM,,PreservedSpecimen,54ac00a4-4ee8-45f6-ad9a-d42f93c09425,,POM accession: 273399,Organism|Plantae|Viridiplantae|Streptophyta|Embryophyta|Tracheophyta|Spermatophytina|Magnoliopsida|Rosanae|Brassicales|Brassicaceae|Raphanus,Plantae,Tracheophyta,Magnoliopsida,Brassicales,Brassicaceae,Raphanus sativus,29702,L.,Raphanus,,sativus,,,Species,,,,,,,,Lyman Benson,,3160,3/26/32,,1932,3,26,86,,,,"Upper Sonoran Zone, South slope, heavy soil.",,Rolling hills.,,,,,,,,,flowers,Introduced,,,,,herbarium sheet,,,,,,United States,California,Riverside,,3 miles N [of] Temecula.,,0,,33.5368,-117.1719,WGS84,1600,,,BerkeleyMapper,,1/4-1 section (appx. 400-1600 M); 1/4-1 section (appx. 400-1600 M),457,,,,,1500ft.,,,Jackie C. McConnaughy; cataloged date: 2012-04-13,54ac00a4-4ee8-45f6-ad9a-d42f93c09425,17,df9d87c7-f588-44a7-b6de-b47328cb0569,https://www.cch2.org/portal/collections/individual/index.php?occid=884140
936997,RSA,RSA,,PreservedSpecimen,6a96c27c-b83b-4ae0-ac47-30c4c1cf2bba,,RSA accession: 38940,Organism|Plantae|Viridiplantae|Streptophyta|Embryophyta|Tracheophyta|Spermatophytina|Magnoliopsida|Rosanae|Brassicales|Brassicaceae|Raphanus,Plantae,Tracheophyta,Magnoliopsida,Brassicales,Brassicaceae,Raphanus sativus,29702,L.,Raphanus,,sativus,,,Species,,,,,,,,E. A. Purer,,2447,2/10/32,,1932,2,10,41,,,,sandy areas,,,,,,,,,,,flowers & fruits,Cultivated,,,,,herbarium sheet,,,,,,United States,California,San Diego,,"Silver Strand, San Diego Co.",,0,,,,,,,,,,,,,,,,,,,T. Kim Nguyen; cataloged date: 2007-09-21,6a96c27c-b83b-4ae0-ac47-30c4c1cf2bba,17,86cf7625-244d-4e78-9f24-e166bf15bab2,https://www.cch2.org/portal/collections/individual/index.php?occid=936997
997281,RSA,RSA,,PreservedSpecimen,871ee658-2f8e-4c8e-aa54-5dc9b702f9fb,,RSA accession: 431485,Organism|Plantae|Viridiplantae|Streptophyta|Embryophyta|Tracheophyta|Spermatophytina|Magnoliopsida|Rosanae|Brassicales|Brassicaceae|Raphanus,Plantae,Tracheophyta,Magnoliopsida,Brassicales,Brassicaceae,Raphanus sativus,29702,L.,Raphanus,,sativus,,,Species,,,,,,,,Jack Rempel,,15268,3/27/32,,1932,3,27,87,,,,"Sand Dunes, protected hollow.",,Flowers purple,,,,,,,,,flowers & fruits,Cultivated,,,,,herbarium sheet,,,,,,United States,California,Los Angeles,,El Segundo.,,0,,,,,,,,,,,,,,,,,,,T. Kim Nguyen; cataloged date: 2007-09-21,871ee658-2f8e-4c8e-aa54-5dc9b702f9fb,17,c0f00465-5109-4b6f-bd48-c5f436a86584,https://www.cch2.org/portal/collections/individual/index.php?occid=997281
1045591,RSA,RSA,,PreservedSpecimen,9e399ba2-8b7d-4578-98e7-19e0e07048d3,,RSA accession: 431489,Organism|Plantae|Viridiplantae|Streptophyta|Embryophyta|Tracheophyta|Spermatophytina|Magnoliopsida|Rosanae|Brassicales|Brassicaceae|Raphanus,Plantae,Tracheophyta,Magnoliopsida,Brassicales,Brassicaceae,Raphanus sativus,29702,L.,Raphanus,,sativus,,,Species,,,,,,,,Helen J. Houck,,s.n.,3/27/32,,1932,3,27,87,,,Could be filed under L.A. Co.,,,,,,,,,,,,flowers & fruits,Cultivated,,,,,herbarium sheet,,,,,,United States,California,Orange,,"Carbon Canyon, Sunny Hill, [Los Angeles County?]",,0,,,,,,,,,,,,,,,,,,,T. Kim Nguyen; cataloged date: 2007-09-21,9e399ba2-8b7d-4578-98e7-19e0e07048d3,17,2912de10-2188-47cd-8a33-d902ea3053d0,https://www.cch2.org/portal/collections/individual/index.php?occid=1045591
1110606,RSA,RSA,,PreservedSpecimen,bd401263-b514-4f28-886b-e7b1b1bdbf62,,RSA accession: 4790,Organism|Plantae|Viridiplantae|Streptophyta|Embryophyta|Tracheophyta|Spermatophytina|Magnoliopsida|Rosanae|Brassicales|Brassicaceae|Raphanus,Plantae,Tracheophyta,Magnoliopsida,Brassicales,Brassicaceae,Raphanus sativus,29702,L.,Raphanus,,sativus,,,Species,,,,,,,,James Snow,,s.n.,1932-00-00,,1932,0,0,,,Spring 1932,"Error in location data: T,S,R and quarter do not match info in location field.",,,,,,,,,,,,flowers & fruits,Cultivated,,,,,herbarium sheet,,,,,,United States,California,Los Angeles,,"Bryant Ranch, near Long Beach, SE/4 Section 27, T4S, R11W Station no.3. Plat. 3.",,0,,33.7930556,-118.0244444,,,,,,,,,,,,,,,,T. Kim Nguyen; cataloged date: 2007-09-21,bd401263-b514-4f28-886b-e7b1b1bdbf62,17,e9fa318d-997e-403e-b6e7-d1c818debaca,https://www.cch2.org/portal/collections/individual/index.php?occid=1110606
1205092,RSA,RSA,,PreservedSpecimen,ea7e4681-e4db-4f62-9544-c5a397178cf7,,RSA accession: 431481,Organism|Plantae|Viridiplantae|Streptophyta|Embryophyta|Tracheophyta|Spermatophytina|Magnoliopsida|Rosanae|Brassicales|Brassicaceae|Raphanus,Plantae,Tracheophyta,Magnoliopsida,Brassicales,Brassicaceae,Raphanus sativus,29702,L.,Raphanus,,sativus,,,Species,,,,,,,,L. C. Wheeler,,433,1/8/32,,1932,1,8,8,,,,light soil,,,,,,,,herbariumSpecimenDuplicate: https://www.cch2.org/portal/collections/individual/index.php?guid=urn:catalog:CAS:BOT-BC:74280 | herbariumSpecimenDuplicate: https://www.cch2.org/portal/collections/individual/index.php?guid=e78beafd-5cf4-4f8d-9ea3-57e3ff73c450 | herbariumSpecimenDuplicate: https://www.cch2.org/portal/collections/individual/index.php?guid=6a3a33be-d142-4c6e-8d4a-53e3a5aafde6,,,flowers & fruits,Cultivated,,,,,herbarium sheet,,,,,,United States,California,Los Angeles,,2 mi. SW Glendora.,,0,,,,,,,,,,,198,,,,,650ft.,,,T. Kim Nguyen; cataloged date: 2007-09-19,ea7e4681-e4db-4f62-9544-c5a397178cf7,17,4daf3f90-f892-490a-bb6f-e896f3a01d30,https://www.cch2.org/portal/collections/individual/index.php?occid=1205092
1224957,RSA,RSA,,PreservedSpecimen,f3fa9f76-3cb3-4775-85ae-7893f359a0f9,,RSA accession: 5502,Organism|Plantae|Viridiplantae|Streptophyta|Embryophyta|Tracheophyta|Spermatophytina|Magnoliopsida|Rosanae|Brassicales|Brassicaceae|Raphanus,Plantae,Tracheophyta,Magnoliopsida,Brassicales,Brassicaceae,Raphanus sativus,29702,L.,Raphanus,,sativus,,,Species,,,,,,,,C. B. Wolf,,3757,6/28/32,,1932,6,28,180,,,,,,,,,,,,,,,flowers & fruits,Cultivated,,,,,herbarium sheet,,,,,,United States,California,Orange,,Bryant Ranch: along western half of north boundary of 40 acre Valencia orange grove at Bryant Ave. and Hansen Road.,,0,,,,,,,,,,,9,15,,,,30-50ft.,,,T. Kim Nguyen; cataloged date: 2007-09-21,f3fa9f76-3cb3-4775-85ae-7893f359a0f9,17,d34fb669-b116-48cf-9e1e-afe66286e7e0,https://www.cch2.org/portal/collections/individual/index.php?occid=1224957
1240026,RSA,POM,,PreservedSpecimen,fb1ad0ac-0916-4932-a921-fd42a633f707,,POM accession: 202603,Organism|Plantae|Viridiplantae|Streptophyta|Embryophyta|Tracheophyta|Spermatophytina|Magnoliopsida|Rosanae|Brassicales|Brassicaceae|Raphanus,Plantae,Tracheophyta,Magnoliopsida,Brassicales,Brassicaceae,Raphanus sativus,29702,L.,Raphanus,,sativus,,,Species,,,,,,,,L. M. Booth,,1017,5/12/32,,1932,5,12,133,,,,,,,,,,,,,,,flowers & fruits,Cultivated,,,,,herbarium sheet,,,,,,United States,California,Orange,,Newport Bay.,,0,,,,,,,,,,,,,,,,,,,T. Kim Nguyen; cataloged date: 2007-09-21,fb1ad0ac-0916-4932-a921-fd42a633f707,17,3dbc1ee5-1b90-4c1b-95d0-8ee186297210,https://www.cch2.org/portal/collections/individual/index.php?occid=1240026
1368001,DAV,,,PreservedSpecimen,UCD115176,DAV310417,Accession #: DAV2629,Organism|Plantae|Viridiplantae|Streptophyta|Embryophyta|Tracheophyta|Spermatophytina|Magnoliopsida|Rosanae|Brassicales|Brassicaceae|Raphanus,Plantae,Tracheophyta,Magnoliopsida,Brassicales,Brassicaceae,Raphanus sativus,29702,L.,Raphanus,,sativus,,,Species,,,,,,,,Bellue-Goodwin,,s.n.,6/10/32,,1932,6,10,162,,10-Jun-32,Access Database Number (Deprecated): UCD115176,,,Common name: wild radish.,,,,,,,,,,,,,,,,,,,,,United States,California,Sacramento,,Sacramento County.,,0,,38.50734,-121.30829,WGS84,44500,UCDavis A,,GoogleMaps via BerkeleyMapper,,Date Georeferenced: Mon Sep 30 12:53:38 2013,,,,,,,,,tcbarry,UCD115176,39,53c7b683-6e99-4828-91dd-b0566263c2e6,https://www.cch2.org/portal/collections/individual/index.php?occid=1368001
2361025,CAS,BOT-BC,,PreservedSpecimen,urn:catalog:CAS:BOT-BC:74229,74229,urn:catalog:CAS:BOT:217004,Organism|Plantae|Viridiplantae|Streptophyta|Embryophyta|Tracheophyta|Spermatophytina|Magnoliopsida|Rosanae|Brassicales|Brassicaceae|Raphanus,Plantae,Tracheophyta,Magnoliopsida,Brassicales,Brassicaceae,Raphanus sativus,29702,L.,Raphanus,,sativus,,,Species,Ihsan A. Al-Shehbaz,2010-01,,,,,,Bellue; Goodwin,,s.n.,7/1/32,,1932,7,1,183,,7/1/32,,,,,,,,,,,,,,,,,,,,,North America,,,,United States,California,Sacramento County,,Unspecified.,,0,,,,,,,,,,,,,,,,,,en,,urn:catalog:CAS:BOT-BC:74229,1,dc3ae814-0588-47a9-93fa-5f2f46811fc4,https://www.cch2.org/portal/collections/individual/index.php?occid=2361025
2384991,CAS,BOT-BC,,PreservedSpecimen,urn:catalog:CAS:BOT-BC:74230,74230,urn:catalog:CAS:DS:220624,Organism|Plantae|Viridiplantae|Streptophyta|Embryophyta|Tracheophyta|Spermatophytina|Magnoliopsida|Rosanae|Brassicales|Brassicaceae|Raphanus,Plantae,Tracheophyta,Magnoliopsida,Brassicales,Brassicaceae,Raphanus sativus,29702,L.,Raphanus,,sativus,,,Species,Ihsan A. Al-Shehbaz,2010-01,,,,,,Bellue; Goodwin,,s.n.,6/10/32,,1932,6,10,162,,6/10/32,,,,,,,,,,,,,,,,,,,,,North America,,,,United States,California,Sacramento County,,Unspecified.,,0,,,,,,,,,,,,,,,,,,en,,urn:catalog:CAS:BOT-BC:74230,1,b8221783-d11f-4c92-875c-e8c7c0f89e42,https://www.cch2.org/portal/collections/individual/index.php?occid=2384991
2440492,CAS,BOT-BC,,PreservedSpecimen,urn:catalog:CAS:BOT-BC:74279,74279,urn:catalog:CAS:DS:691244,Organism|Plantae|Viridiplantae|Streptophyta|Embryophyta|Tracheophyta|Spermatophytina|Magnoliopsida|Rosanae|Brassicales|Brassicaceae|Raphanus,Plantae,Tracheophyta,Magnoliopsida,Brassicales,Brassicaceae,Raphanus sativus,29702,L.,Raphanus,,sativus,,,Species,Ihsan A. Al-Shehbaz,2010-01,,,,,,"Wheeler, Louis C.",,513,3/25/32,,1932,3,25,85,,25-Mar-32,Flowers yellow.,Clay soil.,,,,,,,,herbariumSpecimenDuplicate: https://www.cch2.org/portal/collections/individual/index.php?guid=d5b6b40e-7ac8-4f60-bb0c-e854466aabcf,,,,,,,,,,,North America,,,,United States,California,Los Angeles County,,Pomona near Fairgrounds.,,0,,,,,,,,,,,274,,,,,900.0000000000 ft,,en,,urn:catalog:CAS:BOT-BC:74279,1,a49c7906-4c53-4946-b55f-f55926bcaca1,https://www.cch2.org/portal/collections/individual/index.php?occid=2440492
2449627,CAS,BOT-BC,,PreservedSpecimen,urn:catalog:CAS:BOT-BC:74280,74280,urn:catalog:CAS:DS:691245,Organism|Plantae|Viridiplantae|Streptophyta|Embryophyta|Tracheophyta|Spermatophytina|Magnoliopsida|Rosanae|Brassicales|Brassicaceae|Raphanus,Plantae,Tracheophyta,Magnoliopsida,Brassicales,Brassicaceae,Raphanus sativus,29702,L.,Raphanus,,sativus,,,Species,Ihsan A. Al-Shehbaz,2010-01,,,,,,"Wheeler, Louis C.",,433,1/8/32,,1932,1,8,8,,Jan. 8. 1932,Flowers yellow.,Light soil in Citrus grove.,,,,,,,,herbariumSpecimenDuplicate: https://www.cch2.org/portal/collections/individual/index.php?guid=ea7e4681-e4db-4f62-9544-c5a397178cf7 | herbariumSpecimenDuplicate: https://www.cch2.org/portal/collections/individual/index.php?guid=e78beafd-5cf4-4f8d-9ea3-57e3ff73c450 | herbariumSpecimenDuplicate: https://www.cch2.org/portal/collections/individual/index.php?guid=6a3a33be-d142-4c6e-8d4a-53e3a5aafde6,,,,,,,,,,,North America,,,,United States,California,Los Angeles County,,2 miles southwest of Glendora.,,0,,,,,,,,,,,198,,,,,650.0000000000 ft,,en,,urn:catalog:CAS:BOT-BC:74280,1,4e43563f-8a58-406a-9d12-80eeb80f7fb0,https://www.cch2.org/portal/collections/individual/index.php?occid=2449627
3224405,UCJEPS,VASC,,PreservedSpecimen,a8d9194c-25b2-4d9b-90e4-bcd9f465691b,UC589365,,Organism|Plantae|Viridiplantae|Streptophyta|Embryophyta|Tracheophyta|Spermatophytina|Magnoliopsida|Rosanae|Brassicales|Brassicaceae|Raphanus,Plantae,Tracheophyta,Magnoliopsida,Brassicales,Brassicaceae,Raphanus sativus,29702,L.,Raphanus,,sativus,,,Species,,,,,,,,Beryl O. Schreiber,,734,8/3/32,,1932,8,3,216,,Aug 3 1932,,sunny slope,,flowers rose-purple,,,,,,,,,Flowering/Fruiting,,,,,,,,,,,,United States,California,Marin,,"Tomales Bay, Avalis Beach Avalis Beach; Tomales Bay, Avalis Beach",,0,,38.23175,-122.98047,NAD27,818,,,Terrain Navigator 5.03 USGS 1:24000,,,,,,,,,,,,a8d9194c-25b2-4d9b-90e4-bcd9f465691b,46,95a506f1-8c14-42a1-809c-49d392f7304c,https://www.cch2.org/portal/collections/individual/index.php?occid=3224405
3358215,UCJEPS,VASC,,PreservedSpecimen,e78beafd-5cf4-4f8d-9ea3-57e3ff73c450,UC519997,,Organism|Plantae|Viridiplantae|Streptophyta|Embryophyta|Tracheophyta|Spermatophytina|Magnoliopsida|Rosanae|Brassicales|Brassicaceae|Raphanus,Plantae,Tracheophyta,Magnoliopsida,Brassicales,Brassicaceae,Raphanus sativus,29702,L.,Raphanus,,sativus,,,Species,,,,,,,,Louis C. Wheeler,,433,1/8/32,,1932,1,8,8,,Jan 8 1932,,light soil in Citrus grove,,fls yellow,,,,,,herbariumSpecimenDuplicate: https://www.cch2.org/portal/collections/individual/index.php?guid=ea7e4681-e4db-4f62-9544-c5a397178cf7 | herbariumSpecimenDuplicate: https://www.cch2.org/portal/collections/individual/index.php?guid=urn:catalog:CAS:BOT-BC:74280 | herbariumSpecimenDuplicate: https://www.cch2.org/portal/collections/individual/index.php?guid=6a3a33be-d142-4c6e-8d4a-53e3a5aafde6,,,Flowering/Fruiting,,,,,,,,,,,,United States,California,Los Angeles,,2 mi sw of Glendora,,0,,34.11558,-117.88912,,,,,,,,198,,,,,650 ft,,,,e78beafd-5cf4-4f8d-9ea3-57e3ff73c450,46,63846926-ac81-45d0-ae3f-b1ab0b77f24a,https://www.cch2.org/portal/collections/individual/index.php?occid=3358215
3904078,LA,,,PreservedSpecimen,d5b6b40e-7ac8-4f60-bb0c-e854466aabcf,LA00606059,,Organism|Plantae|Viridiplantae|Streptophyta|Embryophyta|Tracheophyta|Spermatophytina|Magnoliopsida|Rosanae|Brassicales|Brassicaceae|Raphanus,Plantae,Tracheophyta,Magnoliopsida,Brassicales,Brassicaceae,Raphanus sativus,29702,L.,Raphanus,,sativus,,,Species,Ihsan A. Al-Shehbaz,00:00.0,,,,,,"Wheeler, Louis C.",,513,1932-03-00,,1932,3,25,85,,25-Mar-32,Flowers yellow.,Clay soil.,,,,,,,,herbariumSpecimenDuplicate: https://www.cch2.org/portal/collections/individual/index.php?guid=urn:catalog:CAS:BOT-BC:74279,,,,,,,,,,,,,,,United States,California,Los Angeles County,,Pomona near Fairgrounds.,,0,,,,,,,,,,,274,274,,,,900 ft,,,abaniaga,,34,d5b6b40e-7ac8-4f60-bb0c-e854466aabcf,https://www.cch2.org/portal/collections/individual/index.php?occid=3904078
3904092,LA,,,PreservedSpecimen,6a3a33be-d142-4c6e-8d4a-53e3a5aafde6,LA00606072,,Organism|Plantae|Viridiplantae|Streptophyta|Embryophyta|Tracheophyta|Spermatophytina|Magnoliopsida|Rosanae|Brassicales|Brassicaceae|Raphanus,Plantae,Tracheophyta,Magnoliopsida,Brassicales,Brassicaceae,Raphanus sativus,29702,L.,Raphanus,,sativus,,,Species,,,,,,,,Louis C. Wheeler,,433,1/8/32,,1932,1,8,8,,,,,,,,,,,,herbariumSpecimenDuplicate: https://www.cch2.org/portal/collections/individual/index.php?guid=ea7e4681-e4db-4f62-9544-c5a397178cf7 | herbariumSpecimenDuplicate: https://www.cch2.org/portal/collections/individual/index.php?guid=urn:catalog:CAS:BOT-BC:74280 | herbariumSpecimenDuplicate: https://www.cch2.org/portal/collections/individual/index.php?guid=e78beafd-5cf4-4f8d-9ea3-57e3ff73c450,,,,,,,,,,,,,,,,,,,,,0,,34.11558,-117.88912,,,,,,,copied from duplicate; UC519997,,,,,,,,,abaniaga,,34,6a3a33be-d142-4c6e-8d4a-53e3a5aafde6,https://www.cch2.org/portal/collections/individual/index.php?occid=3904092
4095407,CDA,,,PreservedSpecimen,7f92ac1a-86a3-497c-b6ff-d57104a74c63,CDA-003831,,Organism|Plantae|Viridiplantae|Streptophyta|Embryophyta|Tracheophyta|Spermatophytina|Magnoliopsida|Rosanae|Brassicales|Brassicaceae|Raphanus,Plantae,Tracheophyta,Magnoliopsida,Brassicales,Brassicaceae,Raphanus sativus,29702,L.,Raphanus,,sativus,,,Species,,,,,,,,Margaret Bellue,Goodwin,,6/10/32,,1932,6,10,162,,6/10/32,,,,annual,,,,,,,,,Flowering,Wild: native/naturalized,0,,,,Standard sheet,,,,,,United States,California,Sacramento,,.,Wild radish.,0,,38.574947,-121.492255,WGS84,5000,gkw_11152021,,"BerkeleyMapper, CCH2, GoogleEarth",,"georef coords mapped to CDFA HQ, 1220 N Street Sacramento, placeholder for locality, updated 11152021",,,,,,,,,preprocessed,,50,7f92ac1a-86a3-497c-b6ff-d57104a74c63,https://www.cch2.org/portal/collections/individual/index.php?occid=4095407
4095417,CDA,,,PreservedSpecimen,51520712-53c4-4f1a-97eb-de33cdcb0343,,,Organism|Plantae|Viridiplantae|Streptophyta|Embryophyta|Tracheophyta|Spermatophytina|Magnoliopsida|Rosanae|Brassicales|Brassicaceae|Raphanus,Plantae,Tracheophyta,Magnoliopsida,Brassicales,Brassicaceae,Raphanus sativus,29702,L.,Raphanus,,sativus,,,Species,,,,,,,,M. K. Bellue and Goodwin,,s.n.,7/1/32,,1932,7,1,183,,7/1/32,Herbarium of the Fresno County Agricultural Commissioner.,,,annual,,,,,,,,,Flowering,Wild: native/naturalized,0,,,,Standard sheet,,,,,,United States,California,Sacramento,,.,,0,,38.574947,-121.492255,WGS84,5000,gkw_11152021,,"BerkeleyMapper, CCH2, GoogleEarth",,"georef coords mapped to CDFA HQ, 1220 N Street Sacramento, placeholder for locality, updated 11152021",,,,,,,,,,,50,51520712-53c4-4f1a-97eb-de33cdcb0343,https://www.cch2.org/portal/collections/individual/index.php?occid=4095417
468993,SD,,,PreservedSpecimen,389E2BA2-1CBD-4149-880D-2CFD1EC53076,SD00062793,SD39743,Organism|Plantae|Viridiplantae|Streptophyta|Embryophyta|Tracheophyta|Spermatophytina|Magnoliopsida|Rosanae|Brassicales|Brassicaceae|Raphanus,Plantae,Tracheophyta,Magnoliopsida,Brassicales,Brassicaceae,Raphanus sativus,29702,L.,Raphanus,,sativus,,,Species,,,,,,,,Edith A. Purer,,5488,8/15/33,,1933,8,15,227,,8/15/33,,Sand dunes.,,,,,,,,herbariumSpecimenDuplicate: https://www.cch2.org/portal/collections/individual/index.php?guid=62d9d3ce-6c1a-4ba1-8337-d487c640f28b,,,FFL,,,,,,,,,,,,United States,California,San Francisco,,"Sand dunes, near ocean, San Francisco.",,0,,37.7645,-122.5082,WGS84,,n/a,,Coordinates from label,,n/a,,,,,,unknownft.,,,,SD39743,43,595f0d03-36c3-42d2-ad57-06b463b6554f,https://www.cch2.org/portal/collections/individual/index.php?occid=468993
920878,RSA,RSA,,PreservedSpecimen,62d9d3ce-6c1a-4ba1-8337-d487c640f28b,,RSA accession: 431504,Organism|Plantae|Viridiplantae|Streptophyta|Embryophyta|Tracheophyta|Spermatophytina|Magnoliopsida|Rosanae|Brassicales|Brassicaceae|Raphanus,Plantae,Tracheophyta,Magnoliopsida,Brassicales,Brassicaceae,Raphanus sativus,29702,L.,Raphanus,,sativus,,,Species,,,,,,,,E. A. Purer,,5488,8/15/33,,1933,8,15,227,,,,Sand dunes near ocean.,,,,,,,,herbariumSpecimenDuplicate: https://www.cch2.org/portal/collections/individual/index.php?guid=389E2BA2-1CBD-4149-880D-2CFD1EC53076,,,flowers & fruits,Introduced,,,,,herbarium sheet,,,,,,United States,California,San Francisco,,San Francisco.,,0,,37.7645,-122.5082,WGS84,6000,San Jose S.U. A,,GoogleMaps via BerkeleyMapper (copied from POM203720),,Fri Nov 2 14:29:20 2012; georef from 2006-2015 archive backup file,,,,,,,,,Jackie C. McConnaughy; cataloged date: 2012-04-17,62d9d3ce-6c1a-4ba1-8337-d487c640f28b,17,c4df26c1-aeef-4f5a-85ce-055b567efa18,https://www.cch2.org/portal/collections/individual/index.php?occid=920878
983573,RSA,RSA,,PreservedSpecimen,80ad90be-d71e-41bb-a4f3-78f885d6a62e,,RSA accession: 431499,Organism|Plantae|Viridiplantae|Streptophyta|Embryophyta|Tracheophyta|Spermatophytina|Magnoliopsida|Rosanae|Brassicales|Brassicaceae|Raphanus,Plantae,Tracheophyta,Magnoliopsida,Brassicales,Brassicaceae,Raphanus sativus,29702,L.,Raphanus,,sativus,,,Species,,,,,,,,M. B. Dunkle,,3275,4/9/33,,1933,4,9,99,,,,grassy slope,,,,,,,,,,,flowers & fruits,Cultivated,,,,,herbarium sheet,,,,,,United States,California,Orange,,Dana Point,,0,,33.4605556,-117.7141667,,,,,,,,,,,,,,,,T. Kim Nguyen; cataloged date: 2007-09-21,80ad90be-d71e-41bb-a4f3-78f885d6a62e,17,5de434dd-255e-447b-97bb-104b3f1cc5c6,https://www.cch2.org/portal/collections/individual/index.php?occid=983573
1045951,RSA,RSA,,PreservedSpecimen,9e63285f-c91a-4ff8-97f7-fb3416fb3fac,,RSA accession: 431500,Organism|Plantae|Viridiplantae|Streptophyta|Embryophyta|Tracheophyta|Spermatophytina|Magnoliopsida|Rosanae|Brassicales|Brassicaceae|Raphanus,Plantae,Tracheophyta,Magnoliopsida,Brassicales,Brassicaceae,Raphanus sativus,29702,L.,Raphanus,,sativus,,,Species,,,,,,,,M. B. Dunkle,,3287,4/9/33,,1933,4,9,99,,,,Dry mesa by ocean.,,,,,,,,,,,flowers & fruits,Cultivated,,,,,herbarium sheet,,,,,,United States,California,Orange,,Dana Point.,,0,,,,,,,,,,,,,,,,,,,T. Kim Nguyen; cataloged date: 2007-09-21,9e63285f-c91a-4ff8-97f7-fb3416fb3fac,17,8e379bfa-362d-49aa-a2d8-fcc0941c0533,https://www.cch2.org/portal/collections/individual/index.php?occid=1045951
1109866,RSA,RSA,,PreservedSpecimen,bceb318c-79df-435a-b17b-93feb02c36d0,,RSA accession: 431495,Organism|Plantae|Viridiplantae|Streptophyta|Embryophyta|Tracheophyta|Spermatophytina|Magnoliopsida|Rosanae|Brassicales|Brassicaceae|Raphanus,Plantae,Tracheophyta,Magnoliopsida,Brassicales,Brassicaceae,Raphanus sativus,29702,L.,Raphanus,,sativus,,,Species,,,,,,,,F. C. Ball,,18265,4/12/33,,1933,4,12,102,,,,,,,,,,,,,,,flowers & fruits,Introduced,,,,,herbarium sheet,,,,,,United States,California,Amador,,Jackson.,,0,,,,,,,,,,,,,,,,,,,Jackie C. McConnaughy; cataloged date: 2012-04-13,bceb318c-79df-435a-b17b-93feb02c36d0,17,6f581af1-c8f9-4611-873b-a40cc985b76e,https://www.cch2.org/portal/collections/individual/index.php?occid=1109866
1175435,RSA,RSA,,PreservedSpecimen,dc4cf2e2-51be-4cd6-812e-3fa0bd07e651,,RSA accession: 603735,Organism|Plantae|Viridiplantae|Streptophyta|Embryophyta|Tracheophyta|Spermatophytina|Magnoliopsida|Rosanae|Brassicales|Brassicaceae|Raphanus,Plantae,Tracheophyta,Magnoliopsida,Brassicales,Brassicaceae,Raphanus sativus,29702,L.,Raphanus,,sativus,,,Species,,,,,,,,L. C. Wheeler,,2034,7/20/33,,1933,7,20,201,,,,Gravelly sunny creek bed.,,,,,,,,,,,flowers & fruits,Cultivated,,,,,herbarium sheet,,,,,,United States,California,San Bernardino,,"S. Fork Meadows, Santa Ana River San Bernardino Mts.",,0,,,,,,,,,,,2530,,,,,8300ft.,,,T. Kim Nguyen; cataloged date: 2007-09-21,dc4cf2e2-51be-4cd6-812e-3fa0bd07e651,17,07e5c07f-3ec9-44e5-98a7-553dcea3162a,https://www.cch2.org/portal/collections/individual/index.php?occid=1175435
1368035,DAV,,,PreservedSpecimen,1af93ab0-a770-4299-be1c-84df300fbd41,DAV310410,Accession #: DAV2630,Organism|Plantae|Viridiplantae|Streptophyta|Embryophyta|Tracheophyta|Spermatophytina|Magnoliopsida|Rosanae|Brassicales|Brassicaceae|Raphanus,Plantae,Tracheophyta,Magnoliopsida,Brassicales,Brassicaceae,Raphanus sativus,29702,L.,Raphanus,,sativus,,,Species,,,,,,,,R. N. Raynor,,s.n.,4/12/33,,1933,4,12,102,,12-Apr-33,Access Database Number (Deprecated): UCD115214,,,,,,,,,,,,,,,,,,,,,,,,United States,California,Alameda,,Alameda County: UC Berkeley campus.,,0,,,,,,,,,,,,,,,,,,,,UCD115214,39,1af93ab0-a770-4299-be1c-84df300fbd41,https://www.cch2.org/portal/collections/individual/index.php?occid=1368035
3492727,UCJEPS,VASC,,PreservedSpecimen,99083635-9188-400a-9386-5634a95d1775,UC521694,,Organism|Plantae|Viridiplantae|Streptophyta|Embryophyta|Tracheophyta|Spermatophytina|Magnoliopsida|Rosanae|Brassicales|Brassicaceae|Raphanus,Plantae,Tracheophyta,Magnoliopsida,Brassicales,Brassicaceae,Raphanus sativus,29702,L.,Raphanus,,sativus,,,Species,,,,,,,,Joseph A. Ewan,,7941,9/2/33,,1933,9,2,245,,Sep 2 1933,,forum of hard ground,,,,,,,,,,,Flowering/Fruiting,,,,,,,,,,,,United States,California,Alameda,,"Berkeley Hills, Strawberry Canyon Strawberry Canyon; Berkeley Hills, Strawberry Canyon",,0,,37.873528,-122.23781,NAD27,1120,,,Terrain Navigator 5.03 1:24000,,,,,,,,,,,,99083635-9188-400a-9386-5634a95d1775,46,d34da736-e51d-463a-a5b3-d6d7228524a1,https://www.cch2.org/portal/collections/individual/index.php?occid=3492727
3792171,FSC,,,PreservedSpecimen,f684103c-25a2-4702-985f-1f52b8e9b95b,FSC0010456,,Organism|Plantae|Viridiplantae|Streptophyta|Embryophyta|Tracheophyta|Spermatophytina|Magnoliopsida|Rosanae|Brassicales|Brassicaceae|Raphanus,Plantae,Tracheophyta,Magnoliopsida,Brassicales,Brassicaceae,Raphanus raphanistrum,29701,L.,Raphanus,,raphanistrum,,,Species,,,,,,,,A. Hawbecker,,443,4/24/34,,1934,4,24,114,,24-Apr-34,,,,,,,,,,,,,,,,,,,,,,,,,United States,California,Alameda,,"Berkeley campus, between Life Sciences Bld, & Mining Bldg.",,0,,,,,,,,,,,,,,,,,,en,pawanpreetgill5,,38,f684103c-25a2-4702-985f-1f52b8e9b95b,https://www.cch2.org/portal/collections/individual/index.php?occid=3792171
4310644,OSC,V,,PreservedSpecimen,{3B85B8DB-A6B3-498A-8A4B-ED91F49D85D4},OSC-V-023805,ORE11657,Organism|Plantae|Viridiplantae|Streptophyta|Embryophyta|Tracheophyta|Spermatophytina|Magnoliopsida|Rosanae|Brassicales|Brassicaceae|Raphanus,Plantae,Tracheophyta,Magnoliopsida,Brassicales,Brassicaceae,Raphanus raphanistrum,29701,L.,Raphanus,,raphanistrum,,,Species,"Ireland, O.",1934,,,,,,Orlin L. Ireland,,94,4/27/34,,1934,4,27,117,,4/27/34,,"Sandy soil, dry open place.",,,,,,,,,,,,wild collection,,,,,,,,,,,United States,Oregon,Lane,,"Near Willamette River, Eugene.",,0,,44.05095,-123.0669,,9656,[automated process-OregonFlora/OSU Herb],OregonFlora 1994-2020 methodology,"OrlookId: 76527, StateProvince: Oregon, County: Lane, LocName: Willamette River, Eugene",,,,,,,,,,,,4436541,81,c4ebafbf-bb1f-4c70-9f0d-b842d7bf3664,https://www.cch2.org/portal/collections/individual/index.php?occid=4310644
468990,SD,,,PreservedSpecimen,E2C5C974-4AD5-4B4B-8135-BD1C8E1D95B8,SD00062715,SD37952,Organism|Plantae|Viridiplantae|Streptophyta|Embryophyta|Tracheophyta|Spermatophytina|Magnoliopsida|Rosanae|Brassicales|Brassicaceae|Raphanus,Plantae,Tracheophyta,Magnoliopsida,Brassicales,Brassicaceae,Raphanus sativus,29702,L.,Raphanus,,sativus,,,Species,,,,,,,,Edith A. Purer,,5667,3/26/34,,1934,3,26,85,,3/26/34,,,,,,,,,,,,,FFL,,,,,,,,,,,,United States,California,San Diego,,Field near Jamul,,0,,32.71699,-116.87613,WGS84,3218,mak,,"TOPO! v3.4.2, GNIS",,,,,,,,unknownft.,,,,SD37952,43,c99be935-82f9-4f8c-b3cd-9dffe07b01c9,https://www.cch2.org/portal/collections/individual/index.php?occid=468990
710528,RSA,POM,,PreservedSpecimen,229048fa-8f5a-43f5-8527-d2132780210e,,POM accession: 273391,Organism|Plantae|Viridiplantae|Streptophyta|Embryophyta|Tracheophyta|Spermatophytina|Magnoliopsida|Rosanae|Brassicales|Brassicaceae|Raphanus,Plantae,Tracheophyta,Magnoliopsida,Brassicales,Brassicaceae,Raphanus sativus,29702,L.,Raphanus,,sativus,,,Species,,,,,,,,Arthur L. Cohen,,453,7/11/34,,1934,7,11,192,,,,"Lower Sonoran, silt soil.",,,,,,,,,,,flowers & fruits,Cultivated,,,,,herbarium sheet,,,,,,United States,California,San Diego,,San Diego Bay mudflats.,,0,,,,,,,,,,,0,,,,,,,,T. Kim Nguyen; cataloged date: 2007-09-21,229048fa-8f5a-43f5-8527-d2132780210e,17,5427ac6a-32a7-425d-945f-3d7d474118e1,https://www.cch2.org/portal/collections/individual/index.php?occid=710528
945473,RSA,RSA,,PreservedSpecimen,6ea29e0d-7798-431b-ad09-5c1e19d663e2,,RSA accession: 696067,Organism|Plantae|Viridiplantae|Streptophyta|Embryophyta|Tracheophyta|Spermatophytina|Magnoliopsida|Rosanae|Brassicales|Brassicaceae|Raphanus,Plantae,Tracheophyta,Magnoliopsida,Brassicales,Brassicaceae,Raphanus sativus,29702,L.,Raphanus,,sativus,,,Species,,,,,,,,Keith E. Hoffmaster,,s.n.,1934-03-00,,1934,3,0,,,1934-03,,Alluvial bench along creek,,wild radish.,,,,,,,,,,Introduced,,,,,herbarium sheet,,,,,,United States,California,San Diego,,San Onofre.,,0,,33.38047,-117.57051,WGS84,1609,Rancho Santa Ana: 2007-2009 CCH GBIF georeferencing grant,,CCH GBIF georeference,,Mon Dec 26 13:37:13 2011; georef from 2006-2015 archive backup file,,,,,,,,,Amber Maurice; cataloged date: 2004-08-25,6ea29e0d-7798-431b-ad09-5c1e19d663e2,17,0ee4baaa-99d9-414e-8185-7e257ad1f72d,https://www.cch2.org/portal/collections/individual/index.php?occid=945473
1114974,RSA,RSA,,PreservedSpecimen,bf5f09f0-dc1a-4802-9c8b-9f7a2ac55fe6,,RSA accession: 12397,Organism|Plantae|Viridiplantae|Streptophyta|Embryophyta|Tracheophyta|Spermatophytina|Magnoliopsida|Rosanae|Brassicales|Brassicaceae|Raphanus,Plantae,Tracheophyta,Magnoliopsida,Brassicales,Brassicaceae,Raphanus sativus,29702,L.,Raphanus,,sativus,,,Species,,,,,,,,C. B. Wolf,,5609,4/11/34,,1934,4,11,101,,,,,,Flowers purple some plants white,,,,,,,,,flowers & fruits,Cultivated,,,,,herbarium sheet,,,,,,United States,California,Los Angeles,,"Bryant Ranch, E of Long Beach on mesa. Alt 100ft NE of concrete mon. 1864.92ft. S of NW corner of section",,0,,,,,,,,,,,15,,,,,50ft.,,,T. Kim Nguyen; cataloged date: 2007-09-21,bf5f09f0-dc1a-4802-9c8b-9f7a2ac55fe6,17,297ba265-c5f8-491a-b121-c2ef88964ee8,https://www.cch2.org/portal/collections/individual/index.php?occid=1114974
3377055,UCJEPS,VASC,,PreservedSpecimen,f040735f-e7df-429e-a4a5-2df53062c514,JEPS53819,,Organism|Plantae|Viridiplantae|Streptophyta|Embryophyta|Tracheophyta|Spermatophytina|Magnoliopsida|Rosanae|Brassicales|Brassicaceae|Raphanus,Plantae,Tracheophyta,Magnoliopsida,Brassicales,Brassicaceae,Raphanus sativus,29702,L.,Raphanus,,sativus,,,Species,,,,,,,,Lincoln Constance,,707,5/27/34,,1934,5,27,147,,May 27 1934,,gravel bar of river,,,,,,,,,,,Flowering/Fruiting,,,,,,,,,,,,United States,California,Humboldt,,"South Fork Eel River, s end of Dyerville Bridge South Fork Eel River; Bull Creek Region, South Fork Eel River",,0,,40.35611,-123.92375,NAD27,1622,,,Terrain Navigator Pro,,,45,,,,,150 ft,,,,f040735f-e7df-429e-a4a5-2df53062c514,46,3bc4cc63-a15a-4e73-bf70-b8246dd39423,https://www.cch2.org/portal/collections/individual/index.php?occid=3377055
3379131,UCJEPS,VASC,,PreservedSpecimen,4767f851-0c9b-4f35-bbc3-eac23aee39d3,UC1126745,,Organism|Plantae|Viridiplantae|Streptophyta|Embryophyta|Tracheophyta|Spermatophytina|Magnoliopsida|Rosanae|Brassicales|Brassicaceae|Raphanus,Plantae,Tracheophyta,Magnoliopsida,Brassicales,Brassicaceae,Raphanus sativus,29702,L.,Raphanus,,sativus,,,Species,,,,,,,,G. E. Sindel,,21,3/12/34,,1934,3,12,71,,Mar 12 1934,"Coordinates continue ""Quadrangle Hayward",,,,,,,,,,,,Flowering/Fruiting,,,,,,,,,,,,United States,California,Alameda,,1/2 mi n extreme e end of Lake Chabot,,0,,37.736881,-122.09288,NAD27,1200,,,Geolocate,,,137,,,,,450 ft,,,,4767f851-0c9b-4f35-bbc3-eac23aee39d3,46,730dca0c-7422-408c-8a13-7e26ac3d5baf,https://www.cch2.org/portal/collections/individual/index.php?occid=3379131
3417594,UCJEPS,VASC,,PreservedSpecimen,e01183ab-d89e-4ac6-a996-c5be5122a368,UC1614555,,Organism|Plantae|Viridiplantae|Streptophyta|Embryophyta|Tracheophyta|Spermatophytina|Magnoliopsida|Rosanae|Brassicales|Brassicaceae|Raphanus,Plantae,Tracheophyta,Magnoliopsida,Brassicales,Brassicaceae,Raphanus sativus,29702,L.,Raphanus,,sativus,,,Species,,,,,,,,Charles M. Belshaw,,170,9/18/34,,1934,9,18,261,,Sep 18 1934,,dry grass slope; refilled ground,,,,,,,,,,,Flowering/Fruiting,,,,,,,,,,,,United States,California,Alameda,,refilled ground 100 yds. e. of U.C. stadium on Strawberry rd. Berkeley,,0,,37.876453,-122.23793,NAD27,1254,,,Terrain Navigator 5.03 1:24000,,,30,,,,,100 ft,,,,e01183ab-d89e-4ac6-a996-c5be5122a368,46,3a4b8c4f-bdf1-4cdb-8a33-e1a6f37b7aa5,https://www.cch2.org/portal/collections/individual/index.php?occid=3417594
3550026,UCJEPS,VASC,,PreservedSpecimen,839fceb0-676a-4289-a302-3623a22cf34e,UC1126746,,Organism|Plantae|Viridiplantae|Streptophyta|Embryophyta|Tracheophyta|Spermatophytina|Magnoliopsida|Rosanae|Brassicales|Brassicaceae|Raphanus,Plantae,Tracheophyta,Magnoliopsida,Brassicales,Brassicaceae,Raphanus sativus,29702,L.,Raphanus,,sativus,,,Species,,,,,,,,G. E. Sindel,,18,3/12/34,,1934,3,12,71,,Mar 12 1934,"Coordinates continue ""Quadrangle Hayward""; No Data in Packet",,,,,,,,,,,,Flowering/Fruiting,,,,,,,,,,,,United States,California,Alameda,,1/2 mi n of extreme e end of Lake Chabot,,0,,37.736881,-122.09288,NAD27,1200,,,Geolocate,,,137,,,,,450 ft,,,,839fceb0-676a-4289-a302-3623a22cf34e,46,5c581b8d-13a1-4186-a79f-4c01c34f0136,https://www.cch2.org/portal/collections/individual/index.php?occid=3550026
4326468,OSC,V,,PreservedSpecimen,{D8C3C45C-DA48-42EE-9E86-C71D093F771C},OSC-V-023818,ORE11656,Organism|Plantae|Viridiplantae|Streptophyta|Embryophyta|Tracheophyta|Spermatophytina|Magnoliopsida|Rosanae|Brassicales|Brassicaceae|Raphanus,Plantae,Tracheophyta,Magnoliopsida,Brassicales,Brassicaceae,Raphanus sativus,29702,L.,Raphanus,,sativus,,,Species,"Al-Shehbaz, I.",2016,,,,,,Orlin L. Ireland,,193,5/30/34,,1934,5,30,150,,5/30/34,,Open roadside.,,,,,,,,,,,,wild collection,,,,,,,,,,,United States,Oregon,Lane,,South of Junction City.,,0,,44.18298,-123.20156,,4828,Bernadette Jenkinson,OregonFlora 1994-2020 methodology,"OrlookId: 79456, StateProvince: Oregon, County: Lane, LocName: Junction City, S of",,,,,,,,,,,,4436310,81,107d79b8-6e45-465c-9fde-cdb391a54b48,https://www.cch2.org/portal/collections/individual/index.php?occid=4326468
2061482,CHSC,VascularPlants,,PreservedSpecimen,d448611d-bb36-4b00-a22d-65de55804496,CHSC000533,,Organism|Plantae|Viridiplantae|Streptophyta|Embryophyta|Tracheophyta|Spermatophytina|Magnoliopsida|Rosanae|Brassicales|Brassicaceae|Raphanus,Plantae,Tracheophyta,Magnoliopsida,Brassicales,Brassicaceae,Raphanus raphanistrum,29701,L.,Raphanus,,raphanistrum,,,Species,R.E. Preston,1/4/82,,,,,,V. Holt,,,3/27/35,,1935,3,27,86,,3/27/35,Vesta Holt label.,,,,,,,,,,,,,,,,,,,,,,,,United States,California,Butte,,"Sandy Gulch, Chico.",,0,,39.730278,-121.901111,NAD83,201,Bill Carlson,,,,,55,,,,,180ft.,,,,,44,d448611d-bb36-4b00-a22d-65de55804496,https://www.cch2.org/portal/collections/individual/index.php?occid=2061482
3262100,UCJEPS,VASC,,PreservedSpecimen,91655a99-9bca-4742-a477-50a6a64fc596,UC765025,,Organism|Plantae|Viridiplantae|Streptophyta|Embryophyta|Tracheophyta|Spermatophytina|Magnoliopsida|Rosanae|Brassicales|Brassicaceae|Raphanus,Plantae,Tracheophyta,Magnoliopsida,Brassicales,Brassicaceae,Raphanus raphanistrum,29701,L.,Raphanus,,raphanistrum,,,Species,,,,,,,,Robert F. Hoover,,195,1/10/35,,1935,1,10,10,,Jan 10 1935,,,,,,,,,,,,,Flowering/Fruiting,,,,,,,,,,,,United States,California,Stanislaus,,Modesto,,0,,37.63917,-120.99583,,,,,,,,,,,,,,,,,91655a99-9bca-4742-a477-50a6a64fc596,46,d823627d-0a82-459c-b85d-142d21ace249,https://www.cch2.org/portal/collections/individual/index.php?occid=3262100
3444193,UCJEPS,VASC,,PreservedSpecimen,458843b0-d68b-4b13-93ed-b00fbefa8d49,UC596419,,Organism|Plantae|Viridiplantae|Streptophyta|Embryophyta|Tracheophyta|Spermatophytina|Magnoliopsida|Rosanae|Brassicales|Brassicaceae|Raphanus,Plantae,Tracheophyta,Magnoliopsida,Brassicales,Brassicaceae,Raphanus raphanistrum,29701,L.,Raphanus,,raphanistrum,,,Species,,,,,,,,R. F. Hoover,,194,1/6/35,,1935,1,6,6,,Jan 6 1935,,,,,,,,,,,,,Flowering/Fruiting,,,,,,,,,,,,United States,California,Stanislaus,,Oakdale,,0,,37.76667,-120.84611,,,,,,,,,,,,,,,,,458843b0-d68b-4b13-93ed-b00fbefa8d49,46,fed9f286-9242-4c7a-b735-cce37b0cd47a,https://www.cch2.org/portal/collections/individual/index.php?occid=3444193
468964,SD,,,PreservedSpecimen,980AF41E-1E8A-4E52-A9A3-38169B3CADF5,SD00062718,SD10310,Organism|Plantae|Viridiplantae|Streptophyta|Embryophyta|Tracheophyta|Spermatophytina|Magnoliopsida|Rosanae|Brassicales|Brassicaceae|Raphanus,Plantae,Tracheophyta,Magnoliopsida,Brassicales,Brassicaceae,Raphanus sativus,29702,L.,Raphanus,,sativus,,,Species,,,,,,,,Frank F. Gander,,124-7,2/19/35,,1935,2,19,50,,2/19/35,,,,,,,,,,,,,FFL,,,,,,,,,,,,United States,California,San Diego,,"Mahogany Canyon, East San Diego.",,0,,32.76805,-117.09675,WGS84,1207,mak,,TOPO! v3.4.2,,"Same as current Fairmont Canyon, www.411kensington.org/kensington-history-content.html, www.pricecharities.com/_downloads/Chapter_1.pdf",,,,,,unknownft.,,,,SD10310,43,bcc55e79-4bd8-41c9-a342-db7d09d2e8c3,https://www.cch2.org/portal/collections/individual/index.php?occid=468964
468965,SD,,,PreservedSpecimen,37F886FA-2BD3-47F3-BED4-E742C8EC3C10,SD00062745,SD11593,Organism|Plantae|Viridiplantae|Streptophyta|Embryophyta|Tracheophyta|Spermatophytina|Magnoliopsida|Rosanae|Brassicales|Brassicaceae|Raphanus,Plantae,Tracheophyta,Magnoliopsida,Brassicales,Brassicaceae,Raphanus sativus,29702,L.,Raphanus,,sativus,,,Species,,,,,,,,Frank F. Gander,,221-32,6/15/35,,1935,6,15,166,,6/15/35,,,,,,,,,,,,,FFL,,,,,,,,,,,,United States,California,San Diego,,Ocean Beach,,0,,32.73946,-117.24245,WGS84,1609,mak,,TOPO! v3.4.2,,,,,,,,unknownft.,,,,SD11593,43,b846e9af-e978-474e-8e12-bfcba833287d,https://www.cch2.org/portal/collections/individual/index.php?occid=468965
468989,SD,,,PreservedSpecimen,F5C5170D-D5AC-48A5-B3A6-8862440B33B5,SD00062736,SD37951,Organism|Plantae|Viridiplantae|Streptophyta|Embryophyta|Tracheophyta|Spermatophytina|Magnoliopsida|Rosanae|Brassicales|Brassicaceae|Raphanus,Plantae,Tracheophyta,Magnoliopsida,Brassicales,Brassicaceae,Raphanus sativus,29702,L.,Raphanus,,sativus,,,Species,,,,,,,,Edith A. Purer,,6089,3/29/35,,1935,3,29,88,,3/29/35,,,,,,,,,,herbariumSpecimenDuplicate: https://www.cch2.org/portal/collections/individual/index.php?guid=E34155D2-6192-4B90-8456-E99C6CD1B736,,,FFL,,,,,,,,,,,,United States,California,San Diego,,"Shady slope, Young's Caves Canyon, Mission Valley",,0,,32.77353,-117.09519,WGS84,241,mak,,TOPO! v3.4.2,,"Best guess, http://content-backend-a.cdlib.org/view?docId=kt6r29q3mg&chunk.id=c02-1.3.14.3.23",,,,,,unknownft.,,,,SD37951,43,f3cf1bb8-a04e-4c9f-976b-79bba4e9ec98,https://www.cch2.org/portal/collections/individual/index.php?occid=468989
468991,SD,,,PreservedSpecimen,79D12930-BDDF-4B48-9D74-3B60351844E2,SD00062716,SD37953,Organism|Plantae|Viridiplantae|Streptophyta|Embryophyta|Tracheophyta|Spermatophytina|Magnoliopsida|Rosanae|Brassicales|Brassicaceae|Raphanus,Plantae,Tracheophyta,Magnoliopsida,Brassicales,Brassicaceae,Raphanus sativus,29702,L.,Raphanus,,sativus,,,Species,,,,,,,,Edith A. Purer,,5942,2/15/35,,1935,2,15,46,,2/15/35,,,,,,,,,,,,,FFL,,,,,,,,,,,,United States,California,San Diego,,"Mesa, east of East San Diego",,0,,32.7693,-117.0824,WGS84,,n/a,,Coordinates from label,,Too vague,,,,,,unknownft.,,,,SD37953,43,647a1aea-bcf5-45d5-ae2c-2690dbbba67c,https://www.cch2.org/portal/collections/individual/index.php?occid=468991
468992,SD,,,PreservedSpecimen,8EB615A1-9AB9-44C7-BCA7-10EF97A677E6,SD00062717,SD37954,Organism|Plantae|Viridiplantae|Streptophyta|Embryophyta|Tracheophyta|Spermatophytina|Magnoliopsida|Rosanae|Brassicales|Brassicaceae|Raphanus,Plantae,Tracheophyta,Magnoliopsida,Brassicales,Brassicaceae,Raphanus sativus,29702,L.,Raphanus,,sativus,,,Species,,,,,,,,Edith A. Purer,,6071,3/25/35,,1935,3,25,84,,3/25/35,,,,,,,,,,,,,FFL,,,,,,,,,,,,United States,California,San Diego,,"Hillside, Mission Valley",,0,,32.77479,-117.13217,WGS84,6436,mak,,TOPO! v3.4.2,,,,,,,,unknownft.,,,,SD37954,43,62bdd6e2-fc1e-49e1-bb85-4ef444f873c9,https://www.cch2.org/portal/collections/individual/index.php?occid=468992
469026,SD,,,PreservedSpecimen,E34155D2-6192-4B90-8456-E99C6CD1B736,SD00062737,SD151742,Organism|Plantae|Viridiplantae|Streptophyta|Embryophyta|Tracheophyta|Spermatophytina|Magnoliopsida|Rosanae|Brassicales|Brassicaceae|Raphanus,Plantae,Tracheophyta,Magnoliopsida,Brassicales,Brassicaceae,Raphanus sativus,29702,L.,Raphanus,,sativus,,,Species,,,,,,,,Edith A. Purer,,6089,3/29/35,,1935,3,29,88,,3/29/35,,,,,,,,,,herbariumSpecimenDuplicate: https://www.cch2.org/portal/collections/individual/index.php?guid=F5C5170D-D5AC-48A5-B3A6-8862440B33B5,,,FFL,,,,,,,,,,,,United States,California,San Diego,,"Shady slope, Young's Caves Canyon, Mission Valley",,0,,32.77353,-117.09519,WGS84,241,mak,,TOPO! v3.4.2,,"Best guess, http://content-backend-a.cdlib.org/view?docId=kt6r29q3mg&chunk.id=c02-1.3.14.3.23",,,,,,unknownft.,,,,SD151742,43,be488377-3a8c-46f4-a9ed-8962e2bce64f,https://www.cch2.org/portal/collections/individual/index.php?occid=469026
957317,RSA,RSA,,PreservedSpecimen,74337e76-0d45-4ba7-a2ba-45df97793a96,,RSA accession: 431487,Organism|Plantae|Viridiplantae|Streptophyta|Embryophyta|Tracheophyta|Spermatophytina|Magnoliopsida|Rosanae|Brassicales|Brassicaceae|Raphanus,Plantae,Tracheophyta,Magnoliopsida,Brassicales,Brassicaceae,Raphanus sativus,29702,L.,Raphanus,,sativus,,,Species,,,,,,,,Robert M. Perkins,,s.n.,3/31/35,,1935,3,31,90,,,,East side of the sand dunes.,,,,,,,,,,,flowers & fruits,Cultivated,,,,,herbarium sheet,,,,,,United States,California,Los Angeles,,Playa del Rey.,,0,,,,,,,,,,,,,,,,,,,T. Kim Nguyen; cataloged date: 2007-09-19,74337e76-0d45-4ba7-a2ba-45df97793a96,17,3ec9a4ba-d4fc-46f4-aeca-3c6a2e963319,https://www.cch2.org/portal/collections/individual/index.php?occid=957317
1007750,RSA,RSA,,PreservedSpecimen,8c1caf03-a4b5-4d1f-a62d-bf260c218021,,RSA accession: 431488,Organism|Plantae|Viridiplantae|Streptophyta|Embryophyta|Tracheophyta|Spermatophytina|Magnoliopsida|Rosanae|Brassicales|Brassicaceae|Raphanus,Plantae,Tracheophyta,Magnoliopsida,Brassicales,Brassicaceae,Raphanus sativus,29702,L.,Raphanus,,sativus,,,Species,Orlando Misretta,2004-06,,,,,,Robert M. Perkins,,39,3/24/35,,1935,3,24,83,,,,,,Along the highway,,,,,,,,,flowers & fruits,Introduced,,,,,herbarium sheet,,,,,,United States,California,Los Angeles,,San Antonio Canyon.[San Gabriel Mountains],,0,,34.235923,-117.658744,WGS84,7000,Rancho Santa Ana (no. 6),,GoogleEarth (copied from LA205959),,Tue Apr 1 11:26:14 2014; georef from 2006-2015 archive backup file,,,,,,,,,Marisa Sripracha; cataloged date: 1997-06-17,8c1caf03-a4b5-4d1f-a62d-bf260c218021,17,57c6cf4d-c019-4a9b-9ab2-e19195741845,https://www.cch2.org/portal/collections/individual/index.php?occid=1007750
3306212,UCJEPS,VASC,,PreservedSpecimen,cf51f545-42ae-4d71-a77b-1c9e4aed6c04,UC1126752,,Organism|Plantae|Viridiplantae|Streptophyta|Embryophyta|Tracheophyta|Spermatophytina|Magnoliopsida|Rosanae|Brassicales|Brassicaceae|Raphanus,Plantae,Tracheophyta,Magnoliopsida,Brassicales,Brassicaceae,Raphanus sativus,29702,L.,Raphanus,,sativus,,,Species,,,,,,,,N. K. Carlson,,5,5/15/35,,1935,5,15,135,,May 15 1935,"Coordinates continue ""Quadrangle Santa Cruz""",grass; nw slope,,,,,,,,,,,Flowering/Fruiting,,,,,,,,,,,,United States,California,Santa Cruz,,3 mi n of Davenport,,0,,37.053168,-122.193533,NAD27,1400,,,Geolocate,,,304,,,,,1000 ft,,,,cf51f545-42ae-4d71-a77b-1c9e4aed6c04,46,3c2e1639-8be6-4bbd-a071-68e1e398685e,https://www.cch2.org/portal/collections/individual/index.php?occid=3306212
3335398,UCJEPS,VASC,,PreservedSpecimen,3634bd75-ee1c-4229-8241-13f7d4304adf,UC765016,,Organism|Plantae|Viridiplantae|Streptophyta|Embryophyta|Tracheophyta|Spermatophytina|Magnoliopsida|Rosanae|Brassicales|Brassicaceae|Raphanus,Plantae,Tracheophyta,Magnoliopsida,Brassicales,Brassicaceae,Raphanus sativus,29702,L.,Raphanus,,sativus,,,Species,,,,,,,,Robert F. Hoover,,223,2/8/35,,1935,2,8,39,,Feb 8 1935,,,,,,,,,,,,,Flowering/Fruiting,,,,,,,,,,,,United States,California,Stanislaus,,Modesto,,0,,37.63917,-120.99583,,,,,,,,,,,,,,,,,3634bd75-ee1c-4229-8241-13f7d4304adf,46,8444c5c4-5e56-4fbd-a95c-f69789090a7c,https://www.cch2.org/portal/collections/individual/index.php?occid=3335398
3366934,UCJEPS,VASC,,PreservedSpecimen,b2a0abde-d4ec-49a1-83a6-b18090e97f27,UC1126750,,Organism|Plantae|Viridiplantae|Streptophyta|Embryophyta|Tracheophyta|Spermatophytina|Magnoliopsida|Rosanae|Brassicales|Brassicaceae|Raphanus,Plantae,Tracheophyta,Magnoliopsida,Brassicales,Brassicaceae,Raphanus sativus,29702,L.,Raphanus,,sativus,,,Species,,,,,,,,F. W. Embree,,331,2/9/35,,1935,2,9,40,,Feb 9 1935,"Coordinates continue ""Quadrangle Santa Barbara""",flat,,,,,,,,,,,Flowering/Fruiting,,,,,,,,,,,,United States,California,Santa Barbara,,El Estero Swamp,,0,,34.4173,-119.5217,NAD27,805,,,trs2LL,,,22,,,,,75 ft,,,,b2a0abde-d4ec-49a1-83a6-b18090e97f27,46,ad7b85af-835e-4d00-8b3b-3d7309b596ba,https://www.cch2.org/portal/collections/individual/index.php?occid=3366934
3433650,UCJEPS,VASC,,PreservedSpecimen,65457557-67b8-4e2e-a88d-12686263152e,UC1126749,,Organism|Plantae|Viridiplantae|Streptophyta|Embryophyta|Tracheophyta|Spermatophytina|Magnoliopsida|Rosanae|Brassicales|Brassicaceae|Raphanus,Plantae,Tracheophyta,Magnoliopsida,Brassicales,Brassicaceae,Raphanus sativus,29702,L.,Raphanus,,sativus,,,Species,,,,,,,,R. C. Wilson,,200,4/29/35,,1935,4,29,119,120,Apr 30 1935,"Coordinates continue ""Quadrangle Santa Cruz""",grass; s slope,,,,,,,,,,,Flowering/Fruiting,,,,,,,,,,,,United States,California,Santa Cruz,,2 mi n of Table Rock,,0,,36.9975,-122.1356,WGS84,600,,,BerkeleyMapper,,,182,,,,,600 ft,,,,65457557-67b8-4e2e-a88d-12686263152e,46,46d2fa94-7644-4621-b15c-b1f1cd3c7761,https://www.cch2.org/portal/collections/individual/index.php?occid=3433650
3462399,UCJEPS,VASC,,PreservedSpecimen,68e6424d-6e78-455b-b035-6d0ff27e05af,JEPS54284,,Organism|Plantae|Viridiplantae|Streptophyta|Embryophyta|Tracheophyta|Spermatophytina|Magnoliopsida|Rosanae|Brassicales|Brassicaceae|Raphanus,Plantae,Tracheophyta,Magnoliopsida,Brassicales,Brassicaceae,Raphanus sativus,29702,L.,Raphanus,,sativus,,,Species,,,,,,,,Allison Krames,,,3/24/35,,1935,3,24,83,,Mar 24 1935,,,,,,,,,,,,,Flowering/Fruiting,,,,,,,,,,,,United States,California,Kern,,between Wasco and Famosa,,0,,35.601574,-119.273315,NAD27,6048,,,Terrain Navigator,,,,,,,,,,,,68e6424d-6e78-455b-b035-6d0ff27e05af,46,e371d9bf-0f38-4960-a795-98ea7d31e7b5,https://www.cch2.org/portal/collections/individual/index.php?occid=3462399
3525429,UCJEPS,VASC,,PreservedSpecimen,231277d3-4fc5-4229-aa8e-52534cc8f730,UC1126748,,Organism|Plantae|Viridiplantae|Streptophyta|Embryophyta|Tracheophyta|Spermatophytina|Magnoliopsida|Rosanae|Brassicales|Brassicaceae|Raphanus,Plantae,Tracheophyta,Magnoliopsida,Brassicales,Brassicaceae,Raphanus sativus,29702,L.,Raphanus,,sativus,,,Species,,,,,,,,F. W. Embree,,416,4/16/35,,1935,4,16,106,,Apr 16 1935,"Coordinates continue ""Quadrangle Goleta""","grass, s slope",,,,,,,,,,,Flowering/Fruiting,,,,,,,,,,,,United States,California,Santa Barbara,,1 1/2 mi n of Coromar (Santa Barbara National Forest); Santa Barbara National Forest,,0,,34.4463,-119.8536,NAD27,805,,,trs2LL,,,76,,,,,250 ft,,,,231277d3-4fc5-4229-aa8e-52534cc8f730,46,490fae58-a741-4b11-ac23-13cdaeef85d3,https://www.cch2.org/portal/collections/individual/index.php?occid=3525429
3562157,UCJEPS,VASC,,PreservedSpecimen,aebe5d86-e3fb-4bf8-8bea-3bae4080f3fa,UC1126747,,Organism|Plantae|Viridiplantae|Streptophyta|Embryophyta|Tracheophyta|Spermatophytina|Magnoliopsida|Rosanae|Brassicales|Brassicaceae|Raphanus,Plantae,Tracheophyta,Magnoliopsida,Brassicales,Brassicaceae,Raphanus sativus,29702,L.,Raphanus,,sativus,,,Species,,,,,,,,G. E. Sindel,,172,3/10/35,,1935,3,10,69,,Mar 10 1935,"Coordinates continue ""Quadrangle Guadalupe""","near cultivated area; grass, e slope",,,,,,,,herbariumSpecimenDuplicate: https://www.cch2.org/portal/collections/individual/index.php?guid=16904cb1-9fe1-4fa9-8139-a28156d79047 | herbariumSpecimenDuplicate: https://www.cch2.org/portal/collections/individual/index.php?guid=5a9f78d9-2fb5-439e-82e6-115dc29fafe2,,,Flowering/Fruiting,,,,,,,,,,,,United States,California,Santa Barbara,,1 mi s of Surf,,0,,34.6737,-120.5773,NAD27,805,,,trs2LL,,,30,,,,,100 ft,,,,aebe5d86-e3fb-4bf8-8bea-3bae4080f3fa,46,a0f439cd-f30b-4b94-99a6-010efa1b68de,https://www.cch2.org/portal/collections/individual/index.php?occid=3562157
3563575,UCJEPS,VASC,,PreservedSpecimen,b04e7dcc-5ffd-4197-96cc-28332e0586a2,UC1536931,,Organism|Plantae|Viridiplantae|Streptophyta|Embryophyta|Tracheophyta|Spermatophytina|Magnoliopsida|Rosanae|Brassicales|Brassicaceae|Raphanus,Plantae,Tracheophyta,Magnoliopsida,Brassicales,Brassicaceae,Raphanus sativus,29702,L.,Raphanus,,sativus,,,Species,,,,,,,,"Gordon H. True, Jr.",,129,3/18/35,,1935,3,18,77,,Mar 18 1935,,roadside,,,,,,,,,,,Flowering/Fruiting,,,,,,,,,,,,United States,California,Riverside,,Pigeon Pass,,0,,33.98,-117.28,NAD27,6000,,,RSA:2009,,,457,,,,,1500 ft,,,,b04e7dcc-5ffd-4197-96cc-28332e0586a2,46,d6ff437d-c22a-43ab-b94a-384ff7e2573c,https://www.cch2.org/portal/collections/individual/index.php?occid=3563575
4940224,US,,,PreservedSpecimen,http://n2t.net/ark:/65665/39fbe7973-81bb-434d-a7c2-39deaa971074,US 2000728,,Organism|Plantae|Viridiplantae|Streptophyta|Embryophyta|Tracheophyta|Spermatophytina|Magnoliopsida|Rosanae|Brassicales|Brassicaceae|Raphanus,Plantae,Tracheophyta,Magnoliopsida,Brassicales,Brassicaceae,Raphanus sativus,29702,L.,Raphanus,,sativus,,,Species,,,,,,,,R. F. Hoover,,223,2/8/35,,1935,2,8,39,39,2/8/35,,,,,,,,,,,,,,,,,,1,,,North America,,,,United States,California,,,"Modesto, Stanislaus County.",,0,,,,,,,,,,,,,,,,,,,,http://n2t.net/ark:/65665/39fbe7973-81bb-434d-a7c2-39deaa971074,91,90333701-4119-4626-89fb-0a4105f2e472,https://www.cch2.org/portal/collections/individual/index.php?occid=4940224
468969,SD,,,PreservedSpecimen,B133594A-099A-4B31-AED1-2E58D9316509,SD00062562,SD13266,Organism|Plantae|Viridiplantae|Streptophyta|Embryophyta|Tracheophyta|Spermatophytina|Magnoliopsida|Rosanae|Brassicales|Brassicaceae|Raphanus,Plantae,Tracheophyta,Magnoliopsida,Brassicales,Brassicaceae,Raphanus raphanistrum,29701,L.,Raphanus,,raphanistrum,,,Species,,,,,,,,Frank F. Gander,,520,1/28/36,,1936,1,28,28,,1/28/36,,,,,,,,,,herbariumSpecimenDuplicate: https://www.cch2.org/portal/collections/individual/index.php?guid=6B9FA299-388E-4F61-AE33-4670C3F339F6,,,FFL,,,,,,,,,,,,United States,California,San Diego,,Tiajuana River near Monument School.,,0,,32.55134,-117.08282,WGS84,402,mak,,TOPO! v3.4.2,,,,,,,,unknownft.,,,,SD13266,43,9b8a7629-e6bc-49b5-9e36-d817dfbf7f1c,https://www.cch2.org/portal/collections/individual/index.php?occid=468969
468972,SD,,,PreservedSpecimen,95CBD9B7-A7D1-4AD5-9539-A6CEF83908FE,SD00062564,SD14033,Organism|Plantae|Viridiplantae|Streptophyta|Embryophyta|Tracheophyta|Spermatophytina|Magnoliopsida|Rosanae|Brassicales|Brassicaceae|Raphanus,Plantae,Tracheophyta,Magnoliopsida,Brassicales,Brassicaceae,Raphanus raphanistrum,29701,L.,Raphanus,,raphanistrum,,,Species,,,,,,,,Frank F. Gander,,835,3/12/36,,1936,3,12,72,,3/12/36,,,,,,,,,,,,,FFL,,,,,,,,,,,,United States,California,San Diego,,"Sweetwater River Bridge, Campo Road.",,0,,32.73339,-116.94197,WGS84,402,mak,,"TOPO! v3.4.2, GNIS",,"This is the location of the Steele Canyon Bridge, built in 1926",,,,,,unknownft.,,,,SD14033,43,58ec7d8c-38e5-4708-99e3-573aef359a93,https://www.cch2.org/portal/collections/individual/index.php?occid=468972
2293307,CAS,BOT-BC,,PreservedSpecimen,urn:catalog:CAS:BOT-BC:74183,74183,urn:catalog:CAS:DS:303495,Organism|Plantae|Viridiplantae|Streptophyta|Embryophyta|Tracheophyta|Spermatophytina|Magnoliopsida|Rosanae|Brassicales|Brassicaceae|Raphanus,Plantae,Tracheophyta,Magnoliopsida,Brassicales,Brassicaceae,Raphanus raphanistrum,29701,L.,Raphanus,,raphanistrum,,,Species,Ihsan A. Al-Shehbaz,2010-01,,,,,,"Browne, Ashley C.",,s.n.,6/11/36,,1936,6,11,163,,11-Jun-36,,,,,,,,,,,,,,,,,,,,,North America,,,,United States,California,Humboldt County,,Patrick's Point State Park.,,0,,,,,,,,,,,,,,,,,,en,,urn:catalog:CAS:BOT-BC:74183,1,03fa8a42-7819-41f6-a608-e8901b392b4b,https://www.cch2.org/portal/collections/individual/index.php?occid=2293307
3183749,UCJEPS,VASC,,PreservedSpecimen,95701232-390e-40f0-a314-b2a823c4e4e9,UC1126742,,Organism|Plantae|Viridiplantae|Streptophyta|Embryophyta|Tracheophyta|Spermatophytina|Magnoliopsida|Rosanae|Brassicales|Brassicaceae|Raphanus,Plantae,Tracheophyta,Magnoliopsida,Brassicales,Brassicaceae,Raphanus raphanistrum,29701,L.,Raphanus,,raphanistrum,,,Species,,,,,,,,C. M. Belshaw,,1811,4/6/36,,1936,4,6,97,,Apr 6 1936,"Coordinates continue ""Quadrangle Indian Gulch, plot 5""",grass,,,,,,,,,,,Flowering/Fruiting,,,,,,,,,,,,United States,California,Mariposa,,1.8 mi nnw of Santa Cruz,,0,,37.467805,-120.237521,NAD27,925,,,Geolocate,,,335,,,,,1100 ft,,,,95701232-390e-40f0-a314-b2a823c4e4e9,46,1d84929d-e7f2-4d1b-80b9-eefcd41af0fb,https://www.cch2.org/portal/collections/individual/index.php?occid=3183749
3489238,UCJEPS,VASC,,PreservedSpecimen,455ad2ea-b42c-49a2-857b-e22ed9928ea1,UC1126741,,Organism|Plantae|Viridiplantae|Streptophyta|Embryophyta|Tracheophyta|Spermatophytina|Magnoliopsida|Rosanae|Brassicales|Brassicaceae|Raphanus,Plantae,Tracheophyta,Magnoliopsida,Brassicales,Brassicaceae,Raphanus raphanistrum,29701,L.,Raphanus,,raphanistrum,,,Species,,,,,,,,G. T. Nordstrom,,658,3/31/36,,1936,3,31,91,,Mar 31 1936,"Coordinates continue ""Quadrangle Sonora""",,,,,,,,,,,,Flowering/Fruiting,,,,,,,,,,,,United States,California,Mariposa,,At Webb's,,0,,37.6026,-120.3084,NAD27,805,,,trs2LL,,,304,,,,,1000 ft,,,,455ad2ea-b42c-49a2-857b-e22ed9928ea1,46,7fc37454-32a8-495a-9ef7-3d943ea8a454,https://www.cch2.org/portal/collections/individual/index.php?occid=3489238
3523645,UCJEPS,VASC,,PreservedSpecimen,def09ae2-6a27-4c6e-b3e8-1f53b203b188,JEPS53814,,Organism|Plantae|Viridiplantae|Streptophyta|Embryophyta|Tracheophyta|Spermatophytina|Magnoliopsida|Rosanae|Brassicales|Brassicaceae|Raphanus,Plantae,Tracheophyta,Magnoliopsida,Brassicales,Brassicaceae,Raphanus raphanistrum,29701,L.,Raphanus,,raphanistrum,,,Species,,,,,,,,Willis L. Jepson,,17521,5/6/36,,1936,5,6,127,,May 6 1936,,creek bank in deep rich soil,,"petals bright yellow or pale yellow, lavender-brown-veined or dark purple-viened",,,,,,,,,Flowering/Fruiting,,,,,,,,,,,,United States,California,Merced,,3 1/2 mi n of Snelling (Dry Creek); Dry Creek,,0,,37.57075,-120.4382,NAD27,5259,,,Terrain Navigator 5.03 USGS 1:24000,,,,,,,,,,,,def09ae2-6a27-4c6e-b3e8-1f53b203b188,46,fc94540d-116f-46c0-b315-12a21736935f,https://www.cch2.org/portal/collections/individual/index.php?occid=3523645
3553698,UCJEPS,VASC,,PreservedSpecimen,4cb815c0-8c6f-4bb3-a064-b01f5a59152d,UC557711,,Organism|Plantae|Viridiplantae|Streptophyta|Embryophyta|Tracheophyta|Spermatophytina|Magnoliopsida|Rosanae|Brassicales|Brassicaceae|Raphanus,Plantae,Tracheophyta,Magnoliopsida,Brassicales,Brassicaceae,Raphanus raphanistrum,29701,L.,Raphanus,,raphanistrum,,,Species,,,,,,,,Nell Murbarger,,192,4/1/36,,1936,4,1,92,,Apr 1 1936,,around old sheep corrals (found in 2 places on island),,"""Mustard."" (pl?)",,,,,,,,,Flowering/Fruiting,,,,,,,,,,,,United States,California,Los Angeles,,San Clemente Island,,0,,32.9,-118.5,,,,,,,,,,,,,,,,,4cb815c0-8c6f-4bb3-a064-b01f5a59152d,46,224b759b-42d8-4841-a158-c3a1081c4d1c,https://www.cch2.org/portal/collections/individual/index.php?occid=3553698
468966,SD,,,PreservedSpecimen,2E5E1BC7-B58C-43FA-B1EF-8A9D77DBE2DD,SD00062754,SD13191,Organism|Plantae|Viridiplantae|Streptophyta|Embryophyta|Tracheophyta|Spermatophytina|Magnoliopsida|Rosanae|Brassicales|Brassicaceae|Raphanus,Plantae,Tracheophyta,Magnoliopsida,Brassicales,Brassicaceae,Raphanus sativus,29702,L.,Raphanus,,sativus,,,Species,,,,,,,,Frank F. Gander,,430,6/16/36,,1936,6,16,168,,6/16/36,,,,,,,,,,,,,FFL,,,,,,,,,,,,United States,California,San Diego,,0.3 miles north of Ponto Station on ocean bluff (mak 8/06),,0,,33.10041,-117.31867,WGS84,161,mak,,TOPO! v3.4.2,,Field notes say .3 miles so that is what I used.,,,,,,unknownft.,,,,SD13191,43,b83d960f-b9bd-4439-acb0-5ee5bf8965d0,https://www.cch2.org/portal/collections/individual/index.php?occid=468966
468967,SD,,,PreservedSpecimen,CF7B432E-05B1-415D-80F9-882F3B975E31,SD00062673,SD13197,Organism|Plantae|Viridiplantae|Streptophyta|Embryophyta|Tracheophyta|Spermatophytina|Magnoliopsida|Rosanae|Brassicales|Brassicaceae|Raphanus,Plantae,Tracheophyta,Magnoliopsida,Brassicales,Brassicaceae,Raphanus sativus,29702,L.,Raphanus,,sativus,,,Species,,,,,,,,Frank F. Gander,,462,1/16/36,,1936,1,16,16,,1/16/36,,,,,,,,,,,,,FFL,,,,,,,,,,,,United States,California,San Diego,,1 mile east of Solano Beach in valley.,,0,,32.99464,-117.25219,WGS84,402,mak,,TOPO! v3.4.2,,,,,,,,unknownft.,,,,SD13197,43,8d590043-1bb1-497c-a629-1cd6a41c3385,https://www.cch2.org/portal/collections/individual/index.php?occid=468967
468968,SD,,,PreservedSpecimen,6B9FA299-388E-4F61-AE33-4670C3F339F6,SD00062672,SD13219,Organism|Plantae|Viridiplantae|Streptophyta|Embryophyta|Tracheophyta|Spermatophytina|Magnoliopsida|Rosanae|Brassicales|Brassicaceae|Raphanus,Plantae,Tracheophyta,Magnoliopsida,Brassicales,Brassicaceae,Raphanus sativus,29702,L.,Raphanus,,sativus,,,Species,,,,,,,,Frank F. Gander,,520,1/28/36,,1936,1,28,28,,1/28/36,,,,,,,,,,herbariumSpecimenDuplicate: https://www.cch2.org/portal/collections/individual/index.php?guid=B133594A-099A-4B31-AED1-2E58D9316509,,,FFL,,,,,,,,,,,,United States,California,San Diego,,Tiajuana River near Monument School.,,0,,32.55134,-117.08282,WGS84,402,mak,,TOPO! v3.4.2,,,,,,,,unknownft.,,,,SD13219,43,035649f2-2df6-4cbb-bd9a-ccd80672e4c2,https://www.cch2.org/portal/collections/individual/index.php?occid=468968
468970,SD,,,PreservedSpecimen,7FBD8235-AFE3-4CFC-9FE3-25D58B2B1F2C,SD00062671,SD13380,Organism|Plantae|Viridiplantae|Streptophyta|Embryophyta|Tracheophyta|Spermatophytina|Magnoliopsida|Rosanae|Brassicales|Brassicaceae|Raphanus,Plantae,Tracheophyta,Magnoliopsida,Brassicales,Brassicaceae,Raphanus sativus,29702,L.,Raphanus,,sativus,,,Species,,,,,,,,Frank F. Gander,,556,2/6/36,,1936,2,6,37,,2/6/36,,,,,,,,,,,,,FFL,,,,,,,,,,,,United States,California,San Diego,,1 mile west of San Marcos.,,0,,33.13653,-117.18212,WGS84,402,mak,,"TOPO! v3.4.2, Gander's Field notes",,,,,,,,unknownft.,,,,SD13380,43,b32351f8-4c40-4971-a0db-e791c45e8ae6,https://www.cch2.org/portal/collections/individual/index.php?occid=468970
468971,SD,,,PreservedSpecimen,58A84C4A-A608-41B7-BD3F-6D5D2FB13716,SD00062678,SD13396,Organism|Plantae|Viridiplantae|Streptophyta|Embryophyta|Tracheophyta|Spermatophytina|Magnoliopsida|Rosanae|Brassicales|Brassicaceae|Raphanus,Plantae,Tracheophyta,Magnoliopsida,Brassicales,Brassicaceae,Raphanus sativus,29702,L.,Raphanus,,sativus,,,Species,,,,,,,,Frank F. Gander,,602,2/20/36,,1936,2,20,51,,2/20/36,,,,,,,,,,,,,FFL,,,,,,,,,,,,United States,California,San Diego,,San Pasqual Battlefields.,,0,,33.08208,-116.99193,WGS84,805,mak,,TOPO! v3.4.2,,,,,,,,unknownft.,,,,SD13396,43,2fff5e01-d825-4deb-8eff-95005a628833,https://www.cch2.org/portal/collections/individual/index.php?occid=468971
468974,SD,,,PreservedSpecimen,2092412E-8EB5-4BBE-8DEE-CBAC45C31973,SD00062679,SD14070,Organism|Plantae|Viridiplantae|Streptophyta|Embryophyta|Tracheophyta|Spermatophytina|Magnoliopsida|Rosanae|Brassicales|Brassicaceae|Raphanus,Plantae,Tracheophyta,Magnoliopsida,Brassicales,Brassicaceae,Raphanus sativus,29702,L.,Raphanus,,sativus,,,Species,,,,,,,,Frank F. Gander,,870,3/17/36,,1936,3,17,77,,3/17/36,,,,,,,,,,,,,FFL,,,,,,,,,,,,United States,California,San Diego,,1 mile south of San Onofre on U. S. 101.,,0,,33.37199,-117.55808,WGS84,805,mak,,TOPO! v3.4.2,,,,,,,,unknownft.,,,,SD14070,43,a23712e9-2814-4498-8559-64c8489a1ffb,https://www.cch2.org/portal/collections/individual/index.php?occid=468974
468975,SD,,,PreservedSpecimen,AA3DD0C4-6654-4C56-B558-C163DAA7E881,SD00062674,SD14235,Organism|Plantae|Viridiplantae|Streptophyta|Embryophyta|Tracheophyta|Spermatophytina|Magnoliopsida|Rosanae|Brassicales|Brassicaceae|Raphanus,Plantae,Tracheophyta,Magnoliopsida,Brassicales,Brassicaceae,Raphanus sativus,29702,L.,Raphanus,,sativus,,,Species,,,,,,,,Frank F. Gander,,1029,3/27/36,,1936,3,27,87,,3/27/36,,,,,,,,,,,,,FFL,,,,,,,,,,,,United States,California,San Diego,,"Buena, 7 miles north of Escondido on U. S. 395.",,0,,33.17337,-117.20865,WGS84,1609,mak,,"TOPO! v3.4.2, GNIS",,,,,,,,unknownft.,,,,SD14235,43,d59fec83-5a49-48dd-817f-3988641e4e9b,https://www.cch2.org/portal/collections/individual/index.php?occid=468975
760531,RSA,POM,,PreservedSpecimen,3a3e60b9-abec-464a-a81e-b7385b293446,,POM accession: 273392,Organism|Plantae|Viridiplantae|Streptophyta|Embryophyta|Tracheophyta|Spermatophytina|Magnoliopsida|Rosanae|Brassicales|Brassicaceae|Raphanus,Plantae,Tracheophyta,Magnoliopsida,Brassicales,Brassicaceae,Raphanus sativus,29702,L.,Raphanus,,sativus,,,Species,,,,,,,,Loren Yaussy,,s.n.,2/21/36,,1936,2,21,52,,,,"Sandy loam soil, none slope",,,,,,,,,,,flowers & fruits,Cultivated,,,,,herbarium sheet,,,,,,United States,California,Kern,,Arvin,,0,,,,,,,,,,,137,,,,,450ft.,,,T. Kim Nguyen; cataloged date: 2007-09-19,3a3e60b9-abec-464a-a81e-b7385b293446,17,6713f79f-85f3-4c42-89fc-e5eccb0fc481,https://www.cch2.org/portal/collections/individual/index.php?occid=760531
1008177,RSA,POM,,PreservedSpecimen,8c516749-30a7-4787-abed-dc557048db3a,,POM accession: 273403,Organism|Plantae|Viridiplantae|Streptophyta|Embryophyta|Tracheophyta|Spermatophytina|Magnoliopsida|Rosanae|Brassicales|Brassicaceae|Raphanus,Plantae,Tracheophyta,Magnoliopsida,Brassicales,Brassicaceae,Raphanus sativus,29702,L.,Raphanus,,sativus,,,Species,,,,,,,,Lyman Benson,,7970,9/4/36,,1936,9,4,248,,,,"Adobe soil, Upper Sonoran",,,,,,,,herbariumSpecimenDuplicate: https://www.cch2.org/portal/collections/individual/index.php?guid=9df4e6d9-3c4a-42fb-917b-5a6f758a854f,,,flowers & fruits,Cultivated,,,,,herbarium sheet,,,,,,United States,California,Santa Clara,,"Palo Alto, Watershed: San Francisco Bay.",,0,,,,,,,,,,,15,,,,,50ft.,,,T. Kim Nguyen; cataloged date: 2007-09-21,8c516749-30a7-4787-abed-dc557048db3a,17,9b32ddff-f495-40e0-8aab-689d225b0472,https://www.cch2.org/portal/collections/individual/index.php?occid=1008177
1045059,RSA,POM,,PreservedSpecimen,9df4e6d9-3c4a-42fb-917b-5a6f758a854f,,POM accession: 273402,Organism|Plantae|Viridiplantae|Streptophyta|Embryophyta|Tracheophyta|Spermatophytina|Magnoliopsida|Rosanae|Brassicales|Brassicaceae|Raphanus,Plantae,Tracheophyta,Magnoliopsida,Brassicales,Brassicaceae,Raphanus sativus,29702,L.,Raphanus,,sativus,,,Species,,,,,,,,Lyman Benson,,7970,9/4/36,,1936,9,4,248,,,,"Adobe soil, Upper Sonoran",,,,,,,,herbariumSpecimenDuplicate: https://www.cch2.org/portal/collections/individual/index.php?guid=8c516749-30a7-4787-abed-dc557048db3a,,,flowers & fruits,Introduced,,,,,herbarium sheet,,,,,,United States,California,Santa Clara,,"Palo Alto, Watershed: San Francisco Bay.",,0,,,,,,,,,,,15,,,,,50ft.,,,Jackie C. McConnaughy; cataloged date: 2012-04-17,9df4e6d9-3c4a-42fb-917b-5a6f758a854f,17,ab1c28fd-7ce5-4398-97db-da4f61804b5d,https://www.cch2.org/portal/collections/individual/index.php?occid=1045059
1102188,RSA,RSA,,PreservedSpecimen,b949f32c-f39b-4518-a121-543dddae0076,,RSA accession: 431498,Organism|Plantae|Viridiplantae|Streptophyta|Embryophyta|Tracheophyta|Spermatophytina|Magnoliopsida|Rosanae|Brassicales|Brassicaceae|Raphanus,Plantae,Tracheophyta,Magnoliopsida,Brassicales,Brassicaceae,Raphanus sativus,29702,L.,Raphanus,,sativus,,,Species,,,,,,,,Claire Kibbe,,19973,1936-07-00,,1936,7,0,,,1936-07,,In moist places at low altitude.,,"Weed in waste places, flowers white with rose or purplish veins",,,,,,,,,flowers & fruits,Cultivated,,,,,herbarium sheet,,,,,,United States,California,Orange,,Santa Ana Canyon.,,0,,,,,,,,,,,,,,,,,,,T. Kim Nguyen; cataloged date: 2007-09-21,b949f32c-f39b-4518-a121-543dddae0076,17,6e229c04-a24e-42cb-9f86-c4dea0bc7c1c,https://www.cch2.org/portal/collections/individual/index.php?occid=1102188
2338864,CAS,BOT-BC,,PreservedSpecimen,urn:catalog:CAS:BOT-BC:74333,74333,urn:catalog:CAS:BOT:248638,Organism|Plantae|Viridiplantae|Streptophyta|Embryophyta|Tracheophyta|Spermatophytina|Magnoliopsida|Rosanae|Brassicales|Brassicaceae|Raphanus,Plantae,Tracheophyta,Magnoliopsida,Brassicales,Brassicaceae,Raphanus sativus,29702,L.,Raphanus,,sativus,,,Species,Ihsan A. Al-Shehbaz,2010-01,,,,,,"Dudley, Chester",,s.n.,1936-07-00,,1936,7,1,,,July 1936.,,,,,,,,,,,,,,,,,,,,,North America,,,,United States,California,San Luis Obispo County,,Morro.,,0,,,,,,,,,,,,,,,,,,en,,urn:catalog:CAS:BOT-BC:74333,1,bc129a6f-f787-4d53-8399-900293bb6831,https://www.cch2.org/portal/collections/individual/index.php?occid=2338864
3281522,UCJEPS,VASC,,PreservedSpecimen,44b6b654-825a-43e6-a0a7-ef25c4845cec,UC1126744,,Organism|Plantae|Viridiplantae|Streptophyta|Embryophyta|Tracheophyta|Spermatophytina|Magnoliopsida|Rosanae|Brassicales|Brassicaceae|Raphanus,Plantae,Tracheophyta,Magnoliopsida,Brassicales,Brassicaceae,Raphanus sativus,29702,L.,Raphanus,,sativus,,,Species,,,,,,,,P. L. Johannsen,,748,4/9/36,,1936,4,9,100,,Apr 9 1936,"Coordinates continue ""Quadrangle Sonora, Plot 1""",grass,,,,,,,,,,,Flowering/Fruiting,,,,,,,,,,,,United States,California,Tuolumne,,1 mi w of Standard,,0,,37.969624,-120.332873,NAD27,1000,,,Geolocate,,,670,,,,,2200 ft,,,,44b6b654-825a-43e6-a0a7-ef25c4845cec,46,10ff7b13-d872-4dc4-9e0f-f278f0fd0f5b,https://www.cch2.org/portal/collections/individual/index.php?occid=3281522
3293792,UCJEPS,VASC,,PreservedSpecimen,3dd5eca9-2cf7-4793-bf9c-3fb4e9ee23da,UC1126754,,Organism|Plantae|Viridiplantae|Streptophyta|Embryophyta|Tracheophyta|Spermatophytina|Magnoliopsida|Rosanae|Brassicales|Brassicaceae|Raphanus,Plantae,Tracheophyta,Magnoliopsida,Brassicales,Brassicaceae,Raphanus sativus,29702,L.,Raphanus,,sativus,,,Species,,,,,,,,P. L. Johannsen,,701,3/21/36,,1936,3,21,81,,Mar 21 1936,"Coordinates continue ""Quadrangle San Luis Obispo, Plot 2""",grass,,,,,,,,,,,Flowering/Fruiting,,,,,,,,,,,,United States,California,San Luis Obispo,,1 1/2 mi se of Terrace Hill,,0,,35.26672,-120.624855,WGS84,1223,,,RSA:2009,,,91,,,,,300 ft,,,,3dd5eca9-2cf7-4793-bf9c-3fb4e9ee23da,46,792792da-10b4-48b2-bfc4-597e2ba04cc8,https://www.cch2.org/portal/collections/individual/index.php?occid=3293792
3310288,UCJEPS,VASC,,PreservedSpecimen,b5f0e7f6-135e-48fb-bbf7-b29ab2044fb5,UC606739,,Organism|Plantae|Viridiplantae|Streptophyta|Embryophyta|Tracheophyta|Spermatophytina|Magnoliopsida|Rosanae|Brassicales|Brassicaceae|Raphanus,Plantae,Tracheophyta,Magnoliopsida,Brassicales,Brassicaceae,Raphanus sativus,29702,L.,Raphanus,,sativus,,,Species,,,,,,,,Edward Lee,,1961,4/19/36,,1936,4,19,110,,Apr 19 1936,"Coordinates continue ""37 deg. 55.6'N; 122 deg. 26-'W",beach of broken Franciscan [chest] rock; ne corner of the island,,,,,,,,,,,Flowering/Fruiting,,,,,,,,,,,,United States,California,Contra Costa,,"Red Rock, ne corner of the island Red Rock; San Francisco Bay Region, Red Rock",,0,,37.926667,-122.433333,WGS84,100,,,"Berkeleymapper, GoogleMaps v2",,,,,,,,,,,,b5f0e7f6-135e-48fb-bbf7-b29ab2044fb5,46,d6420f55-e413-4451-81fb-c863644659e5,https://www.cch2.org/portal/collections/individual/index.php?occid=3310288
3440200,UCJEPS,VASC,,PreservedSpecimen,16c50f82-d35a-4a6a-ad34-af720d0cf5c0,UC1126753,,Organism|Plantae|Viridiplantae|Streptophyta|Embryophyta|Tracheophyta|Spermatophytina|Magnoliopsida|Rosanae|Brassicales|Brassicaceae|Raphanus,Plantae,Tracheophyta,Magnoliopsida,Brassicales,Brassicaceae,Raphanus sativus,29702,L.,Raphanus,,sativus,,,Species,,,,,,,,N. K. Carlson,,152,3/18/36,,1936,3,18,78,,Mar 18 1936,"Coordinates continue ""Quadrangle Arroyo Grande, Plot 4""",grass,,,,,,,,,,,Flowering/Fruiting,,,,,,,,,,,,United States,California,San Luis Obispo,,.2 mi s of Nipomo Hill,,0,,35.098251,-120.578155,NAD27,475,,,Geolocate,,,124,,,,,410 ft,,,,16c50f82-d35a-4a6a-ad34-af720d0cf5c0,46,e74a6855-e6bf-4d93-b4d2-d305a1b86a0c,https://www.cch2.org/portal/collections/individual/index.php?occid=3440200
3534929,UCJEPS,VASC,,PreservedSpecimen,442f7e44-9212-4c3b-baf3-6110d0e737e5,JEPS53813,,Organism|Plantae|Viridiplantae|Streptophyta|Embryophyta|Tracheophyta|Spermatophytina|Magnoliopsida|Rosanae|Brassicales|Brassicaceae|Raphanus,Plantae,Tracheophyta,Magnoliopsida,Brassicales,Brassicaceae,Raphanus sativus,29702,L.,Raphanus,,sativus,,,Species,,,,,,,,Willis L. Jepson,,17689,7/22/36,,1936,7,22,204,,Jul 22 1936,,,,"petals white, faint purple veinings",,,,,,,,,Flowering/Fruiting,,,,,,,,,,,,United States,California,Mendocino,,"Albion, Mendocino coast Albion; , Mendocino coast",,0,,39.22411,-123.76765,NAD27,810,,,Terrain Navigator (inferred),,,,,,,,,,,,442f7e44-9212-4c3b-baf3-6110d0e737e5,46,bd40bc0b-4e4e-4e9c-9eb0-b088b5e86f1c,https://www.cch2.org/portal/collections/individual/index.php?occid=3534929
3539396,UCJEPS,VASC,,PreservedSpecimen,21ff7e52-6a30-4f5a-9929-fd79c1831af2,UC1543096,,Organism|Plantae|Viridiplantae|Streptophyta|Embryophyta|Tracheophyta|Spermatophytina|Magnoliopsida|Rosanae|Brassicales|Brassicaceae|Raphanus,Plantae,Tracheophyta,Magnoliopsida,Brassicales,Brassicaceae,Raphanus sativus,29702,L.,Raphanus,,sativus,,,Species,,,,,,,,Donald G. Nelson,,432,5/29/36,,1936,5,29,150,,May 29 1936,"Teratological form""",,,,,,,,,,,,Flowering/Fruiting,,,,,,,,,,,,United States,California,Orange,,"e of Buena Park (on n side of West Commonwealth Avenue, on edge of Fullerton Municipal airport); Fullerton Municipal airport, West Commonwealth Avenue",,0,,33.87,-117.98,NAD27,805,,,Terrain Navigator 5.03 USGS 1:24000,,,,,,,,,,,,21ff7e52-6a30-4f5a-9929-fd79c1831af2,46,021aa3f7-cb4d-4694-a9ab-8a59456252e1,https://www.cch2.org/portal/collections/individual/index.php?occid=3539396
468976,SD,,,PreservedSpecimen,01913244-A71D-429E-943C-097B4B02C9C8,SD00062565,SD16512,Organism|Plantae|Viridiplantae|Streptophyta|Embryophyta|Tracheophyta|Spermatophytina|Magnoliopsida|Rosanae|Brassicales|Brassicaceae|Raphanus,Plantae,Tracheophyta,Magnoliopsida,Brassicales,Brassicaceae,Raphanus raphanistrum,29701,L.,Raphanus,,raphanistrum,,,Species,,,,,,,,Frank F. Gander,,2997,1/18/37,,1937,1,18,18,,1/18/37,,,,,,,,,,,,,FFL,,,,,,,,,,,,United States,California,San Diego,,"Mar Vista, Pacific Beach",,0,,32.80427,-117.24817,WGS84,,n/a,,Coordinates from label,,Do not know this locality,,,,,,unknownft.,,,,SD16512,43,a6f92803-cedd-47ee-8d4a-644c666799d7,https://www.cch2.org/portal/collections/individual/index.php?occid=468976
764500,RSA,POM,,PreservedSpecimen,3c27fd5d-c65b-45e2-a499-c51e4cd5bee4,,POM accession: 306601,Organism|Plantae|Viridiplantae|Streptophyta|Embryophyta|Tracheophyta|Spermatophytina|Magnoliopsida|Rosanae|Brassicales|Brassicaceae|Raphanus,Plantae,Tracheophyta,Magnoliopsida,Brassicales,Brassicaceae,Raphanus raphanistrum,29701,L.,Raphanus,,raphanistrum,,,Species,,,,,,,,Henry J. Ramsey,Henry J. Ramsey,1554,7/20/37,,1937,7,20,201,,,,,,,,,,,,,,,flowers & fruits,Introduced,,,,,herbarium sheet,,,,,,United States,California,San Diego,,Between San Diego and Temecula,,0,,,,,,,,,,,,,,,,,,,T. Kim Nguyen; cataloged date: 2007-09-19,3c27fd5d-c65b-45e2-a499-c51e4cd5bee4,17,1a6e5adc-14cc-4475-b8db-33abd680713f,https://www.cch2.org/portal/collections/individual/index.php?occid=764500
2405523,CAS,BOT-BC,,PreservedSpecimen,urn:catalog:CAS:BOT-BC:74175,74175,urn:catalog:CAS:BOT:531062,Organism|Plantae|Viridiplantae|Streptophyta|Embryophyta|Tracheophyta|Spermatophytina|Magnoliopsida|Rosanae|Brassicales|Brassicaceae|Raphanus,Plantae,Tracheophyta,Magnoliopsida,Brassicales,Brassicaceae,Raphanus raphanistrum,29701,L.,Raphanus,,raphanistrum,,,Species,Ihsan A. Al-Shehbaz,2010-01,,,,,,"Covel, Paul F.",,662,10/1/37,,1937,10,1,274,,Oct I '37,,,,,,,,,,,,,,,,,,,,,North America,,,,United States,California,Alameda County,,Oakland Hills.,,0,,,,,,,,,,,,,,,,,,en,,urn:catalog:CAS:BOT-BC:74175,1,94e1fa36-af08-4029-8584-8fb935bcb7fe,https://www.cch2.org/portal/collections/individual/index.php?occid=2405523
4696212,RENO,V,,PreservedSpecimen,7c653894-e659-4f7c-abec-4c7a19b2b005,19880,RENO 9354,Organism|Plantae|Viridiplantae|Streptophyta|Embryophyta|Tracheophyta|Spermatophytina|Magnoliopsida|Rosanae|Brassicales|Brassicaceae|Raphanus,Plantae,Tracheophyta,Magnoliopsida,Brassicales,Brassicaceae,Raphanus raphanistrum,29701,L.,Raphanus,,raphanistrum,,,Species,A. Tiehm,3-Dec,,,,,,J.R. Henrichs,,297,6/21/37,,1937,6,21,172,,6/21/37,Weed; flowers oyster white.,Near ditch.,,,,,,,,,,,,,,,,,,,,,,,United States,Nevada,Washoe,,Streets of Reno.,,0,,39.529633,-119.813803,WGS84,4000,Mike Hagebusch,,GeoLocate,,unmappable.,,,,,,,Currently in collection,En,,5342781,89,430dfb61-a604-4406-82e9-de22ae543390,https://www.cch2.org/portal/collections/individual/index.php?occid=4696212
468977,SD,,,PreservedSpecimen,D4CE6124-3744-44B3-843E-228712CE9350,SD00062676,SD16528,Organism|Plantae|Viridiplantae|Streptophyta|Embryophyta|Tracheophyta|Spermatophytina|Magnoliopsida|Rosanae|Brassicales|Brassicaceae|Raphanus,Plantae,Tracheophyta,Magnoliopsida,Brassicales,Brassicaceae,Raphanus sativus,29702,L.,Raphanus,,sativus,,,Species,,,,,,,,Frank F. Gander,,3013,1/18/37,,1937,1,18,18,,1/18/37,,,,,,,,,,,,,FFL,,,,,,,,,,,,United States,California,San Diego,,Mar Vista at Pacific Beach.,,0,,32.80427,-117.24817,WGS84,,n/a,,Coordinates from label,,Do not know this locality,,,,,,unknownft.,,,,SD16528,43,0e61a2c4-2cba-49cb-a4cf-54ddc8402c83,https://www.cch2.org/portal/collections/individual/index.php?occid=468977
468980,SD,,,PreservedSpecimen,E060B461-56C1-4E01-B69F-307C1C391A81,SD00062677,SD16959,Organism|Plantae|Viridiplantae|Streptophyta|Embryophyta|Tracheophyta|Spermatophytina|Magnoliopsida|Rosanae|Brassicales|Brassicaceae|Raphanus,Plantae,Tracheophyta,Magnoliopsida,Brassicales,Brassicaceae,Raphanus sativus,29702,L.,Raphanus,,sativus,,,Species,,,,,,,,Frank F. Gander,,3323,4/15/37,,1937,4,15,105,,4/15/37,,,,,,,,,,,,,FFL,,,,,,,,,,,,United States,California,San Diego,,San Luis Rey,,0,,33.23198,-117.32365,WGS84,1609,mak,,"TOPO! v3.4.2, GNIS",,,,,,,,unknownft.,,,,SD16959,43,276aeca1-abd7-487c-899c-90c476e49eef,https://www.cch2.org/portal/collections/individual/index.php?occid=468980
468982,SD,,,PreservedSpecimen,FEA8EA4E-B30C-427E-97C9-1C76D1C91508,SD00062675,SD20193,Organism|Plantae|Viridiplantae|Streptophyta|Embryophyta|Tracheophyta|Spermatophytina|Magnoliopsida|Rosanae|Brassicales|Brassicaceae|Raphanus,Plantae,Tracheophyta,Magnoliopsida,Brassicales,Brassicaceae,Raphanus sativus,29702,L.,Raphanus,,sativus,,,Species,,,,,,,,Frank F. Gander,,4884,12/22/37,,1937,12,22,356,,12/22/37,,,,,,,,,,,,,FFL,,,,,,,,,,,,United States,California,San Diego,,"1 mile north of Salt Works, National City.",,0,,32.61615,-117.1001,WGS84,402,mak,,"TOPO! v3.4.2, Google",,,,,,,,unknownft.,,,,SD20193,43,4d9de30f-fd3e-4627-980c-0b3f82118dbb,https://www.cch2.org/portal/collections/individual/index.php?occid=468982
720388,RSA,POM,,PreservedSpecimen,273bd9f0-a866-43eb-91b8-faf6de2397d7,,POM accession: 273400,Organism|Plantae|Viridiplantae|Streptophyta|Embryophyta|Tracheophyta|Spermatophytina|Magnoliopsida|Rosanae|Brassicales|Brassicaceae|Raphanus,Plantae,Tracheophyta,Magnoliopsida,Brassicales,Brassicaceae,Raphanus sativus,29702,L.,Raphanus,,sativus,,,Species,,,,,,,,Lyman Benson,,8124,4/17/37,,1937,4,17,107,,,,Granite sandy soil,,,,,,,,herbariumSpecimenDuplicate: https://www.cch2.org/portal/collections/individual/index.php?guid=8ba0a9ce-7b39-44a5-8acf-5f46c13cb2f0,,,flowers & fruits,Cultivated,,,,,herbarium sheet,,,,,,United States,California,Ventura,,E Bakersfield.,,0,,,,,,,,,,,122,,,,,400ft.,,,T. Kim Nguyen; cataloged date: 2007-09-19,273bd9f0-a866-43eb-91b8-faf6de2397d7,17,e62ca182-a4c7-47b7-92d2-083a68d3b76e,https://www.cch2.org/portal/collections/individual/index.php?occid=720388
962044,RSA,POM,,PreservedSpecimen,766ea758-c530-41ab-831e-bfaca2e5c10a,,POM accession: 306600,Organism|Plantae|Viridiplantae|Streptophyta|Embryophyta|Tracheophyta|Spermatophytina|Magnoliopsida|Rosanae|Brassicales|Brassicaceae|Raphanus,Plantae,Tracheophyta,Magnoliopsida,Brassicales,Brassicaceae,Raphanus sativus,29702,L.,Raphanus,,sativus,,,Species,,,,,,,,Henry J. Ramsey,Henry J. Ramsey,1555,7/20/37,,1937,7,20,201,,,,,,,,,,,,,,,flowers & fruits,Cultivated,,,,,herbarium sheet,,,,,,United States,California,San Diego,,Between San Diego and Temecula,,0,,,,,,,,,,,,,,,,,,,T. Kim Nguyen; cataloged date: 2007-09-21,766ea758-c530-41ab-831e-bfaca2e5c10a,17,f4f9232e-6ba1-4ef0-8c43-8b1465316326,https://www.cch2.org/portal/collections/individual/index.php?occid=962044
1012091,RSA,RSA,,PreservedSpecimen,8e27a45f-e92a-403b-91b5-76d39bf15333,,RSA accession: 651173,Organism|Plantae|Viridiplantae|Streptophyta|Embryophyta|Tracheophyta|Spermatophytina|Magnoliopsida|Rosanae|Brassicales|Brassicaceae|Raphanus,Plantae,Tracheophyta,Magnoliopsida,Brassicales,Brassicaceae,Raphanus sativus,29702,L.,Raphanus,,sativus,,,Species,,,,,,,,Eleanor McClung,,4,3/14/37,,1937,3,14,73,,,,,,,,,,,,,,,flowers,Introduced,,,,,herbarium sheet,,,,,,United States,California,Los Angeles,,Playa del Rey.,,0,,,,,,,,,,,,,,,,,,,cataloged date: 2001-01-24,8e27a45f-e92a-403b-91b5-76d39bf15333,17,39d880fd-2e84-4c77-b40c-113d33eebfcf,https://www.cch2.org/portal/collections/individual/index.php?occid=1012091
1193190,RSA,POM,,PreservedSpecimen,e4caffb2-3ca8-4be6-a5be-8a510e479aaa,,POM accession: 307355,Organism|Plantae|Viridiplantae|Streptophyta|Embryophyta|Tracheophyta|Spermatophytina|Magnoliopsida|Rosanae|Brassicales|Brassicaceae|Raphanus,Plantae,Tracheophyta,Magnoliopsida,Brassicales,Brassicaceae,Raphanus sativus,29702,L.,Raphanus,,sativus,,,Species,,,,,,,,Henry J. Ramsey,Henry J. Ramsey,2184,3/21/37,,1937,3,21,80,,,,,,,,,,,,,,,flowers & fruits,Cultivated,,,,,herbarium sheet,,,,,,United States,California,Los Angeles,,"North Craig Ave., Altadena.",,0,,,,,,,,,,,,,,,,,,,T. Kim Nguyen; cataloged date: 2007-09-21,e4caffb2-3ca8-4be6-a5be-8a510e479aaa,17,12cbe8bc-8cbd-485d-af79-c48341849a0a,https://www.cch2.org/portal/collections/individual/index.php?occid=1193190
1247827,RSA,POM,,PreservedSpecimen,fec64046-d192-49d2-8bcc-578a3495d4e9,,POM accession: 307009,Organism|Plantae|Viridiplantae|Streptophyta|Embryophyta|Tracheophyta|Spermatophytina|Magnoliopsida|Rosanae|Brassicales|Brassicaceae|Raphanus,Plantae,Tracheophyta,Magnoliopsida,Brassicales,Brassicaceae,Raphanus sativus,29702,L.,Raphanus,,sativus,,,Species,,,,,,,,Henry J. Ramsey,Henry J. Ramsey,1914,8/19/37,,1937,8,19,231,,,,Roadside.,,,,,,,,,,,flowers & fruits,Cultivated,,,,,herbarium sheet,,,,,,United States,California,Los Angeles,,San Gabriel Wash.,,0,,,,,,,,,,,,,,,,,,,T. Kim Nguyen; cataloged date: 2007-09-21,fec64046-d192-49d2-8bcc-578a3495d4e9,17,11cb8cca-0c4f-4fe4-9186-7bace4f9fc10,https://www.cch2.org/portal/collections/individual/index.php?occid=1247827
2771952,CAS,BOT-BC,,PreservedSpecimen,urn:catalog:CAS:BOT-BC:550561,550561,,Organism|Plantae|Viridiplantae|Streptophyta|Embryophyta|Tracheophyta|Spermatophytina|Magnoliopsida|Rosanae|Brassicales|Brassicaceae|Raphanus,Plantae,Tracheophyta,Magnoliopsida,Brassicales,Brassicaceae,Raphanus sativus,29702,L.,Raphanus,,sativus,,,Species,,,,,,,,"Griffith, Gerald",,241,5/18/37,,1937,5,18,138,,18-May-37,"""Wild Radish"".","Lower Sonoran zone, sandy soil.",,,,,,,,,,,,,,,,,,,North America,,,,United States,California,Kern County,,"S.P. Yards, San Joaquin Valley watershed",,0,,,,,,,,,,,126,,,,,414.0000000000 ft,,en,,urn:catalog:CAS:BOT-BC:550561,1,ed077a12-43f8-458d-9d80-ee470f6ca424,https://www.cch2.org/portal/collections/individual/index.php?occid=2771952
2771954,CAS,BOT-BC,,PreservedSpecimen,urn:catalog:CAS:BOT-BC:550563,550563,,Organism|Plantae|Viridiplantae|Streptophyta|Embryophyta|Tracheophyta|Spermatophytina|Magnoliopsida|Rosanae|Brassicales|Brassicaceae|Raphanus,Plantae,Tracheophyta,Magnoliopsida,Brassicales,Brassicaceae,Raphanus sativus,29702,L.,Raphanus,,sativus,,,Species,,,,,,,,"Griffith, Gerald",,282,6/14/37,,1937,6,14,165,,14-Jun-37,"""Wild Radish"".","Lower Sonoran zone, sandy soil.",,,,,,,,,,,,,,,,,,,North America,,,,United States,California,Kern County,,"S.P. Yards, San Joaquin Valley watershed",,0,,,,,,,,,,,126,,,,,414.0000000000 ft,,en,,urn:catalog:CAS:BOT-BC:550563,1,dc6bd141-823c-4c4d-bad3-ab145ffa897e,https://www.cch2.org/portal/collections/individual/index.php?occid=2771954
2772132,CAS,BOT-BC,,PreservedSpecimen,urn:catalog:CAS:BOT-BC:550642,550642,,Organism|Plantae|Viridiplantae|Streptophyta|Embryophyta|Tracheophyta|Spermatophytina|Magnoliopsida|Rosanae|Brassicales|Brassicaceae|Raphanus,Plantae,Tracheophyta,Magnoliopsida,Brassicales,Brassicaceae,Raphanus sativus,29702,L.,Raphanus,,sativus,,,Species,,,,,,,,"Griffith, Gerald",,40,3/22/37,,1937,3,22,81,,22-Mar-37,"""Wild Radish"".",Upper Sonoran zone; clay soil.,,,,,,,,,,,,,,,,,,,North America,,,,United States,California,San Luis Obispo County,,"National Guard Camp, Pacific Coast watershed",,0,,,,,,,,,,,30,,,,,100.0000000000 ft,,en,,urn:catalog:CAS:BOT-BC:550642,1,c408bbc7-d780-423c-8bc2-83392dc11e0b,https://www.cch2.org/portal/collections/individual/index.php?occid=2772132
2772133,CAS,BOT-BC,,PreservedSpecimen,urn:catalog:CAS:BOT-BC:550643,550643,,Organism|Plantae|Viridiplantae|Streptophyta|Embryophyta|Tracheophyta|Spermatophytina|Magnoliopsida|Rosanae|Brassicales|Brassicaceae|Raphanus,Plantae,Tracheophyta,Magnoliopsida,Brassicales,Brassicaceae,Raphanus sativus,29702,L.,Raphanus,,sativus,,,Species,,,,,,,,"Griffith, Gerald",,40,3/22/37,,1937,3,22,81,,22-Mar-37,"""Wild Radish"".",Upper Sonoran zone; clay soil.,,,,,,,,,,,,,,,,,,,North America,,,,United States,California,San Luis Obispo County,,"National Guard Training Camp, Coast mountain range, Pacific Coast watershed",,0,,,,,,,,,,,30,,,,,100.0000000000 ft,,en,,urn:catalog:CAS:BOT-BC:550643,1,d246c388-e1bf-49f2-9192-2cb5c4b5708d,https://www.cch2.org/portal/collections/individual/index.php?occid=2772133
2772139,CAS,BOT-BC,,PreservedSpecimen,urn:catalog:CAS:BOT-BC:550649,550649,,Organism|Plantae|Viridiplantae|Streptophyta|Embryophyta|Tracheophyta|Spermatophytina|Magnoliopsida|Rosanae|Brassicales|Brassicaceae|Raphanus,Plantae,Tracheophyta,Magnoliopsida,Brassicales,Brassicaceae,Raphanus sativus,29702,L.,Raphanus,,sativus,,,Species,,,,,,,,"Griffith, Gerald",,95,4/10/37,,1937,4,10,100,,10-Apr-37,"""Wild Radish"".",Lower Sonoran zone; sandy soil.,,,,,,,,,,,,,,,,,,,North America,,,,United States,California,Kern County,,"Bakersfield - City Lot, San Joaquin Valley watershed",,0,,,,,,,,,,,122,,,,,400.0000000000 ft,,en,,urn:catalog:CAS:BOT-BC:550649,1,3277349a-4413-4ed0-812a-0d2fd455868c,https://www.cch2.org/portal/collections/individual/index.php?occid=2772139
2773470,CAS,BOT-BC,,PreservedSpecimen,urn:catalog:CAS:BOT-BC:554230,554230,,Organism|Plantae|Viridiplantae|Streptophyta|Embryophyta|Tracheophyta|Spermatophytina|Magnoliopsida|Rosanae|Brassicales|Brassicaceae|Raphanus,Plantae,Tracheophyta,Magnoliopsida,Brassicales,Brassicaceae,Raphanus sativus,29702,L.,Raphanus,,sativus,,,Species,,,,,,,,"Griffith, Gerald",,95,4/10/37,,1937,4,10,100,,10-Apr-37,"""Wild Radish"".",Lower Sonoran Zone; sandy soil.,,,,,,,,,,,,,,,,,,,North America,,,,United States,California,Kern County,,"Bakersfield City Lot, San Joaquin Valley watershed",,0,,,,,,,,,,,122,,,,,400.0000000000 ft,,en,,urn:catalog:CAS:BOT-BC:554230,1,74b3aa50-adc8-4360-9529-b898eb938bd3,https://www.cch2.org/portal/collections/individual/index.php?occid=2773470
3232355,UCJEPS,VASC,,PreservedSpecimen,8b32a9f4-b153-440a-8fa1-88c6f3123984,UC1084367,,Organism|Plantae|Viridiplantae|Streptophyta|Embryophyta|Tracheophyta|Spermatophytina|Magnoliopsida|Rosanae|Brassicales|Brassicaceae|Raphanus,Plantae,Tracheophyta,Magnoliopsida,Brassicales,Brassicaceae,Raphanus sativus,29702,L.,Raphanus,,sativus,,,Species,,,,,,,,G. Thomas Robbins,,33,3/26/37,,1937,3,26,85,,Mar 26 1937,,,,,,,,,,,,,Flowering/Fruiting,,,,,,,,,,,,United States,California,Sonoma,,along road to Bodega (just e of Bodega),,0,,38.35787,-122.92995,NAD27,3980,,,Terrain Navigator,,,,,,,,,,,,8b32a9f4-b153-440a-8fa1-88c6f3123984,46,fbefdd19-26e9-452d-900f-dea485cd216f,https://www.cch2.org/portal/collections/individual/index.php?occid=3232355
3477178,UCJEPS,VASC,,PreservedSpecimen,e6ba55f1-c806-47ac-a3d7-cefd8bd21995,UC1126751,,Organism|Plantae|Viridiplantae|Streptophyta|Embryophyta|Tracheophyta|Spermatophytina|Magnoliopsida|Rosanae|Brassicales|Brassicaceae|Raphanus,Plantae,Tracheophyta,Magnoliopsida,Brassicales,Brassicaceae,Raphanus sativus,29702,L.,Raphanus,,sativus,,,Species,,,,,,,,G. T. Nordstrom,,1304,6/4/37,,1937,6,4,155,,Jun 4 1937,"Coordinates continue ""Quadrangle Adelaida""",sw slope,,,,,,,,,,,Flowering/Fruiting,,,,,,,,,,,,United States,California,San Luis Obispo,,1.9 mi nw of Mammoth Rock School,,0,,35.5657,-120.987,NAD27,805,,,trs2LL,,,121,,,,,400 ft,,,,e6ba55f1-c806-47ac-a3d7-cefd8bd21995,46,3a7c3521-3fc5-443f-a2fe-c023eda512ac,https://www.cch2.org/portal/collections/individual/index.php?occid=3477178
3904093,LA,,,PreservedSpecimen,9693654b-f838-443a-8c1a-2f4c49081eae,LA00606074,,Organism|Plantae|Viridiplantae|Streptophyta|Embryophyta|Tracheophyta|Spermatophytina|Magnoliopsida|Rosanae|Brassicales|Brassicaceae|Raphanus,Plantae,Tracheophyta,Magnoliopsida,Brassicales,Brassicaceae,Raphanus sativus,29702,L.,Raphanus,,sativus,,,Species,,,,,,,,Mary Reynolds,,4,3/14/37,,1937,3,14,73,,,,,,,,,,,,,,,,,,,,,,,,,,,,,,,,,0,,,,,,,,,,,,,,,,,,,abaniaga,,34,9693654b-f838-443a-8c1a-2f4c49081eae,https://www.cch2.org/portal/collections/individual/index.php?occid=3904093
4126372,RSA,POM,,PreservedSpecimen,8ba0a9ce-7b39-44a5-8acf-5f46c13cb2f0,,POM accession: 273401,Organism|Plantae|Viridiplantae|Streptophyta|Embryophyta|Tracheophyta|Spermatophytina|Magnoliopsida|Rosanae|Brassicales|Brassicaceae|Raphanus,Plantae,Tracheophyta,Magnoliopsida,Brassicales,Brassicaceae,Raphanus sativus,29702,L.,Raphanus,,sativus,,,Species,,,,,,,,Lyman Benson,,8124,4/17/37,,1937,4,17,107,,,,Granite sandy soil,,,,,,,,herbariumSpecimenDuplicate: https://www.cch2.org/portal/collections/individual/index.php?guid=273bd9f0-a866-43eb-91b8-faf6de2397d7,,,flowers & fruits,Cultivated,,,,,herbarium sheet,,,,,,United States,California,Ventura,,E Bakersfield.,,0,,,,,,,,,,,122,,,,,400ft.,Deaccessioned,,T. Kim Nguyen; cataloged date: 2007-09-19,8ba0a9ce-7b39-44a5-8acf-5f46c13cb2f0,17,d3e8e8a5-1c0b-4e46-beed-e6ddc98d7475,https://www.cch2.org/portal/collections/individual/index.php?occid=4126372
4334377,OSC,V,,PreservedSpecimen,{BF3A0CF0-D30B-4D94-9C31-B6CB69F0AAEE},OSC-V-023800,ORE12407,Organism|Plantae|Viridiplantae|Streptophyta|Embryophyta|Tracheophyta|Spermatophytina|Magnoliopsida|Rosanae|Brassicales|Brassicaceae|Raphanus,Plantae,Tracheophyta,Magnoliopsida,Brassicales,Brassicaceae,Raphanus raphanistrum,29701,L.,Raphanus,,raphanistrum,,,Species,"Ireland, O.",1938,,,,,,Orlin L. Ireland,,1046,3/18/38,,1938,3,18,77,,3/18/38,,Open roadside.,,,,,,,,,,,,wild collection,,,,,,,,,,,United States,Oregon,Douglas,,2-3 miles north of Drain.,,0,,43.69842498,-123.3175,,4828,Tyler Norby,OregonFlora 1994-2020 methodology,"OrlookId: 99563, StateProvince: Oregon, County: Douglas, LocName: Drain, 2.3 mi. N of",,,,,,,,,,,,4437134,81,708a46c6-07a7-4d43-9960-5fba54a4eb33,https://www.cch2.org/portal/collections/individual/index.php?occid=4334377
468983,SD,,,PreservedSpecimen,ED659251-3A25-49EF-9724-41E433C42BEE,SD00062670,SD21110,Organism|Plantae|Viridiplantae|Streptophyta|Embryophyta|Tracheophyta|Spermatophytina|Magnoliopsida|Rosanae|Brassicales|Brassicaceae|Raphanus,Plantae,Tracheophyta,Magnoliopsida,Brassicales,Brassicaceae,Raphanus sativus,29702,L.,Raphanus,,sativus,,,Species,,,,,,,,Frank F. Gander,,5533,5/7/38,,1938,5,7,127,,5/7/38,,,,,,,,,,,,,FFL,,,,,,,,,,,,United States,California,San Diego,,South end of San Diego Bay.,,0,,32.59102,-117.11158,WGS84,1609,mak,,TOPO! v3.4.2,,,,,,,,unknownft.,,,,SD21110,43,f4292985-9eae-4454-bb7d-3160552eb06c,https://www.cch2.org/portal/collections/individual/index.php?occid=468983
1000036,RSA,POM,,PreservedSpecimen,886af347-8a43-4a4c-974d-0d67455429b1,,POM accession: 307800,Organism|Plantae|Viridiplantae|Streptophyta|Embryophyta|Tracheophyta|Spermatophytina|Magnoliopsida|Rosanae|Brassicales|Brassicaceae|Raphanus,Plantae,Tracheophyta,Magnoliopsida,Brassicales,Brassicaceae,Raphanus sativus,29702,L.,Raphanus,,sativus,,,Species,,,,,,,,Henry J. Ramsey,Henry J. Ramsey,2760,3/1/38,,1938,3,1,60,,,,,,,,,,,,,,,flowers & fruits,Cultivated,,,,,herbarium sheet,,,,,,United States,California,Los Angeles,,El Monte.,,0,,,,,,,,,,,,,,,,,,,T. Kim Nguyen; cataloged date: 2007-09-21,886af347-8a43-4a4c-974d-0d67455429b1,17,62ca8a3f-de22-47b9-b7a0-78e8e7b8591f,https://www.cch2.org/portal/collections/individual/index.php?occid=1000036
1368058,DAV,,,PreservedSpecimen,61e3fd42-d91e-4247-9c14-902cad7bd777,DAV310398,Accession #: DAV98673,Organism|Plantae|Viridiplantae|Streptophyta|Embryophyta|Tracheophyta|Spermatophytina|Magnoliopsida|Rosanae|Brassicales|Brassicaceae|Raphanus,Plantae,Tracheophyta,Magnoliopsida,Brassicales,Brassicaceae,Raphanus sativus,29702,L.,Raphanus,,sativus,,,Species,"Nancy Ryan Zabriskie, 20 Oct 1972",,,,,,,R. S. Woglum,,1996,8/29/38,,1938,8,29,241,,29-Aug-38,Los Angeles State and County Herbarium #3259. | Access Database Number (Deprecated): UCD115238,Growing on beach.,,,,,,,,,,,,,,,,,,,,,,,United States,California,Del Norte,,Del Norte County: south of Crescent City in north-central part of county.,,0,,41.675229,-123.933082,WGS84,14000,C. Walden,,GeoLocate,,,,,,,,,,,,UCD115238,39,61e3fd42-d91e-4247-9c14-902cad7bd777,https://www.cch2.org/portal/collections/individual/index.php?occid=1368058
2061578,CHSC,VascularPlants,,PreservedSpecimen,95b975b1-1508-4960-ac28-0563af2edf7e,CHSC000535,,Organism|Plantae|Viridiplantae|Streptophyta|Embryophyta|Tracheophyta|Spermatophytina|Magnoliopsida|Rosanae|Brassicales|Brassicaceae|Raphanus,Plantae,Tracheophyta,Magnoliopsida,Brassicales,Brassicaceae,Raphanus sativus,29702,L.,Raphanus,,sativus,,,Species,,,,,,,,S. Westerberg,,,3/9/38,,1938,3,9,68,,3/9/38,Vesta Holt label.,Red soil.,,,,,,,,,,,,,,,,,,,,,,,United States,California,San Bernardino,,Highlands.,,0,,34.128611,-117.208889,NAD83,8047,Bill Carlson,,UCBerkeley: 2007-2009 CCH GBIF georeferencing grant,,georef from 2006-2015 archive backup file; Date Georeferenced: Mon Dec 26 13:37:13 2011,,,,,,,,,preprocessed,,44,95b975b1-1508-4960-ac28-0563af2edf7e,https://www.cch2.org/portal/collections/individual/index.php?occid=2061578
4280169,OSC,V,,PreservedSpecimen,{D9FEAFD0-2B92-46B0-B7E3-22EA73C0B6CA},OSC-V-023819,OSC43634,Organism|Plantae|Viridiplantae|Streptophyta|Embryophyta|Tracheophyta|Spermatophytina|Magnoliopsida|Rosanae|Brassicales|Brassicaceae|Raphanus,Plantae,Tracheophyta,Magnoliopsida,Brassicales,Brassicaceae,Raphanus sativus,29702,L.,Raphanus,,sativus,,,Species,"Al-Shehbaz, I.",2016,,,,,,Louis Whitaker,L. Whitaker,s.n.,5/14/38,,1938,5,14,134,,5/14/38,,Roadside.,,,,,,,,,,,,wild collection,,,,,,,,,,,United States,Oregon,Benton,,W. of Corvallis.,,0,,44.5717,-123.3639,,4828,[automated process-OregonFlora/OSU Herb],OregonFlora 1994-2020 methodology,"OrlookId: 70930, StateProvince: Oregon, County: Benton, LocName: Corvallis, W of",,,,,,,,,,,,4436571,81,93393512-92ce-42de-8ea4-25e69ebf446d,https://www.cch2.org/portal/collections/individual/index.php?occid=4280169
108810,SBBG,,,PreservedSpecimen,993b39be-761c-41ef-8469-56039eb37196,SBBG213812,SBBG_old: 72196,Organism|Plantae|Viridiplantae|Streptophyta|Embryophyta|Tracheophyta|Spermatophytina|Magnoliopsida|Rosanae|Brassicales|Brassicaceae|Raphanus,Plantae,Tracheophyta,Magnoliopsida,Brassicales,Brassicaceae,Raphanus raphanistrum,29701,L.,Raphanus,,raphanistrum,,,Species,,,,,,,,P. Bartholomew,,,5/15/39,,1939,5,15,135,,5/15/39,,,,,,,,,,,,,Flowers Present; Fruit Present,,,,,,,,,,,,United States,California,Santa Barbara,,Los Padres National Forest; upper Camuesa Camp Rd,,0,,34.50872,-119.57732,WGS84,402,Rancho Santa Ana (no. 8),,Rancho Santa Ana: 2007-2009 CCH GBIF georeferencing grant,,georef from 2006-2015 archive backup file; Date Georeferenced: Mon Dec 26 13:37:13 2011,,,,,,,,,alejanneros,,16,9a3918e4-7c2c-46c9-83c6-9b805e77841c,https://www.cch2.org/portal/collections/individual/index.php?occid=108810
610288,SFV,,,PreservedSpecimen,4def0b94-d018-4f46-b482-0bc3f1d68a7a,SFV104572,SFV-1506,Organism|Plantae|Viridiplantae|Streptophyta|Embryophyta|Tracheophyta|Spermatophytina|Magnoliopsida|Rosanae|Brassicales|Brassicaceae|Raphanus,Plantae,Tracheophyta,Magnoliopsida,Brassicales,Brassicaceae,Raphanus raphanistrum,29701,L.,Raphanus,,raphanistrum,,,Species,M. L. Vincent,,,,,,,L. R. Abrams,,13822,7/17/39,,1939,7,17,198,,17-Jul-39,,,,,,,,,,,,,Flowering & Fruiting,Wild: native/naturalized,,,,,,,,,,,United States,California,Santa Clara,,Santa Cruz Mountains; Railway at Laurel.,,0,,,,,,,,,,,,,,,,,,,JNH,,41,4def0b94-d018-4f46-b482-0bc3f1d68a7a,https://www.cch2.org/portal/collections/individual/index.php?occid=610288
3904076,LA,,,PreservedSpecimen,b4a807f7-5a42-4578-a46f-30d20fb561d1,LA00606056,,Organism|Plantae|Viridiplantae|Streptophyta|Embryophyta|Tracheophyta|Spermatophytina|Magnoliopsida|Rosanae|Brassicales|Brassicaceae|Raphanus,Plantae,Tracheophyta,Magnoliopsida,Brassicales,Brassicaceae,Raphanus raphanistrum,29701,L.,Raphanus,,raphanistrum,,,Species,,,,,,,,Harlan Lewis,,,4/7/39,,1939,4,7,97,,,,,,,,,,,,,,,,,,,,,,,,,,,,,,,,,0,,,,,,,,,,,,,,,,,,,abaniaga,,34,b4a807f7-5a42-4578-a46f-30d20fb561d1,https://www.cch2.org/portal/collections/individual/index.php?occid=3904076
75275,SBBG,,,PreservedSpecimen,55ad9033-b518-4ce5-9813-53a21cd009c3,SBBG155532,SBBG_old: 37749,Organism|Plantae|Viridiplantae|Streptophyta|Embryophyta|Tracheophyta|Spermatophytina|Magnoliopsida|Rosanae|Brassicales|Brassicaceae|Raphanus,Plantae,Tracheophyta,Magnoliopsida,Brassicales,Brassicaceae,Raphanus sativus,29702,L.,Raphanus,,sativus,,,Species,,,,,,,,M. B. Dunkle,,8630,8/15/39,,1939,8,15,227,,8/15/39,,grassy bank,,,,,,,,herbariumSpecimenDuplicate: https://www.cch2.org/portal/collections/individual/index.php?guid=DBBFDF38-71F6-424B-B5F4-F7B0A260ED6F | herbariumSpecimenDuplicate: https://www.cch2.org/portal/collections/individual/index.php?guid=77960bfd-90d7-4a7b-a258-e1dfe92827eb,,,Flowers Present; Fruit Present,,,,,,,,,,,,United States,California,Santa Barbara,,Santa Cruz Island: main ranch,,0,,33.9955,-119.715,NAD83,1500,dwilken,,MyTopo,,,,,,,,,,,,,16,b7798d8a-2b15-4d81-824f-be5169d27962,https://www.cch2.org/portal/collections/individual/index.php?occid=75275
469016,SD,,,PreservedSpecimen,DBBFDF38-71F6-424B-B5F4-F7B0A260ED6F,SD00062789,SD132661,Organism|Plantae|Viridiplantae|Streptophyta|Embryophyta|Tracheophyta|Spermatophytina|Magnoliopsida|Rosanae|Brassicales|Brassicaceae|Raphanus,Plantae,Tracheophyta,Magnoliopsida,Brassicales,Brassicaceae,Raphanus sativus,29702,L.,Raphanus,,sativus,,,Species,,,,,,,,M. B. Dunkle,,8630,8/15/39,,1939,8,15,227,,8/15/39,,Grassy bank.,,,,,,,,herbariumSpecimenDuplicate: https://www.cch2.org/portal/collections/individual/index.php?guid=55ad9033-b518-4ce5-9813-53a21cd009c3 | herbariumSpecimenDuplicate: https://www.cch2.org/portal/collections/individual/index.php?guid=77960bfd-90d7-4a7b-a258-e1dfe92827eb,,,FFL,,,,,,,,,,,,United States,California,Santa Barbara,,Santa Cruz Island; main ranch.,,0,,33.99528,-119.71544,WGS84,,n/a,,Coordinates from label,,n/a,,,,,,unknownft.,,,,SD132661,43,4080df59-25ff-4d08-ae49-8feec52dc7b0,https://www.cch2.org/portal/collections/individual/index.php?occid=469016
639302,RSA,RSA,,PreservedSpecimen,00cec93f-091f-46f4-a010-4c474edfef3c,,RSA accession: 431497,Organism|Plantae|Viridiplantae|Streptophyta|Embryophyta|Tracheophyta|Spermatophytina|Magnoliopsida|Rosanae|Brassicales|Brassicaceae|Raphanus,Plantae,Tracheophyta,Magnoliopsida,Brassicales,Brassicaceae,Raphanus sativus,29702,L.,Raphanus,,sativus,,,Species,,,,,,,,Nellie V. Haynie,,3659,6/6/39,,1939,6,6,157,,,,,,Sandy roadside.,,,,,,,,,flowers & fruits,Introduced,,,,,herbarium sheet,,,,,,United States,California,Monterey,,Pacific Grove.,,0,,,,,,,,,,,,,,,,,,,Jackie C. McConnaughy; cataloged date: 2012-04-13,00cec93f-091f-46f4-a010-4c474edfef3c,17,b25059e5-b635-452c-ad68-538588ea4a82,https://www.cch2.org/portal/collections/individual/index.php?occid=639302
963330,RSA,RSA,,PreservedSpecimen,7705d86a-61c4-4b96-b888-715dbfc30830,,RSA accession: 431501,Organism|Plantae|Viridiplantae|Streptophyta|Embryophyta|Tracheophyta|Spermatophytina|Magnoliopsida|Rosanae|Brassicales|Brassicaceae|Raphanus,Plantae,Tracheophyta,Magnoliopsida,Brassicales,Brassicaceae,Raphanus sativus,29702,L.,Raphanus,,sativus,,,Species,,,,,,,,Edith Allen,,s.n,7/3/39,,1939,7,3,184,,,,,,,,,,,,,,,flowers & fruits,Cultivated,,,,,herbarium sheet,,,,,,United States,California,San Bernardino,,Big Bear.,,0,,,,,,,,,,,,,,,,,,,T. Kim Nguyen; cataloged date: 2007-09-21,7705d86a-61c4-4b96-b888-715dbfc30830,17,08366ab4-f891-440f-9b97-221e9936d32b,https://www.cch2.org/portal/collections/individual/index.php?occid=963330
964523,RSA,RSA,,PreservedSpecimen,77960bfd-90d7-4a7b-a258-e1dfe92827eb,,RSA accession: 431506,Organism|Plantae|Viridiplantae|Streptophyta|Embryophyta|Tracheophyta|Spermatophytina|Magnoliopsida|Rosanae|Brassicales|Brassicaceae|Raphanus,Plantae,Tracheophyta,Magnoliopsida,Brassicales,Brassicaceae,Raphanus sativus,29702,L.,Raphanus,,sativus,,,Species,,,,,,,,M. B. Dunkle,,8630,8/15/39,,1939,8,15,227,,,,grassy bank,,,,,,,,herbariumSpecimenDuplicate: https://www.cch2.org/portal/collections/individual/index.php?guid=55ad9033-b518-4ce5-9813-53a21cd009c3 | herbariumSpecimenDuplicate: https://www.cch2.org/portal/collections/individual/index.php?guid=DBBFDF38-71F6-424B-B5F4-F7B0A260ED6F,,,flowers & fruits,Cultivated,,,,,herbarium sheet,,,,,,United States,California,Santa Barbara,,Santa Cruz Island. Main Ranch.,,0,,,,,,,,,,,,,,,,,,,T. Kim Nguyen; cataloged date: 2007-09-21,77960bfd-90d7-4a7b-a258-e1dfe92827eb,17,ef68cc36-9d55-4bd4-8836-677779eb91db,https://www.cch2.org/portal/collections/individual/index.php?occid=964523
2916054,PASA,,,PreservedSpecimen,,PASA_2074,,Organism|Plantae|Viridiplantae|Streptophyta|Embryophyta|Tracheophyta|Spermatophytina|Magnoliopsida|Rosanae|Brassicales|Brassicaceae|Raphanus,Plantae,Tracheophyta,Magnoliopsida,Brassicales,Cruciferae,Raphanus sativus,29702,L.,Raphanus,,sativus,,,Species,,,,,wild radish,,,,,,4/28/39,,1939,4,28,118,,28-Apr-39,,,,,,,,,,,,,,,,,,,,,,,,,United States,California,Los Angeles,,Claremont,,0,,,,,,,,,,,,,,,,,,,,,49,3e87003b-eef3-4831-b584-315e7b1af4c1,https://www.cch2.org/portal/collections/individual/index.php?occid=2916054
4263197,OSC,V,,PreservedSpecimen,{40279EBF-77F8-4D23-98A8-0C2573FF44EE},OSC-V-023829,OSC80770,Organism|Plantae|Viridiplantae|Streptophyta|Embryophyta|Tracheophyta|Spermatophytina|Magnoliopsida|Rosanae|Brassicales|Brassicaceae|Raphanus,Plantae,Tracheophyta,Magnoliopsida,Brassicales,Brassicaceae,Raphanus sativus,29702,L.,Raphanus,,sativus,,,Species,"Al-Shehbaz, I.",2016,,,,,,Taini Lammi,T. Lammi,s.n.,6/30/39,,1939,6,30,181,,6/30/39,,,,,,,,,,,,,,wild collection,,,,,,,,,,,United States,Oregon,Coos,,N of Charleston.,,0,,43.36926,-124.28401,,4828,Stephen C. Meyers,OregonFlora 1994-2020 methodology,"OrlookId: 100100, StateProvince: Oregon, County: Coos, LocName: Charleston, N of",,,,,,,,,,,,4437195,81,0a126db1-6b96-4c5b-8798-15b7ac56c253,https://www.cch2.org/portal/collections/individual/index.php?occid=4263197
4340968,OSC,V,,PreservedSpecimen,{FD385B0A-40BE-4B2F-BCCD-8CA884B22023},,ORE40999,Organism|Plantae|Viridiplantae|Streptophyta|Embryophyta|Tracheophyta|Spermatophytina|Magnoliopsida|Rosanae|Brassicales|Brassicaceae|Raphanus,Plantae,Tracheophyta,Magnoliopsida,Brassicales,Brassicaceae,Raphanus sativus,29702,L.,Raphanus,,sativus,,,Species,Clover Park Jr-Sr High,1939,,,,,,Clover Park High School,Clover Park School,s.n.,8/2/39,,1939,8,2,214,,8/2/39,,Highways.,,,,,,,,,,,,,,,,,,,,,,,United States,Washington,Pierce,,Interlaaken (?),,0,,,,,,,,,,,,,,,,,,,,1111352,81,aff1f1b1-e158-45df-91ab-fed34d1484b4,https://www.cch2.org/portal/collections/individual/index.php?occid=4340968
869110,RSA,RSA,,PreservedSpecimen,540851f2-6aee-4886-86f9-1e79f0eeab76,RSA0018131,RSA accession: 805368,Organism|Plantae|Viridiplantae|Streptophyta|Embryophyta|Tracheophyta|Spermatophytina|Magnoliopsida|Rosanae|Brassicales|Brassicaceae|Raphanus,Plantae,Tracheophyta,Magnoliopsida,Brassicales,Brassicaceae,Raphanus raphanistrum,29701,L.,Raphanus,,raphanistrum,,,Species,R. F. Thorne,6/23/40,,,,,,R. F. Thorne,,s.n.,6/23/40,,1940,6,23,175,,,,Highway,,,,,,,,,,,,Introduced,,,,,herbarium sheet,,,,,,United States,New Jersey,Monmouth,,Belmar.,,0,,,,,,,,,,,,,,,,,,,Jennifer G. Pilapil; cataloged date: 2012-11-15,540851f2-6aee-4886-86f9-1e79f0eeab76,17,1598cce8-9a17-4772-b8cb-b2cf873e0609,https://www.cch2.org/portal/collections/individual/index.php?occid=869110
1045565,RSA,RSA,,PreservedSpecimen,9e35d0bd-2a83-4780-bb66-78078cb89363,RSA0016375,RSA accession: 805207,Organism|Plantae|Viridiplantae|Streptophyta|Embryophyta|Tracheophyta|Spermatophytina|Magnoliopsida|Rosanae|Brassicales|Brassicaceae|Raphanus,Plantae,Tracheophyta,Magnoliopsida,Brassicales,Brassicaceae,Raphanus raphanistrum,29701,L.,Raphanus,,raphanistrum,,,Species,R. F. Thorne,6/30/40,,,,,,R. F. Thorne,,s.n.,6/30/40,,1940,6,30,182,,,,,,,,,,,,,,,,Introduced,,,,,herbarium sheet,,,,,,United States,New Jersey,Monmouth,,Belmar: City Dump.,,0,,,,,,,,,,,,,,,,,,,Jennifer G. Pilapil; cataloged date: 2012-12-03,9e35d0bd-2a83-4780-bb66-78078cb89363,17,e9e32959-1de4-4257-ae6f-2631e5a79222,https://www.cch2.org/portal/collections/individual/index.php?occid=1045565
3792179,FSC,,,PreservedSpecimen,c269bfab-3dee-4514-a20b-f444a242fa2a,FSC0010464,,Organism|Plantae|Viridiplantae|Streptophyta|Embryophyta|Tracheophyta|Spermatophytina|Magnoliopsida|Rosanae|Brassicales|Brassicaceae|Raphanus,Plantae,Tracheophyta,Magnoliopsida,Brassicales,Brassicaceae,Raphanus raphanistrum,29701,L.,Raphanus,,raphanistrum,,,Species,,,,,,,,J. P. Eich,,,4/2/40,,1940,4,2,93,,2-Apr-40,,"Clay soil, very wet",,,,,,,,,,,,,,,,,,,,,,,United States,California,Madera,,Yosemite rd. 2 mi NE of Laves Bridge.,,0,,,,,,,,,,,,,,,,,,en,pawanpreetgill5,,38,c269bfab-3dee-4514-a20b-f444a242fa2a,https://www.cch2.org/portal/collections/individual/index.php?occid=3792179
468985,SD,,,PreservedSpecimen,1217F8A9-830D-44B5-BDDF-3EF6507F30C1,SD00062743,SD26576,Organism|Plantae|Viridiplantae|Streptophyta|Embryophyta|Tracheophyta|Spermatophytina|Magnoliopsida|Rosanae|Brassicales|Brassicaceae|Raphanus,Plantae,Tracheophyta,Magnoliopsida,Brassicales,Brassicaceae,Raphanus sativus,29702,L.,Raphanus,,sativus,,,Species,"Darin L. Banks, 1997",,,,,,,Frank F. Gander,,7977,3/30/40,,1940,3,30,90,,3/30/40,,,,,,,,,,,,,FFL,,,,,,,,,,,,United States,California,San Diego,,"Hormiguero Ranch,",,0,,33.39493,-117.0338,WGS84,1609,mak,,"TOPO! v3.4.2, Place names of San Diego County by Durham",,,,,,,,unknownft.,,,,SD26576,43,a544ef3f-014c-4935-a2c8-86628d62027a,https://www.cch2.org/portal/collections/individual/index.php?occid=468985
468986,SD,,,PreservedSpecimen,5F6C8C7B-DBC5-4CC9-8CE4-78270F87D1D7,SD00062669,SD26957,Organism|Plantae|Viridiplantae|Streptophyta|Embryophyta|Tracheophyta|Spermatophytina|Magnoliopsida|Rosanae|Brassicales|Brassicaceae|Raphanus,Plantae,Tracheophyta,Magnoliopsida,Brassicales,Brassicaceae,Raphanus sativus,29702,L.,Raphanus,,sativus,,,Species,,,,,,,,Frank F. Gander,,8292,4/18/40,,1940,4,18,109,,4/18/40,,,,,,,,,,,,,FFL,,,,,,,,,,,,United States,California,San Diego,,Herron Ranch near DeLuz.,,0,,33.43751,-117.32043,WGS84,,n/a,,Coordinates from label,,Do not know where this ranch is,,,,,,unknownft.,,,,SD26957,43,48e87009-94e2-4bd1-8276-36cea1971adb,https://www.cch2.org/portal/collections/individual/index.php?occid=468986
468987,SD,,,PreservedSpecimen,6C7B4EE7-F755-4492-89AA-6DF09573D1EA,SD00062668,SD27136,Organism|Plantae|Viridiplantae|Streptophyta|Embryophyta|Tracheophyta|Spermatophytina|Magnoliopsida|Rosanae|Brassicales|Brassicaceae|Raphanus,Plantae,Tracheophyta,Magnoliopsida,Brassicales,Brassicaceae,Raphanus sativus,29702,L.,Raphanus,,sativus,,,Species,,,,,,,,Frank F. Gander,,8473,5/2/40,,1940,5,2,123,,5/2/40,,,,,,,,,,,,,FFL,,,,,,,,,,,,United States,California,San Diego,,O'Neill Lake,,0,,33.33047,-117.32216,WGS84,1609,mak,,TOPO! v3.4.2,,Field notes say also Santa Margarita Ranch,,,,,,unknownft.,,,,SD27136,43,7e18171e-6edd-4554-adbd-35426e84c173,https://www.cch2.org/portal/collections/individual/index.php?occid=468987
1092827,RSA,RSA,,PreservedSpecimen,b4c77892-b0d0-4f3b-b169-384b34e642ef,,RSA accession: 431494,Organism|Plantae|Viridiplantae|Streptophyta|Embryophyta|Tracheophyta|Spermatophytina|Magnoliopsida|Rosanae|Brassicales|Brassicaceae|Raphanus,Plantae,Tracheophyta,Magnoliopsida,Brassicales,Brassicaceae,Raphanus sativus,29702,L.,Raphanus,,sativus,,,Species,,,,,,,,D. G. Nichols,,2,3/30/40,,1940,3,30,90,,,,,,Artificial land in swampy area. Corolla purplish.,,,,,,,,,flowers & fruits,Introduced,,,,,herbarium sheet,,,,,,United States,California,Alameda,,"KRE pond, foot Ashby Ave, Berkeley.",,0,,37.8585,-122.2773611,,,,,,,,0,,,,,,,,Jackie C. McConnaughy; cataloged date: 2012-04-13,b4c77892-b0d0-4f3b-b169-384b34e642ef,17,93a4c946-34b6-4e8f-891e-8dd03e151381,https://www.cch2.org/portal/collections/individual/index.php?occid=1092827
1171088,RSA,RSA,,PreservedSpecimen,da2f0f36-0df1-459f-a621-31d249901d32,,RSA accession: 431486,Organism|Plantae|Viridiplantae|Streptophyta|Embryophyta|Tracheophyta|Spermatophytina|Magnoliopsida|Rosanae|Brassicales|Brassicaceae|Raphanus,Plantae,Tracheophyta,Magnoliopsida,Brassicales,Brassicaceae,Raphanus sativus,29702,L.,Raphanus,,sativus,,,Species,,,,,,,,Vesta Bruner,,s.n.,1940-05-00,,1940,5,0,,,1940-05,,Open field,,,,,,,,,,,flowers & fruits,Cultivated,,,,,herbarium sheet,,,,,,United States,California,Los Angeles,,Palo Verde.,,0,,,,,,,,,,,,,,,,,,,T. Kim Nguyen; cataloged date: 2007-09-19,da2f0f36-0df1-459f-a621-31d249901d32,17,7c4fe50b-03df-4007-a572-ebc72feeddc7,https://www.cch2.org/portal/collections/individual/index.php?occid=1171088
469010,SD,,,PreservedSpecimen,FF411FFF-B6AB-495F-922F-B85C1C86648D,SD00062563,SD113141,Organism|Plantae|Viridiplantae|Streptophyta|Embryophyta|Tracheophyta|Spermatophytina|Magnoliopsida|Rosanae|Brassicales|Brassicaceae|Raphanus,Plantae,Tracheophyta,Magnoliopsida,Brassicales,Brassicaceae,Raphanus raphanistrum,29701,L.,Raphanus,,raphanistrum,,,Species,,,,,,,,Darley F. Howe,,1048,2/16/41,,1941,2,16,47,,2/16/41,,,,,,,,,,,,,FFL,,,,,,,,,,,,United States,California,San Diego,,Near Otay,,0,,32.58927,-117.053,WGS84,,n/a,,Coordinates from label,,"Which Otay, mountain or mesa",,,,,,unknownft.,,,,SD113141,43,2701682f-3a16-420a-a494-5051b559b38f,https://www.cch2.org/portal/collections/individual/index.php?occid=469010
1068117,RSA,RSA,,PreservedSpecimen,a8f2b342-74b9-4bea-8873-295f71ae4780,,RSA accession: 431510,Organism|Plantae|Viridiplantae|Streptophyta|Embryophyta|Tracheophyta|Spermatophytina|Magnoliopsida|Rosanae|Brassicales|Brassicaceae|Raphanus,Plantae,Tracheophyta,Magnoliopsida,Brassicales,Brassicaceae,Raphanus raphanistrum,29701,L.,Raphanus,,raphanistrum,,,Species,,,,,,,,R. S. Woglum,,2989,4/27/41,,1941,4,27,117,,,,,,,,,,,,,,,flowers & fruits,Introduced,,,,,herbarium sheet,,,,,,United States,California,San Joaquin,,San Joaquin Valley: Lodi.,,0,,,,,,,,,,,,,,,,,,,Jackie C. McConnaughy; cataloged date: 2012-04-13,a8f2b342-74b9-4bea-8873-295f71ae4780,17,922ff251-139d-44f1-9cf9-71086f09fef4,https://www.cch2.org/portal/collections/individual/index.php?occid=1068117
5084121,RSA,VascularPlants,,PreservedSpecimen,3081b102-3466-46ba-b5ad-d1f6d2d4da38,RSA0335004,RSA accession: 893464,Organism|Plantae|Viridiplantae|Streptophyta|Embryophyta|Tracheophyta|Spermatophytina|Magnoliopsida|Rosanae|Brassicales|Brassicaceae|Raphanus,Plantae,Tracheophyta,Magnoliopsida,Brassicales,Brassicaceae,Raphanus raphanistrum,29701,L.,Raphanus,,raphanistrum,,,Species,Paul H. Wood,s.d.,Munz key used.,,,,,Paul H. Wood,,s.n.,4/20/41,,1941,4,20,110,,20-Apr-41,,Open roadsides.,,,,,,[Acquisition: 2021-0017],,,,,flowers & fruits,,,,,,herbarium sheet,,,,,,United States,California,Los Angeles,,Whittier.,,,,,,,,,,,,,,,,,,,,,eberkowitz,,17,3081b102-3466-46ba-b5ad-d1f6d2d4da38,https://www.cch2.org/portal/collections/individual/index.php?occid=5084121
1368036,DAV,,,PreservedSpecimen,cbc60367-4635-4ac7-a69a-77543189eb40,DAV310432,Accession #: DAV2637,Organism|Plantae|Viridiplantae|Streptophyta|Embryophyta|Tracheophyta|Spermatophytina|Magnoliopsida|Rosanae|Brassicales|Brassicaceae|Raphanus,Plantae,Tracheophyta,Magnoliopsida,Brassicales,Brassicaceae,Raphanus sativus,29702,L.,Raphanus,,sativus,,,Species,,,,,,,,R. N. Raynor,,s.n.,5/20/41,,1941,5,20,140,,20-May-41,Access Database Number (Deprecated): UCD115215,Growing in grain field.,,,,,,,,,,,,,,,,,,,,,,,United States,California,Stanislaus,,Stanislaus County: Montpelier.,,0,,,,,,,,,,,,,,,,,,,,UCD115215,39,cbc60367-4635-4ac7-a69a-77543189eb40,https://www.cch2.org/portal/collections/individual/index.php?occid=1368036
5084126,RSA,VascularPlants,,PreservedSpecimen,f94753b2-9ff5-4961-a273-e20c655667fe,RSA0335003,RSA accession: 893465,Organism|Plantae|Viridiplantae|Streptophyta|Embryophyta|Tracheophyta|Spermatophytina|Magnoliopsida|Rosanae|Brassicales|Brassicaceae|Raphanus,Plantae,Tracheophyta,Magnoliopsida,Brassicales,Brassicaceae,Raphanus sativus,29702,L.,Raphanus,,sativus,,,Species,Paul H. Wood,s.d.,Munz key used.,,,,,Paul H. Wood,,s.n.,4/18/41,,1941,4,18,108,,18-Apr-41,,Common in waste places.,,,,,,[Acquisition: 2021-0017],,,,,flowers,,,,,,herbarium sheet,,,,,,United States,California,Los Angeles,,Whittier Field.,,,,,,,,,,,,,,,,,,,,,eberkowitz,,17,f94753b2-9ff5-4961-a273-e20c655667fe,https://www.cch2.org/portal/collections/individual/index.php?occid=5084126
1367984,DAV,,,PreservedSpecimen,3f44d085-4d11-4201-bbe8-fdcedf38fbf4,DAV300681,Accession #: DAV50527,Organism|Plantae|Viridiplantae|Streptophyta|Embryophyta|Tracheophyta|Spermatophytina|Magnoliopsida|Rosanae|Brassicales|Brassicaceae|Raphanus,Plantae,Tracheophyta,Magnoliopsida,Brassicales,Brassicaceae,Raphanus raphanistrum,29701,L.,Raphanus,,raphanistrum,,,Species,E. Crum,,,,,,,H. W. Grinnell,,1148,1942-00-00,,1942,0,0,,,6-9 Apr 1942,Access Database Number (Deprecated): UCD115156,,,,,,,,,,,,,,,,,,,,,,,,United States,California,Monterey,,Monterey County: Berglund Ranch near Corralitos.,,0,,37.006941,-121.837128,WGS84,660,,,,,,366,,,,,1200ft,,,,UCD115156,39,3f44d085-4d11-4201-bbe8-fdcedf38fbf4,https://www.cch2.org/portal/collections/individual/index.php?occid=1367984
89884,SBBG,,,PreservedSpecimen,72ce64d2-97fd-46e6-beec-7b1f7397f4a4,SBBG213826,SBBG_old: 72195,Organism|Plantae|Viridiplantae|Streptophyta|Embryophyta|Tracheophyta|Spermatophytina|Magnoliopsida|Rosanae|Brassicales|Brassicaceae|Raphanus,Plantae,Tracheophyta,Magnoliopsida,Brassicales,Brassicaceae,Raphanus sativus,29702,L.,Raphanus,,sativus,,,Species,,,,,,,,R. H. Nordhoff,,,3/6/42,,1942,3,6,65,,3/6/42,,field,,,,,,,,,,,Flowers Present,,,,,,,,,,,,United States,California,Santa Barbara,,Santa Ynez Mtns: top of San Marcos Pass,,0,,34.512,-119.8236,WGS84,1000,,,GeoLocate,,,,,,,,,,,,,16,4cd79aed-7cde-4d66-9cf4-3a173204ad1f,https://www.cch2.org/portal/collections/individual/index.php?occid=89884
36646,SBBG,,,PreservedSpecimen,07abd657-dd88-45c6-af4c-e664eb6e8c03,SBBG213820,SBBG_old: 86686,Organism|Plantae|Viridiplantae|Streptophyta|Embryophyta|Tracheophyta|Spermatophytina|Magnoliopsida|Rosanae|Brassicales|Brassicaceae|Raphanus,Plantae,Tracheophyta,Magnoliopsida,Brassicales,Brassicaceae,Raphanus sativus,29702,L.,Raphanus,,sativus,,,Species,,,,,,,,Clifton F. Smith,,27,9/2/43,,1943,9,2,245,,9/2/43,,field,,1 ft tall,,,,,,,,,Flowers Present; Fruit Present,,,,,,,,,,,,United States,California,Santa Barbara,,"Santa Ynez Mtns: N end of Cheltenham Rd above Tunnel Rd, Mission Cyn",,0,,34.453,-119.712,NAD83,1000,Rancho Santa Ana (no. 8),,MyTopo,,georef from 2006-2015 archive backup file; Date Georeferenced: Mon Dec 26 13:37:13 2011,,,,,,,,,alejanneros,,16,d95f907c-3cb3-4e58-b52d-4fcb132382cb,https://www.cch2.org/portal/collections/individual/index.php?occid=36646
49117,SBBG,,,PreservedSpecimen,211a7734-3521-4713-bd10-a9f84118e1e9,SBBG213827,SBBG_old: 86732,Organism|Plantae|Viridiplantae|Streptophyta|Embryophyta|Tracheophyta|Spermatophytina|Magnoliopsida|Rosanae|Brassicales|Brassicaceae|Raphanus,Plantae,Tracheophyta,Magnoliopsida,Brassicales,Brassicaceae,Raphanus sativus,29702,L.,Raphanus,,sativus,,,Species,,,,,,,,Clifton F. Smith,,,9/10/43,,1943,9,10,253,,9/10/43,,field,,,,,,,,,,,Flowers Present,,,,,,,,,,,,United States,California,Santa Barbara,,"Santa Ynez Mtns: N end of Cheltenham Rd at Montrose Place above Tunnel Rd, Mission Cyn",,0,,34.453,-119.712,NAD83,1000,Rancho Santa Ana (no. 8),,MyTopo,,georef from 2006-2015 archive backup file; Date Georeferenced: Mon Dec 26 13:37:13 2011,,,,,,,,,alejanneros,,16,0ece5df7-a58b-4094-98c4-b79ab04a8a87,https://www.cch2.org/portal/collections/individual/index.php?occid=49117
734125,RSA,RSA,,PreservedSpecimen,2dccc2e8-9a83-476f-b602-d38f3eeea723,,RSA accession: 431490,Organism|Plantae|Viridiplantae|Streptophyta|Embryophyta|Tracheophyta|Spermatophytina|Magnoliopsida|Rosanae|Brassicales|Brassicaceae|Raphanus,Plantae,Tracheophyta,Magnoliopsida,Brassicales,Brassicaceae,Raphanus sativus,29702,L.,Raphanus,,sativus,,,Species,,,,,,,,B. E. Burch,,s.n.,1943-07-00,,1943,7,0,,,1943-07,,Sandy loam.,,,,,,,,,,,flowers & fruits,Cultivated,,,,,herbarium sheet,,,,,,United States,California,Los Angeles,,Redondo Beach.,,0,,,,,,,,,,,,,,,,,,,T. Kim Nguyen; cataloged date: 2007-09-21,2dccc2e8-9a83-476f-b602-d38f3eeea723,17,a5e8d93c-eea5-4058-9da4-7c4ae042a930,https://www.cch2.org/portal/collections/individual/index.php?occid=734125
1368038,DAV,,,PreservedSpecimen,UCD115217,,Accession #: DAV10561,Organism|Plantae|Viridiplantae|Streptophyta|Embryophyta|Tracheophyta|Spermatophytina|Magnoliopsida|Rosanae|Brassicales|Brassicaceae|Raphanus,Plantae,Tracheophyta,Magnoliopsida,Brassicales,Brassicaceae,Raphanus sativus,29702,L.,Raphanus,,sativus,,,Species,,,,,,,,Bob Rodin,,193,5/14/43,,1943,5,14,134,,14-May-43,Access Database Number (Deprecated): UCD115217,Moist Places.,,Common weed.,,,,,,herbariumSpecimenDuplicate: https://www.cch2.org/portal/collections/individual/index.php?guid=83583a9a-0d12-4aa4-bcf5-de5c2864f8e6,,,,,,,,,,,,,,,United States,California,Alameda,,"Alameda County: Strawberry Canyon, University of California, Berkeley campus.",,0,,37.87645,-122.23793,NAD27,1255,San Jose S.U. A,,Terrain Navigator 5.03 1:24000 (copied from JEPS113080),,Date Georeferenced: Sun Nov 25 21:10:41 2012,,,,,,,,,dvadsich,UCD115217,39,729c1d8c-018e-4436-b3d6-b28bf91a2be7,https://www.cch2.org/portal/collections/individual/index.php?occid=1368038
2299319,CAS,BOT-BC,,PreservedSpecimen,urn:catalog:CAS:BOT-BC:74251,74251,urn:catalog:CAS:BOT:341230,Organism|Plantae|Viridiplantae|Streptophyta|Embryophyta|Tracheophyta|Spermatophytina|Magnoliopsida|Rosanae|Brassicales|Brassicaceae|Raphanus,Plantae,Tracheophyta,Magnoliopsida,Brassicales,Brassicaceae,Raphanus sativus,29702,L.,Raphanus,,sativus,,,Species,Ihsan A. Al-Shehbaz,2010-01,,,,,,"Bracelin, Nina Floy",,2461,4/4/43,,1943,4,4,94,,4-Apr-43,"Native of Europe, nationalized in California and Adelante, 3-5 feet high. Flower white, yellow, violet with purple veinings.",,,,,,,,,,,,,,,,,,,,North America,,,,United States,California,Alameda County,,The Garden of Anson and Anita Blake. Berkeley.,,0,,37.9134,-122.2851,WGS84,200,,GoogleMaps via BerkeleyMapper (copied from NY24346),,,,,,,,,,,en,,urn:catalog:CAS:BOT-BC:74251,1,16946f9a-ca2e-4380-9d8f-87913e34c2b7,https://www.cch2.org/portal/collections/individual/index.php?occid=2299319
2423815,CAS,BOT-BC,,PreservedSpecimen,urn:catalog:CAS:BOT-BC:74252,74252,urn:catalog:CAS:BOT:341228,Organism|Plantae|Viridiplantae|Streptophyta|Embryophyta|Tracheophyta|Spermatophytina|Magnoliopsida|Rosanae|Brassicales|Brassicaceae|Raphanus,Plantae,Tracheophyta,Magnoliopsida,Brassicales,Brassicaceae,Raphanus sativus,29702,L.,Raphanus,,sativus,,,Species,Ihsan A. Al-Shehbaz,2010-01,,,,,,"Bracelin, Nina Floy",,2462,4/4/43,,1943,4,4,94,,4-Apr-43,"Native of Europe, nationalized in California and Adelante, 3-5 feet high. Flower white, yellow, violet with purple veinings.",,,,,,,,,,,,,,,,,,,,North America,,,,United States,California,Alameda County,,The Garden of Anson and Anita Blake. Berkeley.,,0,,37.9134,-122.2851,WGS84,200,,GoogleMaps via BerkeleyMapper (copied from NY24346),,,,,,,,,,,en,,urn:catalog:CAS:BOT-BC:74252,1,d10bda0c-bf11-4d37-b991-c8e40a2d3076,https://www.cch2.org/portal/collections/individual/index.php?occid=2423815
3286045,UCJEPS,VASC,,PreservedSpecimen,83583a9a-0d12-4aa4-bcf5-de5c2864f8e6,UC685672,,Organism|Plantae|Viridiplantae|Streptophyta|Embryophyta|Tracheophyta|Spermatophytina|Magnoliopsida|Rosanae|Brassicales|Brassicaceae|Raphanus,Plantae,Tracheophyta,Magnoliopsida,Brassicales,Brassicaceae,Raphanus sativus,29702,L.,Raphanus,,sativus,,,Species,,,,,,,,Bob Rodin,,193,5/14/43,,1943,5,14,134,,May 14 1943,,in moist places,,,,,,,,herbariumSpecimenDuplicate: https://www.cch2.org/portal/collections/individual/index.php?guid=UCD115217,,,Flowering/Fruiting,,,,,,,,,,,,United States,California,Alameda,,"Strawberry Canyon, University of California Campus, Berkeley Strawberry Canyon; Berkeley, University of California Campus",,0,,37.876453,-122.23793,NAD27,1254,,,Terrain Navigator 5.03 1:24000,,,,,,,,,,,,83583a9a-0d12-4aa4-bcf5-de5c2864f8e6,46,70a50447-5f09-47cc-8d0a-2f458aac9f22,https://www.cch2.org/portal/collections/individual/index.php?occid=3286045
4192251,OSC,V,,PreservedSpecimen,{631DB807-EBF1-4F0E-B238-23DB1592AE6E},,WILLU24700,Organism|Plantae|Viridiplantae|Streptophyta|Embryophyta|Tracheophyta|Spermatophytina|Magnoliopsida|Rosanae|Brassicales|Brassicaceae|Raphanus,Plantae,Tracheophyta,Magnoliopsida,Brassicales,Brassicaceae,Raphanus sativus,29702,L.,Raphanus,,sativus,,,Species,"Al-Shehbaz, I.",2016,,,,,,Morton E. Peck,M.E. Peck,22112,7/31/43,,1943,7,31,212,,7/31/43,,,,,,,,,,,,,flowering and fruiting,,,,,,,,,,,,United States,Oregon,Polk,,bar along Willamette R. West Salem.,,0,,44.9503,-123.0601,,4828,Lacey D. Yarbrough,OregonFlora 1994-2020 methodology,"OrlookId: 100486, StateProvince: Oregon, County: Polk, LocName: Willamette River, Polk Co., West Salem (subdivision)",,,,,,,,,,,,655397,81,4792518c-a561-41a4-b02b-f99d8d79b194,https://www.cch2.org/portal/collections/individual/index.php?occid=4192251
87856,SBBG,,,PreservedSpecimen,6eb973c6-e397-421e-925e-2d55a7899f32,SBBG213810,SBBG_old: 2547,Organism|Plantae|Viridiplantae|Streptophyta|Embryophyta|Tracheophyta|Spermatophytina|Magnoliopsida|Rosanae|Brassicales|Brassicaceae|Raphanus,Plantae,Tracheophyta,Magnoliopsida,Brassicales,Brassicaceae,Raphanus raphanistrum,29701,L.,Raphanus,,raphanistrum,,,Species,,,,,,,,Clifton F. Smith,,779,5/5/44,,1944,5,5,126,,5/5/44,,roadside,,,,,,,,herbariumSpecimenDuplicate: https://www.cch2.org/portal/collections/individual/index.php?guid=UCD115162,,,Flowers Present; Fruit Present,,,,,,,,,,,,United States,California,Santa Barbara,,"Tunnel Rd, Mission Cyn",,0,,34.454,-119.71,NAD83,1500,dwilken,,MyTopo,,,,,,,,,,,,,16,df7b9b06-ab37-4113-8227-e8693ed8d7d3,https://www.cch2.org/portal/collections/individual/index.php?occid=87856
1367988,DAV,,,PreservedSpecimen,UCD115162,DAV300683,Accession #: DAV16460,Organism|Plantae|Viridiplantae|Streptophyta|Embryophyta|Tracheophyta|Spermatophytina|Magnoliopsida|Rosanae|Brassicales|Brassicaceae|Raphanus,Plantae,Tracheophyta,Magnoliopsida,Brassicales,Brassicaceae,Raphanus raphanistrum,29701,L.,Raphanus,,raphanistrum,,,Species,,,,,,,,Clifton F. Smith,,779,5/5/44,,1944,5,5,126,,5-May-44,Access Database Number (Deprecated): UCD115162,,,,,,,,,herbariumSpecimenDuplicate: https://www.cch2.org/portal/collections/individual/index.php?guid=6eb973c6-e397-421e-925e-2d55a7899f32,,,,,,,,,,,,,,,United States,California,Santa Barbara,,"Sacramento County: Tunnel Road, Mission Canyon. City of Santa Barbara.",,0,,34.454,-119.71,NAD83,3000,Santa Barbara Botanic Garden A,,Terrain Nav. v. 8.7 (copied from SBBG2547),,,274,,,,,900ft,,,tcbarry,UCD115162,39,98555b39-91aa-4f7a-b341-b0f092dd5c03,https://www.cch2.org/portal/collections/individual/index.php?occid=1367988
3904073,LA,,,PreservedSpecimen,d16cd969-804e-480a-86a6-ffa2f3ca7712,LA00606054,LA85147,Organism|Plantae|Viridiplantae|Streptophyta|Embryophyta|Tracheophyta|Spermatophytina|Magnoliopsida|Rosanae|Brassicales|Brassicaceae|Raphanus,Plantae,Tracheophyta,Magnoliopsida,Brassicales,Brassicaceae,Raphanus raphanistrum,29701,L.,Raphanus,,raphanistrum,,,Species,,,,,,,,O.H. Kappler,,679,6/13/44,,1944,6,13,165,,,,,,,,,,,,,,,,,,,,,,,,,,,,,,,,,0,,,,,,,,,,,,,,,,,,,abaniaga,,34,d16cd969-804e-480a-86a6-ffa2f3ca7712,https://www.cch2.org/portal/collections/individual/index.php?occid=3904073
61217,SBBG,,,PreservedSpecimen,395e96e5-d3c0-443f-ba6a-35f507179e11,SBBG213824,SBBG_old: 2548,Organism|Plantae|Viridiplantae|Streptophyta|Embryophyta|Tracheophyta|Spermatophytina|Magnoliopsida|Rosanae|Brassicales|Brassicaceae|Raphanus,Plantae,Tracheophyta,Magnoliopsida,Brassicales,Brassicaceae,Raphanus sativus,29702,L.,Raphanus,,sativus,,,Species,,,,,,,,Clifton F. Smith,,435,1/9/44,,1944,1,9,9,,1/9/44,,hill,,,,,,,,herbariumSpecimenDuplicate: https://www.cch2.org/portal/collections/individual/index.php?guid=UCD115219,,,Flowers Present; Fruit Present,,,,,,,,,,,,United States,California,Santa Barbara,,"Santa Ynez Mtns: W of Botanic Garden, Mission Cyn",,0,,34.454,-119.711,NAD83,1000,dwilken,,MyTopo,,,,,,,,,,,,,16,ac451195-618c-4d33-a74f-5d1f081b4dd8,https://www.cch2.org/portal/collections/individual/index.php?occid=61217
110889,SBBG,,,PreservedSpecimen,9d774260-7905-48a5-8341-02f2df783cd9,SBBG213835,SBBG_old: 47443,Organism|Plantae|Viridiplantae|Streptophyta|Embryophyta|Tracheophyta|Spermatophytina|Magnoliopsida|Rosanae|Brassicales|Brassicaceae|Raphanus,Plantae,Tracheophyta,Magnoliopsida,Brassicales,Brassicaceae,Raphanus sativus,29702,L.,Raphanus,,sativus,,,Species,,,,,,,,N. C. Cooper,,1152,4/23/44,,1944,4,23,114,,4/23/44,,roadside & fields,,fls blue to white,,,,,,herbariumSpecimenDuplicate: https://www.cch2.org/portal/collections/individual/index.php?guid=e06b2907-8e60-436e-98ee-7d0bd02e3c3f | herbariumSpecimenDuplicate: https://www.cch2.org/portal/collections/individual/index.php?guid=e482e2f8-8e68-4dea-9d78-2cdc312fb988 | herbariumSpecimenDuplicate: https://www.cch2.org/portal/collections/individual/index.php?guid=a88f59c9-8ac9-42ca-a559-8a1efc84ffe6,,,,,,,,,,,,,,,United States,California,San Bernardino,,Pomona,,0,,34.05547,-117.74912,WGS84,3218,Rancho Santa Ana (no. 8),,Rancho Santa Ana: 2007-2009 CCH GBIF georeferencing grant,,georef from 2006-2015 archive backup file; Date Georeferenced: Mon Dec 26 13:37:13 2011,,,,,,,,,alejanneros,,16,9f51c780-bd8c-416a-98ca-149cd6b4a8aa,https://www.cch2.org/portal/collections/individual/index.php?occid=110889
130694,SBBG,,,PreservedSpecimen,c574e636-d1cb-4fe5-a1c4-45bfccec0cc4,SBBG213821,SBBG_old: 2549,Organism|Plantae|Viridiplantae|Streptophyta|Embryophyta|Tracheophyta|Spermatophytina|Magnoliopsida|Rosanae|Brassicales|Brassicaceae|Raphanus,Plantae,Tracheophyta,Magnoliopsida,Brassicales,Brassicaceae,Raphanus sativus,29702,L.,Raphanus,,sativus,,,Species,,,,,,,,Clifton F. Smith,,549,3/6/44,,1944,3,6,66,,3/6/44,,field on hill,,,,,,,,,,,Flowers Present,,,,,,,,,,,,United States,California,Santa Barbara,,"Santa Ynez Mtns: W of Botanic Garden, Mission Cyn",,0,,34.454,-119.711,NAD83,1000,dwilken,,MyTopo,,,,,,,,,,,,,16,c76eea48-70f7-4bba-814e-60e5d42395b9,https://www.cch2.org/portal/collections/individual/index.php?occid=130694
469012,SD,,,PreservedSpecimen,C4A67F5C-54CF-487D-9626-3C68D97317E7,SD00062667,SD113143,Organism|Plantae|Viridiplantae|Streptophyta|Embryophyta|Tracheophyta|Spermatophytina|Magnoliopsida|Rosanae|Brassicales|Brassicaceae|Raphanus,Plantae,Tracheophyta,Magnoliopsida,Brassicales,Brassicaceae,Raphanus sativus,29702,L.,Raphanus,,sativus,,,Species,,,,,,,,Darley F. Howe,,1242,7/21/44,,1944,7,21,203,,7/21/44,,,,,,,,,,,,,FFL,,,,,,,,,,,,United States,California,San Diego,,Cultivated ground 1.0 mile north of Otay.,,0,,32.61009,-117.06784,WGS84,,n/a,,Coordinates from label,,"Which Otay, mountain or mesa",,,,,,unknownft.,,,,SD113143,43,e7f1d8ac-cfff-4671-946f-890d13688eca,https://www.cch2.org/portal/collections/individual/index.php?occid=469012
681941,RSA,RSA,,PreservedSpecimen,15042995-e641-4bdb-88d6-342ec5651493,,RSA accession: 482865,Organism|Plantae|Viridiplantae|Streptophyta|Embryophyta|Tracheophyta|Spermatophytina|Magnoliopsida|Rosanae|Brassicales|Brassicaceae|Raphanus,Plantae,Tracheophyta,Magnoliopsida,Brassicales,Brassicaceae,Raphanus sativus,29702,L.,Raphanus,,sativus,,,Species,A. C. Sanders,1990,,,,,,N. C. Cooper,,1272,5/21/44,,1944,5,21,142,,,,Moist canyon floor.,,Burned over area.,,,,,,,,,flowers,Introduced,,,,,herbarium sheet,,,,,,United States,California,Riverside,,"San Jacinto Mountains, West side",,0,,33.71,-116.27,NAD27,4000,Rancho Santa Ana: 2007-2009 CCH GBIF georeferencing grant,,CCH GBIF georeference,,Mon Dec 26 13:37:13 2011; georef from 2006-2015 archive backup file,915,,,,,3000ft.,,,Scott D. White; cataloged date: 2006-03-10,15042995-e641-4bdb-88d6-342ec5651493,17,6b760572-3444-4ffb-9b38-e9374757206f,https://www.cch2.org/portal/collections/individual/index.php?occid=681941
807444,RSA,RSA,,PreservedSpecimen,509d4c4f-691d-44dc-93c6-02b21ad4c0ed,,RSA accession: 33888,Organism|Plantae|Viridiplantae|Streptophyta|Embryophyta|Tracheophyta|Spermatophytina|Magnoliopsida|Rosanae|Brassicales|Brassicaceae|Raphanus,Plantae,Tracheophyta,Magnoliopsida,Brassicales,Brassicaceae,Raphanus sativus,29702,L.,Raphanus,,sativus,,,Species,,,,,,,,N. C. Cooper,,1151,4/22/44,,1944,4,22,113,,,,,,Dry open desert. Flowers bluish.,,,,,,,,,flowers & fruits,Introduced,,,,,herbarium sheet,,,,,,United States,California,Riverside,,Banning.,,0,,33.9,-116.875,NAD27,10000,Rancho Santa Ana: 2007-2009 CCH GBIF georeferencing grant,,CCH GBIF georeference,,Mon Dec 26 13:37:13 2011; georef from 2006-2015 archive backup file,762,,,,,2500ft.,,,Scott D. White; cataloged date: 2006-03-10,509d4c4f-691d-44dc-93c6-02b21ad4c0ed,17,eb316b2d-bdb6-447a-bb09-6b7c4f3e1f38,https://www.cch2.org/portal/collections/individual/index.php?occid=807444
1184063,RSA,RSA,,PreservedSpecimen,e06b2907-8e60-436e-98ee-7d0bd02e3c3f,,RSA accession: 33816,Organism|Plantae|Viridiplantae|Streptophyta|Embryophyta|Tracheophyta|Spermatophytina|Magnoliopsida|Rosanae|Brassicales|Brassicaceae|Raphanus,Plantae,Tracheophyta,Magnoliopsida,Brassicales,Brassicaceae,Raphanus sativus,29702,L.,Raphanus,,sativus,,,Species,,,,,,,,N. C. Cooper,,1152,4/23/44,,1944,4,23,114,,,"Specimen consists of two sheets (one in flower, one in fruit).",Roadside,,Flowers blue to white,,,,,,herbariumSpecimenDuplicate: https://www.cch2.org/portal/collections/individual/index.php?guid=9d774260-7905-48a5-8341-02f2df783cd9 | herbariumSpecimenDuplicate: https://www.cch2.org/portal/collections/individual/index.php?guid=e482e2f8-8e68-4dea-9d78-2cdc312fb988 | herbariumSpecimenDuplicate: https://www.cch2.org/portal/collections/individual/index.php?guid=a88f59c9-8ac9-42ca-a559-8a1efc84ffe6,,,flowers & fruits,Introduced,,,,,herbarium sheet,,,,,,United States,California,Los Angeles,,Pomona.,,0,,,,,,,,,,,244,,,,,800ft.,,,Scott D. White; cataloged date: 2006-03-10,e06b2907-8e60-436e-98ee-7d0bd02e3c3f,17,f513535a-3165-4a14-9eb8-08da76624f73,https://www.cch2.org/portal/collections/individual/index.php?occid=1184063
1192564,RSA,RSA,,PreservedSpecimen,e482e2f8-8e68-4dea-9d78-2cdc312fb988,,RSA accession: 431502,Organism|Plantae|Viridiplantae|Streptophyta|Embryophyta|Tracheophyta|Spermatophytina|Magnoliopsida|Rosanae|Brassicales|Brassicaceae|Raphanus,Plantae,Tracheophyta,Magnoliopsida,Brassicales,Brassicaceae,Raphanus sativus,29702,L.,Raphanus,,sativus,,,Species,,,,,,,,N. C. Cooper,,1152,4/23/44,,1944,4,23,114,,,,,,Roadside and fields. Flowers blue to white.,,,,,,herbariumSpecimenDuplicate: https://www.cch2.org/portal/collections/individual/index.php?guid=9d774260-7905-48a5-8341-02f2df783cd9 | herbariumSpecimenDuplicate: https://www.cch2.org/portal/collections/individual/index.php?guid=e06b2907-8e60-436e-98ee-7d0bd02e3c3f | herbariumSpecimenDuplicate: https://www.cch2.org/portal/collections/individual/index.php?guid=a88f59c9-8ac9-42ca-a559-8a1efc84ffe6,,,fruits,Introduced,,,,,herbarium sheet,,,,,,United States,California,Los Angeles,,Pomona,,0,,,,,,,,,,,244,,,,,800ft.,,,Jackie C. McConnaughy; cataloged date: 2012-04-13,e482e2f8-8e68-4dea-9d78-2cdc312fb988,17,105fa8cb-8a0f-4b10-b45d-a46c5d158bc1,https://www.cch2.org/portal/collections/individual/index.php?occid=1192564
1368040,DAV,,,PreservedSpecimen,UCD115219,DAV310412,Accession #: DAV16461,Organism|Plantae|Viridiplantae|Streptophyta|Embryophyta|Tracheophyta|Spermatophytina|Magnoliopsida|Rosanae|Brassicales|Brassicaceae|Raphanus,Plantae,Tracheophyta,Magnoliopsida,Brassicales,Brassicaceae,Raphanus sativus,29702,L.,Raphanus,,sativus,,,Species,,,,,,,,Clifton F. Smith,,435,1/9/44,,1944,1,9,9,,9-Jan-44,Access Database Number (Deprecated): UCD115219,Growing on hill.,,,,,,,,herbariumSpecimenDuplicate: https://www.cch2.org/portal/collections/individual/index.php?guid=395e96e5-d3c0-443f-ba6a-35f507179e11,,,,,,,,,,,,,,,United States,California,Santa Barbara,,Santa Barbara County: west of Botanic Garden in Santa Barbara.,,0,,34.454,-119.711,NAD83,1000,Santa Barbara Botanic Garden A,,Terrain Nav. v. 8.7 (copied from SBBG3466),,Date Georeferenced: Sun Nov 3 18:33:40 2013,,,,,,,,,tcbarry,UCD115219,39,d01b7e23-60ea-49e7-90bb-ace08ca0f73f,https://www.cch2.org/portal/collections/individual/index.php?occid=1368040
2395595,CAS,BOT-BC,,PreservedSpecimen,urn:catalog:CAS:BOT-BC:74242,74242,urn:catalog:CAS:BOT:330593,Organism|Plantae|Viridiplantae|Streptophyta|Embryophyta|Tracheophyta|Spermatophytina|Magnoliopsida|Rosanae|Brassicales|Brassicaceae|Raphanus,Plantae,Tracheophyta,Magnoliopsida,Brassicales,Brassicaceae,Raphanus sativus,29702,L.,Raphanus,,sativus,,,Species,Ihsan A. Al-Shehbaz,2010-01,,,,,,"Pollard, Henry M.",,s.n.,10/5/44,,1944,10,5,279,,"Oct. 5, 1944.",,,,,,,,,,,,,,,,,,,,,North America,,,,United States,California,Ventura County,,"Ojai Valley. Ojai, School garden, California Prep. School.",,0,,,,,,,,,,,,,,,,,,en,,urn:catalog:CAS:BOT-BC:74242,1,db5d6bc4-e67d-4f5c-b86a-5bf6e5df83e9,https://www.cch2.org/portal/collections/individual/index.php?occid=2395595
3904091,LA,,,PreservedSpecimen,a88f59c9-8ac9-42ca-a559-8a1efc84ffe6,LA00606073,,Organism|Plantae|Viridiplantae|Streptophyta|Embryophyta|Tracheophyta|Spermatophytina|Magnoliopsida|Rosanae|Brassicales|Brassicaceae|Raphanus,Plantae,Tracheophyta,Magnoliopsida,Brassicales,Brassicaceae,Raphanus sativus,29702,L.,Raphanus,,sativus,,,Species,,,,,,,,N. C. Cooper,,1152,4/23/44,,1944,4,23,114,,,,Roadside and fields.,,Flowers blue to white,,,,,,herbariumSpecimenDuplicate: https://www.cch2.org/portal/collections/individual/index.php?guid=9d774260-7905-48a5-8341-02f2df783cd9 | herbariumSpecimenDuplicate: https://www.cch2.org/portal/collections/individual/index.php?guid=e06b2907-8e60-436e-98ee-7d0bd02e3c3f | herbariumSpecimenDuplicate: https://www.cch2.org/portal/collections/individual/index.php?guid=e482e2f8-8e68-4dea-9d78-2cdc312fb988,,,flowers & fruits,Introduced,,,,,,,,,,,United States,California,Los Angeles,,Pomona.,,0,,34.05547,-117.74912,,3218,Rancho Santa Ana (no. 8),,,,copied from duplicate; SBBG213835; 47443; georef from 2006-2015 archive backup file; Date Georeferenced: Mon Dec 26 13:37:13 2011,244,,,,,800ft.,,,abaniaga,,34,a88f59c9-8ac9-42ca-a559-8a1efc84ffe6,https://www.cch2.org/portal/collections/individual/index.php?occid=3904091
98493,SBBG,,,PreservedSpecimen,8455c1c0-f40c-44a6-8a2d-09d941301aeb,SBBG213814,SBBG_old: 2546,Organism|Plantae|Viridiplantae|Streptophyta|Embryophyta|Tracheophyta|Spermatophytina|Magnoliopsida|Rosanae|Brassicales|Brassicaceae|Raphanus,Plantae,Tracheophyta,Magnoliopsida,Brassicales,Brassicaceae,Raphanus raphanistrum,29701,L.,Raphanus,,raphanistrum,,,Species,,,,,,,,Clifton F. Smith,,1488,7/17/45,,1945,7,17,198,,7/17/45,,along football field,,fls yellow,,,,,,herbariumSpecimenDuplicate: https://www.cch2.org/portal/collections/individual/index.php?guid=fc2b0d32-1a5d-11e3-b49f-525400a0a001,,,Flowers Present; Fruit Present,,,,,,,,,,,,United States,California,Santa Barbara,,"West Beach, Santa Barbara",,0,,34.403,-119.698,NAD83,500,Rancho Santa Ana (no. 8),,MyTopo,,georef from 2006-2015 archive backup file; Date Georeferenced: Mon Dec 26 13:37:13 2011,,,,,,,,,alejanneros,,16,236861bc-cd98-4dca-8639-f99a152f6f3b,https://www.cch2.org/portal/collections/individual/index.php?occid=98493
304536,UCSB,,,PreservedSpecimen,fc2b0d32-1a5d-11e3-b49f-525400a0a001,UCSB031995,2403,Organism|Plantae|Viridiplantae|Streptophyta|Embryophyta|Tracheophyta|Spermatophytina|Magnoliopsida|Rosanae|Brassicales|Brassicaceae|Raphanus,Plantae,Tracheophyta,Magnoliopsida,Brassicales,Brassicaceae,Raphanus raphanistrum,29701,L.,Raphanus,,raphanistrum,,,Species,,,,,,,,"Smith, Clifton",,1488,7/17/45,,1945,7,17,198,,,,,,,,,,,,herbariumSpecimenDuplicate: https://www.cch2.org/portal/collections/individual/index.php?guid=8455c1c0-f40c-44a6-8a2d-09d941301aeb,,,,,,,,,Sheet - 1,,,,,,United States,California,Santa Barbara,,"Along La Playa Football Field at West Beach, Santa Barbara",,0,,34.403,-119.698,NAD83,500,Rancho Santa Ana (no. 8),,MyTopo,,copied from duplicate; georef from 2006-2015 archive backup file; Date Georeferenced: Mon Dec 26 13:37:13 2011,,,,,,,,,preprocessed,,35,44406ab7-8904-4717-bc94-047ee512ee17,https://www.cch2.org/portal/collections/individual/index.php?occid=304536
786393,RSA,POM,,PreservedSpecimen,468d9524-f56f-4b09-abd2-a50b380993f7,,POM accession: 302264,Organism|Plantae|Viridiplantae|Streptophyta|Embryophyta|Tracheophyta|Spermatophytina|Magnoliopsida|Rosanae|Brassicales|Brassicaceae|Raphanus,Plantae,Tracheophyta,Magnoliopsida,Brassicales,Brassicaceae,Raphanus raphanistrum,29701,L.,Raphanus,,raphanistrum,,,Species,,,,,,,,Hulda Crooks,,s.n.,10/25/45,,1945,10,25,298,,,,,,,,,,,,,,,flowers & fruits,Introduced,,,,,herbarium sheet,,,,,,United States,California,San Bernardino,,Loma Linda. Santa Ana River.,,0,,34.04608,-117.25847,WGS84,2414,Rancho Santa Ana: 2007-2009 CCH GBIF georeferencing grant,,CCH GBIF georeference,,Mon Dec 26 13:37:13 2011; georef from 2006-2015 archive backup file,366,,,,,1200ft.,,,Scott D. White; cataloged date: 2006-03-10,468d9524-f56f-4b09-abd2-a50b380993f7,17,b920f38c-77f1-46cc-8c11-79aa87bf4bc7,https://www.cch2.org/portal/collections/individual/index.php?occid=786393
2411397,CAS,BOT-BC,,PreservedSpecimen,urn:catalog:CAS:BOT-BC:74215,74215,urn:catalog:CAS:BOT:480326,Organism|Plantae|Viridiplantae|Streptophyta|Embryophyta|Tracheophyta|Spermatophytina|Magnoliopsida|Rosanae|Brassicales|Brassicaceae|Raphanus,Plantae,Tracheophyta,Magnoliopsida,Brassicales,Brassicaceae,Raphanus raphanistrum,29701,L.,Raphanus,,raphanistrum,,,Species,Ihsan A. Al-Shehbaz,2010-01,,,,,,"Pollard, Henry M.",,s.n.,3/24/45,,1945,3,24,83,,24-Mar-45,,,,,,,,,,,,,,,,,,,,,North America,,,,United States,California,Ventura County,,Ventura River Basin. Fairview Road.,,0,,,,,,,,,,,,,,,,,,en,,urn:catalog:CAS:BOT-BC:74215,1,8ffe0f10-1e71-42ac-ac94-497c19ea3922,https://www.cch2.org/portal/collections/individual/index.php?occid=2411397
107786,SBBG,,,PreservedSpecimen,972787ac-00f3-4e6a-9fca-aef16dbeccd9,72200,SBBG_old: 72200,Organism|Plantae|Viridiplantae|Streptophyta|Embryophyta|Tracheophyta|Spermatophytina|Magnoliopsida|Rosanae|Brassicales|Brassicaceae|Raphanus,Plantae,Tracheophyta,Magnoliopsida,Brassicales,Brassicaceae,Raphanus sativus,29702,L.,Raphanus,,sativus,,,Species,,,,,,,,Henry M. Pollard,,,3/24/45,,1945,3,24,83,,3/24/45,,along road,,,,,,,,,,,Flowers Present; Fruit Present,,,,,,,,,,,,United States,California,Ventura,,Fairview Rd,,0,,34.458,-119.266,NAD83,1000,Rancho Santa Ana (no. 8),,MyTopo,,georef from 2006-2015 archive backup file; Date Georeferenced: Mon Dec 26 13:37:13 2011,,,,,,,,,preprocessed,,16,97ca4e50-8639-4302-9564-aba8dfb5e4a2,https://www.cch2.org/portal/collections/individual/index.php?occid=107786
304556,UCSB,,,PreservedSpecimen,fc2b8820-1a5d-11e3-b49f-525400a0a001,UCSB032011,59666,Organism|Plantae|Viridiplantae|Streptophyta|Embryophyta|Tracheophyta|Spermatophytina|Magnoliopsida|Rosanae|Brassicales|Brassicaceae|Raphanus,Plantae,Tracheophyta,Magnoliopsida,Brassicales,Brassicaceae,Raphanus sativus,29702,L.,Raphanus,,sativus,,,Species,,,,,,,,Lyman Benson,,11728,5/21/45,,1945,5,21,141,,,,Chaparral; woodland; north slope; heavy soils,,,,,,,,herbariumSpecimenDuplicate: https://www.cch2.org/portal/collections/individual/index.php?guid=6d4e22e3-9e71-41cc-9204-0a036cadad66,,,,,,,,,Sheet - 1,,,,,,United States,California,Los Angeles,,1300 feet Pacific Slope Drainage,,0,,34.115,-117.7133333,NAD83,,,,,,"copied from duplicate; Latitude was missing the degree, I added the 34d. Mapps correctly, in the Garden, Indian Hill is actual hill, not the street]; <1/4 section (appx. <400 M); <1/4 section (appx. <400 M)",,,,,,,,,preprocessed,,35,a8f2f44b-14a6-45ba-bb5e-43b5a4f3e9e4,https://www.cch2.org/portal/collections/individual/index.php?occid=304556
942671,RSA,POM,,PreservedSpecimen,6d4e22e3-9e71-41cc-9204-0a036cadad66,,POM accession: 293205,Organism|Plantae|Viridiplantae|Streptophyta|Embryophyta|Tracheophyta|Spermatophytina|Magnoliopsida|Rosanae|Brassicales|Brassicaceae|Raphanus,Plantae,Tracheophyta,Magnoliopsida,Brassicales,Brassicaceae,Raphanus sativus,29702,L.,Raphanus,,sativus,,,Species,,,,,,,,Lyman Benson,,11728,5/21/45,,1945,5,21,141,,,,California chaparral.,,,,,,,,herbariumSpecimenDuplicate: https://www.cch2.org/portal/collections/individual/index.php?guid=fc2b8820-1a5d-11e3-b49f-525400a0a001,,,flowers & fruits,Cultivated,,,,,herbarium sheet,,,,,,United States,California,Los Angeles,,Claremont: Indian Hill. Pacific Slope Drainage Area.,,0,,34.115,-117.7133333,NAD83,400,,,TOPO!,,"Latitude was missing the degree, I added the 34d. Mapps correctly, in the Garden, Indian Hill is actual hill, not the street]; <1/4 section (appx. <400 M); <1/4 section (appx. <400 M)",396,,,,,1300ft.,,,T. Kim Nguyen; cataloged date: 2007-09-21,6d4e22e3-9e71-41cc-9204-0a036cadad66,17,35094aa1-1d32-46f7-a81a-9cdf7f61fe99,https://www.cch2.org/portal/collections/individual/index.php?occid=942671
1132499,RSA,RSA,,PreservedSpecimen,c7cfbe27-6cb1-4d95-aaf7-c862f7781129,,RSA accession: 431492,Organism|Plantae|Viridiplantae|Streptophyta|Embryophyta|Tracheophyta|Spermatophytina|Magnoliopsida|Rosanae|Brassicales|Brassicaceae|Raphanus,Plantae,Tracheophyta,Magnoliopsida,Brassicales,Brassicaceae,Raphanus sativus,29702,L.,Raphanus,,sativus,,,Species,,,,,,,,N. C. Cooper,,2214,5/1/45,,1945,5,1,121,,,,roadside ditch,,Flowers white,,,,,,,,,flowers & fruits,Cultivated,,,,,herbarium sheet,,,,,,United States,California,Los Angeles,,"Tapia Park area, Santa Monica Mountains.",,0,,,,,,,,,,,305,,,,,1000ft.,,,T. Kim Nguyen; cataloged date: 2007-09-21,c7cfbe27-6cb1-4d95-aaf7-c862f7781129,17,8e475ce0-7e6c-4d8d-9c6e-7f986dde8067,https://www.cch2.org/portal/collections/individual/index.php?occid=1132499
2324177,CAS,BOT-BC,,PreservedSpecimen,urn:catalog:CAS:BOT-BC:74208,74208,urn:catalog:CAS:DS:312810,Organism|Plantae|Viridiplantae|Streptophyta|Embryophyta|Tracheophyta|Spermatophytina|Magnoliopsida|Rosanae|Brassicales|Brassicaceae|Raphanus,Plantae,Tracheophyta,Magnoliopsida,Brassicales,Brassicaceae,Raphanus raphanistrum,29701,L.,Raphanus,,raphanistrum,,,Species,Ihsan A. Al-Shehbaz,2010-01,,,,,,"Kolts, Barbara",,s.n.,7/27/46,,1946,7,27,208,,27-Jul-46,,Dry fields.,,,,,,,,,,,,,,,,,,,North America,,,,United States,California,Santa Clara County,,Around Stanford.,,0,,,,,,,,,,,,,,,,,,en,,urn:catalog:CAS:BOT-BC:74208,1,2235d4fb-1d1a-418d-afb0-e33640f47f53,https://www.cch2.org/portal/collections/individual/index.php?occid=2324177
659987,RSA,RSA,,PreservedSpecimen,0a9d4c84-7466-42dc-8c59-8f06a2ca1b44,,RSA accession: 43502,Organism|Plantae|Viridiplantae|Streptophyta|Embryophyta|Tracheophyta|Spermatophytina|Magnoliopsida|Rosanae|Brassicales|Brassicaceae|Raphanus,Plantae,Tracheophyta,Magnoliopsida,Brassicales,Brassicaceae,Raphanus raphanistrum,29701,L.,Raphanus,,raphanistrum,,,Species,,,,,,,,H. M. Pollard,,s.n.,2/16/47,,1947,2,16,47,,,,,,,,,,,,,,,flowers & fruits,Introduced,,,,,herbarium sheet,,,,,,United States,California,Ventura,,Fairview Road.,,0,,34.45828,-119.26906,WGS84,1207,Rancho Santa Ana: 2007-2009 CCH GBIF georeferencing grant,,CCH GBIF georeference,,Mon Dec 26 13:37:13 2011; georef from 2006-2015 archive backup file,,,,,,,,,T. Kim Nguyen; cataloged date: 2007-09-19,0a9d4c84-7466-42dc-8c59-8f06a2ca1b44,17,3b68855f-72da-4a28-b464-9dfb0298b09a,https://www.cch2.org/portal/collections/individual/index.php?occid=659987
2288810,CAS,BOT-BC,,PreservedSpecimen,urn:catalog:CAS:BOT-BC:74216,74216,urn:catalog:CAS:BOT:336657,Organism|Plantae|Viridiplantae|Streptophyta|Embryophyta|Tracheophyta|Spermatophytina|Magnoliopsida|Rosanae|Brassicales|Brassicaceae|Raphanus,Plantae,Tracheophyta,Magnoliopsida,Brassicales,Brassicaceae,Raphanus raphanistrum,29701,L.,Raphanus,,raphanistrum,,,Species,Ihsan A. Al-Shehbaz,2010-01,,,,,,"Pollard, Henry M.",,s.n.,2/16/47,,1947,2,16,47,,"Feb. 16, 1947",,,,,,,,,,,,,,,,,,,,,North America,,,,United States,California,Ventura County,,Ventura River Basin. Fairview Road.,,0,,,,,,,,,,,,,,,,,,en,,urn:catalog:CAS:BOT-BC:74216,1,3c6a9d7f-e5ac-4a72-adad-ff7f31a3099c,https://www.cch2.org/portal/collections/individual/index.php?occid=2288810
47113,SBBG,,,PreservedSpecimen,1cfccead-16c2-46a7-8300-807381b4bae1,SBBG213834,SBBG_old: 25547,Organism|Plantae|Viridiplantae|Streptophyta|Embryophyta|Tracheophyta|Spermatophytina|Magnoliopsida|Rosanae|Brassicales|Brassicaceae|Raphanus,Plantae,Tracheophyta,Magnoliopsida,Brassicales,Brassicaceae,Raphanus sativus,29702,L.,Raphanus,,sativus,,,Species,,,,,,,,Dara Emery,,,4/4/47,,1947,4,4,94,,4/4/47,,,,,,,,,,,,,Flowers Present; Fruit Present,,,,,,,,,,,,United States,California,Los Angeles,,San Fernando Valley,,0,,,,NULL,30000,DHWilken,,GeoLocate,,ER > 30 km; too vague to georeference,,,,,,,,,,,16,ae63514d-1f52-4bb2-9b1e-b7ca4d633aa8,https://www.cch2.org/portal/collections/individual/index.php?occid=47113
1368004,DAV,,,PreservedSpecimen,74da8b2e-fbaa-4675-9808-a78d2a94750e,DAV310414,Accession #: DAV9634,Organism|Plantae|Viridiplantae|Streptophyta|Embryophyta|Tracheophyta|Spermatophytina|Magnoliopsida|Rosanae|Brassicales|Brassicaceae|Raphanus,Plantae,Tracheophyta,Magnoliopsida,Brassicales,Brassicaceae,Raphanus sativus,29702,L.,Raphanus,,sativus,,,Species,,,,,,,,Chas. Heiser,,s.n.,3/7/47,,1947,3,7,66,,7-Mar-47,Access Database Number (Deprecated): UCD115179,,,"Growing in an old garden. ""Garden Radish""",,,,,,,,,,,,,,,,,,,,,United States,California,Yolo,,Yolo County: Davis.,,0,,38.553154,-121.751816,WGS84,3553,cwalden (2020-03-20 16:17:09),,georef batch tool 2020-03-20,reviewed - high confidence,,,,,,,,,,,UCD115179,39,74da8b2e-fbaa-4675-9808-a78d2a94750e,https://www.cch2.org/portal/collections/individual/index.php?occid=1368004
4191626,OSC,V,,PreservedSpecimen,{17F6D85A-35A0-4D28-BBBC-27081F3D4B34},,WILLU26399,Organism|Plantae|Viridiplantae|Streptophyta|Embryophyta|Tracheophyta|Spermatophytina|Magnoliopsida|Rosanae|Brassicales|Brassicaceae|Raphanus,Plantae,Tracheophyta,Magnoliopsida,Brassicales,Brassicaceae,Raphanus sativus,29702,L.,Raphanus,,sativus,,,Species,"Al-Shehbaz, I.",2016,,,,,,Morton E. Peck,M.E. Peck,24192,6/30/47,,1947,6,30,181,,6/30/47,,high beach.,,,,,,,,,,,flowering and fruiting,,,,,,,,,,,,United States,Oregon,Tillamook,,Garibaldi.,,0,,45.56,-123.9097,,402,[automated process-OregonFlora/OSU Herb],OregonFlora 1994-2020 methodology,"OrlookId: 82791, StateProvince: Oregon, County: Tillamook, LocName: Garibaldi",,,,,,,,,,,,654795,81,36361b6d-3dc4-4252-afb2-93e1aea37e18,https://www.cch2.org/portal/collections/individual/index.php?occid=4191626
304543,UCSB,,,PreservedSpecimen,fc2b37d0-1a5d-11e3-b49f-525400a0a001,UCSB032009,2431,Organism|Plantae|Viridiplantae|Streptophyta|Embryophyta|Tracheophyta|Spermatophytina|Magnoliopsida|Rosanae|Brassicales|Brassicaceae|Raphanus,Plantae,Tracheophyta,Magnoliopsida,Brassicales,Brassicaceae,Raphanus sativus,29702,L.,Raphanus,,sativus,,,Species,,,,,,,,"Kamb, Peter",,760,2/1/48,,1948,2,1,32,,,,Damp roadside ditch; Upper Sonoran Zone,,,,,,,,,,,,,,,,,Sheet - 1,,,,,,United States,California,Riverside,,"Valley in the Jurupa Mts. west of Colton, San Bernardino/Riverside County",,0,,34.03,-117.416,NAD27,5000,UCRiverside A,,CCH GBIF georeference (copied from UCD56268),,Sun Mar 2 21:11:46 2014,,,,,,,,,preprocessed,,35,ecfc5503-93c4-48d4-8343-95b0da04051e,https://www.cch2.org/portal/collections/individual/index.php?occid=304543
911854,RSA,RSA,,PreservedSpecimen,5e8d80e1-dac2-4083-81f7-035ecf1069b9,,RSA accession: 651170,Organism|Plantae|Viridiplantae|Streptophyta|Embryophyta|Tracheophyta|Spermatophytina|Magnoliopsida|Rosanae|Brassicales|Brassicaceae|Raphanus,Plantae,Tracheophyta,Magnoliopsida,Brassicales,Brassicaceae,Raphanus sativus,29702,L.,Raphanus,,sativus,,,Species,,,,,,,,Norman Willis,,s.n.,2/8/48,,1948,2,8,39,,,,,,,,,,,,,,,flowers,Introduced,,,,,herbarium sheet,,,,,,United States,California,Orange,,2 miles E of Orange.,,0,,33.7877,-117.79344,WGS84,804,Rancho Santa Ana: 2007-2009 CCH GBIF georeferencing grant,,CCH GBIF georeference,,Mon Dec 26 13:37:13 2011; georef from 2006-2015 archive backup file,61,,,,,200ft.,,,cataloged date: 2001-01-24,5e8d80e1-dac2-4083-81f7-035ecf1069b9,17,7cf07518-33a8-4e0f-a929-c8901529adc5,https://www.cch2.org/portal/collections/individual/index.php?occid=911854
1005302,RSA,RSA,,PreservedSpecimen,8aed2e0b-d33c-40dd-a1c2-1f0534970472,,RSA accession: 651175,Organism|Plantae|Viridiplantae|Streptophyta|Embryophyta|Tracheophyta|Spermatophytina|Magnoliopsida|Rosanae|Brassicales|Brassicaceae|Raphanus,Plantae,Tracheophyta,Magnoliopsida,Brassicales,Brassicaceae,Raphanus sativus,29702,L.,Raphanus,,sativus,,,Species,,,,,,,,Phil Goodwin,,s.n.,2/6/48,,1948,2,6,37,,,,,,Wild Radish,,,,,,,,,flowers & fruits,Introduced,,,,,herbarium sheet,,,,,,United States,California,Riverside,,"Found in orange grove, 3 mi. north of Orange.",,0,,33.81909,-117.85172,WGS84,3886,UCRiverside A,,GoogleMaps via BerkeleyMapper,,Wed Mar 26 20:47:35 2014; georef from 2006-2015 archive backup file,,,,,,300ft.,,,cataloged date: 2001-01-17,8aed2e0b-d33c-40dd-a1c2-1f0534970472,17,3b702fc8-1c5c-445b-b34a-50e666f5199a,https://www.cch2.org/portal/collections/individual/index.php?occid=1005302
1104772,RSA,POM,,PreservedSpecimen,ba827467-4c98-4c72-a3c2-0c2170b30ab8,,POM accession: 293233,Organism|Plantae|Viridiplantae|Streptophyta|Embryophyta|Tracheophyta|Spermatophytina|Magnoliopsida|Rosanae|Brassicales|Brassicaceae|Raphanus,Plantae,Tracheophyta,Magnoliopsida,Brassicales,Brassicaceae,Raphanus sativus,29702,L.,Raphanus,,sativus,,,Species,Orlando Mistretta,2006-05,,,,,,Lyman Benson,,12857,3/27/48,,1948,3,27,87,,,,,,"Sandy loam, south slope.",,,,,,,,,flowers,Introduced,,,,,herbarium sheet,,,,,,United States,California,Los Angeles,,Claremont.,,0,,,,,,,,,,,366,,,,,1200ft.,,,Naomi S. Fraga; cataloged date: 2001-11-15,ba827467-4c98-4c72-a3c2-0c2170b30ab8,17,b8445727-f4ac-4888-865f-2cbbffc1105c,https://www.cch2.org/portal/collections/individual/index.php?occid=1104772
1213435,RSA,RSA,,PreservedSpecimen,ee74db64-f6e9-4378-b14f-8d576717418e,,RSA accession: 651174,Organism|Plantae|Viridiplantae|Streptophyta|Embryophyta|Tracheophyta|Spermatophytina|Magnoliopsida|Rosanae|Brassicales|Brassicaceae|Raphanus,Plantae,Tracheophyta,Magnoliopsida,Brassicales,Brassicaceae,Raphanus sativus,29702,L.,Raphanus,,sativus,,,Species,,,,,,,,Arthur Walden,,s.n.,2/21/48,,1948,2,21,52,,,,,,Wild Radish.,,,,,,,,,flowers & fruits,Introduced,,,,,herbarium sheet,,,,,,United States,California,Ventura,,"4' north of Foothill Rd., 3 miles west of Santa Paula.",,0,,34.33462,-119.13959,WGS84,402,Rancho Santa Ana: 2007-2009 CCH GBIF georeferencing grant,,CCH GBIF georeference,,Mon Dec 26 13:37:13 2011; georef from 2006-2015 archive backup file,,,,,,200ft.,,,cataloged date: 2001-01-17,ee74db64-f6e9-4378-b14f-8d576717418e,17,a7123a37-f91a-4800-888c-73dc3ac94c35,https://www.cch2.org/portal/collections/individual/index.php?occid=1213435
1368003,DAV,,,PreservedSpecimen,03ce433e-1cd3-4529-a731-bd1f876f21fd,DAV310415,Accession #: DAV9503,Organism|Plantae|Viridiplantae|Streptophyta|Embryophyta|Tracheophyta|Spermatophytina|Magnoliopsida|Rosanae|Brassicales|Brassicaceae|Raphanus,Plantae,Tracheophyta,Magnoliopsida,Brassicales,Brassicaceae,Raphanus sativus,29702,L.,Raphanus,,sativus,,,Species,,,,,,,,W. A. Harvey,J. M. Tucker,1698,6/28/48,,1948,6,28,180,,28-Jun-48,Access Database Number (Deprecated): UCD115178,Weed in flax field. Growing on ridge.,,,,,,,,,,,,,,,,,,,,,,,United States,California,San Mateo,,San Mateo County: 3 miles north of Pescadero.,,0,,,,,,,,,,,,,,,,,,,,UCD115178,39,03ce433e-1cd3-4529-a731-bd1f876f21fd,https://www.cch2.org/portal/collections/individual/index.php?occid=1368003
1368052,DAV,,,PreservedSpecimen,84421ddd-3b36-4019-b725-16457dd13057,DAV310403,Accession #: DAV9821,Organism|Plantae|Viridiplantae|Streptophyta|Embryophyta|Tracheophyta|Spermatophytina|Magnoliopsida|Rosanae|Brassicales|Brassicaceae|Raphanus,Plantae,Tracheophyta,Magnoliopsida,Brassicales,Brassicaceae,Raphanus sativus,29702,L.,Raphanus,,sativus,,,Species,,,,,,,,M. R. Wanzer,,13,5/6/48,,1948,5,6,127,,6-May-48,Access Database Number (Deprecated): UCD115232,Moist soil near creek; in full sun.,,Corolla white to purple.,,,,,,,,,,,,,,,,,,,,,United States,California,Napa,,"Napa County: Putah Canyon, 8.5 miles west of Winters.",,0,,,,,,,,,,,,,,,,,,,,UCD115232,39,84421ddd-3b36-4019-b725-16457dd13057,https://www.cch2.org/portal/collections/individual/index.php?occid=1368052
1368034,DAV,,,PreservedSpecimen,d644b799-6847-48b4-901f-6f55cd80d5b4,DAV310404,Accession #: DAV10202,Organism|Plantae|Viridiplantae|Streptophyta|Embryophyta|Tracheophyta|Spermatophytina|Magnoliopsida|Rosanae|Brassicales|Brassicaceae|Raphanus,Plantae,Tracheophyta,Magnoliopsida,Brassicales,Brassicaceae,Raphanus sativus,29702,L.,Raphanus,,sativus,,,Species,,,,,,,,H. Popenoe,,6,4/17/49,,1949,4,17,107,,17-Apr-49,Access Database Number (Deprecated): UCD115213,Growing in sandy loam.,,White flowers.,,,,,,,,,,,,,,,,,,,,,United States,California,Napa,,Napa County: along Putah Creek.,,0,,,,,,,,,,,,,,,,,,,,UCD115213,39,d644b799-6847-48b4-901f-6f55cd80d5b4,https://www.cch2.org/portal/collections/individual/index.php?occid=1368034
2291878,CAS,BOT-BC,,PreservedSpecimen,urn:catalog:CAS:BOT-BC:74283,74283,urn:catalog:CAS:BOT:490962,Organism|Plantae|Viridiplantae|Streptophyta|Embryophyta|Tracheophyta|Spermatophytina|Magnoliopsida|Rosanae|Brassicales|Brassicaceae|Raphanus,Plantae,Tracheophyta,Magnoliopsida,Brassicales,Brassicaceae,Raphanus sativus,29702,L.,Raphanus,,sativus,,,Species,Ihsan A. Al-Shehbaz,2010-01,,,,,,"Gallup, A. H.",,s.n.,3/17/49,,1949,3,17,76,,3/17/49,Common. Native of Eurasia.,In open places.,,,,,,,,,,,,,,,,,,,North America,,,,United States,California,Los Angeles County,,"Near north-central portion of the property, LASCA.",,0,,,,,,,,,,,,,,,,,,en,,urn:catalog:CAS:BOT-BC:74283,1,0df0bd87-12a9-4682-9a22-1cceb6d7c7b4,https://www.cch2.org/portal/collections/individual/index.php?occid=2291878
2315912,CAS,BOT-BC,,PreservedSpecimen,urn:catalog:CAS:BOT-BC:74347,74347,urn:catalog:CAS:DS:593633,Organism|Plantae|Viridiplantae|Streptophyta|Embryophyta|Tracheophyta|Spermatophytina|Magnoliopsida|Rosanae|Brassicales|Brassicaceae|Raphanus,Plantae,Tracheophyta,Magnoliopsida,Brassicales,Brassicaceae,Raphanus sativus,29702,L.,Raphanus,,sativus,,,Species,Ihsan A. Al-Shehbaz,2010-01,,,,,,"Thomas, J. H.",,206,3/31/49,,1949,3,31,90,,31-Mar-49,,,,,,,,,,,,,,,,,,,,,North America,,,,United States,California,Santa Clara County,,Stanford University Campus.,,0,,,,,,,,,,,,,,,,,,en,,urn:catalog:CAS:BOT-BC:74347,1,669b7351-91f0-495a-84a1-11bba03f90b9,https://www.cch2.org/portal/collections/individual/index.php?occid=2315912
2390070,CAS,BOT-BC,,PreservedSpecimen,urn:catalog:CAS:BOT-BC:74348,74348,urn:catalog:CAS:DS:593632,Organism|Plantae|Viridiplantae|Streptophyta|Embryophyta|Tracheophyta|Spermatophytina|Magnoliopsida|Rosanae|Brassicales|Brassicaceae|Raphanus,Plantae,Tracheophyta,Magnoliopsida,Brassicales,Brassicaceae,Raphanus sativus,29702,L.,Raphanus,,sativus,,,Species,Ihsan A. Al-Shehbaz,2010-01,,,,,,"Thomas, J. H.",,221,4/2/49,,1949,4,2,92,,2-Apr-49,Weeds.,,,,,,,,,,,,,,,,,,,,North America,,,,United States,California,Santa Clara County,,In Palo Alto.,,0,,,,,,,,,,,,,,,,,,en,,urn:catalog:CAS:BOT-BC:74348,1,c232140f-c9d7-4fcb-b8e0-1b5f33b41b66,https://www.cch2.org/portal/collections/individual/index.php?occid=2390070
2292239,CAS,BOT-BC,,PreservedSpecimen,urn:catalog:CAS:BOT-BC:74194,74194,urn:catalog:CAS:BOT:531046,Organism|Plantae|Viridiplantae|Streptophyta|Embryophyta|Tracheophyta|Spermatophytina|Magnoliopsida|Rosanae|Brassicales|Brassicaceae|Raphanus,Plantae,Tracheophyta,Magnoliopsida,Brassicales,Brassicaceae,Raphanus raphanistrum,29701,L.,Raphanus,,raphanistrum,,,Species,Ihsan A. Al-Shehbaz,2010-01,,,,,,"Merkel, Terrence J.",,41,5/20/50,,1950,5,20,140,,20-May-50,"Erect, herbage hispid, base of stem purple. Corolla white.","Sand dunes. Associated plant - Malva borealis, Lupinus arboreus, Eschscholtzia californica.",,,,,,,,,,,,,,,,,,,North America,,,,United States,California,San Francisco County,,"West side of Lone Mountain, San Francisco.",,0,,,,,,,,,,,91,,,,,300.0000000000 ft,,en,,urn:catalog:CAS:BOT-BC:74194,1,afe78eb9-d3cb-41e2-9565-07e12ae3c604,https://www.cch2.org/portal/collections/individual/index.php?occid=2292239
2450089,CAS,BOT-BC,,PreservedSpecimen,urn:catalog:CAS:BOT-BC:74197,74197,urn:catalog:CAS:DS:380398,Organism|Plantae|Viridiplantae|Streptophyta|Embryophyta|Tracheophyta|Spermatophytina|Magnoliopsida|Rosanae|Brassicales|Brassicaceae|Raphanus,Plantae,Tracheophyta,Magnoliopsida,Brassicales,Brassicaceae,Raphanus raphanistrum,29701,L.,Raphanus,,raphanistrum,,,Species,Ihsan A. Al-Shehbaz,2010-01,,,,,,"Thomas, J. H.",,1984,6/10/50,,1950,6,10,161,,10-Jun-50,,At edge of cultivated field.,,,,,,,,,,,,,,,,,,,North America,,,,United States,California,Santa Cruz County,,"North end of Cliff Drive, Santa Cruz.",,0,,,,,,,,,,,,,,,,,,en,,urn:catalog:CAS:BOT-BC:74197,1,b415a381-c2ad-4e45-9561-19e4282550ca,https://www.cch2.org/portal/collections/individual/index.php?occid=2450089
765477,RSA,RSA,,PreservedSpecimen,3c9b4340-f7f2-4619-9794-929b58ccc92f,,RSA accession: 128343,Organism|Plantae|Viridiplantae|Streptophyta|Embryophyta|Tracheophyta|Spermatophytina|Magnoliopsida|Rosanae|Brassicales|Brassicaceae|Raphanus,Plantae,Tracheophyta,Magnoliopsida,Brassicales,Brassicaceae,Raphanus sativus,29702,L.,Raphanus,,sativus,,,Species,,,,,,,,P. H. Raven,,2581,7/12/50,,1950,7,12,193,,,,,,Oceanic situations.,,,,,,,,,flowers & fruits,Introduced,,,,,herbarium sheet,,,,,,United States,California,Monterey,,Carmel.,,0,,36.63385,-121.93829,WGS84,265,UCSanta Cruz H,,GoogleMaps via BerkeleyMapper (copied from GH355661),,Fri May 24 16:06:54 2013; georef from 2006-2015 archive backup file,,,,,,,,,Jackie C. McConnaughy; cataloged date: 2012-04-13,3c9b4340-f7f2-4619-9794-929b58ccc92f,17,7d7e81c4-8357-45eb-bca9-fb723be64713,https://www.cch2.org/portal/collections/individual/index.php?occid=765477
1116413,RSA,RSA,,PreservedSpecimen,c01449a5-54f3-4551-a5c4-247d1d87a3d4,,RSA accession: 187274,Organism|Plantae|Viridiplantae|Streptophyta|Embryophyta|Tracheophyta|Spermatophytina|Magnoliopsida|Rosanae|Brassicales|Brassicaceae|Raphanus,Plantae,Tracheophyta,Magnoliopsida,Brassicales,Brassicaceae,Raphanus sativus,29702,L.,Raphanus,,sativus,,,Species,,,,,,,,John H. Thomas,,1361A,3/27/50,,1950,3,27,86,,,,,,"Plants 3-4 ft tall. Flowers white, sepals glabrous, or at least not hispid.",,,,,,herbariumSpecimenDuplicate: https://www.cch2.org/portal/collections/individual/index.php?guid=urn:catalog:CAS:BOT-BC:74354,,,flowers,Introduced,,,,,herbarium sheet,,,,,,United States,California,Santa Cruz,,Davenport Landing.,,0,,37.025,-122.2166667,,,,,,,,,,,,,,,,Jackie C. McConnaughy; cataloged date: 2012-04-17,c01449a5-54f3-4551-a5c4-247d1d87a3d4,17,032f9781-019f-4a72-a81c-14d094f6eeca,https://www.cch2.org/portal/collections/individual/index.php?occid=1116413
1368043,DAV,,,PreservedSpecimen,UCD115222,DAV310390,Accession #: DAV29667,Organism|Plantae|Viridiplantae|Streptophyta|Embryophyta|Tracheophyta|Spermatophytina|Magnoliopsida|Rosanae|Brassicales|Brassicaceae|Raphanus,Plantae,Tracheophyta,Magnoliopsida,Brassicales,Brassicaceae,Raphanus sativus,29702,L.,Raphanus,,sativus,,,Species,,,,,,,,John H. Thomas,,1419,3/30/50,,1950,3,30,89,,30-Mar-50,Access Database Number (Deprecated): UCD115222,Growing in vacant lot.,,Petals yellow. Common locally.,,,,,,herbariumSpecimenDuplicate: https://www.cch2.org/portal/collections/individual/index.php?guid=urn:catalog:CAS:BOT-BC:74356,,,,,,,,,,,,,,,United States,California,Santa Cruz,,Santa Cruz County: city of Capitola.,,0,,36.97753,-121.95459,WGS84,2267,UCSanta Cruz C,,GoogleMaps via BerkeleyMapper (copied from DS142593),,Date Georeferenced: Sun May 5 12:55:34 2013,,,,,,,,,tcbarry,UCD115222,39,199e3980-023e-42a8-bb6f-e8a9d7d170c1,https://www.cch2.org/portal/collections/individual/index.php?occid=1368043
2270810,CAS,BOT-BC,,PreservedSpecimen,urn:catalog:CAS:BOT-BC:74353,74353,urn:catalog:CAS:DS:593630,Organism|Plantae|Viridiplantae|Streptophyta|Embryophyta|Tracheophyta|Spermatophytina|Magnoliopsida|Rosanae|Brassicales|Brassicaceae|Raphanus,Plantae,Tracheophyta,Magnoliopsida,Brassicales,Brassicaceae,Raphanus sativus,29702,L.,Raphanus,,sativus,,,Species,Ihsan A. Al-Shehbaz,2010-01,,,,,,"Thomas, J. H.",,1361,3/27/50,,1950,3,27,86,,"Mar. 27, 1950","Weeds. Plants 1-2 feet tall, flowers blue and white.",,,,,,,,,,,,,,,,,,,,North America,,,,United States,California,Santa Cruz County,,Davenport Landing.,,0,,37.025,-122.2166667,,,,,,,,,,,,,,,en,,urn:catalog:CAS:BOT-BC:74353,1,60d65e25-5bda-4e43-b780-cc8085141225,https://www.cch2.org/portal/collections/individual/index.php?occid=2270810
2334980,CAS,BOT-BC,,PreservedSpecimen,urn:catalog:CAS:BOT-BC:74356,74356,urn:catalog:CAS:DS:593629,Organism|Plantae|Viridiplantae|Streptophyta|Embryophyta|Tracheophyta|Spermatophytina|Magnoliopsida|Rosanae|Brassicales|Brassicaceae|Raphanus,Plantae,Tracheophyta,Magnoliopsida,Brassicales,Brassicaceae,Raphanus sativus,29702,L.,Raphanus,,sativus,,,Species,Ihsan A. Al-Shehbaz,2010-01,,,,,,"Thomas, John H.",,1419,3/30/50,,1950,3,30,89,,30-Mar-50,Petals yellow. Common locally.,,,,,,,,,herbariumSpecimenDuplicate: https://www.cch2.org/portal/collections/individual/index.php?guid=UCD115222,,,,,,,,,,,North America,,,,United States,California,Santa Cruz County,,Vacant lot at Capitola.,,0,,,,,,,,,,,,,,,,,,en,,urn:catalog:CAS:BOT-BC:74356,1,4b2a13aa-37fd-4ad1-a13c-250319141c12,https://www.cch2.org/portal/collections/individual/index.php?occid=2334980
2385707,CAS,BOT-BC,,PreservedSpecimen,urn:catalog:CAS:BOT-BC:74355,74355,urn:catalog:CAS:DS:415797,Organism|Plantae|Viridiplantae|Streptophyta|Embryophyta|Tracheophyta|Spermatophytina|Magnoliopsida|Rosanae|Brassicales|Brassicaceae|Raphanus,Plantae,Tracheophyta,Magnoliopsida,Brassicales,Brassicaceae,Raphanus sativus,29702,L.,Raphanus,,sativus,,,Species,Ihsan A. Al-Shehbaz,2010-01,,,,,,"Thomas, J. H.",,1361B,3/27/50,,1950,3,27,86,,"Mar. 27, 1950","Flowers light blue to pink, sepals hispid. Plants 3-4 feet tall.",,,,,,,,,,,,,,,,,,,,North America,,,,United States,California,Santa Cruz County,,Davenport Landing.,,0,,37.025,-122.2166667,,,,,,,,,,,,,,,en,,urn:catalog:CAS:BOT-BC:74355,1,92f9265f-51af-4832-882f-0a4a33dfa625,https://www.cch2.org/portal/collections/individual/index.php?occid=2385707
2446523,CAS,BOT-BC,,PreservedSpecimen,urn:catalog:CAS:BOT-BC:74354,74354,urn:catalog:CAS:DS:415794,Organism|Plantae|Viridiplantae|Streptophyta|Embryophyta|Tracheophyta|Spermatophytina|Magnoliopsida|Rosanae|Brassicales|Brassicaceae|Raphanus,Plantae,Tracheophyta,Magnoliopsida,Brassicales,Brassicaceae,Raphanus sativus,29702,L.,Raphanus,,sativus,,,Species,Ihsan A. Al-Shehbaz,2010-01,,,,,,"Thomas, J. H.",,1361A,3/27/50,,1950,3,27,86,,"Mar. 27, 1950","Plants 3-4 feet tall. Flowers white, sepals glabrous, or at least not hispid.",,,,,,,,,herbariumSpecimenDuplicate: https://www.cch2.org/portal/collections/individual/index.php?guid=c01449a5-54f3-4551-a5c4-247d1d87a3d4,,,,,,,,,,,North America,,,,United States,California,Santa Cruz County,,Davenport Landing.,,0,,37.025,-122.2166667,,,,,,,,,,,,,,,en,,urn:catalog:CAS:BOT-BC:74354,1,2f01edf2-b7b4-440f-b574-b8a57a5307f1,https://www.cch2.org/portal/collections/individual/index.php?occid=2446523
1367980,DAV,,,PreservedSpecimen,e71fe15d-52ab-41da-a0d9-d27409507e2b,DAV310436,Accession #: DAV21651,Organism|Plantae|Viridiplantae|Streptophyta|Embryophyta|Tracheophyta|Spermatophytina|Magnoliopsida|Rosanae|Brassicales|Brassicaceae|Raphanus,Plantae,Tracheophyta,Magnoliopsida,Brassicales,Brassicaceae,Raphanus raphanistrum,29701,L.,Raphanus,,raphanistrum,,,Species,,,,,,,,Rimo Bacigalupi,Alex D. Hawkes,3280,4/22/51,,1951,4,22,112,,22-Apr-51,Access Database Number (Deprecated): UCD115152,Along roadside.,,,,,,,,,,,,,,,,,,,,,,,United States,California,Merced,,Merced County: between Merced Falls and Snelling.,,0,,,,,,,,,,,,,,,,,,,,UCD115152,39,e71fe15d-52ab-41da-a0d9-d27409507e2b,https://www.cch2.org/portal/collections/individual/index.php?occid=1367980
3476616,UCJEPS,VASC,,PreservedSpecimen,2d6c09bb-4e24-4961-acc0-8850f864dfac,UC1046483,,Organism|Plantae|Viridiplantae|Streptophyta|Embryophyta|Tracheophyta|Spermatophytina|Magnoliopsida|Rosanae|Brassicales|Brassicaceae|Raphanus,Plantae,Tracheophyta,Magnoliopsida,Brassicales,Brassicaceae,Raphanus raphanistrum,29701,L.,Raphanus,,raphanistrum,,,Species,,,,,,,,"Rimo Bacigalupi, Alex D. Hawkes",,3280,4/22/51,,1951,4,22,112,,Apr 22 1951,,along roadside,,,,,,,,,,,Flowering/Fruiting,,,,,,,,,,,,United States,California,Merced,,between Merced Falls and Snelling,,0,,37.517044,-120.38377,NAD27,4841,,,Terrain Navigator 5.03 USGS 1:24000,,,,,,,,,,,,2d6c09bb-4e24-4961-acc0-8850f864dfac,46,4435a549-d5d4-4523-ac81-5e1f6d49f5e5,https://www.cch2.org/portal/collections/individual/index.php?occid=3476616
3498289,UCJEPS,VASC,,PreservedSpecimen,951b2846-bdad-463d-8e82-3d221e365539,JEPS8424,,Organism|Plantae|Viridiplantae|Streptophyta|Embryophyta|Tracheophyta|Spermatophytina|Magnoliopsida|Rosanae|Brassicales|Brassicaceae|Raphanus,Plantae,Tracheophyta,Magnoliopsida,Brassicales,Brassicaceae,Raphanus raphanistrum,29701,L.,Raphanus,,raphanistrum,,,Species,,,,,,,,"Rimo Bacigalupi, A. D. Hawkes",,3280,4/22/51,,1951,4,22,112,,Apr 22 1951,,along roadside,,,,,,,,,,,Flowering/Fruiting,,,,,,,,,,,,United States,California,Merced,,along roadside between Merced Falls and Snelling,,0,,37.517044,-120.38377,NAD27,4841,,,Terrain Navigator 5.03 USGS 1:24000,,,,,,,,,,,,951b2846-bdad-463d-8e82-3d221e365539,46,38adc61d-0019-42d5-ad15-9863b288d4ce,https://www.cch2.org/portal/collections/individual/index.php?occid=3498289
375714,SDSU,,,PreservedSpecimen,31c8303f-e91e-4b23-a4aa-ab4c877fc897,SDSU01237,1237,Organism|Plantae|Viridiplantae|Streptophyta|Embryophyta|Tracheophyta|Spermatophytina|Magnoliopsida|Rosanae|Brassicales|Brassicaceae|Raphanus,Plantae,Tracheophyta,Magnoliopsida,Brassicales,Brassicaceae,Raphanus sativus,29702,L.,Raphanus,,sativus,,,Species,,,,,,,,"Beckett, G.D.",,2950,3/12/51,,1951,3,12,71,,3/12/51,,,,Wild-radish.?,,,,,,,,,,,0,,,,,,,,,,United States,California,San Diego,,Bonita.,,0,,32.65783,-117.03003,WGS84,1609,Mary Alice Kessler,,Rancho Santa Ana: 2007-2009 CCH GBIF georeferencing grant,,3-Mar-09,,,,,,,,,preprocessed,,6,31c8303f-e91e-4b23-a4aa-ab4c877fc897,https://www.cch2.org/portal/collections/individual/index.php?occid=375714
375726,SDSU,,,PreservedSpecimen,6910e0ce-c5e5-4a35-acb6-9503d17d39f7,SDSU01249,1249,Organism|Plantae|Viridiplantae|Streptophyta|Embryophyta|Tracheophyta|Spermatophytina|Magnoliopsida|Rosanae|Brassicales|Brassicaceae|Raphanus,Plantae,Tracheophyta,Magnoliopsida,Brassicales,Brassicaceae,Raphanus sativus,29702,L.,Raphanus,,sativus,,,Species,,,,,,,,"Collier, Gerald",,M194,4/7/51,,1951,4,7,97,,4/7/51,,Brim of sea bluff Point Dume.,,,,,,,,herbariumSpecimenDuplicate: https://www.cch2.org/portal/collections/individual/index.php?guid=481bcaac-1e3a-4ca9-bad6-638dd111c5c7 | herbariumSpecimenDuplicate: https://www.cch2.org/portal/collections/individual/index.php?guid=d3bfaae9-c1c9-4036-84e0-e11788664360 | herbariumSpecimenDuplicate: https://www.cch2.org/portal/collections/individual/index.php?guid=c33fa65f-8372-4990-aa63-73f8870b8a25,,,,,0,,,,,,,,,,United States,California,Los Angeles,,About 2 miles west of U.S Hwy 101. 100 yards from road.,,0,,,,,,,,,,,,,,,,,,,preprocessed,,6,6910e0ce-c5e5-4a35-acb6-9503d17d39f7,https://www.cch2.org/portal/collections/individual/index.php?occid=375726
2358602,CAS,BOT-BC,,PreservedSpecimen,urn:catalog:CAS:BOT-BC:74223,74223,urn:catalog:CAS:BOT:886052,Organism|Plantae|Viridiplantae|Streptophyta|Embryophyta|Tracheophyta|Spermatophytina|Magnoliopsida|Rosanae|Brassicales|Brassicaceae|Raphanus,Plantae,Tracheophyta,Magnoliopsida,Brassicales,Brassicaceae,Raphanus sativus,29702,L.,Raphanus,,sativus,,,Species,Ihsan A. Al-Shehbaz,2010-01,,,,,,"Pollard, Henry M.",,s.n.,8/23/51,,1951,8,23,235,,"Aug. 23, 1951.",,,,,,,,,,,,,,,,,,,,,North America,,,,United States,California,Fresno County,,Huntington Lake and vicinity. Big Creek.,,0,,,,,,,,,,,1524,,,,,5000.0000000000 ft,,en,,urn:catalog:CAS:BOT-BC:74223,1,8539c602-be81-47f8-9e5c-7a2f081e25a1,https://www.cch2.org/portal/collections/individual/index.php?occid=2358602
3035050,CLARK,,,PreservedSpecimen,,CLARK-A1528-362,A1528-362,Organism|Plantae|Viridiplantae|Streptophyta|Embryophyta|Tracheophyta|Spermatophytina|Magnoliopsida|Rosanae|Brassicales|Brassicaceae|Raphanus,Plantae,Tracheophyta,Magnoliopsida,Brassicales,Brassicaceae,Raphanus sativus,29702,L.,Raphanus,,sativus,,,Species,,,,,,,,"John C. Roos, Lucille Roos",,5342,10/24/51,,1951,10,24,297,,10/24/51,,,,,,,,,,,,,,,,,,,,,,,,,United States,California,Riverside,,Pedley,,0,,33.9753,-117.4759,WGS84,,,,,,,244,,,,,800 ft,,,,,61,2b20c0dd-38b8-4545-942b-4675bec87dd0,https://www.cch2.org/portal/collections/individual/index.php?occid=3035050
3036199,CLARK,,,PreservedSpecimen,,CLARK-A1528-5387,A1528-5387,Organism|Plantae|Viridiplantae|Streptophyta|Embryophyta|Tracheophyta|Spermatophytina|Magnoliopsida|Rosanae|Brassicales|Brassicaceae|Raphanus,Plantae,Tracheophyta,Magnoliopsida,Brassicales,Brassicaceae,Raphanus sativus,29702,L.,Raphanus,,sativus,,,Species,,,,,,,,"John C. Roos, Lucille Roos",,5342,10/24/51,,1951,10,24,297,,10/24/51,,,,,,,,,,,,,,,,,,,,,,,,,United States,California,Riverside,,Pedley,,0,,33.9753,-117.4759,WGS84,,,,,,,244,,,,,800 ft,,,,,61,5a0dbbde-d0b8-47ce-89a1-22a6555f83e9,https://www.cch2.org/portal/collections/individual/index.php?occid=3036199
3904081,LA,,,PreservedSpecimen,0d7c3e2f-a558-4cad-8dc8-14850a4f00c7,LA00606061,LA35603,Organism|Plantae|Viridiplantae|Streptophyta|Embryophyta|Tracheophyta|Spermatophytina|Magnoliopsida|Rosanae|Brassicales|Brassicaceae|Raphanus,Plantae,Tracheophyta,Magnoliopsida,Brassicales,Brassicaceae,Raphanus sativus,29702,L.,Raphanus,,sativus,,,Species,,,,,,,,A. K. Khudairi,,s.n.,4/21/51,,1951,4,21,111,,21-Apr-51,,,,,,,,,,,,,,,,,,,,,,,,,United States,California,Los Angeles,,"Santa Monica Mountains; Westwood, UCLA campus. ""Faculty Hill""",,0,,,,,,,,,,,,,,,,,,,abaniaga,,34,0d7c3e2f-a558-4cad-8dc8-14850a4f00c7,https://www.cch2.org/portal/collections/individual/index.php?occid=3904081
3904084,LA,,,PreservedSpecimen,9af01255-d576-4f51-a540-648e3eef2f58,LA00606065,,Organism|Plantae|Viridiplantae|Streptophyta|Embryophyta|Tracheophyta|Spermatophytina|Magnoliopsida|Rosanae|Brassicales|Brassicaceae|Raphanus,Plantae,Tracheophyta,Magnoliopsida,Brassicales,Brassicaceae,Raphanus sativus,29702,L.,Raphanus,,sativus,,,Species,,,,,,,,A. H. Lange,,,5/10/51,,1951,5,10,130,,,,,,,,,,,,,,,,,,,,,,,,,,,,,,,,,0,,,,,,,,,,,,,,,,,,,abaniaga,,34,9af01255-d576-4f51-a540-648e3eef2f58,https://www.cch2.org/portal/collections/individual/index.php?occid=3904084
3904088,LA,,,PreservedSpecimen,46693868-3ed2-4461-afc6-ff9f944abb9d,LA00606070,,Organism|Plantae|Viridiplantae|Streptophyta|Embryophyta|Tracheophyta|Spermatophytina|Magnoliopsida|Rosanae|Brassicales|Brassicaceae|Raphanus,Plantae,Tracheophyta,Magnoliopsida,Brassicales,Brassicaceae,Raphanus sativus,29702,L.,Raphanus,,sativus,,,Species,,,,,,,,Virginia Mars,,,3/18/51,,1951,3,18,77,,,,,,,,,,,,,,,,,,,,,,,,,,,,,,,,,0,,,,,,,,,,,,,,,,,,,abaniaga,,34,46693868-3ed2-4461-afc6-ff9f944abb9d,https://www.cch2.org/portal/collections/individual/index.php?occid=3904088
3904070,LA,,,PreservedSpecimen,44a1b2a2-b8c6-41cf-99ad-a2817beb22ee,LA00606051,LA212266,Organism|Plantae|Viridiplantae|Streptophyta|Embryophyta|Tracheophyta|Spermatophytina|Magnoliopsida|Rosanae|Brassicales|Brassicaceae|Raphanus|Raphanus raphanistrum,Plantae,Tracheophyta,Magnoliopsida,Brassicales,Brassicaceae,Raphanus raphanistrum subsp. sativus,265975,(L.) Domin,Raphanus,,raphanistrum,subsp.,sativus,Subspecies,,,,,,,,Elwood Fordham,,s.n.,3/20/51,,1951,3,20,79,,20-Mar-51,,,,,,,,,,,,,,,,,,,,,,,,,United States,California,Los Angeles,,"Santa Monica Mountains; Westwood, UCLA campus. ""Faculty Hill""",,0,,,,,,,,,,,,,,,,,,,abaniaga,,34,44a1b2a2-b8c6-41cf-99ad-a2817beb22ee,https://www.cch2.org/portal/collections/individual/index.php?occid=3904070
2311342,CAS,BOT-BC,,PreservedSpecimen,urn:catalog:CAS:BOT-BC:74195,74195,urn:catalog:CAS:BOT:531050,Organism|Plantae|Viridiplantae|Streptophyta|Embryophyta|Tracheophyta|Spermatophytina|Magnoliopsida|Rosanae|Brassicales|Brassicaceae|Raphanus,Plantae,Tracheophyta,Magnoliopsida,Brassicales,Brassicaceae,Raphanus raphanistrum,29701,L.,Raphanus,,raphanistrum,,,Species,Ihsan A. Al-Shehbaz,2010-01,,,,,,"Rubtzoff, Peter",,1068,5/29/52,,1952,5,29,150,,"May 29, 1952.",,Sand dunes. With many weeds.,,,,,,,,,,,,,,,,,,,North America,,,,United States,California,San Francisco County,,San Francisco. Sand dunes at 37th Avenue between Ortega and Quintara Streets. Eastern edge of area.,,0,,,,,,,,,,,,,,,,,,en,,urn:catalog:CAS:BOT-BC:74195,1,1a0e20a6-dbaa-4c17-95ba-5ca014030055,https://www.cch2.org/portal/collections/individual/index.php?occid=2311342
5504845,CAS,BOT-BC,,PreservedSpecimen,urn:catalog:CAS:BOT-BC:684482,684482,,Organism|Plantae|Viridiplantae|Streptophyta|Embryophyta|Tracheophyta|Spermatophytina|Magnoliopsida|Rosanae|Brassicales|Brassicaceae|Raphanus,Plantae,Tracheophyta,Magnoliopsida,Brassicales,Brassicaceae,Raphanus raphanistrum,29701,L.,Raphanus,,raphanistrum,,,Species,,,,,,,,"Roos, John C.",,5565,4/22/52,,1952,4,22,113,,22-Apr-52,Cruciferae. Flowers yellow. . CalState Hayward.,"along roadside with Chenopodium album, Raphanus sativus, ect.",,,,,,,,,,,,,,,,,,,North America,,,,United States,California,San Bernardino County,,Loma Linda; San Bernardino Valley.,,0,,,,,,,,,,,320,,,,,1050.0000000000 ft,,en,,urn:catalog:CAS:BOT-BC:684482,1,651b821f-0c74-435a-9ab1-a2d36fd52c1c,https://www.cch2.org/portal/collections/individual/index.php?occid=5504845
375708,SDSU,,,PreservedSpecimen,c12c8217-99e8-447c-88ea-5a4affb75b54,SDSU01231,1231,Organism|Plantae|Viridiplantae|Streptophyta|Embryophyta|Tracheophyta|Spermatophytina|Magnoliopsida|Rosanae|Brassicales|Brassicaceae|Raphanus,Plantae,Tracheophyta,Magnoliopsida,Brassicales,Brassicaceae,Raphanus sativus,29702,L.,Raphanus,,sativus,,,Species,,,,,,,,"Coop, Wm E.",,,5/1/52,,1952,5,1,122,,5/1/52,,,,,,,,,,,,,,,0,,,,,,,,,,United States,California,San Diego,,Leucadia.,,0,,33.07216,-117.29556,WGS84,1609,San Diego NHM B,,(copied from SD28182),,georef from 2006-2015 archive backup file; Date Georeferenced: Wed Mar 7 14:49:11 2012,,,,,,,,,preprocessed,,6,c12c8217-99e8-447c-88ea-5a4affb75b54,https://www.cch2.org/portal/collections/individual/index.php?occid=375708
753633,RSA,RSA,,PreservedSpecimen,36fbf26a-26a9-41a2-8e4a-2ce193ea899e,,RSA accession: 212520,Organism|Plantae|Viridiplantae|Streptophyta|Embryophyta|Tracheophyta|Spermatophytina|Magnoliopsida|Rosanae|Brassicales|Brassicaceae|Raphanus,Plantae,Tracheophyta,Magnoliopsida,Brassicales,Brassicaceae,Raphanus sativus,29702,L.,Raphanus,,sativus,,,Species,,,,,,,,Peter Rubtzoff,,1067,5/29/52,,1952,5,29,150,,,,,,"Eastern edge of area, with many weeds.",,,,,,,,,flowers & fruits,Introduced,,,,,herbarium sheet,,,,,,United States,California,San Francisco,,Sand dunes at 37th Avenue below Ortega and Quintara streets.,,0,,37.7496,-122.4957,WGS84,200,San Jose S.U. A,,GoogleMaps via BerkeleyMapper (copied from RSA224302),,Tue Nov 27 18:51:00 2012; georef from 2006-2015 archive backup file,,,,,,,,,Jackie C. McConnaughy; cataloged date: 2012-04-17,36fbf26a-26a9-41a2-8e4a-2ce193ea899e,17,906bc281-c5c6-4255-bbae-bd87fdda179e,https://www.cch2.org/portal/collections/individual/index.php?occid=753633
2262517,LOB,,,PreservedSpecimen,201ade35-4d6c-47dd-b0f9-5d595dc1948b,LOB116472,2524,Organism|Plantae|Viridiplantae|Streptophyta|Embryophyta|Tracheophyta|Spermatophytina|Magnoliopsida|Rosanae|Brassicales|Brassicaceae|Raphanus,Plantae,Tracheophyta,Magnoliopsida,Brassicales,Brassicaceae,Raphanus sativus,29702,L.,Raphanus,,sativus,,,Species,,,,,,,,Martha Hawkins,,s.n.,5/10/52,,1952,5,10,131,,10-May-52,,waste places,,,,,,,,,,,,,,,,,,,,,,,United States,California,Orange,,Costa Mesa,,0,,33.641132,-117.918669,WGS84,5882,,,GeoLocate,,,,,,,,,,,14412695,,19,201ade35-4d6c-47dd-b0f9-5d595dc1948b,https://www.cch2.org/portal/collections/individual/index.php?occid=2262517
2262518,LOB,,,PreservedSpecimen,b5003bba-7a89-4f01-a08b-e2f2f6faa616,LOB116473,2525,Organism|Plantae|Viridiplantae|Streptophyta|Embryophyta|Tracheophyta|Spermatophytina|Magnoliopsida|Rosanae|Brassicales|Brassicaceae|Raphanus,Plantae,Tracheophyta,Magnoliopsida,Brassicales,Brassicaceae,Raphanus sativus,29702,L.,Raphanus,,sativus,,,Species,D. Nead,,,,,,,Don Nead,,34,5/24/52,,1952,5,24,145,,24-May-52,,canyon floor,silt,,,,,,,,,,,,,,,,,,,,,,United States,California,Los Angeles,,Palos Verde Hills,,0,,33.766672,-118.364114,WGS84,6902,Aefisher (2019-12-22 14:00:32),,georef batch tool 2019-12-22; GeoLocate,reviewed - high confidence,,122,,,,,400 ft,,,14412695,,19,b5003bba-7a89-4f01-a08b-e2f2f6faa616,https://www.cch2.org/portal/collections/individual/index.php?occid=2262518
2411987,CAS,BOT-BC,,PreservedSpecimen,urn:catalog:CAS:BOT-BC:74331,74331,urn:catalog:CAS:BOT:531253,Organism|Plantae|Viridiplantae|Streptophyta|Embryophyta|Tracheophyta|Spermatophytina|Magnoliopsida|Rosanae|Brassicales|Brassicaceae|Raphanus,Plantae,Tracheophyta,Magnoliopsida,Brassicales,Brassicaceae,Raphanus sativus,29702,L.,Raphanus,,sativus,,,Species,Ihsan A. Al-Shehbaz,2010-01,,,,,,"Bush, Dr. Mildred",,s.n.,10/17/52,,1952,10,17,291,,"Oct. 17, 1952",,,,,,,,,,,,,,,,,,,,,North America,,,,United States,California,San Francisco County,,San Francisco. Lake Merced.,,0,,37.7183,-122.4881,WGS84,1700,,GoogleMaps via BerkeleyMapper (copied from RSA169410),,,,,,,,,,,en,,urn:catalog:CAS:BOT-BC:74331,1,02577a22-2bd3-46e2-8924-0301600be16f,https://www.cch2.org/portal/collections/individual/index.php?occid=2411987
2414651,CAS,BOT-BC,,PreservedSpecimen,urn:catalog:CAS:BOT-BC:74335,74335,urn:catalog:CAS:BOT:592408,Organism|Plantae|Viridiplantae|Streptophyta|Embryophyta|Tracheophyta|Spermatophytina|Magnoliopsida|Rosanae|Brassicales|Brassicaceae|Raphanus,Plantae,Tracheophyta,Magnoliopsida,Brassicales,Brassicaceae,Raphanus sativus,29702,L.,Raphanus,,sativus,,,Species,Ihsan A. Al-Shehbaz,2010-01,,,,,,"Twisselmann, Ernest C.",,234,7/31/52,,1952,7,31,213,,"July 31, 1952.","Single plant. Adventive. Spreading, bushy. Not otherwise known in the region. (Now extinct here: 2-23-65).",In a natural garden.,,,,,,,,,,,,,,,,,,,North America,,,,United States,California,San Luis Obispo County,,"Temblor Range and the Western San Joaquin Valley. Twisselmann Ranch, 7 miles south of Cholame.",,0,,,,,,,,,,,,,,,,,,en,,urn:catalog:CAS:BOT-BC:74335,1,924972bf-100e-4afa-9a16-82d1e7dbb072,https://www.cch2.org/portal/collections/individual/index.php?occid=2414651
304537,UCSB,,,PreservedSpecimen,fc2b1782-1a5d-11e3-b49f-525400a0a001,UCSB031994,2402,Organism|Plantae|Viridiplantae|Streptophyta|Embryophyta|Tracheophyta|Spermatophytina|Magnoliopsida|Rosanae|Brassicales|Brassicaceae|Raphanus,Plantae,Tracheophyta,Magnoliopsida,Brassicales,Brassicaceae,Raphanus raphanistrum,29701,L.,Raphanus,,raphanistrum,,,Species,,,,,,,,Isabelle McElwain,,s.n.,3/29/53,,1953,3,29,88,,,,"Bottom of steep-sloping, N-facing, irregated cow-pasture",,,,,,,,,,,,,,,,,Sheet - 1,,,,,,United States,California,Los Angeles,,"N of 18000 Bull Canyon Rd., Granada Hills",,0,,34.29362,-118.522631,WGS84,500,gwahlert (2020-09-11 15:59:48),,georef batch tool 2020-09-11,,,,,,,,,,,,,35,9029e95d-3173-4ff1-9ba5-954be18804d2,https://www.cch2.org/portal/collections/individual/index.php?occid=304537
2061660,CHSC,VascularPlants,,PreservedSpecimen,a0ecafea-1239-4cfb-a3b5-c6be3a892483,CHSC000536,,Organism|Plantae|Viridiplantae|Streptophyta|Embryophyta|Tracheophyta|Spermatophytina|Magnoliopsida|Rosanae|Brassicales|Brassicaceae|Raphanus,Plantae,Tracheophyta,Magnoliopsida,Brassicales,Brassicaceae,Raphanus raphanistrum,29701,L.,Raphanus,,raphanistrum,,,Species,R.E. Preston,1/4/82,,,,,,M. Underhill,,,4/12/53,,1953,4,12,102,,4/12/53,Vesta Holt label.,,,,,,,,,,,,,,,,,,,,,,,,United States,California,Shasta,,,,0,,40.793611,-121.9425,NAD83,402,Bill Carlson,,,,,76,,,,,250ft.,,,,,44,a0ecafea-1239-4cfb-a3b5-c6be3a892483,https://www.cch2.org/portal/collections/individual/index.php?occid=2061660
3792159,FSC,,,PreservedSpecimen,c83b8377-ed07-481c-967e-86e0572aef89,FSC0010444,,Organism|Plantae|Viridiplantae|Streptophyta|Embryophyta|Tracheophyta|Spermatophytina|Magnoliopsida|Rosanae|Brassicales|Brassicaceae|Raphanus,Plantae,Tracheophyta,Magnoliopsida,Brassicales,Brassicaceae,Raphanus raphanistrum,29701,L.,Raphanus,,raphanistrum,,,Species,,,,,,,,Chas. H. Quibell,,1674,3/17/53,,1953,3,17,76,,17-Mar-53,,Valley Grassld. area.,,,,,,,,herbariumSpecimenDuplicate: https://www.cch2.org/portal/collections/individual/index.php?guid=95de43fc-683a-4bad-9a3b-c3ec42ec909d,,,,,,,,,,,,,,,United States,California,Fresno,,Fields along Hiway 41 just s. of pt. where rd. starts downgrade to San Joaquin R.,,0,,,,,,,,,,,107,,,,,350',,en,pawanpreetgill5,,38,c83b8377-ed07-481c-967e-86e0572aef89,https://www.cch2.org/portal/collections/individual/index.php?occid=3792159
3792160,FSC,,,PreservedSpecimen,8a09bdc7-8cb8-4066-8202-ec845255f939,FSC0010445,,Organism|Plantae|Viridiplantae|Streptophyta|Embryophyta|Tracheophyta|Spermatophytina|Magnoliopsida|Rosanae|Brassicales|Brassicaceae|Raphanus,Plantae,Tracheophyta,Magnoliopsida,Brassicales,Brassicaceae,Raphanus raphanistrum,29701,L.,Raphanus,,raphanistrum,,,Species,,,,,,,,Simon Simonian,,2797,4/4/53,,1953,4,4,94,,4-Apr-53,Raphanus few crest of ditch,crest of ditch; canal with water.,,,,,,,,,,,,,,,,,,,,,,,United States,California,Fresno,,"Kaiser Ditch, w-e sect. at Shields & Westlawn Ave. about 3 m. n. of Rolinda.",,0,,,,,,,,,,,,,,,,,,en,pawanpreetgill5,,38,8a09bdc7-8cb8-4066-8202-ec845255f939,https://www.cch2.org/portal/collections/individual/index.php?occid=3792160
304554,UCSB,,,PreservedSpecimen,fc2b8406-1a5d-11e3-b49f-525400a0a001,UCSB031998,2419,Organism|Plantae|Viridiplantae|Streptophyta|Embryophyta|Tracheophyta|Spermatophytina|Magnoliopsida|Rosanae|Brassicales|Brassicaceae|Raphanus,Plantae,Tracheophyta,Magnoliopsida,Brassicales,Brassicaceae,Raphanus sativus,29702,L.,Raphanus,,sativus,,,Species,,,,,,,,Isabelle McElwain,,s.n.,3/29/53,,1953,3,29,88,,,,"Bottom of an irregated, north sloping cow-pasture",,,,,,,,,,,,,,,,,Sheet - 1,,,,,,United States,California,Los Angeles,,500 yds. north of 18000 Bull Canyon Rd.,,0,,34.29362,-118.522631,WGS84,500,gwahlert (2020-09-11 15:59:48),,georef batch tool 2020-09-11,,,,,,,,,,,,,35,60ea8d68-5e32-4205-b722-ef8d726f88c4,https://www.cch2.org/portal/collections/individual/index.php?occid=304554
304571,UCSB,,,PreservedSpecimen,fc2ba4a4-1a5d-11e3-b49f-525400a0a001,UCSB032026,2425,Organism|Plantae|Viridiplantae|Streptophyta|Embryophyta|Tracheophyta|Spermatophytina|Magnoliopsida|Rosanae|Brassicales|Brassicaceae|Raphanus,Plantae,Tracheophyta,Magnoliopsida,Brassicales,Brassicaceae,Raphanus sativus,29702,L.,Raphanus,,sativus,,,Species,,,,,,,,Norman Haller,,,4/18/53,,1953,4,18,108,,,,Vacant lot; growing among other vacant lot grasses,,,,,,,,,,,,,,,,,Sheet - 1,,,,,,United States,California,Los Angeles,,"Two lots up from Tri-Delt house, Hilgard Ave., University of Calif. at Los Angeles",,0,,,,WGS84,,,,,,,,,,,,,,,,,35,1ce81d8e-348f-4bf4-babd-21856cee9c23,https://www.cch2.org/portal/collections/individual/index.php?occid=304571
921047,RSA,RSA,,PreservedSpecimen,62ee012d-caa3-4844-a089-14c14c39c615,RSA0029813,RSA accession: 808972,Organism|Plantae|Viridiplantae|Streptophyta|Embryophyta|Tracheophyta|Spermatophytina|Magnoliopsida|Rosanae|Brassicales|Brassicaceae|Raphanus,Plantae,Tracheophyta,Magnoliopsida,Brassicales,Brassicaceae,Raphanus sativus,29702,L.,Raphanus,,sativus,,,Species,,,,,,,,D. M. McF,,s.n.,2/17/53,,1953,2,17,48,,,,Gentle west slope. Rocky soil.,,,,,,,,,,,,Introduced,,,,,herbarium sheet,,,,,,United States,California,San Luis Obispo,,Pecho Ranch. On the ocean.,,0,,,,,,,,,,,,,,,,,,,Rachel L. Poutasse; cataloged date: 2014-08-07,62ee012d-caa3-4844-a089-14c14c39c615,17,578d8953-6a6b-4b4f-94df-6e6aca481f10,https://www.cch2.org/portal/collections/individual/index.php?occid=921047
1028268,RSA,RSA,,PreservedSpecimen,95de43fc-683a-4bad-9a3b-c3ec42ec909d,,RSA accession: 88977,Organism|Plantae|Viridiplantae|Streptophyta|Embryophyta|Tracheophyta|Spermatophytina|Magnoliopsida|Rosanae|Brassicales|Brassicaceae|Raphanus,Plantae,Tracheophyta,Magnoliopsida,Brassicales,Brassicaceae,Raphanus sativus,29702,L.,Raphanus,,sativus,,,Species,,,,,,,,Chas. H. Quibell,,1674,3/17/53,,1953,3,17,76,,,,Valley Grassland area.,,Fields.,,,,,,herbariumSpecimenDuplicate: https://www.cch2.org/portal/collections/individual/index.php?guid=c83b8377-ed07-481c-967e-86e0572aef89,,,flowers,Introduced,,,,,herbarium sheet,,,,,,United States,California,Fresno,,Along Hwy 41 just S of pt where rd starts downgrade to San Joaquin River.,,0,,,,,,,,,,,107,,,,,350ft.,,,Jackie C. McConnaughy; cataloged date: 2012-04-13,95de43fc-683a-4bad-9a3b-c3ec42ec909d,17,59827043-23ed-4223-b77b-6eddc7438f26,https://www.cch2.org/portal/collections/individual/index.php?occid=1028268
1153085,RSA,RSA,,PreservedSpecimen,d1955841-2f4a-43f2-beb1-8d9662902010,,RSA accession: 126321,Organism|Plantae|Viridiplantae|Streptophyta|Embryophyta|Tracheophyta|Spermatophytina|Magnoliopsida|Rosanae|Brassicales|Brassicaceae|Raphanus,Plantae,Tracheophyta,Magnoliopsida,Brassicales,Brassicaceae,Raphanus sativus,29702,L.,Raphanus,,sativus,,,Species,,,,,,,,John H. Thomas,,3186,5/23/53,,1953,5,23,143,,,,grazed grassland,,Grazed grassland with occasional Oak -madrone woods. In oat field.,,,,,,herbariumSpecimenDuplicate: https://www.cch2.org/portal/collections/individual/index.php?guid=urn:catalog:CAS:BOT-BC:74358,,,flowers & fruits,Introduced,,,,,herbarium sheet,,,,,,United States,California,Santa Cruz,,"Saint Mary of the Palms, summer girls? camp near Glenwood.",,0,,37.1083333,-121.985,,,,,,,,305,,,,,1000ft.,,,Jackie C. McConnaughy; cataloged date: 2012-04-17,d1955841-2f4a-43f2-beb1-8d9662902010,17,27fd27ee-09eb-4ee8-b29e-5d6dcd6c9876,https://www.cch2.org/portal/collections/individual/index.php?occid=1153085
1367996,DAV,,,PreservedSpecimen,f1d043fa-9c90-4067-b9ab-ab196eda04a3,AHUC100065,Accession #: AHUC20205,Organism|Plantae|Viridiplantae|Streptophyta|Embryophyta|Tracheophyta|Spermatophytina|Magnoliopsida|Rosanae|Brassicales|Brassicaceae|Raphanus,Plantae,Tracheophyta,Magnoliopsida,Brassicales,Brassicaceae,Raphanus sativus,29702,L.,Raphanus,,sativus,,,Species,,,,,,,,Beecher Crampton,,s.n.,4/27/53,,1953,4,27,117,,27-Apr-53,Access Database Number (Deprecated): UCD115171,Along the road. Growing in foothills.,,,,,,,,,,,,,,,,,,,,,,,United States,California,Yolo,,Yolo County: 3 miles west of Winters.,,0,,,,,,,,,,,,,,,,,,,,UCD115171,39,f1d043fa-9c90-4067-b9ab-ab196eda04a3,https://www.cch2.org/portal/collections/individual/index.php?occid=1367996
2262519,LOB,,,PreservedSpecimen,a37dfda6-c723-4712-961d-47218e8c5ce8,LOB116474,2528,Organism|Plantae|Viridiplantae|Streptophyta|Embryophyta|Tracheophyta|Spermatophytina|Magnoliopsida|Rosanae|Brassicales|Brassicaceae|Raphanus,Plantae,Tracheophyta,Magnoliopsida,Brassicales,Brassicaceae,Raphanus sativus,29702,L.,Raphanus,,sativus,,,Species,,,,,,,,James D. Milne,,47,2/28/53,,1953,2,28,59,,28-Feb-53,,,,,,,,,,,,,,,,,,,,,,,,,United States,California,Los Angeles,Long Beach,"Campus, west of Palo Verde Avenue",,0,,33.784505,-118.114478,WGS84,1253,Aefisher (2019-11-28 22:37:10),,georef batch tool 2019-11-28; GeoLocate,reviewed - high confidence,,,,,,,,,,14412695,,19,a37dfda6-c723-4712-961d-47218e8c5ce8,https://www.cch2.org/portal/collections/individual/index.php?occid=2262519
2275918,CAS,BOT-BC,,PreservedSpecimen,urn:catalog:CAS:BOT-BC:74350,74350,urn:catalog:CAS:DS:593819,Organism|Plantae|Viridiplantae|Streptophyta|Embryophyta|Tracheophyta|Spermatophytina|Magnoliopsida|Rosanae|Brassicales|Brassicaceae|Raphanus,Plantae,Tracheophyta,Magnoliopsida,Brassicales,Brassicaceae,Raphanus sativus,29702,L.,Raphanus,,sativus,,,Species,Ihsan A. Al-Shehbaz,2010-01,,,,,,"Cohen, Daniel",,7,4/5/53,,1953,4,5,95,,"Apr. 5, 1953",Thick radish smelling root.,Grassy meadow.,,,,,,,,,,,,,,,,,,,North America,,,,United States,California,Santa Clara County,,West of Anatomy Building. Stanford Campus.,,0,,,,,,,,,,,,,,,,,,en,,urn:catalog:CAS:BOT-BC:74350,1,6ebaac03-70d4-434a-bfc1-9dfb977bf17e,https://www.cch2.org/portal/collections/individual/index.php?occid=2275918
2360184,CAS,BOT-BC,,PreservedSpecimen,urn:catalog:CAS:BOT-BC:74357,74357,urn:catalog:CAS:DS:380399,Organism|Plantae|Viridiplantae|Streptophyta|Embryophyta|Tracheophyta|Spermatophytina|Magnoliopsida|Rosanae|Brassicales|Brassicaceae|Raphanus,Plantae,Tracheophyta,Magnoliopsida,Brassicales,Brassicaceae,Raphanus sativus,29702,L.,Raphanus,,sativus,,,Species,Ihsan A. Al-Shehbaz,2010-01,,,,,,"Thomas, J. H.",,2723,2/1/53,,1953,2,1,32,,1-Feb-53,Petals whitish with blue veins.,"Along edge of and in cabbage field. Soil is heavy, moist, black. Other weed species common here: Capsella bursa-pastoris, Stellaria media, Spergula arvensis, Poa annua, Anthemis cotula, Lamium amplexicaule.",,,,,,,,,,,,,,,,,,,North America,,,,United States,California,Santa Cruz County,,About 0.5 mile inland from Sea Cliff Beach State Park which is between Santa Cruz and Watsonville.,,0,,37.97083333,-121.8916667,,,,,,,,61,,,,,200.0000000000 ft,,en,,urn:catalog:CAS:BOT-BC:74357,1,566f6e58-512e-4846-a069-6eee02844588,https://www.cch2.org/portal/collections/individual/index.php?occid=2360184
2423571,CAS,BOT-BC,,PreservedSpecimen,urn:catalog:CAS:BOT-BC:74358,74358,urn:catalog:CAS:DS:593628,Organism|Plantae|Viridiplantae|Streptophyta|Embryophyta|Tracheophyta|Spermatophytina|Magnoliopsida|Rosanae|Brassicales|Brassicaceae|Raphanus,Plantae,Tracheophyta,Magnoliopsida,Brassicales,Brassicaceae,Raphanus sativus,29702,L.,Raphanus,,sativus,,,Species,Ihsan A. Al-Shehbaz,2010-01,,,,,,"Thomas, J. H.",,3186,5/23/53,,1953,5,23,143,,23-May-53,,Grazed grassland with occasional Oak-Madrone woods. In oat field.,,,,,,,,herbariumSpecimenDuplicate: https://www.cch2.org/portal/collections/individual/index.php?guid=d1955841-2f4a-43f2-beb1-8d9662902010,,,,,,,,,,,North America,,,,United States,California,Santa Cruz County,,"Saint Mary of the Palms, summer girls' camp near Glenwood.",,0,,37.10833333,-121.985,,,,,,,,305,,,,,1000.0000000000 ft,,en,,urn:catalog:CAS:BOT-BC:74358,1,73d6c48f-495e-47fb-a963-4a22f772ff88,https://www.cch2.org/portal/collections/individual/index.php?occid=2423571
2962239,HREC,,,PreservedSpecimen,6f743d1b-99e7-4761-b692,HREC988,,Organism|Plantae|Viridiplantae|Streptophyta|Embryophyta|Tracheophyta|Spermatophytina|Magnoliopsida|Rosanae|Brassicales|Brassicaceae|Raphanus,Plantae,Tracheophyta,Magnoliopsida,Brassicales,Brassicaceae,Raphanus sativus,29702,L.,Raphanus,,sativus,,,Species,,,,,,,,H. F. Heady,,685,5/6/53,,1953,5,6,126,,6-May-53,,,,,,,,,,,,,,,,,,,,,,,,,United States,California,Mendocino,,"Hopland Field Station: Vassar Field, along road",,0,,38.9890162,-123.0796707,,1344,,,,,,,,,,,,,,,6f743d1b-99e7-4761-b692,59,36de1628-99c6-430c-ae69-f4ba8270dcd0,https://www.cch2.org/portal/collections/individual/index.php?occid=2962239
3514143,UCJEPS,VASC,,PreservedSpecimen,2d8a5144-3d05-49d3-a415-da1a8434d7c2,UC1252110,,Organism|Plantae|Viridiplantae|Streptophyta|Embryophyta|Tracheophyta|Spermatophytina|Magnoliopsida|Rosanae|Brassicales|Brassicaceae|Raphanus,Plantae,Tracheophyta,Magnoliopsida,Brassicales,Brassicaceae,Raphanus sativus,29702,L.,Raphanus,,sativus,,,Species,,,,,,,,J. H. Thomas,,2723,2/1/53,,1953,2,1,32,,Feb 1 1953,,"weeds along edge of and in cabbage field; soil is heavy, moist, black",,petals whitish with blue veins,,,,,,,,,Flowering/Fruiting,,,,,,,,,,,,United States,California,Santa Cruz,,about 1/2 mi inland from Sea Cliff Beach State Park (which is between Santa Cruz and Watsonville),,0,,36.970833,-121.891667,,,,,,,,60,,,,,200 ft,,,,2d8a5144-3d05-49d3-a415-da1a8434d7c2,46,fd2dd55b-b5de-4e99-a9f1-5eb99b60324a,https://www.cch2.org/portal/collections/individual/index.php?occid=3514143
3904086,LA,,,PreservedSpecimen,afb9362a-c608-4f69-8735-54620eae9e8b,LA00606067,,Organism|Plantae|Viridiplantae|Streptophyta|Embryophyta|Tracheophyta|Spermatophytina|Magnoliopsida|Rosanae|Brassicales|Brassicaceae|Raphanus,Plantae,Tracheophyta,Magnoliopsida,Brassicales,Brassicaceae,Raphanus sativus,29702,L.,Raphanus,,sativus,,,Species,,,,,,,,Leo Boyd,,,3/29/53,,1953,3,29,88,,,,,,,,,,,,,,,,,,,,,,,,,,,,,,,,,0,,,,,,,,,,,,,,,,,,,abaniaga,,34,afb9362a-c608-4f69-8735-54620eae9e8b,https://www.cch2.org/portal/collections/individual/index.php?occid=3904086
705793,RSA,RSA,,PreservedSpecimen,2046f368-7614-4739-91e4-444413a17006,,RSA accession: 763925,Organism|Plantae|Viridiplantae|Streptophyta|Embryophyta|Tracheophyta|Spermatophytina|Magnoliopsida|Rosanae|Brassicales|Brassicaceae|Raphanus,Plantae,Tracheophyta,Magnoliopsida,Brassicales,Brassicaceae,Raphanus raphanistrum,29701,L.,Raphanus,,raphanistrum,,,Species,,,,,,,,Doris Hoover Bowers,,156,4/5/54,,1954,4,5,95,,,,,,Common Name: Jointed Charlock,,,,,,,,,,Introduced,,,,,herbarium sheet,,,,,,United States,California,Los Angeles,,LaVerne hills,,0,,,,,,,,,,,320,,,,,1050ft.,,,Baby M. Snigdha; cataloged date: 2010-04-21,2046f368-7614-4739-91e4-444413a17006,17,f11d5a2e-b6a1-4163-8a36-af51353448ec,https://www.cch2.org/portal/collections/individual/index.php?occid=705793
2324050,CAS,BOT-BC,,PreservedSpecimen,urn:catalog:CAS:BOT-BC:74181,74181,urn:catalog:CAS:BOT:886063,Organism|Plantae|Viridiplantae|Streptophyta|Embryophyta|Tracheophyta|Spermatophytina|Magnoliopsida|Rosanae|Brassicales|Brassicaceae|Raphanus,Plantae,Tracheophyta,Magnoliopsida,Brassicales,Brassicaceae,Raphanus raphanistrum,29701,L.,Raphanus,,raphanistrum,,,Species,Ihsan A. Al-Shehbaz,2010-01,,,,,,"Howell, John Thomas",,s.n.,5/16/54,,1954,5,16,136,,"May 16, 1954.",,,,,,,,,,,,,,,,,,,,,North America,,,,United States,California,El Dorado County,,Sierra Nevada. Shingle Springs.,,0,,,,,,,,,,,450,,,,,1476.0000000000 ft,,en,,urn:catalog:CAS:BOT-BC:74181,1,adab05f8-a2b9-44bc-9904-289729913df4,https://www.cch2.org/portal/collections/individual/index.php?occid=2324050
2370292,CAS,BOT-BC,,PreservedSpecimen,urn:catalog:CAS:BOT-BC:74202,74202,urn:catalog:CAS:BOT:390409,Organism|Plantae|Viridiplantae|Streptophyta|Embryophyta|Tracheophyta|Spermatophytina|Magnoliopsida|Rosanae|Brassicales|Brassicaceae|Raphanus,Plantae,Tracheophyta,Magnoliopsida,Brassicales,Brassicaceae,Raphanus raphanistrum,29701,L.,Raphanus,,raphanistrum,,,Species,Ihsan A. Al-Shehbaz,2010-01,,,,,,"Raven, Peter H.",,7105,6/30/54,,1954,6,30,181,,30-Jun-54,,,,,,,,,,,,,,,,,,,,,North America,,,,United States,California,Fresno County,,Sierra Nevada. Mono Hot Springs.,,0,,,,,,,,,,,1981,,,,,6500.0000000000 ft,,en,,urn:catalog:CAS:BOT-BC:74202,1,ad049e3d-1b86-49fd-a910-cbc526f9eafa,https://www.cch2.org/portal/collections/individual/index.php?occid=2370292
3792168,FSC,,,PreservedSpecimen,42308214-3a3a-4b93-9d4c-8b487f25e3f0,FSC0010453,,Organism|Plantae|Viridiplantae|Streptophyta|Embryophyta|Tracheophyta|Spermatophytina|Magnoliopsida|Rosanae|Brassicales|Brassicaceae|Raphanus,Plantae,Tracheophyta,Magnoliopsida,Brassicales,Brassicaceae,Raphanus raphanistrum,29701,L.,Raphanus,,raphanistrum,,,Species,,,,,,,,Simon Simonian,,1953A,4/16/54,,1954,4,16,106,,16-Apr-54,Occasional,,,,,,,,,,,,,,,,,,,,,,,,United States,California,Fresno,,"Forkner Ditch, e-2 sect. xing of Friant Rd. s. of Shepherd Ave. 1 1/2 m. ne of Pinedale. Fresno Irrigation District",,0,,,,,,,,,,,,,,,,,,en,pawanpreetgill5,,38,42308214-3a3a-4b93-9d4c-8b487f25e3f0,https://www.cch2.org/portal/collections/individual/index.php?occid=3792168
3792176,FSC,,,PreservedSpecimen,2067929c-0abc-41ce-a8fc-2ba898690e69,FSC0010461,,Organism|Plantae|Viridiplantae|Streptophyta|Embryophyta|Tracheophyta|Spermatophytina|Magnoliopsida|Rosanae|Brassicales|Brassicaceae|Raphanus,Plantae,Tracheophyta,Magnoliopsida,Brassicales,Brassicaceae,Raphanus raphanistrum,29701,L.,Raphanus,,raphanistrum,,,Species,,,,,,,,Simon Simonian,,637,4/10/54,,1954,4,10,100,,10-Apr-54,Rare on crest of bank,Canal with water,,,,,,,,,,,,,,,,,,,,,,,United States,California,Fresno,,Enterprise Canal. e-w sect. xing Sanger-academy Rd. at Gettysburg Ave. About 9 n. nw. of Centerville. Main Canal,,0,,,,,,,,,,,,,,,,,,en,pawanpreetgill5,,38,2067929c-0abc-41ce-a8fc-2ba898690e69,https://www.cch2.org/portal/collections/individual/index.php?occid=3792176
4298010,OSC,V,,PreservedSpecimen,{B33771DC-72D8-42D3-9526-2DC525F817BC},OSC-V-023813,OSC89816,Organism|Plantae|Viridiplantae|Streptophyta|Embryophyta|Tracheophyta|Spermatophytina|Magnoliopsida|Rosanae|Brassicales|Brassicaceae|Raphanus,Plantae,Tracheophyta,Magnoliopsida,Brassicales,Brassicaceae,Raphanus raphanistrum,29701,L.,Raphanus,,raphanistrum,,,Species,"Halse, R.",1996,,,,,,Keith R. Matson,,24,4/18/54,,1954,4,18,108,,4/18/54,,"Abundant, on dry rocky roadside flat.",,,,,,,,,,,,wild collection,,,,,,,,,,,United States,Oregon,Benton,,"3 miles North of Corvallis, on Highway 99W.",,0,,44.65293243,-123.2719,,4828,,OregonFlora 1994-2020 methodology,"OrlookId: 67958, StateProvince: Oregon, County: Benton, LocName: Corvallis, 3 mi. N of",,Georeferencing could be made more precise.,,,,,,,,,,4436518,81,fdd741ff-a11c-4ff8-8cf2-a69dbdf82db7,https://www.cch2.org/portal/collections/individual/index.php?occid=4298010
304597,UCSB,,,PreservedSpecimen,fc2be752-1a5d-11e3-b49f-525400a0a001,UCSB032064,2417,Organism|Plantae|Viridiplantae|Streptophyta|Embryophyta|Tracheophyta|Spermatophytina|Magnoliopsida|Rosanae|Brassicales|Brassicaceae|Raphanus,Plantae,Tracheophyta,Magnoliopsida,Brassicales,Brassicaceae,Raphanus sativus,29702,L.,Raphanus,,sativus,,,Species,,,,,,,,Ballard,,31,4/18/54,,1954,4,18,108,,,,Growing in open field,,,,,,,,,,,,,,,,,Sheet - 1,,,,,,United States,California,San Diego,,"Rancho Rincon del Diablo, Escondido",,0,,33.1188,-117.0846,WGS84,8000,San Diego NHM E,,Google Earth (copied from UCSB4851),,Wed Mar 1 14:02:33 2017,,,,,,,,,preprocessed,,35,fdf0b5c3-08b5-4b2d-9406-a3d7b29fc73f,https://www.cch2.org/portal/collections/individual/index.php?occid=304597
2262516,LOB,,,PreservedSpecimen,97e537d1-7b20-4ad7-8473-327564377235,LOB116471,2529,Organism|Plantae|Viridiplantae|Streptophyta|Embryophyta|Tracheophyta|Spermatophytina|Magnoliopsida|Rosanae|Brassicales|Brassicaceae|Raphanus,Plantae,Tracheophyta,Magnoliopsida,Brassicales,Brassicaceae,Raphanus sativus,29702,L.,Raphanus,,sativus,,,Species,D. Willis,,,,,,,David Willis,,s.n.,4/14/54,,1954,4,14,104,,14-Apr-54,,canyon bottom,coarse sand,White flowers,,,,,,,,,,,,,,,,,,,,,United States,California,Orange,,"Lower Silverado Canyon, Santa Ana Mtns.",,0,,33.745987,-117.609957,WGS84,2432,Aefisher (2020-06-08 11:38:24),,georef batch tool 2020-06-08; GeoLocate,reviewed - high confidence,,244,,,,,800 ft,,,14412695,,19,97e537d1-7b20-4ad7-8473-327564377235,https://www.cch2.org/portal/collections/individual/index.php?occid=2262516
2262520,LOB,,,PreservedSpecimen,7fe45371-233a-4a2a-84f1-25bf46fd162c,LOB116475,2522,Organism|Plantae|Viridiplantae|Streptophyta|Embryophyta|Tracheophyta|Spermatophytina|Magnoliopsida|Rosanae|Brassicales|Brassicaceae|Raphanus,Plantae,Tracheophyta,Magnoliopsida,Brassicales,Brassicaceae,Raphanus sativus,29702,L.,Raphanus,,sativus,,,Species,Ken Tanskley,,,,,,,Ken Tanksley,,s.n.,9/25/54,,1954,9,25,268,,"Sept. 25, 1954",,,,,,,,,,,,,,,,,,,,,,,,,United States,,,,Buena Park,,0,,,,,,,,,,,,,,,,,,,14412695,,19,7fe45371-233a-4a2a-84f1-25bf46fd162c,https://www.cch2.org/portal/collections/individual/index.php?occid=2262520
2262522,LOB,,,PreservedSpecimen,673a71d0-0380-4a55-adb9-52fd1338803b,LOB116477,2526,Organism|Plantae|Viridiplantae|Streptophyta|Embryophyta|Tracheophyta|Spermatophytina|Magnoliopsida|Rosanae|Brassicales|Brassicaceae|Raphanus,Plantae,Tracheophyta,Magnoliopsida,Brassicales,Brassicaceae,Raphanus sativus,29702,L.,Raphanus,,sativus,,,Species,B. House,,,,,,,Bob House,,s.n.,1954-05-00,,1954,5,,,,May-54,,fields & waste places,sandy adobe,,,,,,,,,,,,,,,,,,,,,,United States,California,Los Angeles,,Long Beach,,0,,33.798101,-118.126467,WGS84,7736,Aefisher (2019-11-16 12:41:38),,georef batch tool 2019-11-16; GeoLocate,reviewed - high confidence,,30,,,,,100 ft,,,14412695,,19,673a71d0-0380-4a55-adb9-52fd1338803b,https://www.cch2.org/portal/collections/individual/index.php?occid=2262522
2282381,CAS,BOT-BC,,PreservedSpecimen,urn:catalog:CAS:BOT-BC:74359,74359,urn:catalog:CAS:DS:593822,Organism|Plantae|Viridiplantae|Streptophyta|Embryophyta|Tracheophyta|Spermatophytina|Magnoliopsida|Rosanae|Brassicales|Brassicaceae|Raphanus,Plantae,Tracheophyta,Magnoliopsida,Brassicales,Brassicaceae,Raphanus sativus,29702,L.,Raphanus,,sativus,,,Species,Ihsan A. Al-Shehbaz,2010-01,,,,,,"Thomas, J. H.",,3878,4/10/54,,1954,4,10,100,,Apr 10 1954,Petals white or yellow.,Growing on a steep bank near air strip.,,,,,,,,,,,,,,,,,,,North America,,,,United States,California,Santa Cruz County,,Northern end of Hilton Airport between airstrip and highway.,,0,,37.15666667,-122.1616667,,,,,,,,244,,,,,800.0000000000 ft,,en,,urn:catalog:CAS:BOT-BC:74359,1,77ebe431-3ecc-468d-9287-f467844fb795,https://www.cch2.org/portal/collections/individual/index.php?occid=2282381
2380407,CAS,BOT-BC,,PreservedSpecimen,urn:catalog:CAS:BOT-BC:74360,74360,urn:catalog:CAS:DS:593635,Organism|Plantae|Viridiplantae|Streptophyta|Embryophyta|Tracheophyta|Spermatophytina|Magnoliopsida|Rosanae|Brassicales|Brassicaceae|Raphanus,Plantae,Tracheophyta,Magnoliopsida,Brassicales,Brassicaceae,Raphanus sativus,29702,L.,Raphanus,,sativus,,,Species,Ihsan A. Al-Shehbaz,2010-01,,,,,,"Thomas, J. H.",,4213,5/26/54,,1954,5,26,146,,May 26 1954,Growing quite commonly.,Growing on airstrip embankment.,,,,,,,,,,,,,,,,,,,North America,,,,United States,California,Santa Cruz County,,Northern end of Hilton Airport between airstrip and highway.,,0,,37.15666667,-122.1616667,,,,,,,,244,,,,,800.0000000000 ft,,en,,urn:catalog:CAS:BOT-BC:74360,1,0ccc3603-8e7a-427f-ac15-76221db713c2,https://www.cch2.org/portal/collections/individual/index.php?occid=2380407
2413016,CAS,BOT-BC,,PreservedSpecimen,urn:catalog:CAS:BOT-BC:74336,74336,urn:catalog:CAS:BOT:390410,Organism|Plantae|Viridiplantae|Streptophyta|Embryophyta|Tracheophyta|Spermatophytina|Magnoliopsida|Rosanae|Brassicales|Brassicaceae|Raphanus,Plantae,Tracheophyta,Magnoliopsida,Brassicales,Brassicaceae,Raphanus sativus,29702,L.,Raphanus,,sativus,,,Species,Ihsan A. Al-Shehbaz,2010-01,,,,,,"Twisselmann, Ernest C.",,1464,7/24/54,,1954,7,24,205,,"July 24, 1954.",Corolla white. Root with radish-like odor. Rare adventive.,In ranchground waste area. Grassland Upper Sonoran.,,,,,,,,,,,,,,,,,,,North America,,,,United States,California,San Luis Obispo County,,Temblor Range and the Western San Joaquin Valley. Twisselmann Ranch.,,0,,,,,,,,,,,668,,,,,2190.0000000000 ft,,en,,urn:catalog:CAS:BOT-BC:74336,1,d121a7a9-5d5e-4289-b4cc-91a913090686,https://www.cch2.org/portal/collections/individual/index.php?occid=2413016
2460390,CAS,BOT-BC,,PreservedSpecimen,urn:catalog:CAS:BOT-BC:74361,74361,urn:catalog:CAS:DS:593636,Organism|Plantae|Viridiplantae|Streptophyta|Embryophyta|Tracheophyta|Spermatophytina|Magnoliopsida|Rosanae|Brassicales|Brassicaceae|Raphanus,Plantae,Tracheophyta,Magnoliopsida,Brassicales,Brassicaceae,Raphanus sativus,29702,L.,Raphanus,,sativus,,,Species,Ihsan A. Al-Shehbaz,2010-01,,,,,,"Thomas, J. H.",,4342,6/24/54,,1954,6,24,175,,Jun 24 1954,,Growing on and below steep bank at edge of airstrip. Grass deep and mainly dead now.,,,,,,,,,,,,,,,,,,,North America,,,,United States,California,Santa Cruz County,,Northern end of Hilton Airport between airstrip and highway.,,0,,37.15666667,-122.1616667,,,,,,,,244,,,,,800.0000000000 ft,,en,,urn:catalog:CAS:BOT-BC:74361,1,595b536e-be37-4512-a0c4-1dc6da953f2f,https://www.cch2.org/portal/collections/individual/index.php?occid=2460390
3792180,FSC,,,PreservedSpecimen,2a703fe9-5a7a-4eee-beb6-26a0122b3b13,FSC0010465,,Organism|Plantae|Viridiplantae|Streptophyta|Embryophyta|Tracheophyta|Spermatophytina|Magnoliopsida|Rosanae|Brassicales|Brassicaceae|Raphanus,Plantae,Tracheophyta,Magnoliopsida,Brassicales,Brassicaceae,Raphanus sativus,29702,L.,Raphanus,,sativus,,,Species,,,,,,,,Simon Simonian,,29140T,5/15/54,,1954,5,15,135,,15-May-54,rare; Plants of Canals and Ditches. Fresno Irrigation District.,Raphanus rare on outside sandy bank. Ditch with water.,,,,,,,,,,,,,,,,,,,,,,,United States,California,Fresno,,"Thompson Canal. n-s sect. North & Bishop Aves. About 3 m se. of Kerman, Main Canal.",,0,,,,,,,,,,,,,,,,,,en,pawanpreetgill5,,38,2a703fe9-5a7a-4eee-beb6-26a0122b3b13,https://www.cch2.org/portal/collections/individual/index.php?occid=3792180
3904094,LA,,,PreservedSpecimen,65cc7c2a-eb61-4407-8127-557b65d310f0,LA00606075,,Organism|Plantae|Viridiplantae|Streptophyta|Embryophyta|Tracheophyta|Spermatophytina|Magnoliopsida|Rosanae|Brassicales|Brassicaceae|Raphanus,Plantae,Tracheophyta,Magnoliopsida,Brassicales,Brassicaceae,Raphanus sativus,29702,L.,Raphanus,,sativus,,,Species,,,,,,,,B. Lower,,,4/28/54,,1954,4,28,118,,,,,,,,,,,,,,,,,,,,,,,,,,,,,,,,,0,,,,,,,,,,,,,,,,,,,abaniaga,,34,65cc7c2a-eb61-4407-8127-557b65d310f0,https://www.cch2.org/portal/collections/individual/index.php?occid=3904094
4255240,OSC,V,,PreservedSpecimen,{6F5F520B-2A35-4D43-8E84-79E60ABE515E},OSC-V-023808,OSC87483,Organism|Plantae|Viridiplantae|Streptophyta|Embryophyta|Tracheophyta|Spermatophytina|Magnoliopsida|Rosanae|Brassicales|Brassicaceae|Raphanus,Plantae,Tracheophyta,Magnoliopsida,Brassicales,Brassicaceae,Raphanus raphanistrum,29701,L.,Raphanus,,raphanistrum,,,Species,"Halse, R.",1996,,,,,,Albert N. Steward,"Albert N. Steward, David Steward",6921,7/4/55,,1955,7,4,185,,7/4/55,,Gravel bed; in moist gravel.,,,,,,,,,,"Vicia, Eschscholzia, Epilobium",,wild collection,,,,,,,,,,,United States,Oregon,Lane,,east of Cottage Grove.,,0,,,,,,,,,,,,,,,,,,,,4436722,81,dc9bf5cf-250c-42b7-a0fe-50ba97045846,https://www.cch2.org/portal/collections/individual/index.php?occid=4255240
4411673,SOC,,SOC,PreservedSpecimen,285c18a7-974d-4587-bc57-20cd1574ff1c,19488,,Organism|Plantae|Viridiplantae|Streptophyta|Embryophyta|Tracheophyta|Spermatophytina|Magnoliopsida|Rosanae|Brassicales|Brassicaceae|Raphanus,Plantae,Tracheophyta,Magnoliopsida,Brassicales,Brassicaceae,Raphanus raphanistrum,29701,L.,Raphanus,,raphanistrum,,,Species,Frank T. Callahan,3/31/14,,,,,,Ireta Kirhofer,,s.n.,1955-06-00,,1955,6,0,152,152,1955-06,"common weed, 1 to 3 ft., native of Europe escaped from cultivation, [blooms in] summer",in fields,,,,,,,,,,,flowering,,,,,,,,,,,,U.S.A.,Oregon,Josephine,,Grants Pass,,0,,,,,,,,,,,,,,,,,,en,,2252904,82,6ec1320c-12ab-40d4-b579-53b1c7f468ea,https://www.cch2.org/portal/collections/individual/index.php?occid=4411673
4745883,RENO,V,,PreservedSpecimen,b7e6b919-20b0-49df-b2e1-f56e7ea6f67b,78052,RENO 45542,Organism|Plantae|Viridiplantae|Streptophyta|Embryophyta|Tracheophyta|Spermatophytina|Magnoliopsida|Rosanae|Brassicales|Brassicaceae|Raphanus,Plantae,Tracheophyta,Magnoliopsida,Brassicales,Brassicaceae,Raphanus raphanistrum,29701,L.,Raphanus,,raphanistrum,,,Species,,,,,,,,Vetter,,8,4/23/55,,1955,4,23,113,,4/23/55,Flowers white.,Sandy loam soil.,,,,,,,,,,,,,,,,,,,,,,,United States,California,Placer,,0.5 mile W of Loomis.,,0,,38.815772,-121.199476,WGS84,500,Mike,,GeoLocate,,,,,,,,,,,Mike,11526778,89,962d29e4-5e00-463f-9f7f-5c9b868afce8,https://www.cch2.org/portal/collections/individual/index.php?occid=4745883
202470,OBI,,,PreservedSpecimen,66328d9b-57cb-4760-a995-2c5281064e6d,OBI101765,14971,Organism|Plantae|Viridiplantae|Streptophyta|Embryophyta|Tracheophyta|Spermatophytina|Magnoliopsida|Rosanae|Brassicales|Brassicaceae|Raphanus,Plantae,Tracheophyta,Magnoliopsida,Brassicales,Brassicaceae,Raphanus sativus,29702,L.,Raphanus,,sativus,,,Species,,,,,,,,Jim Heaston,,29,10/13/55,,1955,10,13,286,,13-Oct-55,,,,,,,,,,,,,,,,,,,,,,,,,United States,California,San Luis Obispo,,Cal Poly San Luis Obispo,,0,,35.3008,-120.6607,WGS84,559,UCBerkeley H,,GoogleMaps via BerkeleyMapper (copied from OBI2880),,georef from old CCH cumulative file,,,,,,,,,preprocessed,,12,7f374043-cb0d-4fe1-bcf3-0ddaf087d909,https://www.cch2.org/portal/collections/individual/index.php?occid=202470
304567,UCSB,,,PreservedSpecimen,fc2b9ca2-1a5d-11e3-b49f-525400a0a001,UCSB032031,2420,Organism|Plantae|Viridiplantae|Streptophyta|Embryophyta|Tracheophyta|Spermatophytina|Magnoliopsida|Rosanae|Brassicales|Brassicaceae|Raphanus,Plantae,Tracheophyta,Magnoliopsida,Brassicales,Brassicaceae,Raphanus sativus,29702,L.,Raphanus,,sativus,,,Species,,,,,,,,Ralph Philbrick,,459,3/1/55,,1955,3,1,60,,,,,,,,,,,,,,,,,,,,,Sheet - 1,,,,,,United States,California,Los Angeles,,"South of La Verne, Puddingstone Dam, San Jose Mts.",,0,,34.087141,-117.798379,WGS84,3000,gwahlert (2020-01-22 17:12:38),,georef batch tool 2020-01-22,,,,,,,,,,,,,35,3dd3732e-c51c-41a0-b70d-fb33c209e397,https://www.cch2.org/portal/collections/individual/index.php?occid=304567
2283407,CAS,BOT-BC,,PreservedSpecimen,urn:catalog:CAS:BOT-BC:74225,74225,urn:catalog:CAS:BOT:399445,Organism|Plantae|Viridiplantae|Streptophyta|Embryophyta|Tracheophyta|Spermatophytina|Magnoliopsida|Rosanae|Brassicales|Brassicaceae|Raphanus,Plantae,Tracheophyta,Magnoliopsida,Brassicales,Brassicaceae,Raphanus sativus,29702,L.,Raphanus,,sativus,,,Species,Ihsan A. Al-Shehbaz,2010-01,,,,,,"Twisselmann, Ernest C.",,1689,3/9/55,,1955,3,9,68,,"March 9, 1955.","Petals lavender-blue. Stems freely branching from the base, 36 inches tall. Large fleshy root. Last season's pods still present. Occasional in small colonies.",Along an irrigation ditch.,,,,,,,,,,,,,,,,,,,North America,,,,United States,California,Kings County,,"Temblor Range and the Western San Joaquin Valley. Old Tulare Lake Bed, 2 miles west of South Lake Farms.",,0,,,,,,,,,,,58,,,,,190.0000000000 ft,,en,,urn:catalog:CAS:BOT-BC:74225,1,1697574e-4a5e-4e67-834d-1f64f3b39137,https://www.cch2.org/portal/collections/individual/index.php?occid=2283407
2285742,CAS,BOT-BC,,PreservedSpecimen,urn:catalog:CAS:BOT-BC:74327,74327,urn:catalog:CAS:BOT:531036,Organism|Plantae|Viridiplantae|Streptophyta|Embryophyta|Tracheophyta|Spermatophytina|Magnoliopsida|Rosanae|Brassicales|Brassicaceae|Raphanus,Plantae,Tracheophyta,Magnoliopsida,Brassicales,Brassicaceae,Raphanus sativus,29702,L.,Raphanus,,sativus,,,Species,Ihsan A. Al-Shehbaz,2010-01,,,,,,"Raven, Peter H.",,8240,1/17/55,,1955,1,17,17,,"Jan. 17, 1955",,Waste place.,,,,,,,,,,,,,,,,,,,North America,,,,United States,California,San Francisco County,,"Along 19th Avenue near Lawton Street, San Francisco.",,0,,,,,,,,,,,,,,,,,,en,,urn:catalog:CAS:BOT-BC:74327,1,ce9af89e-91fe-4ce5-a754-3ebd530daa82,https://www.cch2.org/portal/collections/individual/index.php?occid=2285742
2321963,CAS,BOT-BC,,PreservedSpecimen,urn:catalog:CAS:BOT-BC:74308,74308,urn:catalog:CAS:BOT:531054,Organism|Plantae|Viridiplantae|Streptophyta|Embryophyta|Tracheophyta|Spermatophytina|Magnoliopsida|Rosanae|Brassicales|Brassicaceae|Raphanus,Plantae,Tracheophyta,Magnoliopsida,Brassicales,Brassicaceae,Raphanus sativus,29702,L.,Raphanus,,sativus,,,Species,Ihsan A. Al-Shehbaz,2010-01,,,,,,"Howitt, Beatrice F.",,18,3/6/55,,1955,3,6,65,,6-Mar-55,,,,,,,,,,,,,,,,,,,,,North America,,,,United States,California,Monterey County,,Monterey Peninsula. Yankee Point.,,0,,,,,,,,,,,,,,,,,,en,,urn:catalog:CAS:BOT-BC:74308,1,f5b2f21b-ce3e-4bd6-a715-c2bcfd8559c0,https://www.cch2.org/portal/collections/individual/index.php?occid=2321963
2355525,CAS,BOT-BC,,PreservedSpecimen,urn:catalog:CAS:BOT-BC:74224,74224,urn:catalog:CAS:BOT:592407,Organism|Plantae|Viridiplantae|Streptophyta|Embryophyta|Tracheophyta|Spermatophytina|Magnoliopsida|Rosanae|Brassicales|Brassicaceae|Raphanus,Plantae,Tracheophyta,Magnoliopsida,Brassicales,Brassicaceae,Raphanus sativus,29702,L.,Raphanus,,sativus,,,Species,Ihsan A. Al-Shehbaz,2010-01,,,,,,"Twisselmann, Ernest C.",,1689,3/9/55,,1955,3,9,68,,"March 9, 1955.","Petals lavender-blue. Stems freely branching from the base, 36 inches tall. Large fleshy root. Last season's pods still present. Occasional in small colonies.",Along an irrigation ditch.,,,,,,,,,,,,,,,,,,,North America,,,,United States,California,Kings County,,"Temblor Range and the Western San Joaquin Valley. Old Tulare Lake Bed, 2 miles west of South Lake Farms.",,0,,,,,,,,,,,58,,,,,190.0000000000 ft,,en,,urn:catalog:CAS:BOT-BC:74224,1,85789539-c089-4cf9-8ad4-cabc19a5b2bb,https://www.cch2.org/portal/collections/individual/index.php?occid=2355525
304573,UCSB,,,PreservedSpecimen,fc2ba85a-1a5d-11e3-b49f-525400a0a001,UCSB032028,2426,Organism|Plantae|Viridiplantae|Streptophyta|Embryophyta|Tracheophyta|Spermatophytina|Magnoliopsida|Rosanae|Brassicales|Brassicaceae|Raphanus,Plantae,Tracheophyta,Magnoliopsida,Brassicales,Brassicaceae,Raphanus sativus,29702,L.,Raphanus,,sativus,,,Species,,,,,,,,"Mooney, Harold",,28,3/12/56,,1956,3,12,72,,,,,,,,,,,,,,,,,,,,,Sheet - 1,,,,,,United States,California,Santa Barbara,,"Las Casitas Rd., Santa Barbara City Dump",,0,,,,WGS84,,,,,,,,,,,,,,,,,35,a9d5d386-b7a1-4003-a773-cfd3c9a63ece,https://www.cch2.org/portal/collections/individual/index.php?occid=304573
304575,UCSB,,,PreservedSpecimen,fc2bac4c-1a5d-11e3-b49f-525400a0a001,UCSB032024,2414,Organism|Plantae|Viridiplantae|Streptophyta|Embryophyta|Tracheophyta|Spermatophytina|Magnoliopsida|Rosanae|Brassicales|Brassicaceae|Raphanus,Plantae,Tracheophyta,Magnoliopsida,Brassicales,Brassicaceae,Raphanus sativus,29702,L.,Raphanus,,sativus,,,Species,,,,,,,,"Hurd, Richard",,,2/27/56,,1956,2,27,58,,,,In meadow,,,,,,,,,,,,,,,,,Sheet - 1,,,,,,United States,California,Santa Barbara,,Refugio Canyon,,0,,34.505401,-120.065555,WGS84,5000,gwahlert (2021-12-06 14:49:36),,georef batch tool 2021-12-06,reviewed - high confidence,,,,,,,,,,,,35,9574b825-03a4-4f12-ac76-87b6562d6882,https://www.cch2.org/portal/collections/individual/index.php?occid=304575
304602,UCSB,,,PreservedSpecimen,fc2bf12a-1a5d-11e3-b49f-525400a0a001,UCSB032059,2415,Organism|Plantae|Viridiplantae|Streptophyta|Embryophyta|Tracheophyta|Spermatophytina|Magnoliopsida|Rosanae|Brassicales|Brassicaceae|Raphanus,Plantae,Tracheophyta,Magnoliopsida,Brassicales,Brassicaceae,Raphanus sativus,29702,L.,Raphanus,,sativus,,,Species,,,,,,,,"Hawkins, L.",,25,3/12/56,,1956,3,12,72,,,,,,,,,,,,,,,,,,,,,Sheet - 1,,,,,,United States,California,Santa Barbara,,Santa Barbara City Dump,,0,,,,WGS84,,,,,,,,,,,,,,,,,35,c79ce944-4ac7-4db7-a28e-11ac25a907f5,https://www.cch2.org/portal/collections/individual/index.php?occid=304602
304604,UCSB,,,PreservedSpecimen,fc2bf4c2-1a5d-11e3-b49f-525400a0a001,UCSB032057,2427,Organism|Plantae|Viridiplantae|Streptophyta|Embryophyta|Tracheophyta|Spermatophytina|Magnoliopsida|Rosanae|Brassicales|Brassicaceae|Raphanus,Plantae,Tracheophyta,Magnoliopsida,Brassicales,Brassicaceae,Raphanus sativus,29702,L.,Raphanus,,sativus,,,Species,,,,,,,,"Garrett, S.",,42,3/26/56,,1956,3,26,86,,,,In grassy foothills,,,,,,,,,,,,,,,,,Sheet - 1,,,,,,United States,California,Santa Barbara,,"Santa Ynez Mtns., on Old San Marcos Rd. N of Santa Barbara",,0,,,,WGS84,,,,,,,,,,,,,,,,,35,60ced64d-b321-4f16-8541-187dfbcba898,https://www.cch2.org/portal/collections/individual/index.php?occid=304604
610289,SFV,,,PreservedSpecimen,390aa6b2-4bea-4ea3-9880-d4b6696dc370,SFV104573,SFV-1509,Organism|Plantae|Viridiplantae|Streptophyta|Embryophyta|Tracheophyta|Spermatophytina|Magnoliopsida|Rosanae|Brassicales|Brassicaceae|Raphanus,Plantae,Tracheophyta,Magnoliopsida,Brassicales,Brassicaceae,Raphanus sativus,29702,L.,Raphanus,,sativus,,,Species,,,,,,,,C. Gasser,,s. n.,3/9/56,,1956,3,9,69,,9-Mar-56,,,,,,,,,,,,,Flowering,Wild: native/naturalized,,,,,,,,,,,United States,California,Los Angeles,,Santa Monica Mountains; Highway 101 by Malibu Canyon Road cutoff.,,0,,34.15,-118.7,,1000,,,,,,240,,,,,787 ft.,,,JNH,,41,390aa6b2-4bea-4ea3-9880-d4b6696dc370,https://www.cch2.org/portal/collections/individual/index.php?occid=610289
2287008,CAS,BOT-BC,,PreservedSpecimen,urn:catalog:CAS:BOT-BC:74320,74320,urn:catalog:CAS:BOT:531047,Organism|Plantae|Viridiplantae|Streptophyta|Embryophyta|Tracheophyta|Spermatophytina|Magnoliopsida|Rosanae|Brassicales|Brassicaceae|Raphanus,Plantae,Tracheophyta,Magnoliopsida,Brassicales,Brassicaceae,Raphanus sativus,29702,L.,Raphanus,,sativus,,,Species,Ihsan A. Al-Shehbaz,2010-01,,,,,,"Howell, John Thomas",,31597,6/17/56,,1956,6,17,169,,17-Jun-56,,,,,,,,,,,,,,,,,,,,,North America,,,,United States,California,San Francisco County,,San Francisco. Summit ridge of Bayview Hills.,,0,,,,,,,,,,,,,,,,,,en,,urn:catalog:CAS:BOT-BC:74320,1,dedab047-bb8f-4d91-b6a0-d98b2a07ff21,https://www.cch2.org/portal/collections/individual/index.php?occid=2287008
2391489,CAS,BOT-BC,,PreservedSpecimen,urn:catalog:CAS:BOT-BC:74332,74332,urn:catalog:CAS:BOT:531058,Organism|Plantae|Viridiplantae|Streptophyta|Embryophyta|Tracheophyta|Spermatophytina|Magnoliopsida|Rosanae|Brassicales|Brassicaceae|Raphanus,Plantae,Tracheophyta,Magnoliopsida,Brassicales,Brassicaceae,Raphanus sativus,29702,L.,Raphanus,,sativus,,,Species,Ihsan A. Al-Shehbaz,2010-01,,,,,,"Hardham, Clare B.",,171,2/24/56,,1956,2,24,55,,24-Feb-56,Flowers white.,Field.,,,,,,,,,,,,,,,,,,,North America,,,,United States,California,San Luis Obispo County,,Santa Lucia Mountains. Santa Rosa Creek.,,0,,,,,,,,,,,,,,,,,,en,,urn:catalog:CAS:BOT-BC:74332,1,3e264fbf-cba8-4fee-b978-810e28f55265,https://www.cch2.org/portal/collections/individual/index.php?occid=2391489
2399359,CAS,BOT-BC,,PreservedSpecimen,urn:catalog:CAS:BOT-BC:74349,74349,urn:catalog:CAS:DS:580986,Organism|Plantae|Viridiplantae|Streptophyta|Embryophyta|Tracheophyta|Spermatophytina|Magnoliopsida|Rosanae|Brassicales|Brassicaceae|Raphanus,Plantae,Tracheophyta,Magnoliopsida,Brassicales,Brassicaceae,Raphanus sativus,29702,L.,Raphanus,,sativus,,,Species,Ihsan A. Al-Shehbaz,2010-01,,,,,,"Thomas, John H.",,5594,4/3/56,,1956,4,3,94,,"Apr. 3, 1956.",Two color forms: yellow and lavender.,,,,,,,,,,,,,,,,,,,,North America,,,,United States,California,Santa Clara County,,Stanford University Campus. Near intersection of Stanford Avenue and Columbia Street.,,0,,37.42,-122.155,,,,,,,,15,,,,,50.0000000000 ft,,en,,urn:catalog:CAS:BOT-BC:74349,1,149d6774-16ee-497a-ad77-74124315fb67,https://www.cch2.org/portal/collections/individual/index.php?occid=2399359
2437632,CAS,BOT-BC,,PreservedSpecimen,urn:catalog:CAS:BOT-BC:74321,74321,urn:catalog:CAS:BOT:531051,Organism|Plantae|Viridiplantae|Streptophyta|Embryophyta|Tracheophyta|Spermatophytina|Magnoliopsida|Rosanae|Brassicales|Brassicaceae|Raphanus,Plantae,Tracheophyta,Magnoliopsida,Brassicales,Brassicaceae,Raphanus sativus,29702,L.,Raphanus,,sativus,,,Species,Ihsan A. Al-Shehbaz,2010-01,,,,,,"Howell, John Thomas",,31938,10/28/56,,1956,10,28,302,,"Oct. 28, 1956.",,Above high water line.,,,,,,,,,,,,,,,,,,,North America,,,,United States,California,San Francisco County,,"San Francisco. Mountain Lake, Presidio.",,0,,,,,,,,,,,,,,,,,,en,,urn:catalog:CAS:BOT-BC:74321,1,59df44b9-fc9b-4d19-a955-42bc4ba01665,https://www.cch2.org/portal/collections/individual/index.php?occid=2437632
3801181,CSLA,,,PreservedSpecimen,7af66fef-00f7-46e8-82cb-4143aa5fd17e,CSLA000825,,Organism|Plantae|Viridiplantae|Streptophyta|Embryophyta|Tracheophyta|Spermatophytina|Magnoliopsida|Rosanae|Brassicales|Brassicaceae|Raphanus,Plantae,Tracheophyta,Magnoliopsida,Brassicales,Brassicaceae,Raphanus sativus,29702,L.,Raphanus,,sativus,,,Species,,,,,,,,Walter Wilson,,,1956-03-00,,1956,3,0,,,Mar-56,,,,,,,,,,,,,,,,,,,,,,,,,United States,California,Ventura,,Santa Monica Mtns.,,0,,,,,,cadiwanaga1212,,GeoLocate (CoGe),,"[Unable to georeference] Unreasonable locality, spanning the entire Santa Monica Mountains.",,,,,,,,,,,42,7af66fef-00f7-46e8-82cb-4143aa5fd17e,https://www.cch2.org/portal/collections/individual/index.php?occid=3801181
4745865,RENO,V,,PreservedSpecimen,4766ec16-4c9b-48d0-b646-2d10b3ac84da,77917,RENO 45824,Organism|Plantae|Viridiplantae|Streptophyta|Embryophyta|Tracheophyta|Spermatophytina|Magnoliopsida|Rosanae|Brassicales|Brassicaceae|Raphanus,Plantae,Tracheophyta,Magnoliopsida,Brassicales,Brassicaceae,Raphanus sativus,29702,L.,Raphanus,,sativus,,,Species,,,,,,,,R.L. Mills,,7,3/27/56,,1956,3,27,87,,3/27/56,Great numbers.,"Small rolling hills; rich, moist, rocky soil.",,,,,,,,,,,,,,,,,,,,,,,United States,California,Amador,,10 miles E of Ione.,,0,,38.356789,-120.782067,WGS84,2000,Mike,,GeoLocate,,Distance measured along Hwy 88.,122,,,,,400 ft.,,,Mike,11526650,89,3c40a911-fd4f-40f3-a981-10378b136aad,https://www.cch2.org/portal/collections/individual/index.php?occid=4745865
4188551,OSC,V,,PreservedSpecimen,{FDDE6E33-5162-4E1D-ACBF-6189A22ECE1E},,WILLU28879,Organism|Plantae|Viridiplantae|Streptophyta|Embryophyta|Tracheophyta|Spermatophytina|Magnoliopsida|Rosanae|Brassicales|Brassicaceae|Raphanus,Plantae,Tracheophyta,Magnoliopsida,Brassicales,Brassicaceae,Raphanus raphanistrum,29701,L.,Raphanus,,raphanistrum,,,Species,"Al-Shehbaz, I.",2016,,,,,,Grover C. Bellinger,G.C. Bellinger,s.n.,5/29/57,,1957,5,29,149,,5/29/57,,,,,,,,,,,,,flowering and fruiting,,,,,,,,,,,,United States,Oregon,Jackson,,Ashland.,,0,,42.1947,-122.7083,,4828,[automated process-OregonFlora/OSU Herb],OregonFlora 1994-2020 methodology,"OrlookId: 78446, StateProvince: Oregon, County: Jackson, LocName: Ashland",,,,,,,,,,,,651789,81,64f02722-36ac-40ea-a394-9f60906c7b18,https://www.cch2.org/portal/collections/individual/index.php?occid=4188551
202455,OBI,,,PreservedSpecimen,5e84c829-8321-408e-b9ef-aef12ed8d1fb,OBI101767,14969,Organism|Plantae|Viridiplantae|Streptophyta|Embryophyta|Tracheophyta|Spermatophytina|Magnoliopsida|Rosanae|Brassicales|Brassicaceae|Raphanus,Plantae,Tracheophyta,Magnoliopsida,Brassicales,Brassicaceae,Raphanus sativus,29702,L.,Raphanus,,sativus,,,Species,,,,,,,,Betty Sheehan,,10,10/11/57,,1957,10,11,284,,11-Oct-57,,,,,,,,,,,,,,,,,,,,,,,,,United States,California,San Luis Obispo,,Science Bldg. Cal Poly Campus,,0,,35.3007,-120.66164,WGS84,487,CalPoly I,,GoogleMaps via BerkeleyMapper (copied from OBI20429),,georef from old CCH cumulative file,,,,,,,,,preprocessed,,12,5f66b8b7-6445-46a2-a2e1-c01686f50dd5,https://www.cch2.org/portal/collections/individual/index.php?occid=202455
304594,UCSB,,,PreservedSpecimen,fc2bdd0c-1a5d-11e3-b49f-525400a0a001,UCSB032036,2418,Organism|Plantae|Viridiplantae|Streptophyta|Embryophyta|Tracheophyta|Spermatophytina|Magnoliopsida|Rosanae|Brassicales|Brassicaceae|Raphanus,Plantae,Tracheophyta,Magnoliopsida,Brassicales,Brassicaceae,Raphanus sativus,29702,L.,Raphanus,,sativus,,,Species,,,,,,,,"Goeschl, John",,7,2/18/57,,1957,2,18,49,,,,,,,,,,,,,,,,,,,,,Sheet - 1,,,,,,United States,California,Santa Barbara,,"Lemon grove 1 mi. N of Hwy. 101, 2 mi. S.E. of Goleta",,0,,,,WGS84,,,,,,,,,,,,,,,,,35,c5c54161-0a03-4dee-86c0-ee5931db31fa,https://www.cch2.org/portal/collections/individual/index.php?occid=304594
304603,UCSB,,,PreservedSpecimen,fc2bf2f6-1a5d-11e3-b49f-525400a0a001,UCSB032058,2416,Organism|Plantae|Viridiplantae|Streptophyta|Embryophyta|Tracheophyta|Spermatophytina|Magnoliopsida|Rosanae|Brassicales|Brassicaceae|Raphanus,Plantae,Tracheophyta,Magnoliopsida,Brassicales,Brassicaceae,Raphanus sativus,29702,L.,Raphanus,,sativus,,,Species,,,,,,,,"Krogen, Roger",,5,1957-00-00,,1957,0,0,,,,,In open fields and near the ocean,,,,,,,,,,,,,,,,,Sheet - 1,,,,,,United States,California,Santa Barbara,,UCSB campus,,0,,34.412583,-119.847697,WGS84,1000,gwahlert (2020-01-22 15:32:40),,georef batch tool 2020-01-22,,,,,,,,,,,,,35,0c353358-ecbd-4c12-bb47-7aab5da29d23,https://www.cch2.org/portal/collections/individual/index.php?occid=304603
1007312,RSA,RSA,,PreservedSpecimen,8be6a76c-897e-471a-94fb-b7d4a4b5ee82,,RSA accession: 223813,Organism|Plantae|Viridiplantae|Streptophyta|Embryophyta|Tracheophyta|Spermatophytina|Magnoliopsida|Rosanae|Brassicales|Brassicaceae|Raphanus,Plantae,Tracheophyta,Magnoliopsida,Brassicales,Brassicaceae,Raphanus sativus,29702,L.,Raphanus,,sativus,,,Species,,,,,,,,E. C. Twisselmann,,3280,3/27/57,,1957,3,27,86,,,,,,"Petals purplish white with purple veins, small roadside colony",,,,,,herbariumSpecimenDuplicate: https://www.cch2.org/portal/collections/individual/index.php?guid=urn:catalog:CAS:BOT-BC:74271 | herbariumSpecimenDuplicate: https://www.cch2.org/portal/collections/individual/index.php?guid=urn:catalog:CAS:BOT-BC:74270,,,flowers & fruits,Cultivated,,,,,herbarium sheet,,,,,,United States,California,Kern,,"Bear Mtn Blvd, 5.3 miles E of Arvin.",,0,,,,,,,,,,,191,,,,,625ft.,,,T. Kim Nguyen; cataloged date: 2007-09-19,8be6a76c-897e-471a-94fb-b7d4a4b5ee82,17,0658e1e6-1d0c-4500-9c11-faf1a21a7425,https://www.cch2.org/portal/collections/individual/index.php?occid=1007312
1174478,RSA,RSA,,PreservedSpecimen,dbd59c3c-6e4f-4184-af10-d10e031ca73f,,RSA accession: 763926,Organism|Plantae|Viridiplantae|Streptophyta|Embryophyta|Tracheophyta|Spermatophytina|Magnoliopsida|Rosanae|Brassicales|Brassicaceae|Raphanus,Plantae,Tracheophyta,Magnoliopsida,Brassicales,Brassicaceae,Raphanus sativus,29702,L.,Raphanus,,sativus,,,Species,,,,,,,,Doris Hoover Bowers,,154,3/23/57,,1957,3,23,82,,,"Collection by former teacher, Doris (Hoover) Bowers, donated by her son John Hoover",,,Common Name: Wild Radish,,,,,,,,,,Introduced,,,,,herbarium sheet,,,,,,United States,California,Los Angeles,,"Rocky Point, LaVerne.",,0,,,,,,,,,,,335,,,,,1100ft.,,,Baby M. Snigdha; cataloged date: 2010-04-21,dbd59c3c-6e4f-4184-af10-d10e031ca73f,17,2d1a8645-8640-413b-846f-51b8d37f63b1,https://www.cch2.org/portal/collections/individual/index.php?occid=1174478
1208522,RSA,RSA,,PreservedSpecimen,ec1f4803-ca91-4e2e-9f31-c4b34e135da7,,RSA accession: 118912,Organism|Plantae|Viridiplantae|Streptophyta|Embryophyta|Tracheophyta|Spermatophytina|Magnoliopsida|Rosanae|Brassicales|Brassicaceae|Raphanus,Plantae,Tracheophyta,Magnoliopsida,Brassicales,Brassicaceae,Raphanus sativus,29702,L.,Raphanus,,sativus,,,Species,,,,,,,,L. S. Rose,,57145,10/6/57,,1957,10,6,279,,,,,,,,,,,,herbariumSpecimenDuplicate: https://www.cch2.org/portal/collections/individual/index.php?guid=urn:catalog:CAS:BOT-BC:74325,,,flowers & fruits,Introduced,,,,,herbarium sheet,,,,,,United States,California,San Francisco,,"Russian Hill, north slope.",,0,,37.80091,-122.41856,NAD27,687,San Jose S.U. A,,"Terrain Navigator 1:24,0000 (copied from UC1106152)",,Wed Nov 28 11:38:33 2012; georef from 2006-2015 archive backup file,91,,,,,300ft.,,,Jackie C. McConnaughy; cataloged date: 2012-04-17,ec1f4803-ca91-4e2e-9f31-c4b34e135da7,17,2553a37e-7901-4816-938a-21ee479b4861,https://www.cch2.org/portal/collections/individual/index.php?occid=1208522
2300993,CAS,BOT-BC,,PreservedSpecimen,urn:catalog:CAS:BOT-BC:74325,74325,urn:catalog:CAS:BOT:531064,Organism|Plantae|Viridiplantae|Streptophyta|Embryophyta|Tracheophyta|Spermatophytina|Magnoliopsida|Rosanae|Brassicales|Brassicaceae|Raphanus,Plantae,Tracheophyta,Magnoliopsida,Brassicales,Brassicaceae,Raphanus sativus,29702,L.,Raphanus,,sativus,,,Species,Ihsan A. Al-Shehbaz,2010-01,,,,,,"Rose, Lewis S.",,57145,10/6/57,,1957,10,6,279,,"Oct. 6, 1957",,,,,,,,,,herbariumSpecimenDuplicate: https://www.cch2.org/portal/collections/individual/index.php?guid=ec1f4803-ca91-4e2e-9f31-c4b34e135da7,,,,,,,,,,,North America,,,,United States,California,San Francisco County,,"San Francisco. Russian Hill, north slope.",,0,,,,,,,,,,,91,,,,,300.0000000000 ft,,en,,urn:catalog:CAS:BOT-BC:74325,1,e2816d4f-20de-42f7-8aa1-7ab2106ba802,https://www.cch2.org/portal/collections/individual/index.php?occid=2300993
2316628,CAS,BOT-BC,,PreservedSpecimen,urn:catalog:CAS:BOT-BC:74323,74323,urn:catalog:CAS:BOT:531052,Organism|Plantae|Viridiplantae|Streptophyta|Embryophyta|Tracheophyta|Spermatophytina|Magnoliopsida|Rosanae|Brassicales|Brassicaceae|Raphanus,Plantae,Tracheophyta,Magnoliopsida,Brassicales,Brassicaceae,Raphanus sativus,29702,L.,Raphanus,,sativus,,,Species,Ihsan A. Al-Shehbaz,2010-01,,,,,,"Howell, John Thomas",,32415,5/26/57,,1957,5,26,146,,"May 26, 1957.",,,,,,,,,,,,,,,,,,,,,North America,,,,United States,California,San Francisco County,,San Francisco. North base of Lone Mountain.,,0,,,,,,,,,,,,,,,,,,en,,urn:catalog:CAS:BOT-BC:74323,1,4e1ca963-78b4-49c7-a983-1a9377e49ad0,https://www.cch2.org/portal/collections/individual/index.php?occid=2316628
2332340,CAS,BOT-BC,,PreservedSpecimen,urn:catalog:CAS:BOT-BC:74271,74271,urn:catalog:CAS:BOT:592410,Organism|Plantae|Viridiplantae|Streptophyta|Embryophyta|Tracheophyta|Spermatophytina|Magnoliopsida|Rosanae|Brassicales|Brassicaceae|Raphanus,Plantae,Tracheophyta,Magnoliopsida,Brassicales,Brassicaceae,Raphanus sativus,29702,L.,Raphanus,,sativus,,,Species,Ihsan A. Al-Shehbaz,2010-01,,,,,,"Twisselmann, Ernest C.",,3280,3/27/57,,1957,3,27,86,,"March 27, 1957.",Petals purplish white with purple veins. Small colony.,Roadside.,,,,,,,,herbariumSpecimenDuplicate: https://www.cch2.org/portal/collections/individual/index.php?guid=8be6a76c-897e-471a-94fb-b7d4a4b5ee82 | herbariumSpecimenDuplicate: https://www.cch2.org/portal/collections/individual/index.php?guid=urn:catalog:CAS:BOT-BC:74270,,,,,,,,,,,North America,,,,United States,California,Kern County,,"Eastern San Joaquin Valley. Bear Mountain Boulevard, 5.3 miles east of Arvin.",,0,,,,,,,,,,,191,,,,,625.0000000000 ft,,en,,urn:catalog:CAS:BOT-BC:74271,1,8ea5b5ae-b6ed-4ae6-99c1-512389e61695,https://www.cch2.org/portal/collections/individual/index.php?occid=2332340
2393200,CAS,BOT-BC,,PreservedSpecimen,urn:catalog:CAS:BOT-BC:74270,74270,urn:catalog:CAS:BOT:531061,Organism|Plantae|Viridiplantae|Streptophyta|Embryophyta|Tracheophyta|Spermatophytina|Magnoliopsida|Rosanae|Brassicales|Brassicaceae|Raphanus,Plantae,Tracheophyta,Magnoliopsida,Brassicales,Brassicaceae,Raphanus sativus,29702,L.,Raphanus,,sativus,,,Species,Ihsan A. Al-Shehbaz,2010-01,,,,,,"Twisselmann, Ernest C.",,3280,3/27/57,,1957,3,27,86,,"March 27, 1957.",Petals purplish white with purple veins. Small colony.,Roadside.,,,,,,,,herbariumSpecimenDuplicate: https://www.cch2.org/portal/collections/individual/index.php?guid=8be6a76c-897e-471a-94fb-b7d4a4b5ee82 | herbariumSpecimenDuplicate: https://www.cch2.org/portal/collections/individual/index.php?guid=urn:catalog:CAS:BOT-BC:74271,,,,,,,,,,,North America,,,,United States,California,Kern County,,"Eastern San Joaquin Valley. Bear Mountain Boulevard, 5.3 miles east of Arvin.",,0,,,,,,,,,,,191,,,,,625.0000000000 ft,,en,,urn:catalog:CAS:BOT-BC:74270,1,30befcbc-6728-42c9-80dd-b3887ca7f2dc,https://www.cch2.org/portal/collections/individual/index.php?occid=2393200
2412262,CAS,BOT-BC,,PreservedSpecimen,urn:catalog:CAS:BOT-BC:74328,74328,urn:catalog:CAS:BOT:531048,Organism|Plantae|Viridiplantae|Streptophyta|Embryophyta|Tracheophyta|Spermatophytina|Magnoliopsida|Rosanae|Brassicales|Brassicaceae|Raphanus,Plantae,Tracheophyta,Magnoliopsida,Brassicales,Brassicaceae,Raphanus sativus,29702,L.,Raphanus,,sativus,,,Species,Ihsan A. Al-Shehbaz,2010-01,,,,,,"Rubtzoff, Peter",,3202,4/6/57,,1957,4,6,96,,"April 6, 1957.",,In the open.,,,,,,,,,,,,,,,,,,,North America,,,,United States,California,San Francisco County,,San Francisco. San Miguel Hills. Bottom of canyon east of O'Shaughnessy Boulevard.,,0,,,,,,,,,,,,,,,,,,en,,urn:catalog:CAS:BOT-BC:74328,1,86b1e216-1a33-48bb-857f-d0148b52aba8,https://www.cch2.org/portal/collections/individual/index.php?occid=2412262
2420423,CAS,BOT-BC,,PreservedSpecimen,urn:catalog:CAS:BOT-BC:74322,74322,urn:catalog:CAS:BOT:531049,Organism|Plantae|Viridiplantae|Streptophyta|Embryophyta|Tracheophyta|Spermatophytina|Magnoliopsida|Rosanae|Brassicales|Brassicaceae|Raphanus,Plantae,Tracheophyta,Magnoliopsida,Brassicales,Brassicaceae,Raphanus sativus,29702,L.,Raphanus,,sativus,,,Species,Ihsan A. Al-Shehbaz,2010-01,,,,,,"Howell, John Thomas",,s.n.,5/17/57,,1957,5,17,137,,17-May-57,,,,,,,,,,,,,,,,,,,,,North America,,,,United States,California,San Francisco County,,San Francisco. Bayview Hills.,,0,,,,,,,,,,,,,,,,,,en,,urn:catalog:CAS:BOT-BC:74322,1,38d29656-f0f1-433f-b885-d37ba22992f7,https://www.cch2.org/portal/collections/individual/index.php?occid=2420423
3792181,FSC,,,PreservedSpecimen,38bd5c7b-b622-4161-8446-ee3a65421793,FSC0010466,,Organism|Plantae|Viridiplantae|Streptophyta|Embryophyta|Tracheophyta|Spermatophytina|Magnoliopsida|Rosanae|Brassicales|Brassicaceae|Raphanus,Plantae,Tracheophyta,Magnoliopsida,Brassicales,Brassicaceae,Raphanus sativus,29702,L.,Raphanus,,sativus,,,Species,,,,,,,,Ray C. Reinhard,,,4/17/57,,1957,4,17,107,,17-Apr-57,abundant,"Quercus lobata and Rubus ursinus (flg) around meadow; Sonchus, Avena, Ranunculus californicus, Medicago hispida, etc., all flg. Open fairly large meadow, surrounded on east side by dense foliage. Meadow grassy and with humus, moist, more sandy soil.",,,,,,,,,,,,,,,,,,,,,,,United States,California,Fresno,,"Ca 2 miles east of Centerville in river bottom between Kings Canyon Road and Trimmer Road, a meadow 20 yards east of Rio Vista Ave.",,0,,,,,,,,,,,,,,,,,,en,pawanpreetgill5,,38,38bd5c7b-b622-4161-8446-ee3a65421793,https://www.cch2.org/portal/collections/individual/index.php?occid=3792181
2298844,CAS,BOT-BC,,PreservedSpecimen,urn:catalog:CAS:BOT-BC:74186,74186,urn:catalog:CAS:BOT:886058,Organism|Plantae|Viridiplantae|Streptophyta|Embryophyta|Tracheophyta|Spermatophytina|Magnoliopsida|Rosanae|Brassicales|Brassicaceae|Raphanus,Plantae,Tracheophyta,Magnoliopsida,Brassicales,Brassicaceae,Raphanus raphanistrum,29701,L.,Raphanus,,raphanistrum,,,Species,Ihsan A. Al-Shehbaz,2010-01,,,,,,"Howell, John Thomas",,34268,8/10/58,,1958,8,10,222,,"Aug. 10, 1958.",,,,,,,,,,,,,,,,,,,,,North America,,,,United States,California,Madera County,,Sierra Nevada. Miller Meadow.,,0,,,,,,,,,,,2103,,,,,6900.0000000000 ft,,en,,urn:catalog:CAS:BOT-BC:74186,1,25dc6c72-0905-48df-a204-f727d453a03c,https://www.cch2.org/portal/collections/individual/index.php?occid=2298844
2358623,CAS,BOT-BC,,PreservedSpecimen,urn:catalog:CAS:BOT-BC:74178,74178,urn:catalog:CAS:DS:612703,Organism|Plantae|Viridiplantae|Streptophyta|Embryophyta|Tracheophyta|Spermatophytina|Magnoliopsida|Rosanae|Brassicales|Brassicaceae|Raphanus,Plantae,Tracheophyta,Magnoliopsida,Brassicales,Brassicaceae,Raphanus raphanistrum,29701,L.,Raphanus,,raphanistrum,,,Species,Ihsan A. Al-Shehbaz,1/10/10,,,,,,"Pawek, Jean L.",,428,4/18/58,,1958,4,18,108,,18-Apr-58,"Flower color white to purple or yellow, some peach also. Plants 8 to 26 inches tall.",Growing at roadside by cultivated fields.,,,,,,,,,,,,,,,,,,,North America,,,,United States,California,Amador County,,On road to Ione.,,0,,,,,,,,,,,91,,,,,300.0000000000 ft,,en,,urn:catalog:CAS:BOT-BC:74178,1,baee4ea7-06e1-40b8-aa39-6db574493775,https://www.cch2.org/portal/collections/individual/index.php?occid=2358623
2393459,CAS,BOT-BC,,PreservedSpecimen,urn:catalog:CAS:BOT-BC:74206,74206,urn:catalog:CAS:BOT:417669,Organism|Plantae|Viridiplantae|Streptophyta|Embryophyta|Tracheophyta|Spermatophytina|Magnoliopsida|Rosanae|Brassicales|Brassicaceae|Raphanus,Plantae,Tracheophyta,Magnoliopsida,Brassicales,Brassicaceae,Raphanus raphanistrum,29701,L.,Raphanus,,raphanistrum,,,Species,Ihsan A. Al-Shehbaz,2010-01,,,,,,"Pollard, Henry M.",,s.n.,4/30/58,,1958,4,30,120,,"Apr. 30, 1958",,,,,,,,,,,,,,,,,,,,,North America,,,,United States,California,Santa Barbara County,,"Area of Devereaux Dunes, Goleta.",,0,,,,,,,,,,,,,,,,,,en,,urn:catalog:CAS:BOT-BC:74206,1,3c8c86a1-7a18-4ab6-998c-6c2cd86e138a,https://www.cch2.org/portal/collections/individual/index.php?occid=2393459
4078612,CDA,,,PreservedSpecimen,217dee9c-2247-4690-8bb5-0206641a0b05,CDA-003828,,Organism|Plantae|Viridiplantae|Streptophyta|Embryophyta|Tracheophyta|Spermatophytina|Magnoliopsida|Rosanae|Brassicales|Brassicaceae|Raphanus,Plantae,Tracheophyta,Magnoliopsida,Brassicales,Brassicaceae,Raphanus raphanistrum,29701,L.,Raphanus,,raphanistrum,,,Species,M.S. Bergseng,Oct-58,,,,,,T.C. Fuller,,1994,10/16/58,,1958,10,16,289,,10/16/58,,,,annual,,,,,,,,,Flowering & Fruiting,Wild: native/naturalized,0,,,,Standard sheet,,,,,,United States,California,Marin,,2 miles north of Novato.,Jointed Charlock.,0,,38.13658,-122.5636,WGS84,500,gkw_11072021,,BerkeleyMapper,,"georef coords mapped from label info, updated 11072021",,,,,,,,,preprocessed,,50,217dee9c-2247-4690-8bb5-0206641a0b05,https://www.cch2.org/portal/collections/individual/index.php?occid=4078612
304552,UCSB,,,PreservedSpecimen,fc2b805a-1a5d-11e3-b49f-525400a0a001,UCSB032000,2429,Organism|Plantae|Viridiplantae|Streptophyta|Embryophyta|Tracheophyta|Spermatophytina|Magnoliopsida|Rosanae|Brassicales|Brassicaceae|Raphanus,Plantae,Tracheophyta,Magnoliopsida,Brassicales,Brassicaceae,Raphanus sativus,29702,L.,Raphanus,,sativus,,,Species,,,,,,,,Glenn Keator,,,6/17/58,,1958,6,17,168,,,,Along roadside and in waste places,,,,,,,,,,,,,,,,,Sheet - 1,,,,,,United States,California,Mendocino,,Just north of Elk on Highway 1,,0,,,,WGS84,,,,,,,,,,,,,,,,,35,1774a3db-7694-42c0-bf15-6b7f91fec5f6,https://www.cch2.org/portal/collections/individual/index.php?occid=304552
304569,UCSB,,,PreservedSpecimen,fc2ba04e-1a5d-11e3-b49f-525400a0a001,UCSB032029,2421,Organism|Plantae|Viridiplantae|Streptophyta|Embryophyta|Tracheophyta|Spermatophytina|Magnoliopsida|Rosanae|Brassicales|Brassicaceae|Raphanus,Plantae,Tracheophyta,Magnoliopsida,Brassicales,Brassicaceae,Raphanus sativus,29702,L.,Raphanus,,sativus,,,Species,,,,,,,,Richard Wilson,,74,5/4/58,,1958,5,4,124,,,,Coastal sage community,,,,,,,,,,,,,,,,,Sheet - 1,,,,,,United States,California,Santa Barbara,,2 miles W of Lompoc on Road to Surr,,0,,,,WGS84,,,,,,,,,,,,,,,,,35,03432991-5f85-4a9b-b382-22f25fb7d7ce,https://www.cch2.org/portal/collections/individual/index.php?occid=304569
304570,UCSB,,,PreservedSpecimen,fc2ba2ce-1a5d-11e3-b49f-525400a0a001,UCSB032025,2422,Organism|Plantae|Viridiplantae|Streptophyta|Embryophyta|Tracheophyta|Spermatophytina|Magnoliopsida|Rosanae|Brassicales|Brassicaceae|Raphanus,Plantae,Tracheophyta,Magnoliopsida,Brassicales,Brassicaceae,Raphanus sativus,29702,L.,Raphanus,,sativus,,,Species,,,,,,,,"Koran, John",,,3/1/58,,1958,3,1,60,,,,"Moist shady plateau, well grasses",,,,,,,,,,,,,,,,,Sheet - 1,,,,,,United States,California,Santa Barbara,,"Two miles west of Goleta, on the south side of the slough, behind the Las Casitas residence halls, Sequoia Hall",,0,,,,WGS84,,,,,,,,,,,,,,,,,35,59ed57a9-b7fc-4c2b-8902-6ac39a3b37ae,https://www.cch2.org/portal/collections/individual/index.php?occid=304570
304572,UCSB,,,PreservedSpecimen,fc2ba67a-1a5d-11e3-b49f-525400a0a001,UCSB032027,2424,Organism|Plantae|Viridiplantae|Streptophyta|Embryophyta|Tracheophyta|Spermatophytina|Magnoliopsida|Rosanae|Brassicales|Brassicaceae|Raphanus,Plantae,Tracheophyta,Magnoliopsida,Brassicales,Brassicaceae,Raphanus sativus,29702,L.,Raphanus,,sativus,,,Species,,,,,,,,"Stoppel, Gordon",,51,4/14/58,,1958,4,14,104,,,,In open field,,,,,,,,,,,,,,,,,Sheet - 1,,,,,,United States,California,Santa Barbara,,"Near Goleta Campus beach, Goleta",,0,,,,WGS84,,,,,,,,,,,,,,,,,35,5e8a93c5-a62c-4d87-9745-136385d1f1b1,https://www.cch2.org/portal/collections/individual/index.php?occid=304572
304578,UCSB,,,PreservedSpecimen,fc2bb1e2-1a5d-11e3-b49f-525400a0a001,UCSB032033,2423,Organism|Plantae|Viridiplantae|Streptophyta|Embryophyta|Tracheophyta|Spermatophytina|Magnoliopsida|Rosanae|Brassicales|Brassicaceae|Raphanus,Plantae,Tracheophyta,Magnoliopsida,Brassicales,Brassicaceae,Raphanus sativus,29702,L.,Raphanus,,sativus,,,Species,,,,,,,,Richard E. Broder,,,1958-03-00,,1958,3,0,,,1958-03,,,,,,,,,,,,,,,,,,,Sheet - 1,,,,,,United States,California,Santa Barbara,,"2 blocks north on Patterson Ave. from Hollister Ave., one mile east of Goleta",,0,,34.438465,-119.809271,WGS84,242,klugta,,GeoLocate,,distance and intersection,,,,,,,,,,,35,2226bb7b-a1f7-40df-9c7a-1fed040386fd,https://www.cch2.org/portal/collections/individual/index.php?occid=304578
304595,UCSB,,,PreservedSpecimen,fc2bdfaa-1a5d-11e3-b49f-525400a0a001,UCSB032035,2413,Organism|Plantae|Viridiplantae|Streptophyta|Embryophyta|Tracheophyta|Spermatophytina|Magnoliopsida|Rosanae|Brassicales|Brassicaceae|Raphanus,Plantae,Tracheophyta,Magnoliopsida,Brassicales,Brassicaceae,Raphanus sativus,29702,L.,Raphanus,,sativus,,,Species,,,,,,,,Pete Atsatt,,2,2/15/58,,1958,2,15,46,,,,Growing in open field,,,,,,,,,,,,,,,,,Sheet - 1,,,,,,United States,California,Santa Barbara,,"Behind Apt. House at 744 Embarcadero Del Mar, Goleta",,0,,34.4167,-119.8566,NAD83,300,Santa Barbara Botanic Garden A,,Google Earth (copied from UCSB10241),,Thu May 22 15:45:30 2014,,,,,,,,,preprocessed,,35,606a8753-0bfd-4be8-98f6-ff606b73deb7,https://www.cch2.org/portal/collections/individual/index.php?occid=304595
1224569,RSA,RSA,,PreservedSpecimen,f3cd6ea5-dc63-4d11-bc5a-994afb7f5a3b,,RSA accession: 783291,Organism|Plantae|Viridiplantae|Streptophyta|Embryophyta|Tracheophyta|Spermatophytina|Magnoliopsida|Rosanae|Brassicales|Brassicaceae|Raphanus,Plantae,Tracheophyta,Magnoliopsida,Brassicales,Brassicaceae,Raphanus sativus,29702,L.,Raphanus,,sativus,,,Species,,,,,,,,J. D. Olmsted,,9,3/2/58,,1958,3,2,61,,,,,,Infrequent in disturbed alluvium and near drainage ditch with grasses and other Cruciferae in oak woodland.,,,,,,,,,flowers,Introduced,,,,,herbarium sheet,,,,,,United States,California,Los Angeles,,[City of] Claremont near eastern end of Los Angeles County. Along San Antonio Creek in Blanchard Park on Pomona College campus.,,0,,,,,,,,,,,366,,,,,1200ft.,,,Grace O. Cho; cataloged date: 2012-06-27,f3cd6ea5-dc63-4d11-bc5a-994afb7f5a3b,17,33c8e00b-469b-43ea-a99b-7b517cef8a62,https://www.cch2.org/portal/collections/individual/index.php?occid=1224569
1310159,DAV,,,PreservedSpecimen,UCD38822,AHUC100067,Accession #: AHUC25307,Organism|Plantae|Viridiplantae|Streptophyta|Embryophyta|Tracheophyta|Spermatophytina|Magnoliopsida|Rosanae|Brassicales|Brassicaceae|Raphanus,Plantae,Tracheophyta,Magnoliopsida,Brassicales,Brassicaceae,Raphanus sativus,29702,L.,Raphanus,,sativus,,,Species,,,,,,,,Beecher Crampton,,4657,1/7/58,,1958,1,7,7,,7-Jan-58,Access Database Number (Deprecated): UCD38822,"Open field, Harbor Blvd. and West Capitol Ave.",,"Fls. yellow, whitish or violet, all with purplish veins in the Corolla lobes.",,,,,,,,,,,,,,,,,,,,,United States,California,Yolo,,West Sacramento.,,0,,38.58045,-121.54703,WGS84,202,UCDavis A,,GoogleMaps via BerkeleyMapper,,Date Georeferenced: Thu Sep 12 14:03:42 2013,,,,,,,,,tcbarry,UCD38822,39,0beafec5-5fd4-420b-ad08-9b7308893a24,https://www.cch2.org/portal/collections/individual/index.php?occid=1310159
2369059,CAS,BOT-BC,,PreservedSpecimen,urn:catalog:CAS:BOT-BC:74298,74298,,Organism|Plantae|Viridiplantae|Streptophyta|Embryophyta|Tracheophyta|Spermatophytina|Magnoliopsida|Rosanae|Brassicales|Brassicaceae|Raphanus,Plantae,Tracheophyta,Magnoliopsida,Brassicales,Brassicaceae,Raphanus sativus,29702,L.,Raphanus,,sativus,,,Species,Ihsan A. Al-Shehbaz,2010-01,,,,,,"Kirby, F. J.",,1227,1958-07-00,,1958,7,1,,,"July, 1958",,Seashore.,,,,,,,,,,,,,,,,,,,North America,,,,United States,California,Mendocino County,,South of Point Arena.,,0,,,,,,,,,,,30,,,,,100.0000000000 ft,,en,,urn:catalog:CAS:BOT-BC:74298,1,6cee7312-14ee-4d19-a5d1-441c2d0dd84d,https://www.cch2.org/portal/collections/individual/index.php?occid=2369059
2369931,CAS,BOT-BC,,PreservedSpecimen,urn:catalog:CAS:BOT-BC:74273,74273,urn:catalog:CAS:BOT:531063,Organism|Plantae|Viridiplantae|Streptophyta|Embryophyta|Tracheophyta|Spermatophytina|Magnoliopsida|Rosanae|Brassicales|Brassicaceae|Raphanus,Plantae,Tracheophyta,Magnoliopsida,Brassicales,Brassicaceae,Raphanus sativus,29702,L.,Raphanus,,sativus,,,Species,Ihsan A. Al-Shehbaz,2010-01,,,,,,"Twisselmann, Ernest C.",,4137,2/23/58,,1958,2,23,54,,"February 23, 1958.",Corollas lavender to light lavender. Colony of numerous plants. Not yet common in the region.,In a wet ranchground waste place.,,,,,,,,,,,,,,,,,,,North America,,,,United States,California,Kern County,,"Temblor Range and the Western San Joaquin Valley. Antelope Ranch grounds, western Kern county.",,0,,,,,,,,,,,305,,,,,1000.0000000000 ft,,en,,urn:catalog:CAS:BOT-BC:74273,1,a0f85b5a-f070-4aa7-a84d-aa363c8525c2,https://www.cch2.org/portal/collections/individual/index.php?occid=2369931
2377415,CAS,BOT-BC,,PreservedSpecimen,urn:catalog:CAS:BOT-BC:74330,74330,urn:catalog:CAS:DS:593820,Organism|Plantae|Viridiplantae|Streptophyta|Embryophyta|Tracheophyta|Spermatophytina|Magnoliopsida|Rosanae|Brassicales|Brassicaceae|Raphanus,Plantae,Tracheophyta,Magnoliopsida,Brassicales,Brassicaceae,Raphanus sativus,29702,L.,Raphanus,,sativus,,,Species,Ihsan A. Al-Shehbaz,2010-01,,,,,,"Thomas, John H.",,7274,6/26/58,,1958,6,26,177,,26-Jun-58,Flowers purple.,Near sea level.,,,,,,,,,,,,,,,,,,,North America,,,,United States,California,San Francisco County,,Vacant lot at intersection of Davidson Ave. and 3rd Street.,,0,,,,,,,,,,,0,,,,,0.0000000000 ft,,en,,urn:catalog:CAS:BOT-BC:74330,1,a0a538d9-c363-44f4-b840-649a8ff32c22,https://www.cch2.org/portal/collections/individual/index.php?occid=2377415
2422780,CAS,BOT-BC,,PreservedSpecimen,urn:catalog:CAS:BOT-BC:74272,74272,urn:catalog:CAS:BOT:592415,Organism|Plantae|Viridiplantae|Streptophyta|Embryophyta|Tracheophyta|Spermatophytina|Magnoliopsida|Rosanae|Brassicales|Brassicaceae|Raphanus,Plantae,Tracheophyta,Magnoliopsida,Brassicales,Brassicaceae,Raphanus sativus,29702,L.,Raphanus,,sativus,,,Species,Ihsan A. Al-Shehbaz,2010-01,,,,,,"Twisselmann, Ernest C.",,4137,2/23/58,,1958,2,23,54,,"February 23, 1958.",Corollas lavender to light lavender. Colony of numerous plants. Not yet common in the region.,In a wet ranchground waste place.,,,,,,,,,,,,,,,,,,,North America,,,,United States,California,Kern County,,"Temblor Range and the Western San Joaquin Valley. Antelope Ranch grounds, western Kern county.",,0,,,,,,,,,,,305,,,,,1000.0000000000 ft,,en,,urn:catalog:CAS:BOT-BC:74272,1,b4c526d0-2ad6-483f-b8da-000e2e5ff427,https://www.cch2.org/portal/collections/individual/index.php?occid=2422780
3386031,UCJEPS,VASC,,PreservedSpecimen,f92bccb7-132e-423b-b9c1,UC2049883,,Organism|Plantae|Viridiplantae|Streptophyta|Embryophyta|Tracheophyta|Spermatophytina|Magnoliopsida|Rosanae|Brassicales|Brassicaceae|Raphanus,Plantae,Tracheophyta,Magnoliopsida,Brassicales,Brassicaceae,Raphanus sativus,29702,L.,Raphanus,,sativus,,,Species,,,,H. W. Johansen (original label determination),,,,H. W. Johansen,,30,5/17/58,,1958,5,17,137,138,18-May-58,,Roadside.,,Very common.,,,,,,,,,Flowering/Fruiting,,,,,,,,,,,,United States,California,Monterey,,Salinas by side of road.,,0,,36.706576,-121.666736,WGS84,,,,,,,,,,,,,,,,f92bccb7-132e-423b-b9c1,46,2ef61b2c-d141-4702-b5bb-f797aef7e336,https://www.cch2.org/portal/collections/individual/index.php?occid=3386031
3801194,CSLA,,,PreservedSpecimen,eea0c1a8-0406-40b5-be5b-c2e1306af805,CSLA000831,,Organism|Plantae|Viridiplantae|Streptophyta|Embryophyta|Tracheophyta|Spermatophytina|Magnoliopsida|Rosanae|Brassicales|Brassicaceae|Raphanus,Plantae,Tracheophyta,Magnoliopsida,Brassicales,Brassicaceae,Raphanus sativus,29702,L.,Raphanus,,sativus,,,Species,,,,,,,,Peter J. Mehringer Jr.,,,2/21/58,,1958,2,21,52,,21-Feb-58,,,,,,,,,,,,,,,,,,,,,,,,,United States,California,Los Angeles,,Griffith Park,,0,,34.131,-118.3088,WGS84,3200,JeannieGregory (2021-02-19 12:44:28),,Google Earth; georef batch tool 2021-02-19,reviewed - high confidence,general point centered in area of Griffith Park,183,,,,,600 ft.,,,,,42,eea0c1a8-0406-40b5-be5b-c2e1306af805,https://www.cch2.org/portal/collections/individual/index.php?occid=3801194
3904087,LA,,,PreservedSpecimen,2bffc74d-395c-4288-ab03-0026452f1062,LA00606068,LA29937,Organism|Plantae|Viridiplantae|Streptophyta|Embryophyta|Tracheophyta|Spermatophytina|Magnoliopsida|Rosanae|Brassicales|Brassicaceae|Raphanus,Plantae,Tracheophyta,Magnoliopsida,Brassicales,Brassicaceae,Raphanus sativus,29702,L.,Raphanus,,sativus,,,Species,,,,,,,,June McCaskill,John M. Tucker,570,5/29/58,,1958,5,29,149,,,,,,,,,,,,,,,,,,,,,,,,,,,,,,,,,0,,,,,,,,,,,,,,,,,,,abaniaga,,34,2bffc74d-395c-4288-ab03-0026452f1062,https://www.cch2.org/portal/collections/individual/index.php?occid=3904087
4234244,OSC,V,,PreservedSpecimen,{5754E2BF-4F89-4E1E-B59A-DD1BB90C5A8F},OSC-V-023824,OSC105926,Organism|Plantae|Viridiplantae|Streptophyta|Embryophyta|Tracheophyta|Spermatophytina|Magnoliopsida|Rosanae|Brassicales|Brassicaceae|Raphanus,Plantae,Tracheophyta,Magnoliopsida,Brassicales,Brassicaceae,Raphanus sativus,29702,L.,Raphanus,,sativus,,,Species,"Al-Shehbaz, I.",2016,,,,,,Kenneth C. Swedberg,K.C. Swedberg,s.n.,6/25/58,,1958,6,25,176,,6/25/58,,Only two in disturbed grassland; moist clay soil.,,,,,,,,,,,,wild collection,,,,,,,,,,,United States,Oregon,Benton,,1/2 mi. north of Corvallis.,,0,,44.583,-123.2612,,1609,,OregonFlora 1994-2020 methodology,"OrlookId: 28105, StateProvince: Oregon, County: Benton, LocName: Corvallis, 0.5 mi. N of",,,,,,,,,,,,4436601,81,74c99c0e-db88-4242-9c6a-017cddc3896e,https://www.cch2.org/portal/collections/individual/index.php?occid=4234244
4745888,RENO,V,,PreservedSpecimen,4f51db3d-3258-46f6-8fdc-a1c5f6f7f579,78053,RENO 25673,Organism|Plantae|Viridiplantae|Streptophyta|Embryophyta|Tracheophyta|Spermatophytina|Magnoliopsida|Rosanae|Brassicales|Brassicaceae,Plantae,Tracheophyta,Magnoliopsida,Brassicales,Brassicaceae,Raphanus,6418,,Raphanus,,,,,Genus,,,,,,,,J.F. Sloan,,s.n.,5/8/59,,1959,5,8,128,,5/8/59,Abundant.,Marshy place.,,,,,,,,,,,,,,,,,,,,,,,United States,California,Amador,,"Along road, 1 mile W of Fiddletown.",,0,,38.509252,-120.771021,WGS84,5241,,,GeoLocate,,,,,,,,,,,Mike,11526794,89,d749ba77-c41b-4ed2-95f5-e2e23216bb09,https://www.cch2.org/portal/collections/individual/index.php?occid=4745888
2262512,LOB,,,PreservedSpecimen,99ff8708-77e6-47b8-b60d-d155d4a2ee9a,LOB116467,13459,Organism|Plantae|Viridiplantae|Streptophyta|Embryophyta|Tracheophyta|Spermatophytina|Magnoliopsida|Rosanae|Brassicales|Brassicaceae|Raphanus,Plantae,Tracheophyta,Magnoliopsida,Brassicales,Brassicaceae,Raphanus raphanistrum,29701,L.,Raphanus,,raphanistrum,,,Species,,,,,,,,Janet L. Kirchner,Janet K. Warter,140,1959-06-00,,1959,6,,,,Jun-59,,waste field,,,,,,,,,,,,,,,,,,,,,,,United States,Pennsylvania,Westmoreland,,Jamison reservoir area,,0,,40.320877,-79.478353,WGS84,2247,Aefisher (2020-10-07 14:25:59),,georef batch tool 2020-10-07; GeoLocate,reviewed - high confidence,,,,,,,,,,14412695,,19,99ff8708-77e6-47b8-b60d-d155d4a2ee9a,https://www.cch2.org/portal/collections/individual/index.php?occid=2262512
2291983,CAS,BOT-BC,,PreservedSpecimen,urn:catalog:CAS:BOT-BC:74184,74184,urn:catalog:CAS:BOT:531060,Organism|Plantae|Viridiplantae|Streptophyta|Embryophyta|Tracheophyta|Spermatophytina|Magnoliopsida|Rosanae|Brassicales|Brassicaceae|Raphanus,Plantae,Tracheophyta,Magnoliopsida,Brassicales,Brassicaceae,Raphanus raphanistrum,29701,L.,Raphanus,,raphanistrum,,,Species,Ihsan A. Al-Shehbaz,2010-01,,,,,,"Twisselmann, Ernest C.",,5012,4/1/59,,1959,4,1,91,,"April 1, 1959.",Corollas yellow. Abundant weed.,Alfalfa field.,,,,,,,,herbariumSpecimenDuplicate: https://www.cch2.org/portal/collections/individual/index.php?guid=UCD115224 | herbariumSpecimenDuplicate: https://www.cch2.org/portal/collections/individual/index.php?guid=urn:catalog:CAS:BOT-BC:74185,,,,,,,,,,,North America,,,,United States,California,Kern County,,"Eastern San Joaquin Valley. Greenfield Road, 1.5 mile east of Pumpkin Center.",,0,,,,,,,,,,,91,,,,,300.0000000000 ft,,en,,urn:catalog:CAS:BOT-BC:74184,1,3e3e8d4d-cae4-423b-9843-d157101f3f46,https://www.cch2.org/portal/collections/individual/index.php?occid=2291983
2465925,CAS,BOT-BC,,PreservedSpecimen,urn:catalog:CAS:BOT-BC:74185,74185,urn:catalog:CAS:BOT:592411,Organism|Plantae|Viridiplantae|Streptophyta|Embryophyta|Tracheophyta|Spermatophytina|Magnoliopsida|Rosanae|Brassicales|Brassicaceae|Raphanus,Plantae,Tracheophyta,Magnoliopsida,Brassicales,Brassicaceae,Raphanus raphanistrum,29701,L.,Raphanus,,raphanistrum,,,Species,Ihsan A. Al-Shehbaz,1/10/10,,,,,,"Twisselmann, Ernest C.",,5012,4/1/59,,1959,4,1,91,,"April 1, 1959.",Corollas yellow. Abundant weed.,Alfalfa field.,,,,,,,,herbariumSpecimenDuplicate: https://www.cch2.org/portal/collections/individual/index.php?guid=UCD115224 | herbariumSpecimenDuplicate: https://www.cch2.org/portal/collections/individual/index.php?guid=urn:catalog:CAS:BOT-BC:74184,,,,,,,,,,,North America,,,,United States,California,Kern County,,"Eastern San Joaquin Valley. Greenfield Road, 1.5 mile east of Pumpkin Center.",,0,,,,,,,,,,,91,,,,,300.0000000000 ft,,en,,urn:catalog:CAS:BOT-BC:74185,1,743122f9-ed71-4f9b-86d5-282755cce6ee,https://www.cch2.org/portal/collections/individual/index.php?occid=2465925
3792167,FSC,,,PreservedSpecimen,dc4692bc-306f-4510-a2ca-4b9cdf0bcc70,FSC0010452,,Organism|Plantae|Viridiplantae|Streptophyta|Embryophyta|Tracheophyta|Spermatophytina|Magnoliopsida|Rosanae|Brassicales|Brassicaceae|Raphanus,Plantae,Tracheophyta,Magnoliopsida,Brassicales,Brassicaceae,Raphanus raphanistrum,29701,L.,Raphanus,,raphanistrum,,,Species,,,,,,,,T. Collins,,,5/1/59,,1959,5,1,121,,1-May-59,,"Canal ditch, cover typical of valley grassland with aven barbata rumex and achillea noticed as surrounding plants. South facing banks with plenty of sunshine and moisture.",,,,,,,,,,,,,,,,,,,,,,,United States,California,Fresno,,Found on canal ditch one mile west of Clovis Avenue on North Avenue.,,0,,,,,,,,,,,,,,,,,,en,pawanpreetgill5,,38,dc4692bc-306f-4510-a2ca-4b9cdf0bcc70,https://www.cch2.org/portal/collections/individual/index.php?occid=3792167
4095380,CDA,,,PreservedSpecimen,72f8d04f-c23f-4ca8-aa26-2c94fbcba936,CDA-003833,,Organism|Plantae|Viridiplantae|Streptophyta|Embryophyta|Tracheophyta|Spermatophytina|Magnoliopsida|Rosanae|Brassicales|Brassicaceae|Raphanus,Plantae,Tracheophyta,Magnoliopsida,Brassicales,Brassicaceae,Raphanus raphanistrum,29701,L.,Raphanus,,raphanistrum,,,Species,R.A. Price,,,,,,,T.C. Fuller,,s.n.,5/20/59,,1959,5,20,140,,5/20/59,,In irrigated pasture.,,annual,,,,,,,,,Flowering & Fruiting,Wild: native/naturalized,0,,,,Standard sheet,,,,,,United States,California,Placer,,"Mt. Pleasant District, 5 miles northeast of Lincoln.",Wild radish. 4.26% nitrates. Abortion in 3 dairy cows.,0,,38.94508,-121.22848,WGS84,1000,gkw_01042022,,"BerkeleyMapper, CCH2, GoogleEarth",,"georef coords mapped from label info, approximate, updated 01042022",,,,,,,,,preprocessed,,50,72f8d04f-c23f-4ca8-aa26-2c94fbcba936,https://www.cch2.org/portal/collections/individual/index.php?occid=4095380
4721,LA,,,PreservedSpecimen,3cea4097-0c1e-4828-906b-bdd6e3c5d179,,LA32256,Organism|Plantae|Viridiplantae|Streptophyta|Embryophyta|Tracheophyta|Spermatophytina|Magnoliopsida|Rosanae|Brassicales|Brassicaceae|Raphanus,Plantae,Tracheophyta,Magnoliopsida,Brassicales,Brassicaceae,Raphanus sativus,29702,L.,Raphanus,,sativus,,,Species,,,,,,,,Peter H. Raven,Henry J. Thompson,14320,6/4/59,,1959,6,4,155,,4-Jun-59,,,,,,,,,,herbariumSpecimenDuplicate: https://www.cch2.org/portal/collections/individual/index.php?guid=06f2e75b-b532-40ab-bc65-fdf93e5689a6 | herbariumSpecimenDuplicate: https://www.cch2.org/portal/collections/individual/index.php?guid=urn:catalog:CAS:BOT-BC:74282,,,,,,,,,,,,,,,United States,California,Los Angeles,,Santa Monica Mountains; Point Dume,,0,,34,-118.8,NAD 1927,500,,USGS Topos,,,,46,,,,,150ft,,,,,34,3cea4097-0c1e-4828-906b-bdd6e3c5d179,https://www.cch2.org/portal/collections/individual/index.php?occid=4721
116271,SBBG,,,PreservedSpecimen,a8619603-9f2f-4664-9951-dea7ebc54966,SBBG213825,SBBG_old: 44775,Organism|Plantae|Viridiplantae|Streptophyta|Embryophyta|Tracheophyta|Spermatophytina|Magnoliopsida|Rosanae|Brassicales|Brassicaceae|Raphanus,Plantae,Tracheophyta,Magnoliopsida,Brassicales,Brassicaceae,Raphanus sativus,29702,L.,Raphanus,,sativus,,,Species,,,,,,,,N. W. Baker,,,7/8/59,,1959,7,8,189,,7/8/59,,bluff,,,,,,,,,,,Flowers Present,,,,,,,,,,,,United States,California,Santa Barbara,,"above beach, University of California Santa Barbara",,0,,34.413,-119.843,NAD27,402,Rancho Santa Ana (no. 8),,MyTopo,,georef from 2006-2015 archive backup file; Date Georeferenced: Mon Dec 26 13:37:13 2011,,,,,,,,,alejanneros,,16,6a806cbe-443b-4c93-a2dc-eb3a4ca65948,https://www.cch2.org/portal/collections/individual/index.php?occid=116271
202486,OBI,,,PreservedSpecimen,9eb9ed69-513c-445c-ac48-f3cabfd15d47,OBI101768,14968,Organism|Plantae|Viridiplantae|Streptophyta|Embryophyta|Tracheophyta|Spermatophytina|Magnoliopsida|Rosanae|Brassicales|Brassicaceae|Raphanus,Plantae,Tracheophyta,Magnoliopsida,Brassicales,Brassicaceae,Raphanus sativus,29702,L.,Raphanus,,sativus,,,Species,,,,,,,,Morton Noble,,12,6/30/59,,1959,6,30,181,,30-Jun-59,,,,,,,,,,,,,,,,,,,,,,,,,United States,California,Santa Barbara,,"UCSB Campus, Goleta",,0,,,,,,,,,,,,,,,,,,,,,12,ad5fbd20-5013-480f-8495-4394be3b3335,https://www.cch2.org/portal/collections/individual/index.php?occid=202486
304551,UCSB,,,PreservedSpecimen,fc2b7e20-1a5d-11e3-b49f-525400a0a001,UCSB032001,2430,Organism|Plantae|Viridiplantae|Streptophyta|Embryophyta|Tracheophyta|Spermatophytina|Magnoliopsida|Rosanae|Brassicales|Brassicaceae|Raphanus,Plantae,Tracheophyta,Magnoliopsida,Brassicales,Brassicaceae,Raphanus sativus,29702,L.,Raphanus,,sativus,,,Species,,,,,,,,"Greenlee, Alice",,24,7/10/59,,1959,7,10,191,,,,"Sandy river bottom, stagnant water",,,,,,,,,,,,,,,,,Sheet - 1,,,,,,United States,California,Santa Barbara,,"Santa Ynez River, near U.S. 101, 1/2 mile S of Buellton",,0,,,,WGS84,,,,,,,,,,,,,,,,,35,d01578dc-e750-4809-85a3-44272f5f2cb5,https://www.cch2.org/portal/collections/individual/index.php?occid=304551
304574,UCSB,,,PreservedSpecimen,fc2baa30-1a5d-11e3-b49f-525400a0a001,UCSB032023,10663,Organism|Plantae|Viridiplantae|Streptophyta|Embryophyta|Tracheophyta|Spermatophytina|Magnoliopsida|Rosanae|Brassicales|Brassicaceae|Raphanus,Plantae,Tracheophyta,Magnoliopsida,Brassicales,Brassicaceae,Raphanus sativus,29702,L.,Raphanus,,sativus,,,Species,,,,,,,,"Lloyd, Robert",,140,4/6/59,,1959,4,6,96,,,,Pacific grassland; south slope; sandy-loam soil,,,,,,,,,,,,,,,,,Sheet - 1,,,,,,United States,California,Kern,,8 miles East of Arvin on the Bear Mt. Road; Tehachapi Mt. Range; San Joaquin Valley,,0,,,,WGS84,,,,,,,,,,,,,,,,,35,cef4ab1d-a392-4923-85ca-d394f6f8b8e1,https://www.cch2.org/portal/collections/individual/index.php?occid=304574
304598,UCSB,,,PreservedSpecimen,fc2be928-1a5d-11e3-b49f-525400a0a001,UCSB032063,7094,Organism|Plantae|Viridiplantae|Streptophyta|Embryophyta|Tracheophyta|Spermatophytina|Magnoliopsida|Rosanae|Brassicales|Brassicaceae|Raphanus,Plantae,Tracheophyta,Magnoliopsida,Brassicales,Brassicaceae,Raphanus sativus,29702,L.,Raphanus,,sativus,,,Species,,,,,,,,Robert H. Gill,,17,3/7/59,,1959,3,7,66,,7-Mar-59,S-facing slope.,Chaparral.,"Sand, rocky soil.",,,,,,,,,,,,,,,,Sheet - 1,,,,,,United States,California,Los Angeles,Claremont,Corner of Baseline and Mills Ave.,,0,,34.121676,-117.707205,WGS84,500,,,,,,,,,,,,,,,,35,98c337f3-9458-4138-94e7-34149ff82fd3,https://www.cch2.org/portal/collections/individual/index.php?occid=304598
304605,UCSB,,,PreservedSpecimen,fc2bf684-1a5d-11e3-b49f-525400a0a001,UCSB032056,2428,Organism|Plantae|Viridiplantae|Streptophyta|Embryophyta|Tracheophyta|Spermatophytina|Magnoliopsida|Rosanae|Brassicales|Brassicaceae|Raphanus,Plantae,Tracheophyta,Magnoliopsida,Brassicales,Brassicaceae,Raphanus sativus,29702,L.,Raphanus,,sativus,,,Species,,,,,,,,Elizabeth Bowker,,8,7/2/59,,1959,7,2,183,,,,sandy soil; sunlight; sea level,,,,,,,,,,,,,,,,,Sheet - 1,,,,,,United States,California,Santa Barbara,,UCSB campus,,0,,34.412583,-119.847697,WGS84,1000,gwahlert (2020-01-22 15:32:40),,georef batch tool 2020-01-22,,,,,,,,,,,,,35,56f87f7c-3298-479e-8469-4f13e14998a1,https://www.cch2.org/portal/collections/individual/index.php?occid=304605
652363,RSA,RSA,,PreservedSpecimen,06f2e75b-b532-40ab-bc65-fdf93e5689a6,,RSA accession: 127770,Organism|Plantae|Viridiplantae|Streptophyta|Embryophyta|Tracheophyta|Spermatophytina|Magnoliopsida|Rosanae|Brassicales|Brassicaceae|Raphanus,Plantae,Tracheophyta,Magnoliopsida,Brassicales,Brassicaceae,Raphanus sativus,29702,L.,Raphanus,,sativus,,,Species,,,,,,,,P. H. Raven,H. J. Thompson,14320,6/4/59,,1959,6,4,155,,,,,,Corollas violet,,,,,,herbariumSpecimenDuplicate: https://www.cch2.org/portal/collections/individual/index.php?guid=3cea4097-0c1e-4828-906b-bdd6e3c5d179 | herbariumSpecimenDuplicate: https://www.cch2.org/portal/collections/individual/index.php?guid=urn:catalog:CAS:BOT-BC:74282,,,flowers & fruits,Cultivated,,,,,herbarium sheet,,,,,,United States,California,Los Angeles,,Santa Monica Mountains. Point Dume.,,0,,34,-118.8,,,,,,,,46,,,,,150ft.,,,T. Kim Nguyen; cataloged date: 2007-09-21,06f2e75b-b532-40ab-bc65-fdf93e5689a6,17,6980b530-3a4f-47df-ac21-4d7f64be10be,https://www.cch2.org/portal/collections/individual/index.php?occid=652363
1368045,DAV,,,PreservedSpecimen,UCD115224,DAV310389,Accession #: DAV27828,Organism|Plantae|Viridiplantae|Streptophyta|Embryophyta|Tracheophyta|Spermatophytina|Magnoliopsida|Rosanae|Brassicales|Brassicaceae|Raphanus,Plantae,Tracheophyta,Magnoliopsida,Brassicales,Brassicaceae,Raphanus sativus,29702,L.,Raphanus,,sativus,,,Species,,,,,,,,Ernest C. Twisselmann,,5012,4/1/59,,1959,4,1,91,,1-Apr-59,Access Database Number (Deprecated): UCD115224,Abundant alfalfa weed field.,,Corollas yellow.,,,,,,herbariumSpecimenDuplicate: https://www.cch2.org/portal/collections/individual/index.php?guid=urn:catalog:CAS:BOT-BC:74184 | herbariumSpecimenDuplicate: https://www.cch2.org/portal/collections/individual/index.php?guid=urn:catalog:CAS:BOT-BC:74185,,,,,,,,,,,,,,,United States,California,Kern,,"Kern County: Greenfield Road, 1.5 miles east of Pumpkin Center.",,0,,35.266841,-119.006815,WGS84,500,Rancho Santa Ana (no. 9),,Google Earth (copied from CAS510373),,Date Georeferenced: Wed Feb 5 10:45:27 2014,91,,,,,300ft,,,tcbarry,UCD115224,39,0c32b00b-2657-454f-8653-c6bdc61d7a59,https://www.cch2.org/portal/collections/individual/index.php?occid=1368045
2456431,CAS,BOT-BC,,PreservedSpecimen,urn:catalog:CAS:BOT-BC:74282,74282,urn:catalog:CAS:BOT:477256,Organism|Plantae|Viridiplantae|Streptophyta|Embryophyta|Tracheophyta|Spermatophytina|Magnoliopsida|Rosanae|Brassicales|Brassicaceae|Raphanus,Plantae,Tracheophyta,Magnoliopsida,Brassicales,Brassicaceae,Raphanus sativus,29702,L.,Raphanus,,sativus,,,Species,Ihsan A. Al-Shehbaz,2010-01,,,,,,"Raven, Peter H.; Thompson, Henry J.",,14320,6/4/59,,1959,6,4,155,,"June 4, 1959.",Corollas violet.,Dune grassland behind point.,,,,,,,,herbariumSpecimenDuplicate: https://www.cch2.org/portal/collections/individual/index.php?guid=3cea4097-0c1e-4828-906b-bdd6e3c5d179 | herbariumSpecimenDuplicate: https://www.cch2.org/portal/collections/individual/index.php?guid=06f2e75b-b532-40ab-bc65-fdf93e5689a6,,,,,,,,,,,North America,,,,United States,California,Los Angeles County,,Santa Monica Mountains. Point Dume.,,0,,34,-118.8,,,,,,,,46,,,,,150.0000000000 ft,,en,,urn:catalog:CAS:BOT-BC:74282,1,823b1563-1386-4269-bbb4-df3d9cc56cfb,https://www.cch2.org/portal/collections/individual/index.php?occid=2456431
3801191,CSLA,,,PreservedSpecimen,ed22d9a9-1b92-46e9-bb4a-3d66e4c91031,CSLA000830,,Organism|Plantae|Viridiplantae|Streptophyta|Embryophyta|Tracheophyta|Spermatophytina|Magnoliopsida|Rosanae|Brassicales|Brassicaceae|Raphanus,Plantae,Tracheophyta,Magnoliopsida,Brassicales,Brassicaceae,Raphanus sativus,29702,L.,Raphanus,,sativus,,,Species,,,,,,,,Robert J. Fortlage,,,4/3/59,,1959,4,3,93,,3-Apr-59,,,,,,,,,,,,,,,,,,,,,,,,,United States,California,Los Angeles,,Bel Air,,0,,34.1012,-118.4595,WGS84,800,JeannieGregory (2021-02-26 12:18:51),Google Earth,Google Earth; georef batch tool 2021-02-26,reviewed - high confidence,point centered in area of Bel Air,46,,,,,150 ft.,,,,,42,ed22d9a9-1b92-46e9-bb4a-3d66e4c91031,https://www.cch2.org/portal/collections/individual/index.php?occid=3801191
4095405,CDA,,,PreservedSpecimen,a86d4c9b-0b4d-4e4a-a75f-f440fabef6c8,CDA-003829,,Organism|Plantae|Viridiplantae|Streptophyta|Embryophyta|Tracheophyta|Spermatophytina|Magnoliopsida|Rosanae|Brassicales|Brassicaceae|Raphanus,Plantae,Tracheophyta,Magnoliopsida,Brassicales,Brassicaceae,Raphanus sativus,29702,L.,Raphanus,,sativus,,,Species,,,,,,,,T.C. Fuller,,s.n.,5/20/59,,1959,5,20,140,,5/20/59,,In irrigated pasture.,,annual,,,,,,,,,Fruiting,Wild: native/naturalized,0,,,,Standard sheet,,,,,,United States,California,Placer,,"Mt. Pleasant District, 5 miles northeast of Lincoln.",Wild Radish. 4.26% nitrates. Abortion in 3 dairy cows.,0,,38.94508,-121.22848,WGS84,1000,gkw_01042022,,"BerkeleyMapper, CCH2, GoogleEarth",,"georef coords mapped from label info, approximate, updated 01042022",,,,,,,,,preprocessed,,50,a86d4c9b-0b4d-4e4a-a75f-f440fabef6c8,https://www.cch2.org/portal/collections/individual/index.php?occid=4095405
4745857,RENO,V,,PreservedSpecimen,a12dace1-d53e-4b9e-83aa-ae009155e884,77911,RENO 19305,Organism|Plantae|Viridiplantae|Streptophyta|Embryophyta|Tracheophyta|Spermatophytina|Magnoliopsida|Rosanae|Brassicales|Brassicaceae|Raphanus,Plantae,Tracheophyta,Magnoliopsida,Brassicales,Brassicaceae,Raphanus sativus,29702,L.,Raphanus,,sativus,,,Species,,,,,,,,M. Dailey,,s.n.,4/16/59,,1959,4,16,106,,4/16/59,,"Along side of house; dry, black soil.",,,,,,,,,,Weeds.,,,,,,,,,,,,,United States,Nevada,Washoe,,"Reno, 26 Stewart Street.",,0,,39.521107,-119.8092,WGS84,50,Mike Hagebusch,,GeoLocate,,,1369,,,,,4490 ft.,,,Mike,11522495,89,7bf54094-d63f-4987-8856-07f1d66646a3,https://www.cch2.org/portal/collections/individual/index.php?occid=4745857
4745858,RENO,V,,PreservedSpecimen,4bb9e7f3-9515-42fb-9b7f-0e1c8a16ed44,77912,RENO 27788,Organism|Plantae|Viridiplantae|Streptophyta|Embryophyta|Tracheophyta|Spermatophytina|Magnoliopsida|Rosanae|Brassicales|Brassicaceae|Raphanus,Plantae,Tracheophyta,Magnoliopsida,Brassicales,Brassicaceae,Raphanus sativus,29702,L.,Raphanus,,sativus,,,Species,,,,,,,,J. Martin,,s.n.,4/12/59,,1959,4,12,102,,4/12/59,,Dry sandy soil.,,,,,,,,,,"Artemisia tridentata, Erodium cicutarium.",,,,,,,,,,,,,United States,Nevada,Washoe,,Wihin 100 yards of the Verdi Fish Hatchery.,,0,,39.520187,-119.997145,WGS84,90,Mike Hagebusch,,GeoLocate,,,1402,,,,,4600 ft.,,,Mike,11522498,89,b793d326-d35a-4f05-9cf6-7777d28d0a40,https://www.cch2.org/portal/collections/individual/index.php?occid=4745858
4745859,RENO,V,,PreservedSpecimen,c4273b31-6433-401f-9e04-096e0f051a78,77913,RENO 27792,Organism|Plantae|Viridiplantae|Streptophyta|Embryophyta|Tracheophyta|Spermatophytina|Magnoliopsida|Rosanae|Brassicales|Brassicaceae|Raphanus,Plantae,Tracheophyta,Magnoliopsida,Brassicales,Brassicaceae,Raphanus sativus,29702,L.,Raphanus,,sativus,,,Species,,,,,,,,C. Burke,,s.n.,3/28/59,,1959,3,28,87,,3/28/59,"Plant 1 meter tall, leafy, erect; flowers yellow, white or light purple; common.","Dry meadow, near meadow and ditch; dry, sandy soil.",,,,,,,,,,"Eschscholtzia, Callandrinia sp., Medicago sp., annual forbs, gramineae.",,,,,,,,,,,,,United States,California,Stanislaus,,3 miles E of Oakdale.,,0,,37.761917,-120.790949,WGS84,969,Mike,,GeoLocate,,,,,,,,,,,Mike,11526617,89,88c69e4c-73c5-48bc-a608-a42ca92ee662,https://www.cch2.org/portal/collections/individual/index.php?occid=4745859
76824,SBBG,,,PreservedSpecimen,58e87cf0-5f01-4ed8-ac31-60dba65f6243,SBBG155403,SBBG_old: 10943,Organism|Plantae|Viridiplantae|Streptophyta|Embryophyta|Tracheophyta|Spermatophytina|Magnoliopsida|Rosanae|Brassicales|Brassicaceae|Raphanus,Plantae,Tracheophyta,Magnoliopsida,Brassicales,Brassicaceae,Raphanus raphanistrum,29701,L.,Raphanus,,raphanistrum,,,Species,,,,,,,,E. R. Blakley,,3179,4/9/60,,1960,4,9,100,,4/9/60,scattered,gravelly clay soil,,Annual; flowers yellow.,,,,,ann; fls yellow,,,,Flowers Present; Fruit Present,,,,,,,,,,,,United States,California,Santa Barbara,,Santa Rosa Island: Beach bluffs at Vail Ranch hdqrtrs,,0,,34.007,-120.0502,NAD83,500,dwilken,,MyTopo,,,15,,,,,50 ft,,,,,16,5aacfbd0-12d9-4095-b6b0-a9576b418de1,https://www.cch2.org/portal/collections/individual/index.php?occid=76824
98773,SBBG,,,PreservedSpecimen,84e04bfc-9902-434c-acd2-117d9ff0a38a,SBBG155404,SBBG_old: 37654,Organism|Plantae|Viridiplantae|Streptophyta|Embryophyta|Tracheophyta|Spermatophytina|Magnoliopsida|Rosanae|Brassicales|Brassicaceae|Raphanus,Plantae,Tracheophyta,Magnoliopsida,Brassicales,Brassicaceae,Raphanus raphanistrum,29701,L.,Raphanus,,raphanistrum,,,Species,,,,,,,,E. R. Blakley,,3180,4/9/60,,1960,4,9,100,,"April 5-10, 1960",scattered,"gravelly clay soil; field, sun",,Annuals; flowers white with pinkish tinge.,,,,,ann; fls white w/ pinkish tinge,,,,Flowers Present; Fruit Present,,,,,,,,,,,,United States,California,Santa Barbara,,Santa Rosa Island: Beach bluffs at Vail Ranch hdqrtrs; 34.007 -120.0502,,0,,34.007,-120.0502,NAD83,500,dwilken,,MyTopo,,,15,,,,,50 ft,,,,,16,24c0aebd-ca2d-4d76-838b-c197c9dfd7ca,https://www.cch2.org/portal/collections/individual/index.php?occid=98773
701419,RSA,RSA,,PreservedSpecimen,1e435867-b51f-4437-a358-23104ca2596e,,RSA accession: 131602,Organism|Plantae|Viridiplantae|Streptophyta|Embryophyta|Tracheophyta|Spermatophytina|Magnoliopsida|Rosanae|Brassicales|Brassicaceae|Raphanus,Plantae,Tracheophyta,Magnoliopsida,Brassicales,Brassicaceae,Raphanus raphanistrum,29701,L.,Raphanus,,raphanistrum,,,Species,,,,,,,,E. R. Blakley,,3179,4/5/60,,1960,4,5,96,,,,"gravelly clay soil, sun, scattered",,"Annual, flowers yellow, weed in a field",,,,,,herbariumSpecimenDuplicate: https://www.cch2.org/portal/collections/individual/index.php?guid=e5dbb50c-e29c-4831-9572-63e7ca333c14 | herbariumSpecimenDuplicate: https://www.cch2.org/portal/collections/individual/index.php?guid=urn:catalog:CAS:BOT-BC:227683 | herbariumSpecimenDuplicate: https://www.cch2.org/portal/collections/individual/index.php?guid=16ea53ea-2668-4f93-9d1d-b90ec3a94e5b,,,flowers & fruits,Introduced,,,,,herbarium sheet,,,,,,United States,California,Santa Barbara,,"Beach bluffs at the Vail Ranch headquaters, Santa Rosa Island",,0,,34.0073,-120.04943,WGS84,160,Rancho Santa Ana: 2007-2009 CCH GBIF georeferencing grant,,CCH GBIF georeference,,Mon Dec 26 13:37:13 2011; georef from 2006-2015 archive backup file,15,,,,,50ft.,,,T. Kim Nguyen; cataloged date: 2007-09-19,1e435867-b51f-4437-a358-23104ca2596e,17,72e5a06c-13e7-43a2-94c2-a2859c6555aa,https://www.cch2.org/portal/collections/individual/index.php?occid=701419
1053432,RSA,RSA,,PreservedSpecimen,a1e00236-e773-4963-af4f-cc8e428a7209,,RSA accession: 131601,Organism|Plantae|Viridiplantae|Streptophyta|Embryophyta|Tracheophyta|Spermatophytina|Magnoliopsida|Rosanae|Brassicales|Brassicaceae|Raphanus,Plantae,Tracheophyta,Magnoliopsida,Brassicales,Brassicaceae,Raphanus raphanistrum,29701,L.,Raphanus,,raphanistrum,,,Species,,,,,,,,E. R. Blakley,,3180,4/5/60,,1960,4,5,96,,,,"gravelly clay soil, sun, scattered",,"Annual, flowers white with pinkish, weed in a field",,,,,,,,,flowers & fruits,Introduced,,,,,herbarium sheet,,,,,,United States,California,Santa Barbara,,"Beach bluffs at the Vail Ranch headquaters, Santa Rosa Island",,0,,34.0073,-120.04943,WGS84,160,Rancho Santa Ana: 2007-2009 CCH GBIF georeferencing grant,,CCH GBIF georeference,,Mon Dec 26 13:37:13 2011; georef from 2006-2015 archive backup file,15,,,,,50ft.,,,T. Kim Nguyen; cataloged date: 2007-09-19,a1e00236-e773-4963-af4f-cc8e428a7209,17,379f8c72-4788-454d-a35f-4082023d56d5,https://www.cch2.org/portal/collections/individual/index.php?occid=1053432
1195442,RSA,RSA,,PreservedSpecimen,e5dbb50c-e29c-4831-9572-63e7ca333c14,RSA0036268,RSA accession: 641701,Organism|Plantae|Viridiplantae|Streptophyta|Embryophyta|Tracheophyta|Spermatophytina|Magnoliopsida|Rosanae|Brassicales|Brassicaceae|Raphanus,Plantae,Tracheophyta,Magnoliopsida,Brassicales,Brassicaceae,Raphanus raphanistrum,29701,L.,Raphanus,,raphanistrum,,,Species,,,,,,,,E. R. Blakley,,3179,4/5/60,,1960,4,5,96,,"April 5-10, 1960",,"Beach bluffs. Field, gravelly clay soil, sun, scattered.",,"Annual, flowers yellow, weed, scattered.",,,,,,herbariumSpecimenDuplicate: https://www.cch2.org/portal/collections/individual/index.php?guid=1e435867-b51f-4437-a358-23104ca2596e | herbariumSpecimenDuplicate: https://www.cch2.org/portal/collections/individual/index.php?guid=urn:catalog:CAS:BOT-BC:227683 | herbariumSpecimenDuplicate: https://www.cch2.org/portal/collections/individual/index.php?guid=16ea53ea-2668-4f93-9d1d-b90ec3a94e5b,,,flowers & fruits,,,,,,herbarium sheet,,,,,,United States,California,Santa Barbara,,Santa Rosa Island. Veil Ranch headquarters.,,0,,,,,,,,,,,15,,,,,50ft.,,,Forrest Freund; cataloged date: 2014-11-24,e5dbb50c-e29c-4831-9572-63e7ca333c14,17,2749c75d-5e58-4611-9ddf-7005efd39600,https://www.cch2.org/portal/collections/individual/index.php?occid=1195442
2035481,CHSC,VascularPlants,,PreservedSpecimen,7ea75acc-5620-4c90-9d42-3a6ea7620204,CHSC021862,,Organism|Plantae|Viridiplantae|Streptophyta|Embryophyta|Tracheophyta|Spermatophytina|Magnoliopsida|Rosanae|Brassicales|Brassicaceae|Raphanus,Plantae,Tracheophyta,Magnoliopsida,Brassicales,Brassicaceae,Raphanus raphanistrum,29701,L.,Raphanus,,raphanistrum,,,Species,,,,,,,,R. A. Schlising,M. E. Musolf,1518b,6/27/60,,1960,6,27,179,,6/27/60,,"Sandy roadside. Showy population, including about equal numbers of plants bearing pale lemon-yellow and plants with whitish-lavender flowers.",,,,,,,,,,,,,,,,,,,,,,,United States,Wisconsin,Columbia,,"Roadside, along town road. T13N R11E S18",,0,,,,,,,,,,,,,,,,,,,,,44,7ea75acc-5620-4c90-9d42-3a6ea7620204,https://www.cch2.org/portal/collections/individual/index.php?occid=2035481
2035482,CHSC,VascularPlants,,PreservedSpecimen,04cf92db-9662-483b-82e1-738d6266e52d,CHSC021863,,Organism|Plantae|Viridiplantae|Streptophyta|Embryophyta|Tracheophyta|Spermatophytina|Magnoliopsida|Rosanae|Brassicales|Brassicaceae|Raphanus,Plantae,Tracheophyta,Magnoliopsida,Brassicales,Brassicaceae,Raphanus raphanistrum,29701,L.,Raphanus,,raphanistrum,,,Species,,,,,,,,R. A. Schlising,M. E. Musolf,1541 d,7/1/60,,1960,7,1,183,,7/1/60,,Weeds in sand along highway; with Cerastium vulgatum var. hirsutum.,,,,,,,,,,,,,,,,,,,,,,,United States,Wisconsin,Portage,,Along Hwy. H. T25N R06E S15,,0,,,,,,,,,,,,,,,,,,,,,44,04cf92db-9662-483b-82e1-738d6266e52d,https://www.cch2.org/portal/collections/individual/index.php?occid=2035482
2569126,CAS,BOT-BC,,PreservedSpecimen,urn:catalog:CAS:BOT-BC:227683,227683,urn:catalog:CAS:BOT:1126375,Organism|Plantae|Viridiplantae|Streptophyta|Embryophyta|Tracheophyta|Spermatophytina|Magnoliopsida|Rosanae|Brassicales|Brassicaceae|Raphanus,Plantae,Tracheophyta,Magnoliopsida,Brassicales,Brassicaceae,Raphanus raphanistrum,29701,L.,Raphanus,,raphanistrum,,,Species,,,,,,,,"Blakley, E. R.",,3179,4/5/60,,1960,4,5,96,101,"April 5 - 10, 1960","Annual, flowers yellow, scattered. Plants of the California Channel Islands.","Weed in a field, gravelly clay soil, sun.",,,,,,,,herbariumSpecimenDuplicate: https://www.cch2.org/portal/collections/individual/index.php?guid=1e435867-b51f-4437-a358-23104ca2596e | herbariumSpecimenDuplicate: https://www.cch2.org/portal/collections/individual/index.php?guid=e5dbb50c-e29c-4831-9572-63e7ca333c14 | herbariumSpecimenDuplicate: https://www.cch2.org/portal/collections/individual/index.php?guid=16ea53ea-2668-4f93-9d1d-b90ec3a94e5b,,,,,,,,,,,North America,,,,United States,California,Santa Barbara County,,Beach bluffs at the Vail ranch headquarters. Santa Rosa Island,,0,,,,,,,,,,,15,,,,,50.0000000000 ft,,en,,urn:catalog:CAS:BOT-BC:227683,1,46959c9d-ad9a-402f-9d93-0ba7c92713b9,https://www.cch2.org/portal/collections/individual/index.php?occid=2569126
2866605,MACF,,,PreservedSpecimen,d6890fe8-fa94-4167-a849-1219efa58b5e,MACF030447,MACF005306,Organism|Plantae|Viridiplantae|Streptophyta|Embryophyta|Tracheophyta|Spermatophytina|Magnoliopsida|Rosanae|Brassicales|Brassicaceae|Raphanus,Plantae,Tracheophyta,Magnoliopsida,Brassicales,Brassicaceae,Raphanus raphanistrum,29701,L.,Raphanus,,raphanistrum,,,Species,,,,,,,,Martha McCarthy,,,3/20/60,,1960,3,20,80,,20-Mar-60,,In deserted roadbed,,,,,,,,,,,,,,,,,,,,,,,United States,California,Orange,,"1/4 mile west of Highway 91, 1/4 mile from Santa Ana Riverbed.",,0,,,,,,,,,,,,,,,,,,,TuesDani,,36,d6890fe8-fa94-4167-a849-1219efa58b5e,https://www.cch2.org/portal/collections/individual/index.php?occid=2866605
3042972,CATA,Vascular,,PreservedSpecimen,16ea53ea-2668-4f93-9d1d-b90ec3a94e5b,CATA 02858,2858,Organism|Plantae|Viridiplantae|Streptophyta|Embryophyta|Tracheophyta|Spermatophytina|Magnoliopsida|Rosanae|Brassicales|Brassicaceae|Raphanus,Plantae,Tracheophyta,Magnoliopsida,Brassicales,Brassicaceae,Raphanus raphanistrum,29701,L.,Raphanus,,raphanistrum,,,Species,,,,,,,,E.R. Blakley,,3179,4/5/60,,1960,4,5,96,,5-Apr-60,"PLANTS OF THE CALIFORNIA CHANNEL ISLANDS, Scattered","Gravelly clay soil, sun",,"Annual, flowers yellow, weed in field",,,,,,herbariumSpecimenDuplicate: https://www.cch2.org/portal/collections/individual/index.php?guid=1e435867-b51f-4437-a358-23104ca2596e | herbariumSpecimenDuplicate: https://www.cch2.org/portal/collections/individual/index.php?guid=e5dbb50c-e29c-4831-9572-63e7ca333c14 | herbariumSpecimenDuplicate: https://www.cch2.org/portal/collections/individual/index.php?guid=urn:catalog:CAS:BOT-BC:227683,,,,,,,,,,,,,,,U.S.A.,California,Santa Barbara,,Santa Rosa Island: Beach bluffs at the Vail Ranch Headquarters,,0,,,,,,,,,,,15,,,,,,,,preprocessed,2858,52,16ea53ea-2668-4f93-9d1d-b90ec3a94e5b,https://www.cch2.org/portal/collections/individual/index.php?occid=3042972
3792178,FSC,,,PreservedSpecimen,f37bbc8d-c540-4292-931f-77fff62d0bcf,FSC0010463,,Organism|Plantae|Viridiplantae|Streptophyta|Embryophyta|Tracheophyta|Spermatophytina|Magnoliopsida|Rosanae|Brassicales|Brassicaceae|Raphanus,Plantae,Tracheophyta,Magnoliopsida,Brassicales,Brassicaceae,Raphanus raphanistrum,29701,L.,Raphanus,,raphanistrum,,,Species,,,,,,,,N. Mastin,,60-12,6/19/60,,1960,6,19,171,,19-Jun-60,Rare (only specimen),"sandy soil, full sun",,,,,,,,,,,,,,,,,,,,,,,United States,California,San Luis Obispo,,2 miles south of Pismo Beach on west side of highway 101 on Sierra Hill,,0,,35.129598,-120.609636,WGS84,1700,kdpearso,,GeoLocate (CoGe),,"point on W side of Hwy 101 2 mi S(E) of Pismo Beach (on 101), error half the distance to center of Pismo Beach",61,,,,,200 ft.,,en,pawanpreetgill5,,38,f37bbc8d-c540-4292-931f-77fff62d0bcf,https://www.cch2.org/portal/collections/individual/index.php?occid=3792178
304580,UCSB,,,PreservedSpecimen,fc2bb598-1a5d-11e3-b49f-525400a0a001,UCSB032051,2410,Organism|Plantae|Viridiplantae|Streptophyta|Embryophyta|Tracheophyta|Spermatophytina|Magnoliopsida|Rosanae|Brassicales|Brassicaceae|Raphanus,Plantae,Tracheophyta,Magnoliopsida,Brassicales,Brassicaceae,Raphanus sativus,29702,L.,Raphanus,,sativus,,,Species,,,,,,,,"Cline, C.",,23 b,3/19/60,,1960,3,19,79,,,,"In old plowed field, light, somewhat sandy soil",,,,,,,,,,,,,,,,,Sheet - 1,,,,,,United States,California,Santa Barbara,,"San Benito Canyon, 2 1/2 mi. N of Hwy. 101",,0,,34.477424,-120.055174,WGS84,3000,gwahlert (2021-12-28 10:59:56),,georef batch tool 2021-12-28,reviewed - high confidence,,,,,,,,,,,,35,87d4b5f9-18dd-4111-88b0-d5d963d6286c,https://www.cch2.org/portal/collections/individual/index.php?occid=304580
304581,UCSB,,,PreservedSpecimen,fc2bb778-1a5d-11e3-b49f-525400a0a001,UCSB032050,2411,Organism|Plantae|Viridiplantae|Streptophyta|Embryophyta|Tracheophyta|Spermatophytina|Magnoliopsida|Rosanae|Brassicales|Brassicaceae|Raphanus,Plantae,Tracheophyta,Magnoliopsida,Brassicales,Brassicaceae,Raphanus sativus,29702,L.,Raphanus,,sativus,,,Species,,,,,,,,"Cline, C.",,23 c.,3/19/60,,1960,3,19,79,,,,"Growing in old plowed field; light, somewhat sandy soil",,,,,,,,,,,,,,,,,Sheet - 1,,,,,,United States,California,Santa Barbara,,"San Benito Canyon, 2 1/2 mi. N of Hwy. 101",,0,,34.477424,-120.055174,WGS84,3000,gwahlert (2021-12-28 10:59:56),,georef batch tool 2021-12-28,reviewed - high confidence,,,,,,,,,,,,35,f40646b4-3f95-4fde-96c0-1924db3fdb01,https://www.cch2.org/portal/collections/individual/index.php?occid=304581
304582,UCSB,,,PreservedSpecimen,fc2bb96c-1a5d-11e3-b49f-525400a0a001,UCSB032049,2407,Organism|Plantae|Viridiplantae|Streptophyta|Embryophyta|Tracheophyta|Spermatophytina|Magnoliopsida|Rosanae|Brassicales|Brassicaceae|Raphanus,Plantae,Tracheophyta,Magnoliopsida,Brassicales,Brassicaceae,Raphanus sativus,29702,L.,Raphanus,,sativus,,,Species,,,,,,,,"Cline, C.",,23 d.,3/19/60,,1960,3,19,79,,,,"Growing in old plowed field; light, somewhat sandy soil",,,,,,,,,,,,,,,,,Sheet - 1,,,,,,United States,California,Santa Barbara,,"San Benito Canyon, 2 1/2 mi. N of Hwy. 101",,0,,34.477424,-120.055174,WGS84,3000,gwahlert (2021-12-28 10:59:56),,georef batch tool 2021-12-28,reviewed - high confidence,,,,,,,,,,,,35,0caa6781-b905-475f-9fb2-5ea0e082ef83,https://www.cch2.org/portal/collections/individual/index.php?occid=304582
304583,UCSB,,,PreservedSpecimen,fc2bbc0a-1a5d-11e3-b49f-525400a0a001,UCSB032048,2405,Organism|Plantae|Viridiplantae|Streptophyta|Embryophyta|Tracheophyta|Spermatophytina|Magnoliopsida|Rosanae|Brassicales|Brassicaceae|Raphanus,Plantae,Tracheophyta,Magnoliopsida,Brassicales,Brassicaceae,Raphanus sativus,29702,L.,Raphanus,,sativus,,,Species,,,,,,,,"Cline, C.",,23 f.,3/19/60,,1960,3,19,79,,,,"Growing in old plowed field; light, somewhat sandy soil",,,,,,,,,,,,,,,,,Sheet - 1,,,,,,United States,California,Santa Barbara,,"San Benito Canyon, 2 1/2 mi. N of Hwy. 101",,0,,34.477424,-120.055174,WGS84,3000,gwahlert (2021-12-28 10:59:56),,georef batch tool 2021-12-28,reviewed - high confidence,,,,,,,,,,,,35,f8ec328d-732b-47d1-aec8-58613b41a319,https://www.cch2.org/portal/collections/individual/index.php?occid=304583
304584,UCSB,,,PreservedSpecimen,fc2bbf0c-1a5d-11e3-b49f-525400a0a001,UCSB032047,2404,Organism|Plantae|Viridiplantae|Streptophyta|Embryophyta|Tracheophyta|Spermatophytina|Magnoliopsida|Rosanae|Brassicales|Brassicaceae|Raphanus,Plantae,Tracheophyta,Magnoliopsida,Brassicales,Brassicaceae,Raphanus sativus,29702,L.,Raphanus,,sativus,,,Species,,,,,,,,"Cline, C.",,23 e.,3/19/60,,1960,3,19,79,,,,"Growing in old plowed field; light, somewhat sandy soil",,,,,,,,,,,,,,,,,Sheet - 1,,,,,,United States,California,Santa Barbara,,"San Benito Canyon, 2 1/2 mi. N of Hwy. 101",,0,,34.477424,-120.055174,WGS84,3000,gwahlert (2021-12-28 10:59:56),,georef batch tool 2021-12-28,reviewed - high confidence,,,,,,,,,,,,35,1d37b665-6b50-4463-91ad-e68f17bb7441,https://www.cch2.org/portal/collections/individual/index.php?occid=304584
304585,UCSB,,,PreservedSpecimen,fc2bc1a0-1a5d-11e3-b49f-525400a0a001,UCSB032046,2406,Organism|Plantae|Viridiplantae|Streptophyta|Embryophyta|Tracheophyta|Spermatophytina|Magnoliopsida|Rosanae|Brassicales|Brassicaceae|Raphanus,Plantae,Tracheophyta,Magnoliopsida,Brassicales,Brassicaceae,Raphanus sativus,29702,L.,Raphanus,,sativus,,,Species,,,,,,,,"Cline, C.",,23 a.,3/19/60,,1960,3,19,79,,,,"Growing in old plowed field; light soil, somewhat sandy",,,,,,,,,,,,,,,,,Sheet - 1,,,,,,United States,California,Santa Barbara,,"San Benito Canyon, 2 1/2 mi. N of Hwy. 101",,0,,34.477424,-120.055174,WGS84,3000,gwahlert (2021-12-28 10:59:56),,georef batch tool 2021-12-28,reviewed - high confidence,,,,,,,,,,,,35,37562a38-ab81-4267-a749-bb8d4ff3b773,https://www.cch2.org/portal/collections/individual/index.php?occid=304585
304586,UCSB,,,PreservedSpecimen,fc2bc43e-1a5d-11e3-b49f-525400a0a001,UCSB032045,2409,Organism|Plantae|Viridiplantae|Streptophyta|Embryophyta|Tracheophyta|Spermatophytina|Magnoliopsida|Rosanae|Brassicales|Brassicaceae|Raphanus,Plantae,Tracheophyta,Magnoliopsida,Brassicales,Brassicaceae,Raphanus sativus,29702,L.,Raphanus,,sativus,,,Species,,,,,,,,"Cline, C.",,23 h.,3/19/60,,1960,3,19,79,,,,"Growing in old plowed field; light, somewhat sandy soil",,,,,,,,,,,,,,,,,Sheet - 1,,,,,,United States,California,Santa Barbara,,"San Benito Canyon, 2 1/2 mi. N of Hwy. 101",,0,,34.477424,-120.055174,WGS84,3000,gwahlert (2021-12-28 10:59:56),,georef batch tool 2021-12-28,reviewed - high confidence,,,,,,,,,,,,35,6e8a4867-819b-465c-9bc5-19f36883b015,https://www.cch2.org/portal/collections/individual/index.php?occid=304586
304587,UCSB,,,PreservedSpecimen,fc2bc6d2-1a5d-11e3-b49f-525400a0a001,UCSB032044,2408,Organism|Plantae|Viridiplantae|Streptophyta|Embryophyta|Tracheophyta|Spermatophytina|Magnoliopsida|Rosanae|Brassicales|Brassicaceae|Raphanus,Plantae,Tracheophyta,Magnoliopsida,Brassicales,Brassicaceae,Raphanus sativus,29702,L.,Raphanus,,sativus,,,Species,,,,,,,,"Cline, C.",,23 i.,3/19/60,,1960,3,19,79,,,,"Growing in old plowed field; light, somewhat sandy soil",,,,,,,,,,,,,,,,,Sheet - 1,,,,,,United States,California,Santa Barbara,,"San Benito Canyon, 2 1/2 mi. N of Hwy. 101",,0,,34.477424,-120.055174,WGS84,3000,gwahlert (2021-12-28 10:59:56),,georef batch tool 2021-12-28,reviewed - high confidence,,,,,,,,,,,,35,efbf4d3f-33f8-455c-ba84-48edb21d454e,https://www.cch2.org/portal/collections/individual/index.php?occid=304587
304588,UCSB,,,PreservedSpecimen,fc2bca1a-1a5d-11e3-b49f-525400a0a001,UCSB032043,2412,Organism|Plantae|Viridiplantae|Streptophyta|Embryophyta|Tracheophyta|Spermatophytina|Magnoliopsida|Rosanae|Brassicales|Brassicaceae|Raphanus,Plantae,Tracheophyta,Magnoliopsida,Brassicales,Brassicaceae,Raphanus sativus,29702,L.,Raphanus,,sativus,,,Species,,,,,,,,"Cline, C.",,23 g.,3/19/60,,1960,3,19,79,,,,"Growing in old plowed field; light, somewhat sandy soil",,,,,,,,,,,,,,,,,Sheet - 1,,,,,,United States,California,Santa Barbara,,"San Benito Canyon, 2 1/2 mi. N of Hwy. 101",,0,,34.477424,-120.055174,WGS84,3000,gwahlert (2021-12-28 10:59:56),,georef batch tool 2021-12-28,reviewed - high confidence,,,,,,,,,,,,35,c3c6dd78-9939-4f39-8ddb-a8e715c14bc5,https://www.cch2.org/portal/collections/individual/index.php?occid=304588
1368032,DAV,,,PreservedSpecimen,UCD115211,DAV310405,Accession #: DAV33461,Organism|Plantae|Viridiplantae|Streptophyta|Embryophyta|Tracheophyta|Spermatophytina|Magnoliopsida|Rosanae|Brassicales|Brassicaceae|Raphanus,Plantae,Tracheophyta,Magnoliopsida,Brassicales,Brassicaceae,Raphanus sativus,29702,L.,Raphanus,,sativus,,,Species,,,,,,,,Gordon Pilone,,10,4/18/60,,1960,4,18,109,,18-Apr-60,Access Database Number (Deprecated): UCD115211,In Pacific slope drainage area. Growing in roadside.,,,,,,,,,,,,,,,,,,,,,,,United States,California,San Bernardino,,San Bernardino County: 0.125 mile west of Archibald on Sixth Street in Cucamonga.,,0,,34.0847,-117.5936,WGS84,300,Rancho Santa Ana D,,CalTopo (copied from UCD103210),,,366,,,,,1200ft,,,tcbarry,UCD115211,39,e37c1ff3-041b-4c3b-aa2f-d02f50c97125,https://www.cch2.org/portal/collections/individual/index.php?occid=1368032
2406304,CAS,BOT-BC,,PreservedSpecimen,urn:catalog:CAS:BOT-BC:74326,74326,urn:catalog:CAS:BOT:520092,Organism|Plantae|Viridiplantae|Streptophyta|Embryophyta|Tracheophyta|Spermatophytina|Magnoliopsida|Rosanae|Brassicales|Brassicaceae|Raphanus,Plantae,Tracheophyta,Magnoliopsida,Brassicales,Brassicaceae,Raphanus sativus,29702,L.,Raphanus,,sativus,,,Species,Ihsan A. Al-Shehbaz,2010-01,,,,,,"Ruckert, Elsa G.",,40,3/23/60,,1960,3,23,83,,23-Mar-60,"Flowers purple leaves rough, prickly, irritating to skin.","On grassy bank. Associates: Grasses, Escholtzia, Brassica, Crassula.",,,,,,,,,,,,,,,,,,,North America,,,,United States,California,San Francisco County,,"19th Avenue, opposite San Francisco State College, San Francisco.",,0,,,,,,,,,,,9,,,,,30.0000000000 ft,,en,,urn:catalog:CAS:BOT-BC:74326,1,4889a785-f92d-4930-b71a-ce1cb1719f97,https://www.cch2.org/portal/collections/individual/index.php?occid=2406304
2866807,MACF,,,PreservedSpecimen,eaeacd20-fa9e-456e-9762-c78ed6d49f42,MACF030466,MACF005311,Organism|Plantae|Viridiplantae|Streptophyta|Embryophyta|Tracheophyta|Spermatophytina|Magnoliopsida|Rosanae|Brassicales|Brassicaceae|Raphanus,Plantae,Tracheophyta,Magnoliopsida,Brassicales,Brassicaceae,Raphanus sativus,29702,L.,Raphanus,,sativus,,,Species,,,,,,,,Martha McCarthy,,,3/20/60,,1960,3,20,80,,20-Mar-60,,,,,,,,,,,,,,,,,,,,,,,,,United States,California,Orange,,"1/4 mile west of U.S. Highway 91, on south edge of Santa Ana Riverbed",,0,,,,,,,,,,,,,,,,,,,TuesDani,,36,eaeacd20-fa9e-456e-9762-c78ed6d49f42,https://www.cch2.org/portal/collections/individual/index.php?occid=2866807
3792191,FSC,,,PreservedSpecimen,e3e3cd81-fad8-4d90-a42a-7083abc2098e,FSC0010476,,Organism|Plantae|Viridiplantae|Streptophyta|Embryophyta|Tracheophyta|Spermatophytina|Magnoliopsida|Rosanae|Brassicales|Brassicaceae|Raphanus,Plantae,Tracheophyta,Magnoliopsida,Brassicales,Brassicaceae,Raphanus sativus,29702,L.,Raphanus,,sativus,,,Species,,,,,,,,N. Mastin,,60-15,6/19/60,,1960,6,19,171,,19-Jun-60,Fairly common; large specimens,Sandy soil; full sun.,,,,,,,,,,,,,,,,,,,,,,,United States,California,San Luis Obispo,,2 miles south of Pismo Beach on west side of highway 101 on Sierra Hill.,,0,,35.129598,-120.609636,WGS84,1700,kdpearso,,GeoLocate (CoGe),,"point on W side of Hwy 101 2 mi S(E) of Pismo Beach (on 101), error half the distance to center of Pismo Beach",61,,,,,200 ft.,,en,pawanpreetgill5,,38,e3e3cd81-fad8-4d90-a42a-7083abc2098e,https://www.cch2.org/portal/collections/individual/index.php?occid=3792191
3801165,CSLA,,,PreservedSpecimen,8b40e7cf-9aa4-4c17-b0de-8303cd7257ba,CSLA000818,,Organism|Plantae|Viridiplantae|Streptophyta|Embryophyta|Tracheophyta|Spermatophytina|Magnoliopsida|Rosanae|Brassicales|Brassicaceae|Raphanus,Plantae,Tracheophyta,Magnoliopsida,Brassicales,Brassicaceae,Raphanus sativus,29702,L.,Raphanus,,sativus,,,Species,,,,,,,,Alfred Traverse,,1403,4/23/60,,1960,4,23,114,,23-Apr-60,,"Cultivated. Flowerbed, E side of house. Horticultural loam.",,,,,,,"annual herb, .3-.5 m. Spindly upright. Variety: Icicly radish. Pale pink-lavender to white petals.",,,,,,,,,,,,,,,,United States,Texas,Harris,,"Houston (Spring Branch), 1428 Adkins Road.",,0,,,,,,,,,,,26,,,,,85 feet,,,,,42,8b40e7cf-9aa4-4c17-b0de-8303cd7257ba,https://www.cch2.org/portal/collections/individual/index.php?occid=3801165
3847652,RSA,RSA,,PreservedSpecimen,4a539689-caf7-40f9-86ed-a53b429dec35,RSA0158686,RSA accession: 876544,Organism|Plantae|Viridiplantae|Streptophyta|Embryophyta|Tracheophyta|Spermatophytina|Magnoliopsida|Rosanae|Brassicales|Brassicaceae|Raphanus,Plantae,Tracheophyta,Magnoliopsida,Brassicales,Brassicaceae,Raphanus sativus,29702,L.,Raphanus,,sativus,,,Species,LeRoy Gross,2018-12,,,,,,Edward F. Anderson,,2149,1960-00-00,,1960,0,0,,,1960,[Collection numbers do not correspond with notebooks; location obtained from bundle information.],,,,,,,,,,,,,,,,,,herbarium sheet,,,,,,United States,California,San Diego,,Fallbrook.,,0,,33.37642,-117.251147,WGS84,,Brandy Watts; georef date: 2019-02-11,,"Google Earth, GeoLocate, Google Maps",,Located Fallbrook. Placed marker at the center of Falllbrook with a large error radius given imprecise nature of locality.,,,,,,,,,Jessica Santavanond; cataloged date: 2018-12-10,4a539689-caf7-40f9-86ed-a53b429dec35,17,e4dabaaf-3dc7-4e55-96f3-a5440957dc94,https://www.cch2.org/portal/collections/individual/index.php?occid=3847652
4745866,RENO,V,,PreservedSpecimen,6371d155-8120-42b7-ab41-3963e91e4e55,77918,RENO 42362,Organism|Plantae|Viridiplantae|Streptophyta|Embryophyta|Tracheophyta|Spermatophytina|Magnoliopsida|Rosanae|Brassicales|Brassicaceae|Raphanus,Plantae,Tracheophyta,Magnoliopsida,Brassicales,Brassicaceae,Raphanus sativus,29702,L.,Raphanus,,sativus,,,Species,,,,,,,,G.D. Cooney,,39,4/13/60,,1960,4,13,104,,4/13/60,,,,,,,,,,,,,,,,,,,,,,,,,United States,California,Napa,,,,0,,38.297137,-122.285529,WGS84,4000,Mike,,GeoLocate,,unmappable.,,,,,,,,,Mike,11526657,89,90d763a3-5e72-4571-9c52-38e6b92827c1,https://www.cch2.org/portal/collections/individual/index.php?occid=4745866
4745869,RENO,V,,PreservedSpecimen,33750a0a-f8fd-4316-9f86-1ae8f2e2d6ae,77919,NESH 56095,Organism|Plantae|Viridiplantae|Streptophyta|Embryophyta|Tracheophyta|Spermatophytina|Magnoliopsida|Rosanae|Brassicales|Brassicaceae|Raphanus,Plantae,Tracheophyta,Magnoliopsida,Brassicales,Brassicaceae,Raphanus sativus,29702,L.,Raphanus,,sativus,,,Species,S. Koniak,1986,,,,,,K. Terrell,,s.n.,4/16/60,,1960,4,16,107,,4/16/60,,Transitional pine forest.,,,,,,,,,,,,,,,,,,,,,,,United States,California,Shasta,,Redding.,,0,,40.58654,-122.391675,WGS84,4000,Mike,,GeoLocate,,,366,,,,,1200 ft.,,,Mike,11526679,89,f0fc56ae-22c7-4252-9986-3878abdcf369,https://www.cch2.org/portal/collections/individual/index.php?occid=4745869
5082640,SD,,,,CA182422-634C-4C75-8A9F-CA394C0F95ED,SD00055687,SD278325,Organism|Plantae|Viridiplantae|Streptophyta|Embryophyta|Tracheophyta|Spermatophytina|Magnoliopsida|Rosanae|Brassicales|Brassicaceae|Raphanus,Plantae,Tracheophyta,Magnoliopsida,Brassicales,Brassicaceae,Raphanus sativus,29702,L.,Raphanus,,sativus,,,Species,"Leroy Gross, 10 Dec 2018",,,,,,,Edward Anderson,,2149,1960-00-00,,1960,0,0,,,,,,,,,,,,,,,,FFL,,,,,,,,,,,,United States,California,San Diego,,Fallbrook,,0,,,,,,,,,,,,,,,,unknownft.,,,,SD278325,43,9d5762c3-28db-4f6d-9d4c-984b6cfcc75e,https://www.cch2.org/portal/collections/individual/index.php?occid=5082640
2035506,CHSC,VascularPlants,,PreservedSpecimen,a0f2ff98-f3fa-4901-90de-2dc39bb02ecf,CHSC021887,,Organism|Plantae|Viridiplantae|Streptophyta|Embryophyta|Tracheophyta|Spermatophytina|Magnoliopsida|Rosanae|Brassicales|Brassicaceae|Raphanus,Plantae,Tracheophyta,Magnoliopsida,Brassicales,Brassicaceae,Raphanus raphanistrum,29701,L.,Raphanus,,raphanistrum,,,Species,,,,,,,,Robert A. Schlising,,1935,6/10/61,,1961,6,10,161,,6/10/61,,"Sandy roadside of highway; with Spergula arvensis, Thlaspi arvense, Cerastium vulgatum, Lychnis alba.",,,,,,,,,,,,,,,,,,,,,,,United States,Wisconsin,Shawano,,Roadside of county hwy Z. T29N R11E S09,,0,,,,,,,,,,,,,,,,,,,,,44,a0f2ff98-f3fa-4901-90de-2dc39bb02ecf,https://www.cch2.org/portal/collections/individual/index.php?occid=2035506
2262508,LOB,,,PreservedSpecimen,219a7b22-a787-4ec4-9c7d-938694f9562a,LOB116463,2519,Organism|Plantae|Viridiplantae|Streptophyta|Embryophyta|Tracheophyta|Spermatophytina|Magnoliopsida|Rosanae|Brassicales|Brassicaceae|Raphanus,Plantae,Tracheophyta,Magnoliopsida,Brassicales,Brassicaceae,Raphanus raphanistrum,29701,L.,Raphanus,,raphanistrum,,,Species,,,,,,,,B.W. Massey,,s.n.,4/6/61,,1961,4,6,96,,6-Apr-61,,,,,,,,,,,,,,,,,,,,,,,,,United States,California,Marin,,"Muir Meadows, 1/2 mile S of jct. of Mt. Tamalpais Rd. on Route 1",,0,,,,,,,,,,,305,,,,,1000 ft,,,14412695,,19,219a7b22-a787-4ec4-9c7d-938694f9562a,https://www.cch2.org/portal/collections/individual/index.php?occid=2262508
2298121,CAS,BOT-BC,,PreservedSpecimen,urn:catalog:CAS:BOT-BC:74191,74191,urn:catalog:CAS:BOT:886053,Organism|Plantae|Viridiplantae|Streptophyta|Embryophyta|Tracheophyta|Spermatophytina|Magnoliopsida|Rosanae|Brassicales|Brassicaceae|Raphanus,Plantae,Tracheophyta,Magnoliopsida,Brassicales,Brassicaceae,Raphanus raphanistrum,29701,L.,Raphanus,,raphanistrum,,,Species,Ihsan A. Al-Shehbaz,1/10/10,,,,,,"True, Gordon H.",,134,8/13/61,,1961,8,13,225,,"Aug. 13, 1961",,,,,,,,,,,,,,,,,,,,,North America,,,,United States,California,Nevada County,,Indian Springs.,,0,,,,,,,,,,,488,,,,,1600.0000000000 ft,,en,,urn:catalog:CAS:BOT-BC:74191,1,a59e6963-4663-48fe-a5aa-560f1601b6db,https://www.cch2.org/portal/collections/individual/index.php?occid=2298121
3414522,UCJEPS,VASC,,PreservedSpecimen,8548a970-b846-481b-b082-d002ceab8e0f,JEPS45441,,Organism|Plantae|Viridiplantae|Streptophyta|Embryophyta|Tracheophyta|Spermatophytina|Magnoliopsida|Rosanae|Brassicales|Brassicaceae|Raphanus,Plantae,Tracheophyta,Magnoliopsida,Brassicales,Brassicaceae,Raphanus raphanistrum,29701,L.,Raphanus,,raphanistrum,,,Species,,,,,,,,Perry Allen,,,4/21/61,,1961,4,21,111,,Apr 21 1961,,in a field that had been cultivated years before,,fls white,,,,,,,,,Flowering/Fruiting,,,,,,,,,,,,United States,California,Stanislaus,,vicinity of La Grange (just n of old dredge camp),,0,,37.66423,-120.46039,NAD27,806,,,Terrain Navigator,,,,,,,,,,,,8548a970-b846-481b-b082-d002ceab8e0f,46,a8585fe9-f833-4fb7-9a18-8d4bb46ac72d,https://www.cch2.org/portal/collections/individual/index.php?occid=3414522
3792165,FSC,,,PreservedSpecimen,11f217d9-2acc-47c2-a595-766ac8c0ae45,FSC0010450,,Organism|Plantae|Viridiplantae|Streptophyta|Embryophyta|Tracheophyta|Spermatophytina|Magnoliopsida|Rosanae|Brassicales|Brassicaceae|Raphanus,Plantae,Tracheophyta,Magnoliopsida,Brassicales,Brassicaceae,Raphanus raphanistrum,29701,L.,Raphanus,,raphanistrum,,,Species,,,,,,,,John H. Weiler,,6145,3/26/61,,1961,3,26,85,,26-Mar-61,abundant,On roadside; assoc. with Lupinus bicolor and annual grasses,,,,,,,,,,,,,,,,,,,,,,,United States,California,Alameda,,On the side of a road cut about 1.5 miles south of the canyon,,0,,,,,,,,,,,,,,,,,,en,pawanpreetgill5,,38,11f217d9-2acc-47c2-a595-766ac8c0ae45,https://www.cch2.org/portal/collections/individual/index.php?occid=3792165
3949199,MCCC,,,PreservedSpecimen,5832351b-79b2-410a-80b6-b314b30ac192,1996,,Organism|Plantae|Viridiplantae|Streptophyta|Embryophyta|Tracheophyta|Spermatophytina|Magnoliopsida|Rosanae|Brassicales|Brassicaceae|Raphanus,Plantae,Tracheophyta,Magnoliopsida,Brassicales,Brassicaceae,Raphanus raphanistrum,29701,L.,Raphanus,,raphanistrum,,,Species,,,,,,,,P. Cuttitta,,,8/12/61,,1961,8,12,224,,,,,,Same as Raphanus sativa except seed pod with 4-10 seeds,,,,,,,,,,,,,,,,,,,,,USA,California,Mendocino,,"Scattered throughout park, California State Park",,,,,,,,,,,,,,,,,,,,,cschomer,,71,5832351b-79b2-410a-80b6-b314b30ac192,https://www.cch2.org/portal/collections/individual/index.php?occid=3949199
43829,SBBG,,,PreservedSpecimen,164d7b92-9c1b-4a66-8663-7c588e46f291,SBBG155537,SBBG_old: 13430,Organism|Plantae|Viridiplantae|Streptophyta|Embryophyta|Tracheophyta|Spermatophytina|Magnoliopsida|Rosanae|Brassicales|Brassicaceae|Raphanus,Plantae,Tracheophyta,Magnoliopsida,Brassicales,Brassicaceae,Raphanus sativus,29702,L.,Raphanus,,sativus,,,Species,,,,,,,,E. R. Blakley,,3931,3/12/61,,1961,3,12,71,,3/12/61,,barnyard,,Annual; flowers purple; 3 ft. tall; weed. Common.,,,,,ann; fls purple; 3 ft tall weed,herbariumSpecimenDuplicate: https://www.cch2.org/portal/collections/individual/index.php?guid=d6551de7-8ba5-4367-af35-412246e35c77 | herbariumSpecimenDuplicate: https://www.cch2.org/portal/collections/individual/index.php?guid=urn:catalog:CAS:BOT-BC:74234,,,Flowers Present; Fruit Present,,,,,,,,,,,,United States,California,Santa Barbara,,Santa Cruz Island: cattle barnyard in Cyn Cebada,,0,,34.018,-119.852,NAD83,1000,Rancho Santa Ana (no. 8),,MyTopo,,georef from 2006-2015 archive backup file; Date Georeferenced: Mon Dec 26 13:37:13 2011,76,,,,,250 ft.,,,LucieG,,16,f7018686-d990-402a-bf28-598a7a4d8d8a,https://www.cch2.org/portal/collections/individual/index.php?occid=43829
304601,UCSB,,,PreservedSpecimen,fc2beeb4-1a5d-11e3-b49f-525400a0a001,UCSB032060,14787,Organism|Plantae|Viridiplantae|Streptophyta|Embryophyta|Tracheophyta|Spermatophytina|Magnoliopsida|Rosanae|Brassicales|Brassicaceae|Raphanus,Plantae,Tracheophyta,Magnoliopsida,Brassicales,Brassicaceae,Raphanus sativus,29702,L.,Raphanus,,sativus,,,Species,,,,,,,,Dennis E. Breedlove,,855,7/23/61,,1961,7,23,204,,,,On disturbed roadbank,,,,,,,,,,,,,,,,,Sheet - 1,,,,,,United States,California,Santa Barbara,,"Along the Alamo Pintado Creek from 7-8 miles north of Los Olivos; base of Figueroa Mountain, Birabent Canyon, San Rafael Range",,0,,34.748,-120.053,NAD83,1000,Santa Barbara Botanic Garden A,,Terrain Nav. v. 8.7 (copied from SBBG15512),,Thu Apr 24 17:32:21 2014,,,,,,,,,preprocessed,,35,317c8aea-e74d-4b6a-bf1d-e178d08730dc,https://www.cch2.org/portal/collections/individual/index.php?occid=304601
610291,SFV,,,PreservedSpecimen,e02d2d0d-81a7-4a27-9d40-74ae04d4d5ac,SFV104576,SFV-1508,Organism|Plantae|Viridiplantae|Streptophyta|Embryophyta|Tracheophyta|Spermatophytina|Magnoliopsida|Rosanae|Brassicales|Brassicaceae|Raphanus,Plantae,Tracheophyta,Magnoliopsida,Brassicales,Brassicaceae,Raphanus sativus,29702,L.,Raphanus,,sativus,,,Species,,,,,,,,K. A. Wilson,,877,3/1/61,,1961,3,1,60,,1-Mar-61,,,,Plant height: about 1 m tall profusely branched herb. Flower color: corolla lavender with dark veins.,,,,,,herbariumSpecimenDuplicate: https://www.cch2.org/portal/collections/individual/index.php?guid=1fdcfcdb-97f9-4eb8-b299-12f0cc217662,,,Flowering,Wild: native/naturalized,,,,,,,,,,,United States,California,Los Angeles,,"San Fernando Valley; Tarzana. Topham Street, corner of Etiwanda Ave. Weed patch near railroad tracks.",,0,,34.18,-118.53,,,,,,,,225,,,,,738 ft.,,,JNH,,41,e02d2d0d-81a7-4a27-9d40-74ae04d4d5ac,https://www.cch2.org/portal/collections/individual/index.php?occid=610291
610292,SFV,,,PreservedSpecimen,2d940544-ab78-4a87-8965-ce716dd38faa,SFV104577,SFV-1507,Organism|Plantae|Viridiplantae|Streptophyta|Embryophyta|Tracheophyta|Spermatophytina|Magnoliopsida|Rosanae|Brassicales|Brassicaceae|Raphanus,Plantae,Tracheophyta,Magnoliopsida,Brassicales,Brassicaceae,Raphanus sativus,29702,L.,Raphanus,,sativus,,,Species,,,,,,,,K. A. Wilson,,1010,3/12/61,,1961,3,12,71,,12-Mar-61,,,,Flower color: petals light lavender or cream colored; the veins dark.,,,,,,herbariumSpecimenDuplicate: https://www.cch2.org/portal/collections/individual/index.php?guid=d36d406c-c0df-437a-aa47-a841a4645174,,,Flowering & Fruiting,Wild: native/naturalized,,,,,,,,,,,United States,California,Los Angeles,,"Santa Monica Mountains; Point Dume, roadside at Cliffside Drive and Fernhill Drive.",,0,,34.007,-118.8,,,,,,,,35,,,,,115 ft.,,,JNH,,41,2d940544-ab78-4a87-8965-ce716dd38faa,https://www.cch2.org/portal/collections/individual/index.php?occid=610292
1163065,RSA,RSA,,PreservedSpecimen,d6551de7-8ba5-4367-af35-412246e35c77,,RSA accession: 641700,Organism|Plantae|Viridiplantae|Streptophyta|Embryophyta|Tracheophyta|Spermatophytina|Magnoliopsida|Rosanae|Brassicales|Brassicaceae|Raphanus,Plantae,Tracheophyta,Magnoliopsida,Brassicales,Brassicaceae,Raphanus sativus,29702,L.,Raphanus,,sativus,,,Species,,,,,,,,E. R. Blakley,,3931,3/12/61,,1961,3,12,71,,,,,,"Annual, flowers purple, 3ft tall weed, common in the barnyard",,,,,,herbariumSpecimenDuplicate: https://www.cch2.org/portal/collections/individual/index.php?guid=164d7b92-9c1b-4a66-8663-7c588e46f291 | herbariumSpecimenDuplicate: https://www.cch2.org/portal/collections/individual/index.php?guid=urn:catalog:CAS:BOT-BC:74234,,,flowers & fruits,Cultivated,,,,,herbarium sheet,,,,,,United States,California,Santa Barbara,,Santa Cruz Island. Near the cattle barn in Canyon Cervada.,,0,,,,,,,,,,,76,,,,,250ft.,,,T. Kim Nguyen; cataloged date: 2007-09-21,d6551de7-8ba5-4367-af35-412246e35c77,17,d4c432b8-6146-4219-a668-24cdc89489c2,https://www.cch2.org/portal/collections/individual/index.php?occid=1163065
1219161,RSA,RSA,,PreservedSpecimen,f12b377d-a693-4336-b4f7-4092b022bc60,,RSA accession: 651172,Organism|Plantae|Viridiplantae|Streptophyta|Embryophyta|Tracheophyta|Spermatophytina|Magnoliopsida|Rosanae|Brassicales|Brassicaceae|Raphanus,Plantae,Tracheophyta,Magnoliopsida,Brassicales,Brassicaceae,Raphanus sativus,29702,L.,Raphanus,,sativus,,,Species,,,,,,,,R. Carlston,,s.n.,5/29/61,,1961,5,29,149,,,,,,,,,,,,,,,flowers,Introduced,,,,,herbarium sheet,,,,,,United States,California,Santa Barbara,,"Mannings Park, Santa Barbara.",,0,,34.8272222,-116.6875,,,,,Unknown,,"[34.8272222222222, 116.6875 are not from the label]",,,,,,,,,cataloged date: 2001-01-24,f12b377d-a693-4336-b4f7-4092b022bc60,17,3e4035b0-92bc-496b-ba34-d041d4ef1c88,https://www.cch2.org/portal/collections/individual/index.php?occid=1219161
1367997,DAV,,,PreservedSpecimen,406e3c3f-b88b-451d-bb25-5d2e6254de6a,AHUC100068,Accession #: AHUC27840,Organism|Plantae|Viridiplantae|Streptophyta|Embryophyta|Tracheophyta|Spermatophytina|Magnoliopsida|Rosanae|Brassicales|Brassicaceae|Raphanus,Plantae,Tracheophyta,Magnoliopsida,Brassicales,Brassicaceae,Raphanus sativus,29702,L.,Raphanus,,sativus,,,Species,,,,,,,,Beecher Crampton,,s.n.,3/13/61,,1961,3,13,72,,13-Mar-61,Access Database Number (Deprecated): UCD115172,Field weed.,,,,,,,,,,,,,,,,,,,,,,,United States,California,Yolo,,Yolo County: Woodland.,,0,,38.678516,-121.773297,WGS84,2460,cwalden,,GeoLocate,,,,,,,,,,,,UCD115172,39,406e3c3f-b88b-451d-bb25-5d2e6254de6a,https://www.cch2.org/portal/collections/individual/index.php?occid=1367997
1368025,DAV,,,PreservedSpecimen,f432c05c-c4d0-4389-aa9b-4e373f04c1e4,DAV310409,Accession #: DAV37303,Organism|Plantae|Viridiplantae|Streptophyta|Embryophyta|Tracheophyta|Spermatophytina|Magnoliopsida|Rosanae|Brassicales|Brassicaceae|Raphanus,Plantae,Tracheophyta,Magnoliopsida,Brassicales,Brassicaceae,Raphanus sativus,29702,L.,Raphanus,,sativus,,,Species,,,,,,,,D. R. Kaplan,,s.n.,2/26/61,,1961,2,26,57,,26-Feb-61,Access Database Number (Deprecated): UCD115204,Growing near pond bed.,,"Plants 2 dm. high, erect; flowers white with purple nerves.",,,,,,,,Gnaphalium and Spergula.,,,,,,,,,,,,,United States,California,Santa Cruz,,"Santa Cruz County: just east of State Highway 156, 6.4 miles south and east of Watsonville.",,0,,36.86019,-121.574386,WGS84,3000,C. Walden,,GeoLocate,,,,,,,,,,,,UCD115204,39,f432c05c-c4d0-4389-aa9b-4e373f04c1e4,https://www.cch2.org/portal/collections/individual/index.php?occid=1368025
1368054,DAV,,,PreservedSpecimen,1fdcfcdb-97f9-4eb8-b299-12f0cc217662,DAV310401,Accession #: DAV31060,Organism|Plantae|Viridiplantae|Streptophyta|Embryophyta|Tracheophyta|Spermatophytina|Magnoliopsida|Rosanae|Brassicales|Brassicaceae|Raphanus,Plantae,Tracheophyta,Magnoliopsida,Brassicales,Brassicaceae,Raphanus sativus,29702,L.,Raphanus,,sativus,,,Species,,,,,,,,Kenneth A. Wilson,,877,3/1/61,,1961,3,1,60,,1-Mar-61,Access Database Number (Deprecated): UCD115234,Growing in weed patch near railroad tracks.,,Corolla lavender with dark veins. Profusely branched herb 1 meter tall.,,,,,,herbariumSpecimenDuplicate: https://www.cch2.org/portal/collections/individual/index.php?guid=e02d2d0d-81a7-4a27-9d40-74ae04d4d5ac,,,,,,,,,,,,,,,United States,California,Los Angeles,,"Los Angeles County: San Fernando Valley. Tarzana, Topham Street, corner of Etiwanda Avenue.",,0,,34.18,-118.53,,,,,,,copied from duplicate,,,,,,,,,preprocessed,UCD115234,39,1fdcfcdb-97f9-4eb8-b299-12f0cc217662,https://www.cch2.org/portal/collections/individual/index.php?occid=1368054
1368055,DAV,,,PreservedSpecimen,d36d406c-c0df-437a-aa47-a841a4645174,DAV310400,Accession #: DAV32166,Organism|Plantae|Viridiplantae|Streptophyta|Embryophyta|Tracheophyta|Spermatophytina|Magnoliopsida|Rosanae|Brassicales|Brassicaceae|Raphanus,Plantae,Tracheophyta,Magnoliopsida,Brassicales,Brassicaceae,Raphanus sativus,29702,L.,Raphanus,,sativus,,,Species,,,,,,,,Kenneth A. Wilson,,1010,3/12/61,,1961,3,12,71,,12-Mar-61,Access Database Number (Deprecated): UCD115235,Growing on roadside.,,"Petals light lavender or cream colored, veins dark.",,,,,,herbariumSpecimenDuplicate: https://www.cch2.org/portal/collections/individual/index.php?guid=2d940544-ab78-4a87-8965-ce716dd38faa,,,,,,,,,,,,,,,United States,California,Los Angeles,,"Los Angeles County: Point Dume, Cliffside Drive and Fernhill Drive.",,0,,34.007,-118.8,,,,,,,copied from duplicate,,,,,,,,,preprocessed,UCD115235,39,d36d406c-c0df-437a-aa47-a841a4645174,https://www.cch2.org/portal/collections/individual/index.php?occid=1368055
2289763,CAS,BOT-BC,,PreservedSpecimen,urn:catalog:CAS:BOT-BC:74313,74313,urn:catalog:CAS:BOT:886051,Organism|Plantae|Viridiplantae|Streptophyta|Embryophyta|Tracheophyta|Spermatophytina|Magnoliopsida|Rosanae|Brassicales|Brassicaceae|Raphanus,Plantae,Tracheophyta,Magnoliopsida,Brassicales,Brassicaceae,Raphanus sativus,29702,L.,Raphanus,,sativus,,,Species,Ihsan A. Al-Shehbaz,2010-01,,,,,,"Howell, John Thomas",,36925,9/24/61,,1961,9,24,267,,"Sept. 24, 1961.",,,,,,,,,,,,,,,,,,,,,North America,,,,United States,California,Plumas County,,Sierra Nevada. Beckwourth.,,0,,,,,,,,,,,1487,,,,,4880.0000000000 ft,,en,,urn:catalog:CAS:BOT-BC:74313,1,40ef8056-b218-41c2-bb8e-16cd25c2b82f,https://www.cch2.org/portal/collections/individual/index.php?occid=2289763
2290828,CAS,BOT-BC,,PreservedSpecimen,urn:catalog:CAS:BOT-BC:74234,74234,urn:catalog:CAS:BOT:970545,Organism|Plantae|Viridiplantae|Streptophyta|Embryophyta|Tracheophyta|Spermatophytina|Magnoliopsida|Rosanae|Brassicales|Brassicaceae|Raphanus,Plantae,Tracheophyta,Magnoliopsida,Brassicales,Brassicaceae,Raphanus sativus,29702,L.,Raphanus,,sativus,,,Species,Ihsan A. Al-Shehbaz,2010-01,,,,,,"Blakley, E. R.",,3931,3/12/61,,1961,3,12,71,,12-Mar-61,Annual. Flowers purple. 3 foot tall weed. Common.,in the barnyard.,,,,,,,,herbariumSpecimenDuplicate: https://www.cch2.org/portal/collections/individual/index.php?guid=164d7b92-9c1b-4a66-8663-7c588e46f291 | herbariumSpecimenDuplicate: https://www.cch2.org/portal/collections/individual/index.php?guid=d6551de7-8ba5-4367-af35-412246e35c77,,,,,,,,,,,North America,,,,United States,California,Santa Barbara County,,Santa Cruz Island. Cattle barnyard in Canyon Cervada.,,0,,,,,,,,,,,76,,,,,250.0000000000 ft,,en,,urn:catalog:CAS:BOT-BC:74234,1,aaa1cfea-7d33-4cdb-a5f6-6562cc5ed159,https://www.cch2.org/portal/collections/individual/index.php?occid=2290828
2333212,CAS,BOT-BC,,PreservedSpecimen,urn:catalog:CAS:BOT-BC:74290,74290,urn:catalog:CAS:BOT:439212,Organism|Plantae|Viridiplantae|Streptophyta|Embryophyta|Tracheophyta|Spermatophytina|Magnoliopsida|Rosanae|Brassicales|Brassicaceae|Raphanus,Plantae,Tracheophyta,Magnoliopsida,Brassicales,Brassicaceae,Raphanus sativus,29702,L.,Raphanus,,sativus,,,Species,Ihsan A. Al-Shehbaz,2010-01,,,,,,"Peñalosa, Javier",,1063,2/25/61,,1961,2,25,56,,"Feb. 26, 1961.","Occasional, forming thickets. On same sheet as accession number CAS 439213, both are Raphanus sativus L. from Marin County.","Dry soil bordering Typha marsh. Associates: Brassica campestris, Stipa pulchra, Lobularia maritima.",,,,,,,,,,,,,,,,,,,North America,,,,United States,California,Marin County,,Tiburon Peninsula. Tiburon.,,0,,,,,,,,,,,,,,,,,,en,,urn:catalog:CAS:BOT-BC:74290,1,70495f9d-180d-4d81-a7b6-e3ce5ba01f34,https://www.cch2.org/portal/collections/individual/index.php?occid=2333212
2378585,CAS,BOT-BC,,PreservedSpecimen,urn:catalog:CAS:BOT-BC:74277,74277,urn:catalog:CAS:DS:557168,Organism|Plantae|Viridiplantae|Streptophyta|Embryophyta|Tracheophyta|Spermatophytina|Magnoliopsida|Rosanae|Brassicales|Brassicaceae|Raphanus,Plantae,Tracheophyta,Magnoliopsida,Brassicales,Brassicaceae,Raphanus sativus,29702,L.,Raphanus,,sativus,,,Species,Ihsan A. Al-Shehbaz,2010-01,,,,,,"Lindholm, Raymond",,s.n.,2/3/61,,1961,2,3,34,,2/3/61,,,,,,,,,,,,,,,,,,,,,North America,,,,United States,California,Los Angeles County,,Near Laverne.,,0,,,,,,,,,,,,,,,,,,en,,urn:catalog:CAS:BOT-BC:74277,1,3cbce4bd-41a4-4599-b028-434577a74c7c,https://www.cch2.org/portal/collections/individual/index.php?occid=2378585
2409497,CAS,BOT-BC,,PreservedSpecimen,urn:catalog:CAS:BOT-BC:74291,74291,urn:catalog:CAS:BOT:439213,Organism|Plantae|Viridiplantae|Streptophyta|Embryophyta|Tracheophyta|Spermatophytina|Magnoliopsida|Rosanae|Brassicales|Brassicaceae|Raphanus,Plantae,Tracheophyta,Magnoliopsida,Brassicales,Brassicaceae,Raphanus sativus,29702,L.,Raphanus,,sativus,,,Species,Ihsan A. Al-Shehbaz,2010-01,,,,,,"Peñalosa, Javier",,1215,4/1/61,,1961,4,1,91,,"April 1, 1961.","Abundant near shore. On same sheet as accession number CAS 439212, both are Raphanus sativus L. from Marin County.","Near shore of Richardson Bay inlet. Associates: Stipa pulchra, Anagallis arvensis, Cotula coronopifolia.",,,,,,,,,,,,,,,,,,,North America,,,,United States,California,Marin County,,Tiburon Peninsula. Tiburon. Near intersection of Blackfiled Drive and Tiburon Boulevard. (ca. 1 mile from US 101).,,0,,,,,,,,,,,,,,,,,,en,,urn:catalog:CAS:BOT-BC:74291,1,846c8e5b-e9e2-45c6-a5d3-69255c82f2fc,https://www.cch2.org/portal/collections/individual/index.php?occid=2409497
2442814,CAS,BOT-BC,,PreservedSpecimen,urn:catalog:CAS:BOT-BC:74240,74240,urn:catalog:CAS:DS:593692,Organism|Plantae|Viridiplantae|Streptophyta|Embryophyta|Tracheophyta|Spermatophytina|Magnoliopsida|Rosanae|Brassicales|Brassicaceae|Raphanus,Plantae,Tracheophyta,Magnoliopsida,Brassicales,Brassicaceae,Raphanus sativus,29702,L.,Raphanus,,sativus,,,Species,Ihsan A. Al-Shehbaz,2010-01,,,,,,"Thomas, John H.",,9609,7/19/61,,1961,7,19,200,,19-Jul-61,Petals yellow.,Pinus contorta latifolia forest. Along road where reconstruction has been going on.,,,,,,,,,,,,,,,,,,,North America,,,,United States,California,Tuolumne County,,Yosemite National Park. Vicinity of Camp White Wolf.,,0,,37.86666667,-119.65,,,,,,,,2438,,,,,8000.0000000000 ft,,en,,urn:catalog:CAS:BOT-BC:74240,1,669dcd9c-20b3-4fd3-b69d-738001d7c34b,https://www.cch2.org/portal/collections/individual/index.php?occid=2442814
3292668,UCJEPS,VASC,,PreservedSpecimen,ef5b06ab-ad02-432e-9672-67422b72498c,JEPS45440,,Organism|Plantae|Viridiplantae|Streptophyta|Embryophyta|Tracheophyta|Spermatophytina|Magnoliopsida|Rosanae|Brassicales|Brassicaceae|Raphanus,Plantae,Tracheophyta,Magnoliopsida,Brassicales,Brassicaceae,Raphanus sativus,29702,L.,Raphanus,,sativus,,,Species,,,,,,,,Perry Allen,,,4/21/61,,1961,4,21,111,,Apr 21 1961,,in a field that had been cultivated years before,,fls yellow,,,,,,,,,Flowering/Fruiting,,,,,,,,,,,,United States,California,Stanislaus,,vicinity of La Grange,,0,,37.66423,-120.46039,NAD27,806,,,Terrain Navigator,,,,,,,,,,,,ef5b06ab-ad02-432e-9672-67422b72498c,46,fa22b640-2d8a-450b-9952-83021dd973f0,https://www.cch2.org/portal/collections/individual/index.php?occid=3292668
3949201,MCCC,,,PreservedSpecimen,6faa44f0-4e07-494b-a9ac-1eefee1b9b22,1995,,Organism|Plantae|Viridiplantae|Streptophyta|Embryophyta|Tracheophyta|Spermatophytina|Magnoliopsida|Rosanae|Brassicales|Brassicaceae|Raphanus,Plantae,Tracheophyta,Magnoliopsida,Brassicales,Brassicaceae,Raphanus sativus,29702,L.,Raphanus,,sativus,,,Species,,,,,,,,Vernon Bridges,,,8/10/61,,1961,8,10,222,,,,,,,,,,,,,,,,,,,,,,,,,,,USA,California,Mendocino,,"All through lower area, Van Damme State Park",,,,,,,,,,,,,,,,,,,,,cschomer,,71,6faa44f0-4e07-494b-a9ac-1eefee1b9b22,https://www.cch2.org/portal/collections/individual/index.php?occid=3949201
3949202,MCCC,,,PreservedSpecimen,c2c2081d-765a-43d7-9c4b-b3f95f49911f,1994,,Organism|Plantae|Viridiplantae|Streptophyta|Embryophyta|Tracheophyta|Spermatophytina|Magnoliopsida|Rosanae|Brassicales|Brassicaceae|Raphanus,Plantae,Tracheophyta,Magnoliopsida,Brassicales,Brassicaceae,Raphanus sativus,29702,L.,Raphanus,,sativus,,,Species,,,,,,,,P. Cuttitta,,,8/12/61,,1961,8,12,224,,,,,,"Flowers white, purple or yellow; plant 2'-5' tall; 2-3 seeded",,,,,,,,,,,,,,,,,,,,,USA,California,Mendocino,Cleone,"Scattered throughout park in open grassy areas, California State Park",,,,,,,,,,,,,,,,,,,,,cschomer,,71,c2c2081d-765a-43d7-9c4b-b3f95f49911f,https://www.cch2.org/portal/collections/individual/index.php?occid=3949202
4295613,OSC,V,,PreservedSpecimen,{609AB2BA-0B6E-4592-83EC-F4F7FACFC04F},OSC-V-023831,OSC109462,Organism|Plantae|Viridiplantae|Streptophyta|Embryophyta|Tracheophyta|Spermatophytina|Magnoliopsida|Rosanae|Brassicales|Brassicaceae|Raphanus,Plantae,Tracheophyta,Magnoliopsida,Brassicales,Brassicaceae,Raphanus sativus,29702,L.,Raphanus,,sativus,,,Species,"Al-Shehbaz, I.",2016,,,,,,Curt G. Carlbom,,s.n.,4/14/61,,1961,4,14,104,,4/14/61,,In cultivated field.,,,,,,,,,,,,wild collection,,,,,,,,,,,United States,Oregon,Benton,,One mile S.W. of Corvallis.,,0,,44.52443149,-123.3292928,,1609,Bailey C. Edgley,OregonFlora 1994-2020 methodology,"OrlookId: 9770, StateProvince: Oregon, County: Benton, LocName: Corvallis, 1 mi. SW of",,,,,,,,,,,,4436413,81,e207b7bf-64f5-4b30-a202-ba25f266eab0,https://www.cch2.org/portal/collections/individual/index.php?occid=4295613
137222,SBBG,,,PreservedSpecimen,d29ae34a-b63d-4b92-a683-f5497da52156,SBBG155411,SBBG_old: 17789,Organism|Plantae|Viridiplantae|Streptophyta|Embryophyta|Tracheophyta|Spermatophytina|Magnoliopsida|Rosanae|Brassicales|Brassicaceae|Raphanus,Plantae,Tracheophyta,Magnoliopsida,Brassicales,Brassicaceae,Raphanus raphanistrum,29701,L.,Raphanus,,raphanistrum,,,Species,,,,,,,,Peter H. Raven,,17300,4/11/62,,1962,4,11,101,,4/11/62,,sandy beach,,Annual; abundant. Corollas yellow.,,,,,ann,herbariumSpecimenDuplicate: https://www.cch2.org/portal/collections/individual/index.php?guid=5B8C7B35-D7F1-4CCE-B9E7-8F328D61F964 | herbariumSpecimenDuplicate: https://www.cch2.org/portal/collections/individual/index.php?guid=84d2b20b-fbfc-4764-a4a5-6d66e6f42ccd,,"Atriplex, Abronia, Cakile",Flowers Present; Fruit Present,,,,,,,,,,,,United States,California,Los Angeles,,San Clemente Island: behind Northwest Harbor,,0,,33.0263,-118.5879,NAD83,750,dwilken,,USN/MyTopo,,,,,,,,20 ft,,,,,16,99bf6649-c4f8-4e3d-afb1-da20967ef3d0,https://www.cch2.org/portal/collections/individual/index.php?occid=137222
304535,UCSB,,,PreservedSpecimen,fc2b0ae4-1a5d-11e3-b49f-525400a0a001,UCSB031996,11398,Organism|Plantae|Viridiplantae|Streptophyta|Embryophyta|Tracheophyta|Spermatophytina|Magnoliopsida|Rosanae|Brassicales|Brassicaceae|Raphanus,Plantae,Tracheophyta,Magnoliopsida,Brassicales,Brassicaceae,Raphanus raphanistrum,29701,L.,Raphanus,,raphanistrum,,,Species,,,,,,,,"Wisehart, Karen",,80,3/30/62,,1962,3,30,89,,,,In field,,,,,,,,,,,,,,,,,Sheet - 1,,,,,,United States,California,Santa Barbara,,"At Madrid and Embarcadero del Mar, Isla Vista District, Goleta",,0,,34.417415,-119.861133,WGS84,3000,gwahlert (2020-01-22 14:54:30),,georef batch tool 2020-01-22,,,,,,,,,,,,,35,16c84472-a325-4c49-b0c5-1116209751e5,https://www.cch2.org/portal/collections/individual/index.php?occid=304535
469001,SD,,,PreservedSpecimen,5B8C7B35-D7F1-4CCE-B9E7-8F328D61F964,SD00013784,SD52843,Organism|Plantae|Viridiplantae|Streptophyta|Embryophyta|Tracheophyta|Spermatophytina|Magnoliopsida|Rosanae|Brassicales|Brassicaceae|Raphanus,Plantae,Tracheophyta,Magnoliopsida,Brassicales,Brassicaceae,Raphanus raphanistrum,29701,L.,Raphanus,,raphanistrum,,,Species,,,,,,,,Peter H. Raven,,17300,4/11/62,,1962,4,11,101,,4/11/62,,"Atriplex, Abronia and Cakile",,,,,,,,herbariumSpecimenDuplicate: https://www.cch2.org/portal/collections/individual/index.php?guid=d29ae34a-b63d-4b92-a683-f5497da52156 | herbariumSpecimenDuplicate: https://www.cch2.org/portal/collections/individual/index.php?guid=84d2b20b-fbfc-4764-a4a5-6d66e6f42ccd,,,FFL,,,,,,,,,,,,United States,California,Los Angeles,,San Clemente Island; sandy beach behind Northwest Harbor.,,0,,33.0278,-118.5862,WGS84,50,fjg,,Google Earth,,n/a,7,,,,,,,,,SD52843,43,be2fe241-aeda-4991-9d35-fb9398a8afd4,https://www.cch2.org/portal/collections/individual/index.php?occid=469001
992535,RSA,RSA,,PreservedSpecimen,84d2b20b-fbfc-4764-a4a5-6d66e6f42ccd,RSA0191131,RSA accession: 158284,Organism|Plantae|Viridiplantae|Streptophyta|Embryophyta|Tracheophyta|Spermatophytina|Magnoliopsida|Rosanae|Brassicales|Brassicaceae|Raphanus,Plantae,Tracheophyta,Magnoliopsida,Brassicales,Brassicaceae,Raphanus raphanistrum,29701,L.,Raphanus,,raphanistrum,,,Species,Jon P. Rebman and Sula Vanderplank,2020,,,,!,,Peter H. Raven,,17300,4/11/62,,1962,4,11,101,,11-Apr-62,,Sandy beach.,,Abundant annual.,,,,,,herbariumSpecimenDuplicate: https://www.cch2.org/portal/collections/individual/index.php?guid=d29ae34a-b63d-4b92-a683-f5497da52156 | herbariumSpecimenDuplicate: https://www.cch2.org/portal/collections/individual/index.php?guid=5B8C7B35-D7F1-4CCE-B9E7-8F328D61F964,,"Atriplex, Abronia, and Cakile",flowers & fruits,Introduced,,,,,herbarium sheet,,,,,,United States,California,Los Angeles,,Behind Northwest Harbor; San Clemente Island.,,0,,,,,,,,,,,6,,,,,20ft.,,,T. Kim Nguyen; cataloged date: 2007-09-19,84d2b20b-fbfc-4764-a4a5-6d66e6f42ccd,17,efebc7a2-73ca-4fcf-b097-b7f7712b837a,https://www.cch2.org/portal/collections/individual/index.php?occid=992535
2262513,LOB,,,PreservedSpecimen,38fef304-c961-43df-887b-79a52acdf305,LOB116468,2674,Organism|Plantae|Viridiplantae|Streptophyta|Embryophyta|Tracheophyta|Spermatophytina|Magnoliopsida|Rosanae|Brassicales|Brassicaceae|Raphanus,Plantae,Tracheophyta,Magnoliopsida,Brassicales,Brassicaceae,Raphanus raphanistrum,29701,L.,Raphanus,,raphanistrum,,,Species,,,,,,,,P.C. Baker,,993,3/11/62,,1962,3,11,70,,11-Mar-62,,fallow field,,,,,,,,,,,,,,,,,,,,,,,United States,South Carolina,Georgetown,,on US. 17 near junction SC. 544,,0,,,,,,,,,,,,,,,,,,,14412695,,19,38fef304-c961-43df-887b-79a52acdf305,https://www.cch2.org/portal/collections/individual/index.php?occid=2262513
375690,SDSU,,,PreservedSpecimen,373fc8f8-350f-4141-8a24-bb741b146338,SDSU01213,1213,Organism|Plantae|Viridiplantae|Streptophyta|Embryophyta|Tracheophyta|Spermatophytina|Magnoliopsida|Rosanae|Brassicales|Brassicaceae|Raphanus,Plantae,Tracheophyta,Magnoliopsida,Brassicales,Brassicaceae,Raphanus sativus,29702,L.,Raphanus,,sativus,,,Species,,,,,,,,"Barber, C.C.",,27,7/9/62,,1962,7,9,190,,7/9/62,MTRP,Coastal sage.,,,,,,,,,,,,,0,,,,,,,,,,United States,California,San Diego,,About 6 miles north of U.S. Highway 80 on Mission Gorge Road. Near Mission Dam in Mission Gorge.,,0,,32.84199,-117.04059,WGS84,402,Mary Alice Kessler,,Rancho Santa Ana: 2007-2009 CCH GBIF georeferencing grant,,3-Mar-09,,,,,,,,,preprocessed,,6,373fc8f8-350f-4141-8a24-bb741b146338,https://www.cch2.org/portal/collections/individual/index.php?occid=375690
375699,SDSU,,,PreservedSpecimen,3bd0599d-1993-4b23-aa01-cd3ee8bb5798,SDSU01222,1222,Organism|Plantae|Viridiplantae|Streptophyta|Embryophyta|Tracheophyta|Spermatophytina|Magnoliopsida|Rosanae|Brassicales|Brassicaceae|Raphanus,Plantae,Tracheophyta,Magnoliopsida,Brassicales,Brassicaceae,Raphanus sativus,29702,L.,Raphanus,,sativus,,,Species,,,,,,,,"Harvin, R.",,14,7/9/62,,1962,7,9,190,,7/9/62,MTRP,"Gallery forest, stream, Salix spp. Prunus ilicfolia, Oenothera hookeri, Baccharis spp.",,,,,,,,,,,,,0,,,,,,,,,,United States,California,San Diego,,Area around Mission Gorge Dam off Mission Gorge Road.,,0,,32.84199,-117.04059,WGS84,402,Mary Alice Kessler,,Rancho Santa Ana: 2007-2009 CCH GBIF georeferencing grant,,3-Mar-09,,,,,,,,,preprocessed,,6,3bd0599d-1993-4b23-aa01-cd3ee8bb5798,https://www.cch2.org/portal/collections/individual/index.php?occid=375699
375700,SDSU,,,PreservedSpecimen,946a44bf-1df7-4627-94b3-971e0cb7a87c,SDSU01223,1223,Organism|Plantae|Viridiplantae|Streptophyta|Embryophyta|Tracheophyta|Spermatophytina|Magnoliopsida|Rosanae|Brassicales|Brassicaceae|Raphanus,Plantae,Tracheophyta,Magnoliopsida,Brassicales,Brassicaceae,Raphanus sativus,29702,L.,Raphanus,,sativus,,,Species,,,,,,,,"Franks, Samuel R.",,,5/26/62,,1962,5,26,146,,5/26/62,,,,,,,,,,,,,,,0,,,,,,,,,,United States,California,San Diego,,Alvarado Canyon.,,0,,32.7783,-117.054,WGS84,805,Mary Alice Kessler,,Rancho Santa Ana: 2007-2009 CCH GBIF georeferencing grant,,3-Mar-09,,,,,,,,,preprocessed,,6,946a44bf-1df7-4627-94b3-971e0cb7a87c,https://www.cch2.org/portal/collections/individual/index.php?occid=375700
375701,SDSU,,,PreservedSpecimen,1d283ded-2278-4a92-9a44-fec29b10b670,SDSU01224,1224,Organism|Plantae|Viridiplantae|Streptophyta|Embryophyta|Tracheophyta|Spermatophytina|Magnoliopsida|Rosanae|Brassicales|Brassicaceae|Raphanus,Plantae,Tracheophyta,Magnoliopsida,Brassicales,Brassicaceae,Raphanus sativus,29702,L.,Raphanus,,sativus,,,Species,,,,,,,,"Bigelow, Ronald H.",,,5/10/62,,1962,5,10,130,,5/10/62,,Roadside.,,,,,,,,,,,,,0,,,,,,,,,,United States,California,San Diego,,"10 feet from main road along section of dead end road De Mar Slough, Del Mar.",,0,,32.97235,-117.25407,WGS84,162,San Diego NHM D,,TOPO!,,georef from 2015-2018 archive backup file; Date Georeferenced: Thu Oct 6 09:58:07 2016,,,,,,,,,preprocessed,,6,1d283ded-2278-4a92-9a44-fec29b10b670,https://www.cch2.org/portal/collections/individual/index.php?occid=375701
375702,SDSU,,,PreservedSpecimen,fd6be72a-94aa-4c8b-bbe4-d7363d611d45,SDSU01225,1225,Organism|Plantae|Viridiplantae|Streptophyta|Embryophyta|Tracheophyta|Spermatophytina|Magnoliopsida|Rosanae|Brassicales|Brassicaceae|Raphanus,Plantae,Tracheophyta,Magnoliopsida,Brassicales,Brassicaceae,Raphanus sativus,29702,L.,Raphanus,,sativus,,,Species,,,,,,,,"Bigelow, Ronald H.",,,5/4/62,,1962,5,4,124,,5/4/62,,Growing among grass along road on east side of road.,,,,,,,,,,,,,0,,,,,,,,,,United States,California,San Diego,,1/4 mile North of College Avenue on Mallard Rd.,Mallard is south of College; Ambiguous,0,,32.72954,-117.05541,WGS84,403,San Diego NHM E,,TOPO! (copied from SDSU2932),,georef from 2015-2018 archive backup file; Date Georeferenced: Thu Apr 6 12:03:42 2017,,,,,,,,,preprocessed,,6,fd6be72a-94aa-4c8b-bbe4-d7363d611d45,https://www.cch2.org/portal/collections/individual/index.php?occid=375702
375720,SDSU,,,PreservedSpecimen,6c52bafd-f458-4375-af5c-842e4e579b14,SDSU01243,1243,Organism|Plantae|Viridiplantae|Streptophyta|Embryophyta|Tracheophyta|Spermatophytina|Magnoliopsida|Rosanae|Brassicales|Brassicaceae|Raphanus,Plantae,Tracheophyta,Magnoliopsida,Brassicales,Brassicaceae,Raphanus sativus,29702,L.,Raphanus,,sativus,,,Species,,,,,,,,"Hunsaker, D.",,,4/10/62,,1962,4,10,100,,4/10/62,,,,,,,,,,,,,,,0,,,,,,,,,,United States,California,Riverside,,Three miles SSW from Temecula.,,0,,33.453,-117.173,NAD27,3000,Rancho Santa Ana,,Rancho Santa Ana: 2007-2009 CCH GBIF georeferencing grant,,georef from 2006-2015 archive backup file; Date Georeferenced: Mon Dec 26 13:37:13 2011,,,,,,,,,preprocessed,,6,6c52bafd-f458-4375-af5c-842e4e579b14,https://www.cch2.org/portal/collections/individual/index.php?occid=375720
376201,SDSU,,,PreservedSpecimen,d1383206-4bc8-40d7-acc9-ff0804f0da4b,SDSU01729,1729,Organism|Plantae|Viridiplantae|Streptophyta|Embryophyta|Tracheophyta|Spermatophytina|Magnoliopsida|Rosanae|Brassicales|Brassicaceae|Raphanus,Plantae,Tracheophyta,Magnoliopsida,Brassicales,Brassicaceae,Raphanus sativus,29702,L.,Raphanus,,sativus,,,Species,,,,,,,,"King, J.",,5,7/2/62,,1962,7,2,183,,7/2/62,,"Growing wild in field adjacent to residence, in a community of other species of Cruciferae.",,,,,,,,,,,,,0,,,,,,,,,,United States,California,San Diego,,"2600 Block of ?D? Avenue, National City.",,0,,32.66014,-117.09626,WGS84,241,Mary Alice Kessler,,Rancho Santa Ana: 2007-2009 CCH GBIF georeferencing grant,,3-Mar-09,23,,,,,75ft.,,,preprocessed,,6,d1383206-4bc8-40d7-acc9-ff0804f0da4b,https://www.cch2.org/portal/collections/individual/index.php?occid=376201
469002,SD,,,PreservedSpecimen,561E11AF-B07B-4997-A215-5D79ED214538,SD00062666,SD53650,Organism|Plantae|Viridiplantae|Streptophyta|Embryophyta|Tracheophyta|Spermatophytina|Magnoliopsida|Rosanae|Brassicales|Brassicaceae|Raphanus,Plantae,Tracheophyta,Magnoliopsida,Brassicales,Brassicaceae,Raphanus sativus,29702,L.,Raphanus,,sativus,,,Species,,,,,,,,Reid Moran,,9697,5/18/62,,1962,5,18,138,,5/18/62,,,,,,,,,,,,,FFL,,,,,,,,,,,,United States,California,San Diego,,"Canyon south of Natural History Museum, Balboa Park.",,0,,32.72822,-117.14954,WGS84,402,mak,,TOPO! v3.4.2,,,,,,,,unknownft.,,,,SD53650,43,2c884a41-cdd1-4225-adab-759a614a50e7,https://www.cch2.org/portal/collections/individual/index.php?occid=469002
978189,RSA,RSA,,PreservedSpecimen,7e205489-f721-43cf-8e8c-8f2d4c8d07aa,,RSA accession: 158333,Organism|Plantae|Viridiplantae|Streptophyta|Embryophyta|Tracheophyta|Spermatophytina|Magnoliopsida|Rosanae|Brassicales|Brassicaceae|Raphanus,Plantae,Tracheophyta,Magnoliopsida,Brassicales,Brassicaceae,Raphanus sativus,29702,L.,Raphanus,,sativus,,,Species,,,,,,,,P. H. Raven,,18034,7/12/62,,1962,7,12,193,,,,Sandy flats.,,,,,,,,,,,flowers & fruits,Cultivated,,,,,herbarium sheet,,,,,,United States,California,Los Angeles,,"Northwest Harbor, San Clemente Island",,0,,,,,,,,,,,9,,,,,30ft.,,,T. Kim Nguyen; cataloged date: 2007-09-21,7e205489-f721-43cf-8e8c-8f2d4c8d07aa,17,40d4c95d-4394-4f69-a99c-117527df2d15,https://www.cch2.org/portal/collections/individual/index.php?occid=978189
1367998,DAV,,,PreservedSpecimen,5760a379-5021-482e-8a94-b05d9b47823b,DAV310418,Accession #: DAV34630,Organism|Plantae|Viridiplantae|Streptophyta|Embryophyta|Tracheophyta|Spermatophytina|Magnoliopsida|Rosanae|Brassicales|Brassicaceae|Raphanus,Plantae,Tracheophyta,Magnoliopsida,Brassicales,Brassicaceae,Raphanus sativus,29702,L.,Raphanus,,sativus,,,Species,,,,,,,,Gerald Dickinson,,36,5/15/62,,1962,5,15,135,,15-May-62,Access Database Number (Deprecated): UCD115173,,,,,,,,,,,,,,,,,,,,,,,,United States,California,Los Angeles,,"Los Angeles County: Pierce College, Woodland Hills.",,0,,,,,,,,,,,244,,,,,800ft,,,,UCD115173,39,5760a379-5021-482e-8a94-b05d9b47823b,https://www.cch2.org/portal/collections/individual/index.php?occid=1367998
2345323,CAS,BOT-BC,,PreservedSpecimen,urn:catalog:CAS:BOT-BC:74239,74239,urn:catalog:CAS:BOT:592409,Organism|Plantae|Viridiplantae|Streptophyta|Embryophyta|Tracheophyta|Spermatophytina|Magnoliopsida|Rosanae|Brassicales|Brassicaceae|Raphanus,Plantae,Tracheophyta,Magnoliopsida,Brassicales,Brassicaceae,Raphanus sativus,29702,L.,Raphanus,,sativus,,,Species,Ihsan A. Al-Shehbaz,2010-01,,,,,,"Twisselmann, Ernest C.",,7855,9/19/62,,1962,9,19,262,,"September 19, 1962.",Corollas lavender. A single plant. Not otherwise observed in the region.,Growing in disturbed dry loam along the river. Sagebrush meadow in a pinyon woods.,,,,,,,,,,,,,,,,,,,North America,,,,United States,California,Tulare County,,Sierra Nevada. Kern Plateau. Kennedy Meadow.,,0,,,,,,,,,,,1920,,,,,6300.0000000000 ft,,en,,urn:catalog:CAS:BOT-BC:74239,1,5c626437-0c70-420b-9585-4e6a45a51abf,https://www.cch2.org/portal/collections/individual/index.php?occid=2345323
2373106,CAS,BOT-BC,,PreservedSpecimen,urn:catalog:CAS:BOT-BC:74226,74226,urn:catalog:CAS:BOT:886054,Organism|Plantae|Viridiplantae|Streptophyta|Embryophyta|Tracheophyta|Spermatophytina|Magnoliopsida|Rosanae|Brassicales|Brassicaceae|Raphanus,Plantae,Tracheophyta,Magnoliopsida,Brassicales,Brassicaceae,Raphanus sativus,29702,L.,Raphanus,,sativus,,,Species,Ihsan A. Al-Shehbaz,2010-01,,,,,,"True, Gordon H.",,588A,5/11/62,,1962,5,11,131,,11-May-62,,,,,,,,,,,,,,,,,,,,,North America,,,,United States,California,Nevada County,,"Sierra Nevada. On Bridgeport-French Corral Road, about 1 mile southeast of Bridgeport.",,0,,,,,,,,,,,366,,,,,1200.0000000000 ft,,en,,urn:catalog:CAS:BOT-BC:74226,1,81d6cce4-11db-4e01-81b0-733b20311647,https://www.cch2.org/portal/collections/individual/index.php?occid=2373106
2890849,IRVC,,,PreservedSpecimen,43f255cb-9dec-4ce2-bdb9-b0e1004146b9,IRVC100801,,Organism|Plantae|Viridiplantae|Streptophyta|Embryophyta|Tracheophyta|Spermatophytina|Magnoliopsida|Rosanae|Brassicales|Brassicaceae|Raphanus,Plantae,Tracheophyta,Magnoliopsida,Brassicales,Brassicaceae,Raphanus sativus,29702,L.,Raphanus,,sativus,,,Species,,,,,,,,Phil Rundel,,1014,4/10/62,,1962,4,10,100,,10-Apr-62,,Open fields; Drainage area San Fran. Bay; soil loam; Oak woodland,,,,,,,,,,,,,,,,,,,,,,,United States,California,Santa Clara,,Open fields one-half mile west of Stanford Shopping Center.,,0,,,,,,,,,,,30,,,,,100 ft.,,,,,37,43f255cb-9dec-4ce2-bdb9-b0e1004146b9,https://www.cch2.org/portal/collections/individual/index.php?occid=2890849
2960499,IRVC,,,PreservedSpecimen,01d4bd04-a68e-4f1d-86e6-d5ba80e45b86,IRVC101205,,Organism|Plantae|Viridiplantae|Streptophyta|Embryophyta|Tracheophyta|Spermatophytina|Magnoliopsida|Rosanae|Brassicales|Brassicaceae|Raphanus,Plantae,Tracheophyta,Magnoliopsida,Brassicales,Brassicaceae,Raphanus sativus,29702,L.,Raphanus,,sativus,,,Species,,,,,,,,Phil Rundel,,1013,4/10/62,,1962,4,10,100,,10-Apr-62,,Open fields. Oak woodland. Soil: loam.,,,,,,,,,,,,,,,,,,,,,,,United States,California,Santa Clara,,open fields one half mile west of Stanford shopping center,,0,,,,,,,,,,,30,,,,,100 ft.,,,,,37,01d4bd04-a68e-4f1d-86e6-d5ba80e45b86,https://www.cch2.org/portal/collections/individual/index.php?occid=2960499
2960568,IRVC,,,PreservedSpecimen,755f3291-25db-48ad-a620-d0f8e194fc89,IRVC101168,,Organism|Plantae|Viridiplantae|Streptophyta|Embryophyta|Tracheophyta|Spermatophytina|Magnoliopsida|Rosanae|Brassicales|Brassicaceae|Raphanus,Plantae,Tracheophyta,Magnoliopsida,Brassicales,Brassicaceae,Raphanus sativus,29702,L.,Raphanus,,sativus,,,Species,,,,,,,,P. Rundel,,1036,4/15/62,,1962,4,15,105,,15-Apr-62,,"Sandy loam, coastal strand",,,,,,,,,,,,,,,,,,,,,,,United States,California,San Mateo,,1/4 mi east of Dunes Beach,,0,,,,,,,,,,,3,,,,,10 ft,,,,,37,755f3291-25db-48ad-a620-d0f8e194fc89,https://www.cch2.org/portal/collections/individual/index.php?occid=2960568
2960569,IRVC,,,PreservedSpecimen,8e4777ff-52fd-4e20-8a24-8859bf3181aa,IRVC101167,,Organism|Plantae|Viridiplantae|Streptophyta|Embryophyta|Tracheophyta|Spermatophytina|Magnoliopsida|Rosanae|Brassicales|Brassicaceae|Raphanus,Plantae,Tracheophyta,Magnoliopsida,Brassicales,Brassicaceae,Raphanus sativus,29702,L.,Raphanus,,sativus,,,Species,,,,,,,,P. Rundel,,1039,4/15/62,,1962,4,15,105,,15-Apr-62,,"coastal strand, sandy loam",,,,,,,,,,,,,,,,,,,,,,,United States,California,San Diego,,1/4 mi east of Dunes Beach,,0,,,,,,,,,,,3,,,,,10 ft.,,,,,37,8e4777ff-52fd-4e20-8a24-8859bf3181aa,https://www.cch2.org/portal/collections/individual/index.php?occid=2960569
2960570,IRVC,,,PreservedSpecimen,de5c60ca-7d6a-4db4-b598-f341cfb44ceb,IRVC101170,,Organism|Plantae|Viridiplantae|Streptophyta|Embryophyta|Tracheophyta|Spermatophytina|Magnoliopsida|Rosanae|Brassicales|Brassicaceae|Raphanus,Plantae,Tracheophyta,Magnoliopsida,Brassicales,Brassicaceae,Raphanus sativus,29702,L.,Raphanus,,sativus,,,Species,,,,,,,,P. Rundel,,1040,4/15/62,,1962,4,15,105,,15-Apr-62,,sandy loam; coastal strand,,,,,,,,,,,,,,,,,,,,,,,United States,California,San Mateo,,1/4 mi east of Dunes Beach,,0,,,,,,,,,,,3,,,,,10 ft.,,,,,37,de5c60ca-7d6a-4db4-b598-f341cfb44ceb,https://www.cch2.org/portal/collections/individual/index.php?occid=2960570
3035049,CLARK,,,PreservedSpecimen,,CLARK-A1528-363,A1528-363,Organism|Plantae|Viridiplantae|Streptophyta|Embryophyta|Tracheophyta|Spermatophytina|Magnoliopsida|Rosanae|Brassicales|Brassicaceae|Raphanus,Plantae,Tracheophyta,Magnoliopsida,Brassicales,Brassicaceae,Raphanus sativus,29702,L.,Raphanus,,sativus,,,Species,,,,,,,,Charlotte Stocks,,,6/26/62,,1962,6,26,177,,6/26/62,,,,,,,,,,,,,,,,,,,,,,,,,United States,California,Riverside,,,,0,,33.68778,-116.24084,WGS84,14455,,,GoogleMaps via BerkeleyMapper,,,,,,,,,,,,,61,374494e8-f004-467e-abf9-3a4e2b36fd38,https://www.cch2.org/portal/collections/individual/index.php?occid=3035049
4745855,RENO,V,,PreservedSpecimen,856c8e8d-f107-40c0-85d9-7ebfd79da0a5,77909,NESH 56086,Organism|Plantae|Viridiplantae|Streptophyta|Embryophyta|Tracheophyta|Spermatophytina|Magnoliopsida|Rosanae|Brassicales|Brassicaceae|Raphanus,Plantae,Tracheophyta,Magnoliopsida,Brassicales,Brassicaceae,Raphanus sativus,29702,L.,Raphanus,,sativus,,,Species,,,,,,,,A. Bruner,,s.n.,4/6/62,,1962,4,6,96,,4/6/62,,,,,,,,,,,,,,,,,,,,,,,,,United States,California,Solano,,"Hwy 40 [now I-80 xcorridor], 7 miles N of Vallejo.",,0,,38.164291,-122.207027,WGS84,969,Mike,,GeoLocate,,,30,,,,,100 ft.,,,Mike,11522470,89,ec2ce832-7d11-4eeb-a04a-a3929ce39e0c,https://www.cch2.org/portal/collections/individual/index.php?occid=4745855
4980123,US,,,PreservedSpecimen,http://n2t.net/ark:/65665/3d1f7885a-9c28-487f-9ae0-b4d08da0367d,US 2522337,,Organism|Plantae|Viridiplantae|Streptophyta|Embryophyta|Tracheophyta|Spermatophytina|Magnoliopsida|Rosanae|Brassicales|Brassicaceae|Raphanus,Plantae,Tracheophyta,Magnoliopsida,Brassicales,Brassicaceae,Raphanus sativus,29702,L.,Raphanus,,sativus,,,Species,,,,,,,,I. L. Wiggins & J. H. Thomas,,383,6/28/62,,1962,6,28,179,179,6/28/62,,,,,,,,,,,,,,,,,,1,,,North America,,,,Mexico,Baja California,,,Roadside weeds about 45 miles S of Tijuana near road to Ensenada. About 7 miles south of La Mission.,,0,,,,,,,,,,,,,,,,,,,,http://n2t.net/ark:/65665/3d1f7885a-9c28-487f-9ae0-b4d08da0367d,91,094cbb1e-3550-44b9-bc99-3c1e1bdadad1,https://www.cch2.org/portal/collections/individual/index.php?occid=4980123
5504851,CAS,BOT-BC,,PreservedSpecimen,urn:catalog:CAS:BOT-BC:684488,684488,,Organism|Plantae|Viridiplantae|Streptophyta|Embryophyta|Tracheophyta|Spermatophytina|Magnoliopsida|Rosanae|Brassicales|Brassicaceae|Raphanus,Plantae,Tracheophyta,Magnoliopsida,Brassicales,Brassicaceae,Raphanus sativus,29702,L.,Raphanus,,sativus,,,Species,,,,,,,,"Bullock, Barbara",,s.n.,4/18/62,,1962,4,18,108,,18-Apr-62,Soil: sandy. . CalState Hayward.,Coastal field,,,,,,,,,,,,,,,,,,,North America,,,,United States,California,Los Angeles County,,San Pedro,,0,,,,,,,,,,,152,,,,,500.0000000000 ft,,en,,urn:catalog:CAS:BOT-BC:684488,1,7bd5ca5a-e7e1-4999-9699-0144edb68fe1,https://www.cch2.org/portal/collections/individual/index.php?occid=5504851
5504855,CAS,BOT-BC,,PreservedSpecimen,urn:catalog:CAS:BOT-BC:684492,684492,,Organism|Plantae|Viridiplantae|Streptophyta|Embryophyta|Tracheophyta|Spermatophytina|Magnoliopsida|Rosanae|Brassicales|Brassicaceae|Raphanus,Plantae,Tracheophyta,Magnoliopsida,Brassicales,Brassicaceae,Raphanus sativus,29702,L.,Raphanus,,sativus,,,Species,,,,,,,,"Hobson, Jean",,27,4/8/62,,1962,4,8,98,,4/8/62,Flowers purple and lavender. . CalState Hayward. .,"weather: sunny; open field, sand.",,,,,,,,,,,,,,,,,,,North America,,,,United States,California,San Joaquin County,,"Holt, California",,0,,,,,,,,,,,0,,,,,0.0000000000 ft,,en,,urn:catalog:CAS:BOT-BC:684492,1,4cb4f84d-4ec0-44a5-986a-b5f8d1852538,https://www.cch2.org/portal/collections/individual/index.php?occid=5504855
5504856,CAS,BOT-BC,,PreservedSpecimen,urn:catalog:CAS:BOT-BC:684493,684493,,Organism|Plantae|Viridiplantae|Streptophyta|Embryophyta|Tracheophyta|Spermatophytina|Magnoliopsida|Rosanae|Brassicales|Brassicaceae|Raphanus,Plantae,Tracheophyta,Magnoliopsida,Brassicales,Brassicaceae,Raphanus sativus,29702,L.,Raphanus,,sativus,,,Species,,,,,,,,"King, David L.",,s.n.,4/27/62,,1962,4,27,117,,4/27/62,CalState Hayward. .,adobe soil,,,,,,,,,,,,,,,,,,,North America,,,,United States,California,San Joaquin County,,Stockton,,0,,,,,,,,,,,3,,,,,10.0000000000 ft,,en,,urn:catalog:CAS:BOT-BC:684493,1,d1893930-be60-4ade-acbd-3b027bed2490,https://www.cch2.org/portal/collections/individual/index.php?occid=5504856
5504857,CAS,BOT-BC,,PreservedSpecimen,urn:catalog:CAS:BOT-BC:684494,684494,,Organism|Plantae|Viridiplantae|Streptophyta|Embryophyta|Tracheophyta|Spermatophytina|Magnoliopsida|Rosanae|Brassicales|Brassicaceae|Raphanus,Plantae,Tracheophyta,Magnoliopsida,Brassicales,Brassicaceae,Raphanus sativus,29702,L.,Raphanus,,sativus,,,Species,,,,,,,,"Avale, Tom",,9,5/5/62,,1962,5,5,125,,5/5/62,CalState Hayward. .,average soil,,,,,,,,,,,,,,,,,,,North America,,,,United States,California,San Joaquin County,,Clements,,0,,,,,,,,,,,152,,,,,500.0000000000 ft,,en,,urn:catalog:CAS:BOT-BC:684494,1,5d869609-81d1-4b6e-b089-be48966eb01a,https://www.cch2.org/portal/collections/individual/index.php?occid=5504857
5504863,CAS,BOT-BC,,PreservedSpecimen,urn:catalog:CAS:BOT-BC:684502,684502,,Organism|Plantae|Viridiplantae|Streptophyta|Embryophyta|Tracheophyta|Spermatophytina|Magnoliopsida|Rosanae|Brassicales|Brassicaceae|Raphanus,Plantae,Tracheophyta,Magnoliopsida,Brassicales,Brassicaceae,Raphanus sativus,29702,L.,Raphanus,,sativus,,,Species,,,,,,,,"Harvey, B.",,s.n.,5/6/62,,1962,5,6,126,,6-May-62,Color: Pink. . CalState Hayward.,,,,,,,,,,,,,,,,,,,,North America,,,,United States,California,Alameda County,,Hayward,,0,,,,,,,,,,,15,,,,,50.0000000000 ft,,en,,urn:catalog:CAS:BOT-BC:684502,1,7c68b7bd-2e72-4a41-bd20-a712eb09dcd8,https://www.cch2.org/portal/collections/individual/index.php?occid=5504863
5569675,CAS,BOT-BC,,PreservedSpecimen,urn:catalog:CAS:BOT-BC:684518,684518,,Organism|Plantae|Viridiplantae|Streptophyta|Embryophyta|Tracheophyta|Spermatophytina|Magnoliopsida|Rosanae|Brassicales|Brassicaceae|Raphanus,Plantae,Tracheophyta,Magnoliopsida,Brassicales,Brassicaceae,Raphanus sativus,29702,L.,Raphanus,,sativus,,,Species,,,,,,,,"Nuddleman, M. Edward",,s.n.,4/20/62,,1962,4,20,110,,4/20/62,CalState Hayward. .,Mud-dry soil.,,,,,,,,,,,,,,,,,,,North America,,,,United States,California,Alameda County,,Oakland,,0,,,,,,,,,,,335,,,,,1100.0000000000 ft,,en,,urn:catalog:CAS:BOT-BC:684518,1,cf98aed5-32e3-4b72-b23a-49e7e2b381a3,https://www.cch2.org/portal/collections/individual/index.php?occid=5569675
5569850,CAS,BOT-BC,,PreservedSpecimen,urn:catalog:CAS:BOT-BC:685177,685177,,Organism|Plantae|Viridiplantae|Streptophyta|Embryophyta|Tracheophyta|Spermatophytina|Magnoliopsida|Rosanae|Brassicales|Brassicaceae|Raphanus,Plantae,Tracheophyta,Magnoliopsida,Brassicales,Brassicaceae,Raphanus sativus,29702,L.,Raphanus,,sativus,,,Species,,,,,,,,"Johnson Jr., Ralph R.",,4,5/15/62,,1962,5,15,135,,5/15/62,CalState Hayward. .,Dirt.,,,,,,,,,,,,,,,,,,,North America,,,,United States,California,Contra Costa County,,Byron,,0,,,,,,,,,,,46,,,,,150.0000000000 ft,,en,,urn:catalog:CAS:BOT-BC:685177,1,b943f6fc-0dc2-4a0a-944a-1d9a946c8cbc,https://www.cch2.org/portal/collections/individual/index.php?occid=5569850
1367986,DAV,,,PreservedSpecimen,UCD115159,DAV300675,Accession #: DAV33424,Organism|Plantae|Viridiplantae|Streptophyta|Embryophyta|Tracheophyta|Spermatophytina|Magnoliopsida|Rosanae|Brassicales|Brassicaceae|Raphanus,Plantae,Tracheophyta,Magnoliopsida,Brassicales,Brassicaceae,Raphanus raphanistrum,29701,L.,Raphanus,,raphanistrum,,,Species,"R. E. Preston, 26 Apr 1984",,,,,,,Gordon J. Pilone,,263,4/15/63,,1963,4,15,105,,15-Apr-63,Access Database Number (Deprecated): UCD115159,Pacific slope drainage area. Growing oak woodland chaparral on north-facing slope.,,,,,,,,,,,,,,,,,,,,,,,United States,California,Los Angeles,,"Los Angeles County: Diamond Bar Ranch, Brea Canyon. Santa Ana Mountain Range.",,0,,34.022725,-117.829608,WGS84,4000,Rancho Santa Ana (no. 6),,GoogleEarth (copied from UCD110253),,,,,,,,,,,tcbarry,UCD115159,39,66d1f3cb-a7db-49a0-9a26-818410ede37e,https://www.cch2.org/portal/collections/individual/index.php?occid=1367986
3904071,LA,,,PreservedSpecimen,0ee695db-5c37-4bbe-812e-010d9c7af8d9,LA00606053,LA212152,Organism|Plantae|Viridiplantae|Streptophyta|Embryophyta|Tracheophyta|Spermatophytina|Magnoliopsida|Rosanae|Brassicales|Brassicaceae|Raphanus,Plantae,Tracheophyta,Magnoliopsida,Brassicales,Brassicaceae,Raphanus raphanistrum,29701,L.,Raphanus,,raphanistrum,,,Species,,,,,,,,Harold Pirie,,s.n.,5/12/63,,1963,5,12,132,,12-May-63,,,,,,,,,,,,,,,,,,,,,,,,,United States,California,Los Angeles,,Open grass field in disturbed soil just N of Desoto and Ventura in Woodland Hills,,0,,,,,,,,,,,244,,,,,800ft,,,abaniaga,,34,0ee695db-5c37-4bbe-812e-010d9c7af8d9,https://www.cch2.org/portal/collections/individual/index.php?occid=3904071
5504847,CAS,BOT-BC,,PreservedSpecimen,urn:catalog:CAS:BOT-BC:684484,684484,,Organism|Plantae|Viridiplantae|Streptophyta|Embryophyta|Tracheophyta|Spermatophytina|Magnoliopsida|Rosanae|Brassicales|Brassicaceae|Raphanus,Plantae,Tracheophyta,Magnoliopsida,Brassicales,Brassicaceae,Raphanus raphanistrum,29701,L.,Raphanus,,raphanistrum,,,Species,,,,,,,,"Fenstermaker, G.",,3,4/15/63,,1963,4,15,105,,15-Apr-63,Jointed Charlock . collected behind new campus site . CalState Hayward.,,,,,,,,,,,,,,,,,,,,North America,,,,United States,California,Alameda County,,Hayward campus site,,0,,,,,,,,,,,600,,,,,600,,en,,urn:catalog:CAS:BOT-BC:684484,1,5160c0e2-9246-4528-bb26-e667fa2cc283,https://www.cch2.org/portal/collections/individual/index.php?occid=5504847
95436,SBBG,,,PreservedSpecimen,7e09ed0b-190b-4e1f-b42e-398fe831c192,SBBG155524,SBBG_old: 20549,Organism|Plantae|Viridiplantae|Streptophyta|Embryophyta|Tracheophyta|Spermatophytina|Magnoliopsida|Rosanae|Brassicales|Brassicaceae|Raphanus,Plantae,Tracheophyta,Magnoliopsida,Brassicales,Brassicaceae,Raphanus sativus,29702,L.,Raphanus,,sativus,,,Species,M.Piehl 1964,,,,,,,E. R. Blakley,,6375,12/7/63,,1963,12,7,341,,12/7/63,,ditch at edge of disturbed ground,,Flowers white. Scattered.,,,,,fl white,,,,Flowers Present; Fruit Present,,,,,,,,,,,,United States,California,Los Angeles,,San Clemente Island: 200 yds SE of new air strip,,0,,32.9098,-118.5321,NAD27,1000,dwilken,,USN/MyTopo,,,61,,,,,200 ft,,,,,16,aa35b144-9f63-4c6b-8eb7-f6a1ab2cf925,https://www.cch2.org/portal/collections/individual/index.php?occid=95436
121316,SBBG,,,PreservedSpecimen,b29a43a3-f850-4828-9f82-c52218149b51,SBBG213837,SBBG_old: 55162,Organism|Plantae|Viridiplantae|Streptophyta|Embryophyta|Tracheophyta|Spermatophytina|Magnoliopsida|Rosanae|Brassicales|Brassicaceae|Raphanus,Plantae,Tracheophyta,Magnoliopsida,Brassicales,Brassicaceae,Raphanus sativus,29702,L.,Raphanus,,sativus,,,Species,,,,,,,,S. Hales,,82,6/4/63,,1963,6,4,155,,6/4/63,,chaparral; sandy loam; shoulder of road,,,,,,,,,,,Flowers Present; Fruit Present,,,,,,,,,,,,United States,California,Los Angeles,,"La Verne Rd, 0.25 mi S of Fire Station [?]",,0,,,,,,,,,,,366,,,,,1200 ft,,,,,16,74703672-bd37-4596-ae91-22d2b3c186a9,https://www.cch2.org/portal/collections/individual/index.php?occid=121316
202469,OBI,,,PreservedSpecimen,1cf66f31-49ec-4e0c-b918-dc1adc6cc5b4,OBI101766,14970,Organism|Plantae|Viridiplantae|Streptophyta|Embryophyta|Tracheophyta|Spermatophytina|Magnoliopsida|Rosanae|Brassicales|Brassicaceae|Raphanus,Plantae,Tracheophyta,Magnoliopsida,Brassicales,Brassicaceae,Raphanus sativus,29702,L.,Raphanus,,sativus,,,Species,,,,,,,,Franscioni & Muscio,,106,4/28/63,,1963,4,28,118,,28-Apr-63,,In grain and pasture fields and along road sides; Common,,Usually weeds; purple fls; large herbs,,,,,,,,,,,,,,,,,,,,,United States,California,Monterey,,5 mi SW of Gonzales on S. Franscioni ranch,,0,,36.440688,-121.394921,WGS84,800,UCSanta Cruz F,,Geolocate (copied from OBI16950),,georef from old CCH cumulative file,,,,,,,,,preprocessed,,12,f4a4c63f-a9d3-4608-8900-aa2138914ca9,https://www.cch2.org/portal/collections/individual/index.php?occid=202469
375691,SDSU,,,PreservedSpecimen,7b59383b-b09a-4d42-ab66-31b000937c17,SDSU01214,1214,Organism|Plantae|Viridiplantae|Streptophyta|Embryophyta|Tracheophyta|Spermatophytina|Magnoliopsida|Rosanae|Brassicales|Brassicaceae|Raphanus,Plantae,Tracheophyta,Magnoliopsida,Brassicales,Brassicaceae,Raphanus sativus,29702,L.,Raphanus,,sativus,,,Species,,,,,,,,"Kasch, F.M.",,140,5/9/63,,1963,5,9,129,,5/9/63,,,,,,,,,,,,,,,0,,,,,,,,,,United States,California,San Diego,,"Carrol Rd., 5 miles from Miramar Rd.",,0,,32.88892,-117.20278,WGS84,1610,San Diego NHM D,,TOPO!,,georef from 2015-2018 archive backup file; Date Georeferenced: Fri Jul 15 08:49:34 2016,,,,,,,,,preprocessed,,6,7b59383b-b09a-4d42-ab66-31b000937c17,https://www.cch2.org/portal/collections/individual/index.php?occid=375691
375692,SDSU,,,PreservedSpecimen,047f5ce4-cbe7-4ddd-a0ec-49b3c9fc114f,SDSU01215,1215,Organism|Plantae|Viridiplantae|Streptophyta|Embryophyta|Tracheophyta|Spermatophytina|Magnoliopsida|Rosanae|Brassicales|Brassicaceae|Raphanus,Plantae,Tracheophyta,Magnoliopsida,Brassicales,Brassicaceae,Raphanus sativus,29702,L.,Raphanus,,sativus,,,Species,,,,,,,,"Waggoner, M.",,,7/15/63,,1963,7,15,196,,7/15/63,,Disturbed slope.,,,,,,,,,,,,,0,,,,,,,,,,United States,California,San Diego,,"North of 9441 Alto Drive, Mount Helix area.",,0,,32.76991,-116.99528,WGS84,161,Mary Alice Kessler,,Rancho Santa Ana: 2007-2009 CCH GBIF georeferencing grant,,3-Mar-09,297,,,,,975ft.,,,preprocessed,,6,047f5ce4-cbe7-4ddd-a0ec-49b3c9fc114f,https://www.cch2.org/portal/collections/individual/index.php?occid=375692
1097620,RSA,RSA,,PreservedSpecimen,b7169ef5-2325-46fd-9caf-9dc89252ad1c,RSA0051704,RSA accession: 828287,Organism|Plantae|Viridiplantae|Streptophyta|Embryophyta|Tracheophyta|Spermatophytina|Magnoliopsida|Rosanae|Brassicales|Brassicaceae|Raphanus,Plantae,Tracheophyta,Magnoliopsida,Brassicales,Brassicaceae,Raphanus sativus,29702,L.,Raphanus,,sativus,,,Species,J. H. K.,4/19/63,,,,,,Geo. E. Julian,,s.n.,4/19/63,,1963,4,19,109,,,,,,,,,,,,,,,,,,,,,herbarium sheet,,,,,,United States,California,Los Angeles,,"Voorhis Campus, Cal Poly, San Dimas.",,0,,,,,,,,,,,,,,,,,,,Nadja Cole; cataloged date: 2015-07-14,b7169ef5-2325-46fd-9caf-9dc89252ad1c,17,92ca7044-8731-4ab5-b57d-a68a7d170e4e,https://www.cch2.org/portal/collections/individual/index.php?occid=1097620
2371446,CAS,BOT-BC,,PreservedSpecimen,urn:catalog:CAS:BOT-BC:74337,74337,urn:catalog:CAS:BOT:529096,Organism|Plantae|Viridiplantae|Streptophyta|Embryophyta|Tracheophyta|Spermatophytina|Magnoliopsida|Rosanae|Brassicales|Brassicaceae|Raphanus,Plantae,Tracheophyta,Magnoliopsida,Brassicales,Brassicaceae,Raphanus sativus,29702,L.,Raphanus,,sativus,,,Species,Ihsan A. Al-Shehbaz,2010-01,,,,,,"McClintock, Elizabeth; Knight, Walter; Knight, Irja",,s.n.,9/2/63,,1963,9,2,245,,"Sept. 2, 1963",Yellowish flowers.,,,,,,,,,,,,,,,,,,,,North America,,,,United States,California,San Mateo County,,San Bruno Mountains. Ridge above Brisbane.,,0,,,,,,,,,,,,,,,,,,en,,urn:catalog:CAS:BOT-BC:74337,1,6e3c1be1-130f-4b63-97ee-d4dd1c20329d,https://www.cch2.org/portal/collections/individual/index.php?occid=2371446
2388759,CAS,BOT-BC,,PreservedSpecimen,urn:catalog:CAS:BOT-BC:74306,74306,urn:catalog:CAS:BOT:531055,Organism|Plantae|Viridiplantae|Streptophyta|Embryophyta|Tracheophyta|Spermatophytina|Magnoliopsida|Rosanae|Brassicales|Brassicaceae|Raphanus,Plantae,Tracheophyta,Magnoliopsida,Brassicales,Brassicaceae,Raphanus sativus,29702,L.,Raphanus,,sativus,,,Species,Ihsan A. Al-Shehbaz,2010-01,,,,,,"Howell, John Thomas",,40401,11/19/63,,1963,11,19,323,,"Nov. 19, 1963",,Along railroad tracks and on the waterfront.,,,,,,,,,,,,,,,,,,,North America,,,,United States,California,Monterey County,,"Near Southern Pacific Station, Monterey.",,0,,,,,,,,,,,,,,,,,,en,,urn:catalog:CAS:BOT-BC:74306,1,1f007818-5435-4a4d-8dc4-93bed6732e75,https://www.cch2.org/portal/collections/individual/index.php?occid=2388759
